id,title,note,excerpt,url,folder,tags,created,cover,highlights,favorite
876793806,Psychology for UX: Study Guide,,Unsure where to start? Use this collection of links to our articles and videos to learn about some principles of human psychology and how they relate to UX design.,https://www.nngroup.com/articles/psychology-study-guide,my_library,"behaviors, emotions, prodmgmt, ui-ux",2024-01-17T07:15:14.000Z,https://media.nngroup.com/media/articles/opengraph_images/Psych_SG_61.png,,False
876792895,8 Ways to Emotionally Reward Your Users | Web Designer Depot,,"They made this digital faux-Montana delightful enough that I don’t want to leave. But hey, you can use these powers for good.Anyway, my point is that people want payoff for the effort they put into things, and that includes the websites they browse. But you can build emotional rewards into just…",https://www.webdesignerdepot.com/2018/04/8-ways-to-emotionally-reward-your-users,my_library,"behaviors, rewards, ui-ux, webdev",2023-08-07T00:42:47.000Z,https://www.webdesignerdepot.com/assets/posts/featured/_1200x630_crop_center-center_82_none/54961/wdd.jpg?mtime=1676929111,,False
876789762,Why vinyl records survive in the digital age | Ars Technica,,Don’t underestimate ritual and tactility.,https://arstechnica.com/gaming/2019/03/the-ux-of-vinyl-the-medium-is-the-message,my_library,"behaviors, music, ui-ux",2022-12-21T18:52:24.000Z,https://cdn.arstechnica.net/wp-content/uploads/2019/01/Screen-Shot-2019-01-08-at-6.14.42-PM.png,,False
876786317,8 Reasons Users Don’t Fill Out Sign Up Forms,,"Signing up for a website is a big commitment to most people. Users who sign up for your site are giving you their personal information. If you misuse their personal information, you could abuse their trust. Most users today are more wary than ever about who handles their personal information. In a cyber world full of […]",http://uxmovement.com/forms/8-reasons-users-arent-filling-out-your-sign-up-form,my_library,"behaviors, ui-ux",2022-07-05T21:43:36.000Z,https://uxmovement.com/wp-content/uploads/2012/04/email-note.png,,False
876784982,GTA V: 9 Facts That Will Blow Your Mind,,,https://whatculture.com/gaming/gta-v-9-facts-that-will-blow-your-mind?page=4,my_library,"behaviors, ui-ux",2022-06-23T23:58:03.000Z,,,False
876783915,Personas vs. Archetypes,,"Archetypes and personas used for UX work contain similar insights, are based on similar kinds of data, and differ mainly in presentation. Personas are presented as a single human character, whereas archetypes are not tied to specific names or faces.",https://www.nngroup.com/articles/personas-archetypes,my_library,"behaviors, ui-ux",2022-05-15T17:03:22.000Z,https://media.nngroup.com/media/articles/opengraph_images/Personas_vs_Archetypes_Social_Posts_2022_1.png,,False
876783808,The Science of Familiarity: Increasing Conversions by Being Unoriginal,,"Familiarity has a major impact on our decision-making process. Understanding the psychology behind it will lead to better UX / design, copy and CTAs.",https://conversionxl.com/science-of-familiarity,my_library,"behaviors, familiarity, recognition, ui-ux",2022-04-11T23:49:32.000Z,https://cxl.com/wp-content/uploads/2020/08/Science-of-familiarity.png,,False
876782762,Using interactions to shape user behavior patterns,,Facebook Messenger: Long Press to Swipe,https://medium.muz.li/using-interactions-to-shape-user-behavior-patterns-e7dac087eebe,my_library,"behaviors, ui-ux",2022-02-24T01:23:05.000Z,https://miro.medium.com/v2/resize:fit:1200/1*rQWWhw-apPi-kPs_xhNgZg.png,,False
876782646,How privilege impacts empathy,,Who are we excluding from “user-centered” design,https://uxdesign.cc/how-privilege-impacts-empathy-b34ad0c16431,my_library,"behaviors, empathy, privilege, ui-ux",2022-02-10T01:29:46.000Z,https://miro.medium.com/v2/resize:fit:1200/1*9-8xPocLU9TE3wocC8XwBA.jpeg,,False
876782645,18 Cognitive Bias Examples Show Why Mental Mistakes Get Made,,Here are 18 of the most common mental mistakes in business and investing. Make sure to learn from these cognitive bias examples to make better decisions.,http://www.visualcapitalist.com/18-cognitive-bias-examples-mental-mistakes,my_library,"behaviors, bias, ui-ux",2022-02-10T01:29:40.000Z,https://www.visualcapitalist.com/wp-content/uploads/2018/03/18-cognitive-bias-examples-share.jpg,,False
876782636,Storming Reddit's Moat,,"A Guide to Reddit, Its Key Competitive Advantages, and How to Unbundle It",https://floodstate.substack.com/p/storming-reddits-moat,my_library,"behaviors, moats, platforms, prodmgmt, ui-ux",2022-02-08T01:42:52.000Z,"https://substackcdn.com/image/fetch/w_1200,h_600,c_fill,f_jpg,q_auto:good,fl_progressive:steep,g_auto/https%3A%2F%2Fbucketeer-e05bbc84-baa3-437e-9518-adb32be77984.s3.amazonaws.com%2Fpublic%2Fimages%2F83c38ed4-76a1-4835-9488-66737324a22d_540x361.png",,False
876782528,Scarcity in UX: The psychological bias that became the norm,,Short analysis on the current state of affairs and a few tips to keep in mind.,https://uxdesign.cc/scarcity-in-ux-the-psychological-bias-that-became-the-norm-3e666b749a9a,my_library,"behaviors, bias, ui-ux",2022-01-29T20:14:13.000Z,https://miro.medium.com/v2/resize:fit:1200/1*-XgzQw76IgZE2gwbOrNSCA.png,,False
876782523,A Game Designer’s Analysis Of QAnon,,Playing with reality,https://link.medium.com/Umv40tMA9cb,my_library,"behaviors, storytelling, ui-ux",2022-01-29T20:13:34.000Z,https://miro.medium.com/v2/resize:fit:1200/1*I9_EDoXn0McpW5xOaJSFkA.jpeg,,False
876782495,UX Crash Course: User Psychology,,"My mission for 2014 was to get more people started in User Experience (UX) Design. In January, hundreds of thousands of people did the original UX Crash Course and it was translated into Spanish, Portuguese and Korean by amazing volunteers. In May we continued with a User Psychology lesson every day.",http://thehipperelement.com/post/87574750438/ux-crash-course-user-psychology,my_library,"behaviors, design, design-patterns, influence-persuasion, ui-ux",2022-01-29T20:12:32.000Z,,,False
876782489,Do We Create Shoplifters? - Unintended Consequences,,The history of technology is one of subtracting humans and replacing them with machines. Do the unintended consequences include creating shoplifters?,https://unintendedconsequenc.es/do-we-create-shoplifters,my_library,"behaviors, prodmgmt, ui-ux",2022-01-29T20:12:14.000Z,https://unintendedconsequenc.es/wp-content/uploads/2019/08/Glass-polishers-image-Vaclav-Smil-879x800.jpg,,False
876782311,How to Gather Quantitative Data on User Behaviors,,"The quantitative methods we used were all time and cost-efficient, demonstrating that user research doesn’t require thousands of dollars and endless time.",https://thenextweb.com/dd/2015/01/18/gather-quantitative-data-user-behaviors-mental-models,my_library,"behaviors, ui-ux",2022-01-17T21:22:14.000Z,https://img-cdn.tnwcdn.com/image/tnw-blurple?filter_last=1&fit=1280%2C640&url=https%3A%2F%2Fcdn0.tnwcdn.com%2Fwp-content%2Fblogs.dir%2F1%2Ffiles%2F2015%2F01%2Fbehaviordata.jpg&signature=e27a2b5456549d4ab102facc1c9f7b6b,,False
876782306,UX Design Psychology Tricks for Design Excellence,,Human brain processes information as well as how it forms certain patterns of behavior. Discover cognitive psychology tips for UX.,https://www.uxpin.com/studio/blog/cognitive-psychology-for-ux-design,my_library,"behaviors, bias, ui-ux",2022-01-17T21:21:24.000Z,https://studio.uxpincdn.com/studio/wp-content/uploads/2020/04/design-system-metrics-copy-1.png.webp,,False
876782276,The User Experience of Public Bathrooms [APRIL FOOLS],,"Public restrooms are plagued by unusable toilet-paper dispensers, difficult flushing controls, and poor stall-status visibility. Many of these issues can be addressed by following standard usability practices.",https://www.nngroup.com/articles/ux-public-bathrooms,my_library,"behaviors, ui-ux",2022-01-17T21:20:14.000Z,https://media.nngroup.com/media/articles/opengraph_images/ux-public-bathrooms.png,,False
876782275,The Authority Principle,,A perceived high-authority status of the person making a request can make people more compliant with that request. Applying this principle in UX can ease users' decision-making process.,https://www.nngroup.com/articles/authority-principle,my_library,"behaviors, ui-ux",2022-01-17T21:20:13.000Z,https://media.nngroup.com/media/articles/opengraph_images/authority-principle-ux-design.png,,False
876782259,Creepiness–Convenience Tradeoff,,"As people consider whether to use the new ""creepy"" technologies, they do a type of cost-benefit analysis weighing the loss of privacy against the benefits they will receive in return.",https://www.nngroup.com/articles/creepiness,my_library,"behaviors, ui-ux",2022-01-17T21:19:31.000Z,https://media.nngroup.com/media/articles/opengraph_images/creepiness.png,,False
876782237,Sympathy vs. Empathy in UX,,The majority of UX professionals practice sympathy instead of empathy for their users.,https://www.nngroup.com/articles/sympathy-vs-empathy-ux,my_library,"behaviors, empathy, ui-ux",2022-01-17T21:18:44.000Z,https://media.nngroup.com/media/articles/opengraph_images/sympathy-vs-empathy.png,,False
876773741,Ask a researcher: How do needs drive intent?,,Consumer needs spark consumer journeys. How can marketers identify those needs and address them? The latest consumer research from Google will help.,https://www.thinkwithgoogle.com/consumer-insights/consumer-needs-research,my_library,"behaviors, prodmgmt, ui-ux",2020-02-19T20:06:57.000Z,https://storage.googleapis.com/twg-content/images/askaresearcher-howdoneedsdriveintent_FI_V1.width-1200.png,,False
876771917,How privilege impacts empathy,,Who are we excluding from “user-centered” design,https://t.co/RZ1Whcgiqq?ssr=true,my_library,"behaviors, empathy, ui-ux",2019-08-29T23:51:07.000Z,https://miro.medium.com/v2/resize:fit:1200/1*9-8xPocLU9TE3wocC8XwBA.jpeg,,False
876770853,Reciprocity Decay,,"Our desire to give back wanes rapidly with time - Why if you want people to return a favor, you need to act fast",https://www.coglode.com/gem/reciprocity-decay?goal=0_d9e2d04969-288a6a3df8-348202825&mc_cid=288a6a3df8&mc_eid=2236fd6cd5&ref=weekly.ui-patterns.com,my_library,"behaviors, reciprocity, ui-ux",2019-03-12T20:49:19.000Z,https://cdn.prod.website-files.com/5da817383e548853bed9550a/5e67c7efa72423416e6ccb04_5b9a31b02d798e1bffc6f694_Reciprocity%2520Decay.png,,False
876769230,The Power of a Free Popsicle | Stanford Graduate School of Business,,,https://www.gsb.stanford.edu/insights/power-free-popsicle?Date=20180223&linkId=48424986,my_library,"behaviors, marketing, prodmgmt, ui-ux",2018-03-05T19:42:43.000Z,https://www.gsb.stanford.edu/sites/default/files/styles/1630x_variable/public/heath-freepopsicle-1630_1.jpg.webp?itok=88UcTvGJ,,False
