id,title,note,excerpt,url,folder,tags,created,cover,highlights,favorite
876784864,Twitter partners with Shopify to bring merchants' products to Twitter Shopping | TechCrunch,,"As part of its ongoing efforts to expand into e-commerce, Twitter today announced a new partnership with Shopify. The deal will see Twitter launching a",https://techcrunch.com/2022/06/22/twitter-partners-with-shopify-to-bring-merchants-products-to-twitter-shopping,my_library,"ecommerce, prodmgmt, shopify, twitter",2022-06-22T17:52:18.000Z,https://techcrunch.com/wp-content/uploads/2022/06/Shopify_Images_Jun2022_3.001.jpeg,,False
876784808,6 Email Triggers for Max Conversions,,"Shoppers' actions on an ecommerce site create opportunities for automated, triggered emails. Such behavior-based email automation is a sure-fire tactic to drive revenue.",https://www.practicalecommerce.com/email-triggers-for-max-conversions,my_library,"analytics, ecommerce, email, prodmgmt",2022-06-21T01:58:28.000Z,https://www.practicalecommerce.com/wp-content/uploads/2022/06/6-Email-Triggers-for-Max-Conversions.jpg,,False
876784222,Packaging Inserts: Types and How To Create Yours (2024) - Shopify,,Increase customer loyalty and take advantage of an additional opportunity to connect with customers by using packaging inserts. Here's why and how to use them in every package you send out.,https://www.shopify.com/blog/18989252-5-ways-to-use-packaging-inserts-to-increase-customer-loyalty-and-revenue,my_library,"churn, ecommerce, packaging, physical-products, prodmgmt",2022-06-13T10:08:51.000Z,https://cdn.shopify.com/s/files/1/0070/7032/articles/Packing_Inserts_Are_A_Customer_Loyalty_Trick.jpg?v=1727453024,,False
876784210,21 Examples of Pricing Pages in Web Design,,,https://webdesignledger.com/21-examples-of-pricing-pages-in-web-design,my_library,"ecommerce, pricing, prodmgmt, webdev",2022-06-13T10:07:17.000Z,http://www.gravatar.com/avatar/8eb9ee80d39f13cbbad56da88ef3a6ee?rating=PG&size=75,,False
876784188,Why You’re Never Really Happy With the Things You Buy Anymore,,Constant bargain hunting makes us value all the wrong things about shopping.,https://getpocket.com/explore/item/why-you-re-never-really-happy-with-the-things-you-buy-anymore,my_library,"ecommerce, pricing, prodmgmt, retail",2022-06-12T23:52:36.000Z,https://pocket-image-cache.com/1200x/filters:format(jpg):extract_focal()/https%3A%2F%2Fs3.amazonaws.com%2Fpocket-syndicated-images%2Farticles%2F3345%2F1582045587_GUR66LXZ5T77CHCPZRUCXU4WIE.jpg,,False
876784176,Product Descriptions: 17 Fresh Writing Angles,,Need to spice up descriptions for bland products? Use these themes and examples the next time you’re describing a back-to-school backpack or plain white t-shirt. You’ll soon understand how to look at ordinary products differently.,https://www.practicalecommerce.com/product-descriptions-17-fresh-writing-angles,my_library,"copywriting, ecommerce, prodmgmt",2022-06-12T12:08:27.000Z,https://www.practicalecommerce.com/wp-content/uploads/2018/09/Product-Descriptions-17-Fresh-Writing-Angles.jpg,,False
876784169,Digital Advertising Platform for Brands and Agencies | AdRoll,,"Boost brand awareness, increase site visitors, and drive conversions with personalized advertising. AdRoll's been trusted by 140,000+ brands for over 15 years.",https://www.adroll.com/getting-started/retargeting,my_library,"ecommerce, prodmgmt",2022-06-12T12:05:42.000Z,https://www.adroll.com/assets/img/globals/social-shares/fb/hp.png,,False
876784114,Past Behavior Does Not Determine Future Purchases | TechCrunch,,"Ever wonder why after buying shoes online (or any other consumer goods), for the next few weeks or months, you can be sure to spot ads or promotions for those same shoes on nearly every website you visit? What’s more, you'll see which shoes your Facebook friends bought, which shoes their friends bought and which shoes “others like you” bought. You already bought shoes, so why are you still being bombarded with ads for them?",https://techcrunch.com/2015/10/24/past-behavior-does-not-determine-future-purchases?ncid=rss,my_library,"churn, ecommerce, prodmgmt",2022-06-07T18:21:33.000Z,"https://techcrunch.com/wp-content/uploads/2015/10/shoppingbags.jpg?resize=1200,797",,False
876784113,https://www.blossom.co/blog/5-smart-ways-to-resurrect-your-customers,,,https://www.blossom.co/blog/5-smart-ways-to-resurrect-your-customers,my_library,"churn, ecommerce, prodmgmt",2022-06-07T18:21:17.000Z,,,False
876784111,Design,,"Find the latest Design news from Fast company. See related business and technology articles, photos, slideshows and videos.",https://www.fastcodesign.com/1671614/branding-a-gentlemens-subscription-service-with-old-school-charm,my_library,"brandmgmt, ecommerce, prodmgmt",2022-06-07T18:20:57.000Z,,,False
876784053,Rithum: End-to-End E-commerce Solutions for Brands & Retailers,,"CommerceHub and ChannelAdvisor are now united as Rithum. We empower top brands, suppliers, and retailers with durable, profitable e-commerce solutions.",https://www.channeladvisor.com,my_library,"ecommerce, prodmgmt, programming",2022-06-02T18:02:32.000Z,https://www.rithum.com/wp-content/uploads/2023/12/Rithum-thumnail-black.png,,False
876783982,SEO: Product Descriptions Are a Blind Spot for Ecommerce Merchants,,Why does the ecommerce community have such a blind spot when it comes to unique product descriptions? Syndicated descriptions produce duplicate content. Why is duplicate product copy accepted so blindly? The answer depends on whether you’re the syndicator or the site using the syndicated content.,https://www.practicalecommerce.com/seo-product-descriptions-are-a-blind-spot-for-ecommerce-merchants,my_library,"ecommerce, keywords-ppc-seo, prodmgmt",2022-05-28T01:08:16.000Z,https://www.practicalecommerce.com/wp-content/uploads/2019/04/SEO-Product-Descriptions-Are-a-Blind-Spot-for-Ecommerce-Merchants.jpg,,False
876783958,13 marketing automation tools that can help you boost your sales,,The way we live our lives has an impact on our work. Long lists of typical chores may turn your,https://dataconomy.com/2022/05/13-marketing-automation-tools-that-can-help-you-boost-your-sales,my_library,"analytics, ecommerce, keywords-ppc-seo, marketing, prodmgmt, programming",2022-05-27T22:05:33.000Z,https://dataconomy.com/wp-content/uploads/2022/05/BEST-MARKETING-AUTOMATION-TOOLS-3.jpg,,False
876783940,When Keyword Poaching Pays Off,,"Competitive poaching refers to the practice of bidding on ads for a competitor’s search terms, in order to poach customers searching for that brand. It’s a common tactic in the world of digital ads — but is it effective? The author shares results from the first-ever empirical study of this practice, which found that poaching can work well for higher-end brands, but may backfire for lower-end or mass market offerings. Specifically, the study found that when an ad poached customers who searched for a high-end brand, users clicked on it more, but when an ad poached a low-end or mass market target, users were less likely to click. Of course, the author notes that clickthrough rate is just one metric, and there may be other ways in which a poaching campaign could be harmful or beneficial. But these findings can help marketers add a bit of science to the art that is digital advertising, helping them to optimize campaigns for their unique products and customers.",https://hbr.org/2022/05/when-keyword-poaching-pays-off,my_library,"analytics, ecommerce, keywords-ppc-seo, marketing, prodmgmt",2022-05-20T19:40:24.000Z,https://hbr.org/resources/images/article_assets/2022/05/May22_13_1055306876.jpg,,False
876783897,3 Keyword Tools for Search Intent,,"Optimizing content for organic rankings requires knowing how Google will interpret searchers' intent — informational, commercial, or navigational.",https://www.practicalecommerce.com/3-keyword-tools-for-search-intent,my_library,"ecommerce, keywords-ppc-seo, prodmgmt, programming",2022-05-12T11:51:48.000Z,https://www.practicalecommerce.com/wp-content/uploads/2022/04/3-Keyword-Tools-for-Search-Intent.jpg,,False
876783887,"Fast, Cheap, and Out of Control: Inside Shein’s Sudden Rise",,The Chinese company has become a fast-fashion juggernaut by appealing to budget-conscious Gen Zers. But its ultralow prices are hiding unacceptable costs.,https://www.wired.com/story/fast-cheap-out-of-control-inside-rise-of-shein,my_library,"clothes, ecommerce, fashion, prodmgmt",2022-05-09T12:48:48.000Z,"https://media.wired.com/photos/62714b994fd425eedd3780f1/191:100/w_1280,c_limit/Backchannel_TA_220419_wired8539-v2.jpg",,False
876783788,Improving Shopping Recommendations for Customers Through eBay’s Relevance C,,"Under the new machine learning model, buyers are recommended items that are more aligned to their shopping interests on eBay.",https://tech.ebayinc.com/engineering/improving-shopping-recommendations-for-customers-through-ebays-relevance-cascade-model,my_library,"ecommerce, machine-learning, prodmgmt, recommenders",2022-04-07T23:15:09.000Z,https://static.ebayinc.com/static/assets/Uploads/Blog/Posts/_resampled/ScaleWidthWzEwMjRd/220404-Improve-Shopping-tech-blog-v1-01-inc-16x9-A.jpg?fs=2a76537cb27c0068,,False
876782700,The Sales Sandwich by @ttunguz,,The most consistent sales leader I’ve worked with hit plan 27 consecutive quarters. How can a sales leader develop similar repeatability? Much goes into it here are the reports he used to manage his team at the board level. The PQR (pipeline-to-quota) funnel is first. Pipeline is the total value of the accounts within a stage or later. Quota is the aggregate quota on the street for the quarter. Divide P by Q to get PQR.,https://www.tomtunguz.com/longitudinal-sales-analysis,my_library,"analytics, ecommerce, prodmgmt, sales-salesmgmt",2022-02-19T19:55:09.000Z,,,False
876782695,Here’s what actually happens to all your online shopping returns,,Ordering clothes from Chinese fast-fashion brands like Shein is easy. Sending them back is a lot more complicated,https://restofworld.org/2022/shein-online-shopping-returns-what-happens,my_library,"ecommerce, prodmgmt, supply-chain",2022-02-18T15:39:27.000Z,https://149346090.v2.pressablecdn.com/wp-content/uploads/2022/02/h_21.00304773-1600x900.jpg,,False
876782654,How to Build an Ecommerce Keyword List,,"Keywords are an important building block for ecommerce marketing. Developing and maintaining a keyword list may help an ecommerce business understand shoppers and do a better job of marketing to them. In the context of search engine optimization, searchers' words or phrases summarize their thoughts, questions, or needs. Those keywords represent the language people use to ask for help finding resources online.",https://www.practicalecommerce.com/build-ecommerce-keyword-list,my_library,"ecommerce, keywords-ppc-seo, prodmgmt",2022-02-10T01:31:08.000Z,https://www.practicalecommerce.com/wp-content/uploads/2018/01/010918-snowblower-featured.png,,False
876780125,"Product Photography, Part 14: Optimizing for Speed, Search",,"The final step in product photography is optimizing the images for search engines and page speed. This is the 14th installment in my series on helping ecommerce merchants create better product images. In this post, I'll address making your photos faster to download and more visible in Google's image search.",https://www.practicalecommerce.com/product-photography-part-14-optimizing-for-speed-search,my_library,"ecommerce, images, prodmgmt",2021-11-29T16:47:42.000Z,https://www.practicalecommerce.com/wp-content/uploads/2021/11/Product-Photography-Part-14-Optimizing-for-Speed-Search.jpg,,False
876780031,The “ghost stores” of Instagram,,"That cute dress you bought off Instagram could be found on Shein, AliExpress, or Amazon for much cheaper.",https://www.vox.com/the-goods/22745054/instagram-boutique-drop-shipping-ghost-stores,my_library,"dropshipping, ecommerce, prodmgmt",2021-11-03T18:16:17.000Z,https://platform.vox.com/wp-content/uploads/sites/2/chorus/uploads/chorus_asset/file/22954742/GettyImages_1282120702.jpg?quality=90&strip=all&crop=0%2C10.752726382539%2C100%2C78.494547234923&w=1200,,False
876779928,The Emergence of B2B Raw Material Marketplaces,,"Business-to-business marketplaces are among ecommerce's leading growth trends, yet many industries remain under-served, especially for raw materials.",https://www.practicalecommerce.com/the-emergence-of-b2b-raw-material-marketplaces,my_library,"ecommerce, platforms, prodmgmt",2021-09-26T23:53:53.000Z,https://www.practicalecommerce.com/wp-content/uploads/2021/09/Emergence-of-B2B-Raw-Material-Marketplaces.jpg,,False
876779867,Why payment apps that thrive in India struggle to succeed in Mexico,,One fintech veteran from India found out the hard way why “Mexicans love cash.”,https://restofworld.org/2021/mexico-payment-apps-india,my_library,"ecommerce, finance, prodmgmt",2021-08-31T14:28:36.000Z,https://149346090.v2.pressablecdn.com/wp-content/uploads/2021/08/Alejandra_Rajal_RoW_16-1600x900.jpg,,False
876779775,Six emerging trends in product packaging,,"In the modern business world, there are several businesses releasing similar products into the market.",https://retailtechinnovationhub.com/home/2021/7/20/six-emerging-trends-in-product-packaging,my_library,"ecommerce, packaging, prodmgmt",2021-07-25T02:07:24.000Z,http://static1.squarespace.com/static/590eeff5b8a79b2147a783be/590ef147e6f2e1fda30e84c5/60f7162ac04b946e145fa363/1707305388291/AdobeStock_283396009.jpeg?format=1500w,,False
876779401,16 Tools to Manage Your Reputation,,"Reputation management is essential for any brand. Your company's future may depend on what’s been said about it in posts, comments, reviews, and rankings. Fortunately, there are affordable tools to help. Here is a list of tools to manage your brand’s reputation.",https://www.practicalecommerce.com/tools-to-manage-your-reputation,my_library,"ecommerce, prodmgmt, reputation",2021-07-20T11:03:27.000Z,https://www.practicalecommerce.com/wp-content/uploads/2021/07/16-Tools-to-Manage-Your-Reputation.jpg,,False
876779343,"Policy Pages, Done Well, Enhance a Brand",,"Shoppers search an online store's policy pages for details on shipping, returns, and more. Rarely are these vital pages engaging. But they should be.",https://www.practicalecommerce.com/policy-pages-done-well-enhance-a-brand,my_library,"custsvc, ecommerce, prodmgmt",2021-07-07T16:06:10.000Z,https://www.practicalecommerce.com/wp-content/uploads/2021/07/Essential-ecommerce-policy-pages.jpg,,False
876779336,The life cycle of a&nbsp;viral product,,The video app is causing products to blow up — and flame out — faster than ever.,https://www.vox.com/the-goods/22555723/tiktok-viral-products-cerave-sky-high-mascara-amazon-leggings,my_library,"ecommerce, prodmgmt, tiktok",2021-07-07T02:02:06.000Z,https://platform.vox.com/wp-content/uploads/sites/2/chorus/uploads/chorus_asset/file/22691148/GettyImages_1223714147.jpg?quality=90&strip=all&crop=0%2C10.732984293194%2C100%2C78.534031413613&w=1200,,False
876779139,Improving The Performance Of An Online Store (Case Study),,Getting a good performance score from Google is hard for any website — but doing so for an online store is even harder. We achieved green scores — even several for mobile. Here is how we did it.,https://smashingmagazine.com/2021/06/front-end-performance-online-store-jewellerybox,my_library,"css, design, ecommerce, fonts-typography, javascript, prodmgmt, webdev",2021-06-03T01:40:22.000Z,https://archive.smashing.media/assets/344dbf88-fdf9-42bb-adb4-46f01eedd629/8a350bf5-9114-420c-b587-fee03ea4acb6/jewellerybox-uk-online-store-scipioerp.jpg,,False
876779103,"Boxes, trucks and bikes",,"Should we still be talking about online and offline retail, or about trucks versus boxes versus bikes?",https://www.ben-evans.com/benedictevans/2021/5/29/boxes-trucks-and-bikes,my_library,"analytics, ecommerce, prodmgmt",2021-05-29T21:13:27.000Z,http://static1.squarespace.com/static/50363cf324ac8e905e7df861/t/60b23bba289bde7618d0ac52/1622293434346/2.jpeg?format=1500w,,False
876779045,3 Keys for High-converting Product Descriptions,,"Writing product descriptions sounds simple. But it takes planning. The best descriptions address a broad audience, which is why many companies employ marketers to help. When writing descriptions for the masses, focus on the following three elements.",https://www.practicalecommerce.com/3-keys-for-high-converting-product-descriptions,my_library,"copywriting, ecommerce, prodmgmt",2021-05-21T00:14:36.000Z,https://www.practicalecommerce.com/wp-content/uploads/2021/05/3-Essentials-for-High-converting-Product-Descriptions.jpg,,False
876778973,Theoretical Understandings of Product Embedding for E-commerce Machine Lear,,,https://arxiv.org/pdf/2102.12029.pdf,my_library,"ecommerce, labeling, machine-learning, prodmgmt",2021-05-09T17:35:35.000Z,,,False
876778363,Evaluating Search Algorithms,,The three-step framework Shopify's Data Science & Engineering team built for evaluating new search algorithms.,https://shopify.engineering/evaluating-search-algorithms,my_library,"ecommerce, keywords-ppc-seo, machine-learning, prodmgmt, search",2021-04-02T10:01:31.000Z,https://cdn.shopify.com/s/files/1/0779/4361/articles/ShopifyHelpCenter.png?v=1617296393,,False
876778340,Here’s Why Your Ecommerce Subscriptions Aren’t Selling,,"A recurring subscription model is a powerful tool for growth and profit — if you can get subscribers. ""A lot of brands install our subscription software",https://www.practicalecommerce.com/heres-why-your-ecommerce-subscriptions-arent-selling,my_library,"ecommerce, packaging, prodmgmt",2021-03-30T13:44:17.000Z,https://www.practicalecommerce.com/wp-content/uploads/2021/03/032621-featuredEvive_flavor_guide-1.jpg,,False
876778286,How Shopify Payments Work: All You Want To Know?,,"Well, if you are planning to sell your stuff online and make money, then there are a few top eCommerce platforms that would help you out. Shopify is the",https://www.noupe.com/business-online/how-shopify-payments-work.html,my_library,"ecommerce, prodmgmt, shopify",2021-03-22T19:35:11.000Z,,,False
876778273,What I wish I knew before building a Shopify App,,,https://ma.ttias.ch/what-i-wish-i-knew-before-building-a-shopify-app.html,my_library,"ecommerce, prodmgmt, shopify",2021-03-21T14:07:48.000Z,,,False
876778138,11 TikTok Video Ideas for Merchants,,You’ve downloaded TikTok and browsed the videos. Now you’re wondering what content to create for your ecommerce business. There are many types of videos to attract leads without dancing on camera. Here are 11 ideas for all types of merchants.,https://www.practicalecommerce.com/11-tiktok-video-ideas-for-merchants,my_library,"ecommerce, prodmgmt, tiktok, video",2021-03-02T17:08:59.000Z,https://www.practicalecommerce.com/wp-content/uploads/2021/02/11-TikTok-Video-Ideas-for-Merchants.jpg,,False
876778105,Buyer beware: Massive experiment shows why ticket sellers hit you with last-second fees | Haas News | Berkeley Haas,,There’s a reason that online ticket sellers hit you with those extra fees after you’ve picked your seats and are ready to click “buy.” Pure profit. A,https://newsroom.haas.berkeley.edu/research/buyer-beware-massive-experiment-shows-why-ticket-sellers-hit-you-with-hidden-fees-drip-pricing,my_library,"analytics, ecommerce, pricing, prodmgmt",2021-02-23T19:54:21.000Z,https://newsroom.haas.berkeley.edu/wp-content/uploads/2021/02/StubHub_AP-image.jpg,,False
876778050,How A Retail Chain Without A Website Powered Through The Pandemic,,"Burlington shut down online sales in March right before coronavirus lockdowns. But it's among the discount retailers that have endured the pandemic surprisingly well, even opening new stores.",https://www.npr.org/2021/02/17/968666255/how-a-retail-chain-without-a-website-powered-through-the-pandemic,my_library,"ecommerce, pricing, prodmgmt, retail",2021-02-18T10:06:24.000Z,https://media.npr.org/assets/img/2021/02/17/gettyimages-1252249653_wide-5d6b13d7533ba741eee3b5d98aec4b536acc8390.jpg?s=1400&c=100&f=jpeg,,False
876777338,The art and science of SaaS pricing: True usage-based pricing,,"Usage-based pricing can be incredibly powerful, particularly in cases where the SaaS solution handles the flow of money.",https://venturebeat.com/2021/01/09/the-art-and-science-of-saas-pricing-true-usage-based-pricing,my_library,"ecommerce, pricing, prodmgmt",2021-01-10T20:44:19.000Z,https://venturebeat.com/wp-content/uploads/2021/01/usage.jpg?w=1024?w=1200&strip=all,,False
876777337,The art and science of SaaS pricing: Finding the right model fit,,Part 1 in this 3-part series: Find the pricing model that fits with your particular options for expansion once you've made that first sale.,https://venturebeat.com/2021/01/09/the-art-and-science-of-saas-pricing-finding-the-right-model-fit,my_library,"ecommerce, pricing, prodmgmt",2021-01-10T20:44:16.000Z,https://venturebeat.com/wp-content/uploads/2021/01/pricing-1-e1635876555154.jpg?w=1024?w=1200&strip=all,,False
876777318,How Amazon’s Business Practices Harm American Consumers: Why Amazon Needs a,,Why Amazon Needs a Competitor and Why Walmart Ain’t It,https://medium.com/swlh/amazon-needs-a-competitor-and-walmart-aint-it-5997977b77b2,my_library,"ecommerce, prodmgmt",2021-01-06T17:02:19.000Z,https://miro.medium.com/v2/resize:fit:1200/1*aRtUMMW-LFt2gIZs4GvlGQ.png,,False
876777313,Looks vs. Results: My ugly ad got 150% more clicks than a professional desi,,"Making things look nice can take a long time, either due to lack of resources or abundance of opinions. This could delay launches, frustrate people, and waste precious energy. Those are high costs for startups or companies hoping to move fast.  Is it worth it?  Long ago I got fed",https://www.gkogan.co/blog/looks-vs-results,my_library,"advertising-commercials, ecommerce, prodmgmt",2021-01-04T15:14:05.000Z,https://www.gkogan.co/content/images/2024/08/Solid_Color_126162.png,,False
876777291,The Top Affiliate Marketing Networks,,Looking to grow your affiliate marketing site but aren't sure which affiliate network is right for you? Here's everything you need to know.,https://neilpatel.com/blog/affiliate-marketing-networks,my_library,"affiliates, ecommerce, marketing, prodmgmt",2021-01-02T22:01:52.000Z,https://neilpatel.com/wp-content/uploads/2020/12/affiliate-marketing.jpg,,False
876776463,Lessons from Running a Sale that Earned 3 Month's Profit in a Week,,Tips on running successful Black Friday sales for creators and Indie Hackers,https://www.coryzue.com/writing/black-friday,my_library,"ecommerce, marketing, prodmgmt",2020-12-10T16:52:03.000Z,https://www.coryzue.com/images/black-friday/total-profits-social.png,,False
876776319,The 11 Best Dropshipping Tools,,How can dropshipping tools give you the edge in the competitive world of e-commerce? We take a look at the 11 best dropshipping tools you should be using.,https://neilpatel.com/blog/dropshipping-tools,my_library,"dropshipping, ecommerce, prodmgmt",2020-11-20T19:11:30.000Z,https://neilpatel.com/wp-content/uploads/2020/11/dropshipping-tools.jpg,,False
876776292,"As its ecosystem grows, companies are becoming reliant on Shopify for more",,"Read more in the DTC Briefing, a weekly Modern Retail column about the biggest challenges and trends facing the DTC startup world.",https://digiday.com/retail/as-its-ecosystem-grows-companies-are-becoming-reliant-on-shopify-for-more-parts-of-their-business,my_library,"ecommerce, prodmgmt",2020-11-13T11:36:25.000Z,https://digiday.com/wp-content/uploads/sites/3/2020/04/Screenshot-2020-04-02-14.22.27-1.jpg,,False
876776277,'Growing two times faster than the rest of the market': Inside L'Oreal's e-,,"If e-commerce was a market for L’Oreal, then it would be the biggest in terms of market value, worth nearly €5 billion ($5.9 billion).",https://digiday.com/marketing/growing-two-times-faster-than-the-rest-of-the-market-inside-loreals-e-commerce-playbook,my_library,"ecommerce, fashion, prodmgmt",2020-11-10T00:16:29.000Z,https://digiday.com/wp-content/uploads/sites/3/2017/08/Loreal.picone-e1502202162625.jpg,,False
876776266,A Guide to Behavioral Segmentation Marketing,,"What is behavioral marketing? Here's how email marketing, demographics, and upsells can be used to monitor and act on customer behavior.",https://neilpatel.com/blog/behavioral-marketing,my_library,"ecommerce, prodmgmt, retargeting",2020-11-06T21:07:57.000Z,https://neilpatel.com/wp-content/uploads/2017/07/behavioral-marketing.jpg,,False
876776180,Managing your product feeds to thrive in a new retail landscape,,"To succeed in today’s e-commerce environment, companies must craft an online experience that meshes with the brick-and-mortar brand experience in their physical stores.",https://www.retaildive.com/spons/managing-your-product-feeds-to-thrive-in-a-new-retail-landscape/585401,my_library,"ecommerce, prodmgmt, rss",2020-11-03T00:47:16.000Z,https://www.retaildive.com/imgproxy/pZHc9YpNwGTcC0l7rt1eJ9hOmJr79FclKyK2QQeyq2o/g:ce/rs:fit:770:435/bG9jYWw6Ly8vZGl2ZWltYWdlLzIwLTA5LTA3X0dZRlRfY2FtcGFpZ25fU3RvcnlfNzcweDM2NC5wbmc=.webp,,False
876776173,4 Payment Methods to Integrate for the Holidays,,"Convenience and security increasingly impact online selling. That's especially the case for the upcoming holiday season, as consumers will likely seek flexible, seamless payment options. Here are four payment methods to consider for this year's holiday selling.",https://www.practicalecommerce.com/4-payment-methods-to-integrate-for-the-holidays,my_library,"ecommerce, prodmgmt",2020-11-03T00:44:25.000Z,https://www.practicalecommerce.com/wp-content/uploads/2020/09/4-Payment-Methods-to-Integrate-for-the-Holidays.jpg,,False
