id,title,note,excerpt,url,folder,tags,created,cover,highlights,favorite
876771595,https://stories.californiasunday.com/2015-06-07/somerton-man?fbclid=IwAR3mTzc-JjmM1vHSTPKCWAsQ_yTrc8Dlt6dLohbcCJ65DvIU8tDyqFUVzDc,,,https://stories.californiasunday.com/2015-06-07/somerton-man?fbclid=IwAR3mTzc-JjmM1vHSTPKCWAsQ_yTrc8Dlt6dLohbcCJ65DvIU8tDyqFUVzDc,my_library,"crime, goodreads, history",2019-06-30T12:59:40.000Z,,,False
876770944,How to identify a body: the Marchioness disaster and my life in forensic pa,,"The long read: In my career, I have investigated many of the UK’s worst disasters. Few cases were as harrowing as the sinking of the Marchioness in 1989, which left scores dead and almost impossible to identify",https://www.theguardian.com/science/2019/apr/18/how-to-identify-a-body-the-marchioness-disaster-and-my-life-in-forensic-pathology,my_library,"biology, crime, goodreads",2019-04-19T02:07:23.000Z,https://i.guim.co.uk/img/media/d1cd4cf1d9a8b1efe2ec561204d2b5afaf355ed4/0_15_4167_2501/master/4167.jpg?width=1200&height=630&quality=85&auto=format&fit=crop&overlay-align=bottom%2Cleft&overlay-width=100p&overlay-base64=L2ltZy9zdGF0aWMvb3ZlcmxheXMvdGctYWdlLTIwMTkucG5n&enable=upscale&s=e5195f495a3c06d447522d84f97d39a3,,False
876770894,The Last Ride of Cowboy Bob,,The feds knew him as a prolific bank robber. But the bearded man who eluded them for so long was not who they imagined him to be. And absolutely no one expected the story to end the way it did.,https://www.texasmonthly.com/articles/the-last-ride-of-cowboy-bob,my_library,"crime, goodreads",2019-04-01T01:13:10.000Z,https://img.texasmonthly.com/2020/05/cowboy-bob-robbery-peggy-jo-tallas-dallas-0.jpg?auto=compress&crop=faces&fit=fit&fm=pjpg&ixlib=php-3.3.1&q=45,,False
876770639,"The unbelievable tale of a fake hitman, a kill list, a darknet vigilante...",,Hitman-for-hire darknet sites are all scams. But some people turn up dead nonetheless,https://www.wired.co.uk/article/kill-list-dark-web-hitmen,my_library,"crime, goodreads",2018-12-26T23:08:18.000Z,"https://media.wired.com/photos/65e713145f2286a91492cd40/191:100/w_1280,c_limit/wired-uk-default-image-1-1.jpeg",,False
876769930,Predatory Lending Practices: Business Borrowers Hurt By ’Confession of Judg,,How an obscure legal document turned New York’s court system into a debt-collection juggernaut.,https://www.bloomberg.com/graphics/2018-confessions-of-judgment,my_library,"crime, goodreads",2018-11-21T12:57:59.000Z,https://www.bloomberg.com/graphics/2018-confessions-of-judgment/img/2018-confessions-of-judgment-facebook.png,,False
876769899,The Stranger in the Shelter,,Two people went for a hike on the Appalachian Trail. Only one made it out.,http://longform.org/posts/12337,my_library,"crime, goodreads",2018-11-10T00:44:28.000Z,https://longform.org/uploads/post/key_image/12337/landscape_doy9WSO8.jpg,,False
876769852,The Unsolved Murder of an Unusual Billionaire,,"Last December, a Canadian pharmaceuticals executive and his wife were found strangled in their home. No one knows who did it or why, but everyone has a theory.",http://longform.org/posts/12293,my_library,"crime, goodreads",2018-10-25T19:51:48.000Z,https://longform.org/uploads/post/key_image/12293/landscape_l7ManIQ7.jpg,,False
876769811,Small-Town Injustice,,The shooting of a civilian exposes the underbelly of a small town police department.,http://longform.org/posts/12253,my_library,"crime, goodreads",2018-10-11T03:03:25.000Z,https://longform.org/uploads/post/key_image/12253/square_viola-house-shooting_Theo-stroomer.jpg,,False
876769797,"My Bodyguard, My Self",,The author spent a day with three men in a high-end security detail to find out how it feels to be safe.,http://longform.org/posts/12240,my_library,"crime, goodreads, security",2018-10-08T20:34:48.000Z,https://longform-corpus.scdn1.secure.raxcdn.com/key_images/groups/50184192/50189213/web_800x250.jpg,,False
876769776,Narratively | Substack,,"Discover extraordinary true stories celebrating the diversity of humanity. Click to read Narratively, a Substack publication with tens of thousands of subscribers.",https://t.co/ghhCVBn3RQ?ssr=true,my_library,"crime, goodreads",2018-10-06T07:56:43.000Z,"https://substackcdn.com/image/fetch/f_auto,q_auto:best,fl_progressive:steep/https%3A%2F%2Fnarratively.substack.com%2Ftwitter%2Fsubscribe-card.jpg%3Fv%3D-182183352%26version%3D9",,False
876769732,"He Was a First-Round Draft Pick in the NBA. 14 Years Later, He Was Found De",,A long-dormant police investigation gives the case new life.,http://longform.org/posts/12171,my_library,"crime, goodreads, sports",2018-09-15T13:27:36.000Z,https://longform-corpus.scdn1.secure.raxcdn.com/key_images/groups/50053120/50055149/web_800x250.jpg,,False
876769729,What Happened at the Lake,,A father took his 10-year-old fishing. She fell in the water and drowned. It was a tragic accident—then he was charged with murder.,http://longform.org/posts/12166,my_library,"crime, goodreads",2018-09-15T12:12:31.000Z,https://longform.org/uploads/post/key_image/12166/landscape_P2npfTHy.jpg,,False
876769701,Blood and Oil,,"Mexico’s drug cartels are moving into the gasoline industry—infiltrating the national oil company, selling stolen fuel on the black market and engaging in open war with the military.",http://longform.org/posts/12151,my_library,"crime, goodreads",2018-09-09T17:04:00.000Z,https://longform.org/uploads/post/key_image/12151/landscape_dmfZGafO.jpg,,False
876769698,A Turbulent Mind,,Andrew Goldstein’s crime set in motion a dramatic shift in how we care for the violent mentally ill. Including for himself—when he’s released this month.,http://longform.org/posts/12152,my_library,"crime, goodreads",2018-09-09T00:19:00.000Z,https://longform-corpus.scdn1.secure.raxcdn.com/key_images/groups/49987584/49992698/web_800x250.jpg,,False
876769605,The Great Chinese Art Heist,,Is the Chinese government behind one of the boldest art-crime waves in history?,http://longform.org/posts/12094,my_library,"art, crime, goodreads",2018-08-18T10:37:43.000Z,https://longform.org/uploads/post/key_image/12094/landscape_The_20Great_20Chinese_20Art_20Heist-GQ-August-2018-01.jpg,,False
876769352,The All-American Bank Heist,,"Having fallen on hard times, a former football star and the pride of his small town decides to rob the local bank. His weapons of choice: Craigslist, bear mace, and an inner tube.",http://longform.org/posts/1383,my_library,"crime, goodreads",2018-05-20T01:32:46.000Z,https://longform.org/uploads/post/key_image/1383/landscape_Screen_Shot_2018-05-14_at_4.jpg,,False
876769350,"Jeff Pike, Texas’s Own Tony Soprano",,"Earlier this spring, Jeff Pike, the head of the infamous Texas-based Bandidos motorcycle club, went on trial in federal court for racketeering. Prosecutors called him a ruthless killer, the man behind one of the deadliest biker shoot-outs in American history, at the Twin Peaks restaurant in Waco. Pike, however, said he was just a good family man. On Thursday, jurors announced their verdict.",https://www.texasmonthly.com/news/jeff-pike-waco,my_library,"crime, goodreads",2018-05-19T21:26:21.000Z,https://txmo-server.imgix.net/2018/05/0518-ArchivalJeffPike3.jpg?auto=compress&crop=faces&fit=fit&h=1249&ixlib=php-3.0.0&q=45&w=2000&s=fad987fe98e9fceb1047822b0a7c4cf8,,False
876769327,The Most Unlikely D.A. In America,,Can Mark Gonzalez change the system?,http://longform.org/posts/11798,my_library,"crime, goodreads",2018-05-09T15:29:03.000Z,https://longform-corpus.scdn1.secure.raxcdn.com/key_images/groups/49332224/49339250/web_800x250.jpg,,False
876769310,Murder at the Alcatraz of the Rockies,,The inside story of the first homicide in America’s most secure prison.,http://longform.org/posts/11779,my_library,"crime, goodreads",2018-05-01T21:08:50.000Z,https://longform.org/uploads/post/key_image/11779/landscape_Screen_Shot_2018-05-01_at_8.04.15_AM.jpg,,False
876769306,Murder at the Alcatraz of the Rockies — The Atavist Magazine,,The inside story of the first homicide in America’s most secure prison.,https://magazine.atavist.com/murder-adx-florence-fbi-mexican-mafia,my_library,"crime, goodreads",2018-05-01T12:21:18.000Z,https://magazine.atavist.com/wp-content/uploads/2018/04/ap676197546-1525780124-72-7-scaled.jpg,,False
876769260,Gangster’s paradise: how organised crime took over Russia,,"The long read: Under Vladmir Putin, gangsterism on the streets has given way to kleptocracy in the state",https://www.theguardian.com/news/2018/mar/23/how-organised-crime-took-over-russia-vory-super-mafia,my_library,"crime, goodreads",2018-03-24T19:15:42.000Z,https://i.guim.co.uk/img/media/0c7ab4cb7ead0edf4247bd4c279c8c4d5ef58716/0_113_1920_1152/master/1920.jpg?width=1200&height=630&quality=85&auto=format&fit=crop&overlay-align=bottom%2Cleft&overlay-width=100p&overlay-base64=L2ltZy9zdGF0aWMvb3ZlcmxheXMvdGctYWdlLTIwMTgucG5n&enable=upscale&s=429deab7ae2bbb27474ef15fed83b654,,False
876769153,The Encyclopedia of the Missing,,"She keeps watch over one of the largest databases of missing persons in the country. For Meaghan Good, the disappeared are still out here, you just have to know where to look.",http://longform.org/posts/11478,my_library,"crime, goodreads",2018-01-14T00:00:14.000Z,https://longform.org/uploads/post/key_image/11478/landscape_Screen_Shot_2018-01-12_at_12.32.54_PM.jpg,,False
876768987,In the Land of Vendettas That Go On Forever,,"In Northern Albania, vengeance is as likely a form of restitution as anything the criminal-justice system can offer.",http://longform.org/posts/11303,my_library,"crime, goodreads",2017-11-10T03:41:39.000Z,https://longform.org/uploads/post/key_image/11303/landscape_crabapple_doublepage.jpg,,False
