id,title,note,excerpt,url,folder,tags,created,cover,highlights,favorite
876788729,Obsidian 1.0 - Obsidian,,Obsidian: A knowledge base that works on local Markdown files.,https://obsidian.md/1.0,my_library,"blogging, programming",2022-10-14T01:29:48.000Z,https://obsidian.md/images/banner.png,,False
876786651,"15 Tools to Curate Content for Social Media, Newsletters, More",,"Content curation is the process of gathering content — blog posts, images, videos — from a variety of sources. Sharing relevant information with your",http://www.practicalecommerce.com/articles/88111-15-Tools-to-Curate-Content-for-Social-Media-Newsletters-More,my_library,"blogging, finance, programming",2022-07-18T15:12:28.000Z,https://www.practicalecommerce.com/wp-content/uploads/2015/05/thumbnail3.jpg,,False
876786341,"45 Tools to Generate Content, for Ecommerce",,"Content marketing is the technique of creating and sharing content — blog posts, images, videos — to attract and retain customers. Generating relevant and",http://www.practicalecommerce.com/articles/76008-45-Tools-to-Generate-Content-for-Ecommerce,my_library,"blogging, ecommerce, programming",2022-07-05T21:47:24.000Z,https://www.practicalecommerce.com/wp-content/uploads/2014/11/thumbnail33-e1677501099276.jpg,,False
876782840,http://www.practicalecommerce.com/articles/94621-20-Platforms-to-Buld-Dynamic-User-generated-Content,,,http://www.practicalecommerce.com/articles/94621-20-Platforms-to-Buld-Dynamic-User-generated-Content,my_library,"blogging, programming, user-generated-content",2022-03-16T20:02:17.000Z,,,False
876780066,Various ways to include comments on your static site,,Overview of different techniques to implement comments using a static site generator.,https://darekkay.com/blog/static-site-comments,my_library,"blogging, jekyll, programming",2021-11-18T12:10:24.000Z,https://darekkay.com/blog/static-site-comments/cover.png,,False
876779943,"Start a blog in 30 minutes with Hugo, a static site generator written in Go",,Get your new site up and running quickly with Hugo.,https://opensource.com/article/18/3/start-blog-30-minutes-hugo,my_library,"blogging, golang, hugo, programming",2021-10-01T17:58:15.000Z,https://opensource.com/sites/default/files/lead-images/programming-code-keyboard-laptop-music-headphones.png,,False
876773908,"fastai/fastpages: An easy to use blogging platform, with enhanced support for Jupyter Notebooks.",,"An easy to use blogging platform, with enhanced support for Jupyter Notebooks. - fastai/fastpages",https://github.com/fastai/fastpages,my_library,"blogging, programming",2020-03-09T20:16:47.000Z,https://repository-images.githubusercontent.com/237890763/6b570c80-fd1c-11ea-9163-00a26e78a40e,,False
