id,title,note,excerpt,url,folder,tags,created,cover,highlights,favorite
876783974,An In-Depth Tutorial to Python Decorators That You Can Actually Use,,Going knee-deep into the internals of Python,https://towardsdatascience.com/an-in-depth-tutorial-to-python-decorators-that-you-can-actually-use-1e34d3d2d305?source=rss----7f60cf5620c9---4,my_library,"decorators, python",2022-05-28T00:59:10.000Z,https://miro.medium.com/v2/resize:fit:1200/1*w6t1OO4Owzi8Ttk3bE45Qw.jpeg,,False
876783969,Useful Python decorators for Data Scientists,,I show toy implementations of Python decorator patterns that may be useful for Data Scientists.,https://bytepawn.com/python-decorators-for-data-scientists.html,my_library,"decorators, machine-learning, python",2022-05-28T00:57:37.000Z,https://bytepawn.com/images/decorators-ds.jpg,,False
876782470,5 Advanced Tips on Python Decorators,,"Do you want to write concise, readable, and efficient code? Well, python decorators may help you on your journey.",https://towardsdatascience.com/5-advanced-tips-on-python-decorators-113307d5a92c,my_library,"decorators, python",2022-01-26T23:50:53.000Z,https://miro.medium.com/v2/da:true/resize:fit:1200/0*jRrWcGQepqSmMyL0,,False
876779333,Why decorators in Python are pure genius,,"Analyze, test, and re-use your code with little more than an @ symbol",https://link.medium.com/83HMWSzoChb,my_library,"decorators, python",2021-07-05T20:35:03.000Z,https://miro.medium.com/v2/resize:fit:1200/1*04aTTsPt0eUPY64YfvO4gg.jpeg,,False
876776323,5 Minute Guide to Decorators in Python,,Let’s master the more advanced topics in no-time,https://towardsdatascience.com/5-minute-guide-to-decorators-in-python-b5ca0f2c7ce7?source=rss----7f60cf5620c9---4,my_library,"decorators, python",2020-11-22T15:39:06.000Z,https://miro.medium.com/v2/da:true/resize:fit:1200/0*gJxIPv7DGGEOQDRG,,False
876773992,Decorators in Python,,Learn how you can change the behavior of objce,https://towardsdatascience.com/decorators-in-python-9cf8ba95e8e7?source=rss----7f60cf5620c9---4,my_library,"decorators, python",2020-03-14T23:49:21.000Z,https://miro.medium.com/v2/resize:fit:800/1*AlZKWb8AYpG8b3F1_KUtxQ.jpeg,,False
876769493,"Python decorators, the right way: the 4 audiences of programming languages",,"Python decorators are a useful but flawed language feature. Intended to make source code easier to write, and a little more readable, they neglect to address another use case: that of the programmer who will be calling the decorated code. If you’re a Python programmer, the following post will show you why decorators exist, and how to compensate for their limitations. And even if you’re not a Python a programmer, I hope to demonstrate the importance of keeping in mind all of the different audiences for the code you write.",https://codewithoutrules.com/2017/08/10/python-decorators,my_library,"decorators, python",2018-06-08T23:44:06.000Z,https://codewithoutrules.com/assets/titles/python-decorators.png,,False
