id,title,note,excerpt,url,folder,tags,created,cover,highlights,favorite
876784958,Hacker News,,,https://torontolife.com/city/the-case-of-the-missing-46-million,my_library,"crime, crypto, goodreads",2022-06-23T23:11:19.000Z,,,False
876783803,How Bitcoin Tracers Took Down the Web’s Biggest Child Abuse Site,,Welcome to Video’s customers thought their payments were untraceable. They couldn’t have been more wrong. The untold story of the case that shredded the myth of Bitcoin’s anonymity.,https://www.wired.com/story/tracers-in-the-dark-welcome-to-video-crypto-anonymity-myth,my_library,"crime, crypto, goodreads",2022-04-10T17:03:33.000Z,"https://media.wired.com/photos/624e318eedc71717de2dee32/191:100/w_1280,c_limit/Crypto-Trap4.jpg",,False
876779895,"The disastrous voyage of Satoshi, the world’s first cryptocurrency cruise s",,"The long read: Last year, three cryptocurrency enthusiasts bought a cruise ship. They named it the Satoshi, and dreamed of starting a floating libertarian utopia. It didn’t work out",https://www.theguardian.com/news/2021/sep/07/disastrous-voyage-satoshi-cryptocurrency-cruise-ship-seassteading,my_library,"crypto, goodreads",2021-09-08T13:31:47.000Z,https://i.guim.co.uk/img/media/f9a64a665016b5916e57cfc3c43ff4dada669f8e/0_261_2750_1649/master/2750.jpg?width=1200&height=630&quality=85&auto=format&fit=crop&overlay-align=bottom%2Cleft&overlay-width=100p&overlay-base64=L2ltZy9zdGF0aWMvb3ZlcmxheXMvdGctYWdlLTIwMjEucG5n&enable=upscale&s=399a6bc6c4cfa160381613314c3bab58,,False
876779270,The Lazarus heist: How North Korea almost pulled off a billion-dollar hack,,In 2016 North Korean hackers planned a $1bn raid on Bangladesh's national bank and came within an inch of success. But how did they do it?,https://www.bbc.com/news/stories-57520169,my_library,"crypto, goodreads, malware",2021-06-25T15:10:31.000Z,https://ichef.bbci.co.uk/news/1024/branded_news/CFE1/production/_118971235_bbc_tlh_arta1-nc-1.png,,False
876779000,"Cryptoqueen: How this woman scammed the world, then vanished - BBC News",,How did Ruja Ignatova make $4bn selling her fake cryptocurrency to the world - and where did she go?,https://www.bbc.com/news/stories-50435014,my_library,"blockchain, crypto, goodreads, truecrime",2021-05-16T00:10:28.000Z,https://ichef.bbci.co.uk/news/1024/branded_news/17996/production/_109826669_queen_promo-nc.jpg,,False
876775777,Electric Crypto Balkan Acid Test | Alexander Clapp,,"After decades of conflict in North Kosovo, all it’s taken for Serb and Albanian politicians to put aside their resentments is the get-rich-quick prospect of cryptomining.",https://thebaffler.com/salvos/electric-crypto-balkan-acid-test-clapp,my_library,"crypto, goodreads",2020-08-10T01:32:43.000Z,https://thebaffler.com/wp-content/uploads/2020/07/B52_Clapp_opener.jpg,,False
