id,title,note,excerpt,url,folder,tags,created,cover,highlights,favorite
876793899,15 Quotes on the Unparalleled Power of Example,,Discover the power of examples in shaping our lives. Explore quotes on example and how they inspire us to reach new heights.,https://www.artofmanliness.com/character/behavior/15-quotes-on-the-unparalleled-power-of-example,my_library,"behaviors, influence-persuasion, leadership",2024-02-05T08:22:21.000Z,https://content.artofmanliness.com/uploads/2024/01/15-quotes-blank.jpg,,False
876793624,Currencies (On Motivating Different People) (Ed Batista),,"A theme in my practice is the leader who's seeking to increase employee motivation. In this context it's important to bear in mind the work of Frederick Herzberg, a 20th century psychologist who had a profound influence on our understanding...",https://www.edbatista.com/2023/09/currencies-on-motivating-different-people.html,my_library,"influence-persuasion, leadership, motivation",2023-10-01T23:01:34.000Z,https://edbatista.typepad.com/.a/6a00d8341e62fd53ef02b75180fc99200b-600wi,,False
876792984,"When your coworker does great work, tell their manager",,,https://jvns.ca/blog/2020/07/14/when-your-coworker-does-great-work-tell-their-manager,my_library,"feedback, influence-persuasion, leadership",2023-09-01T17:40:48.000Z,,,False
876792919,Talking About a Difficult Decision — When You Can’t Share All the Details,,"When you have to communicate a difficult organizational decision to employees, it’s hard to know how much information to provide when you can’t be fully transparent yet. Saying nothing can undermine people’s trust in your motives and compassion, whereas saying too much can leave people feeling overwhelmed and vulnerable as they struggle to process the information and implications. Striking the right balance between these two extremes is a tricky exercise for leaders. The author presents five strategies to help you figure out what to say and do when you can’t yet be fully transparent with your employees.",https://hbr.org/2023/08/talking-about-a-difficult-decision-when-you-cant-share-all-the-details,my_library,"influence-persuasion, leadership, speaking",2023-08-12T01:25:50.000Z,https://hbr.org/resources/images/article_assets/2023/08/Aug23_11_1501196010.jpg,,False
876792060,The Culture Map: How to Navigate Foreign Cultures in Business,,,https://ahalbert.com/reviews/2023/06/04/the_culture_map.html,my_library,"culture, influence-persuasion, leadership, management, speaking",2023-06-19T10:49:25.000Z,https://ahalbert.com/assets/Anglo-Dutch-Translation-Guide.jpeg,,False
876792040,The Art of Leadership: Lessons from Art Blakey,,Let Your People Shine,https://albertcory50.substack.com/p/the-art-of-leadership-lessons-from,my_library,"influence-persuasion, jazz, leadership, music",2023-06-13T22:54:25.000Z,"https://substackcdn.com/image/fetch/w_1200,h_600,c_fill,f_jpg,q_auto:good,fl_progressive:steep,g_auto/https%3A%2F%2Fsubstack-post-media.s3.amazonaws.com%2Fpublic%2Fimages%2F3928a25e-ea94-4323-897d-8962a7f07ce8_600x600.jpeg",,False
876792000,What working as a military psychologist taught me about coaching people,,"3 tips for coaching people, from a former military psychologist",https://qz.com/what-working-as-a-military-psychologist-taught-me-about-1850409744,my_library,"coaching-mentoring, influence-persuasion, leadership",2023-05-31T11:01:56.000Z,"https://i.kinja-img.com/image/upload/c_fill,h_675,pg_1,q_80,w_1200/f7df1b755a44909b1500389a868fc659.jpg",,False
876791613,Carl Braun on Communicating Like a Grown-Up,,Industrial genius Carl Braun believed that clear thinking and clear communication go hand in hand. Here the guide on writing productively to get things done.,https://fs.blog/carl-braun-communicating,my_library,"charisma, influence-persuasion, leadership, speaking, writing",2023-03-30T12:07:19.000Z,https://149664534.v2.pressablecdn.com/wp-content/uploads/2016/03/Productive-writing.png,,False
876789577,How Great Leaders Communicate,,"Transformational leaders are exceptional communicators. In this piece, the author outlines four communication strategies to help motivate and inspire your team: 1) Use short words to talk about hard things. 2) Choose sticky metaphors to reinforce key concepts. 3) Humanize data to create value. 4). Make mission your mantra to align teams.",https://hbr.org/2022/11/how-great-leaders-communicate,my_library,"influence-persuasion, leadership, speaking",2022-11-23T23:32:58.000Z,https://hbr.org/resources/images/article_assets/2022/11/Nov22_23_412821498.jpg,,False
876787776,"Learnings of a CEO: Wade Foster, Zapier | Y Combinator",,"Today, Zapier automates work by connecting with over 5,000 apps. The company has been profitable since 2014 and is valued at $5B – with 700 employees working remotely. Wade, Zapier CEO, shared his learnings growing into the role of a growth-stage CEO.",https://www.ycombinator.com/blog/learnings-of-a-ceo-wade-foster-zapier,my_library,"influence-persuasion, leadership",2022-08-17T01:12:07.000Z,https://www.ycombinator.com/blog/content/images/2022/08/BlogTwitter-Image-Template.jpg,,False
876787584,Medium,,,https://medium.com/my-first-job-1/3-life-lessons-from-the-red-light-district-9f86778b0cb3%23.8ygyk88zg,my_library,"behaviors, influence-persuasion, leadership",2022-07-19T00:31:25.000Z,,,False
876787579,Tribal Leadership: The Key To Building Great Teams,,Have you ever wondered about internal organization dynamics and why some groups of people (who aren’t on the same team) are more successful than others? Why different “tribes” inside the organization seem to be at war with one another lowering performance in increasing politics? Why certain groups of people never seem to do anything? Or why …,https://www.farnamstreetblog.com/2017/02/tribal-leadership,my_library,"behaviors, influence-persuasion, leadership",2022-07-19T00:31:10.000Z,https://149664534.v2.pressablecdn.com/wp-content/uploads/2016/11/Tribal-Leadership.png,,False
876787570,Medium,,,https://medium.com/the-year-of-the-looking-glass/unintuitive-things-i-ve-learned-about-management-f2c42d68604b%23.i93jpv7sv,my_library,"behaviors, influence-persuasion, leadership",2022-07-19T00:30:55.000Z,,,False
876787501,42 Rules to Lead by from the Man Who Defined Google's Product Strategy,,Former Google SVP of Products Jonathan Rosenberg on the quintessential lessons every leader needs to learn.,http://firstround.com/review/42-Rules-to-Lead-by-from-the-Man-Who-Defined-Googles-Product-Strategy,my_library,"influence-persuasion, leadership",2022-07-19T00:28:34.000Z,https://review.firstround.com/content/images/2056/firstround-2fyfz17klytam52rbnivnh_chrome_logo.png,,False
876787474,Stop Overcomplicating It: The Simple Guidebook to Upping Your Management Game,,"Russ Laraway wades through all of the competing opinions, complex frameworks and advice out there on how to be a better manager, creating a simple, data-backed leadership toolkit.",https://review.firstround.com/stop-overcomplicating-it-the-simple-guidebook-to-upping-your-management-game,my_library,"influence-persuasion, leadership",2022-07-18T23:42:59.000Z,https://review.firstround.com/content/images/2056/firstround-2fgettyimages-1357074921.jpg,,False
876787453,https://www.fastcompany.com/3062156/lessons-learned/this-former-linkedin-product-managers-surprising-leadership-formula,,,https://www.fastcompany.com/3062156/lessons-learned/this-former-linkedin-product-managers-surprising-leadership-formula,my_library,"behaviors, influence-persuasion, leadership",2022-07-18T16:17:11.000Z,,,False
876787418,Military reading lists,,U.S. Army Engineer School Commandant’s Reading List,https://militaryreadinglists.com/reading_list/29-u-s-army-engineer-school,my_library,"behaviors, influence-persuasion, leadership",2022-07-18T16:07:17.000Z,,,False
876787417,Managing Two People Who Hate Each Other,,How to minimize the drama and keep your team on track.,https://hbr.org/2014/06/managing-two-people-who-hate-each-other,my_library,"behaviors, influence-persuasion, leadership",2022-07-18T16:07:15.000Z,,,False
876787409,8 common traits of uncommon product leaders,,I’ve found the following to be common (and not easily taught) in people whose product skills I admire.,https://medium.com/@cw/8-common-traits-of-uncommon-product-leaders-4d8f11caf9eb?curator=MediaREDEF%23.pyvjyxesp=,my_library,"behaviors, influence-persuasion, leadership",2022-07-18T16:06:50.000Z,https://miro.medium.com/v2/resize:fit:1200/1*X2YucaIkzZ2ctYFWyLbbqw.jpeg,,False
876787408,Take Your Team From Worst To First: Leadership Lessons From The Boston Red Sox,,John Farrell took his team from the bottom of their division last year to the 2013 World Series with a set of tactics every manager should learn.,https://www.americanexpress.com/us/small-business/openforum/articles/boston-red-sox-john-farrell-business-leadership,my_library,"behaviors, influence-persuasion, leadership",2022-07-18T16:06:48.000Z,https://icm.aexp-static.com/content/dam/contenthub/us/en/images/wp-content/uploads/2013/10/take-your-team-from-worst-to-first-leadership-lessons-from-the-boston-red-sox-brick-open-forum-display.jpg,,False
876787404,http://www.terrystarbucker.com/2014/03/06/complete-collection-25-timeless-leadership-lessons-just-plain-work/,,,http://www.terrystarbucker.com/2014/03/06/complete-collection-25-timeless-leadership-lessons-just-plain-work,my_library,"behaviors, influence-persuasion, leadership",2022-07-18T16:06:39.000Z,,,False
876787398,Mentors Are The Secret Weapons Of Successful Startups | TechCrunch,,"“I’ve probably revised this investor pitch deck 200 times,” a founder told me recently. She’d met with more than 50 potential investors before closing a seed round last month. This might sound excessive to some, but her experience is not unusual.  Entrepreneurs often spend hundreds of hours raising funds from angel and venture capital investors. While these activities are clearly important, analysis of new data on startups suggests that founders should also dedicate significant time to something that many people overlook: recruiting great mentors. This simple strategy can increase a company’s odds of success more than almost anything else.",https://techcrunch.com/2015/03/22/mentors-are-the-secret-weapons-of-successful-startups,my_library,"behaviors, coaching-mentoring, influence-persuasion, leadership",2022-07-18T16:06:26.000Z,https://techcrunch.com/wp-content/uploads/2015/03/shutterstock_203486686.png?w=1200,,False
876787373,"LappleApple/awesome-leading-and-managing: Awesome List of resources on leading people and being a manager. Geared toward tech, but potentially useful to anyone.",,"Awesome List of resources on leading people and being a manager. Geared toward tech, but potentially useful to anyone. - LappleApple/awesome-leading-and-managing",https://github.com/LappleApple/awesome-leading-and-managing,my_library,"behaviors, glossaries, influence-persuasion, leadership",2022-07-18T16:05:22.000Z,https://opengraph.githubassets.com/0d4f3ec0cf754e84a2cbe96102ed2ad95cc17bff0821adb38e28d5490c5372f2/LappleApple/awesome-leading-and-managing,,False
876787368,4 Leadership Types That Can Destroy a Perfectly Good Strategy,,"The home of Process Excellence covers topics from Business Process Management (BPM) to Robotic Process Automation (RPA), AI, Lean Six Sigma and more. Latest news, freshest insight and upcoming events and webinars.",http://www.processexcellencenetwork.com/innovation/articles/how-leadership-can-destroy-a-perfectly-good-strate,my_library,"behaviors, influence-persuasion, leadership",2022-07-18T16:05:12.000Z,https://eco-cdn.iqpc.com/eco/images/channel_content/images/pex-logo-lg_1.png,,False
876787366,Real Leaders Don’t Do Focus Groups,,"Apple is famous for not engaging in the focus-grouping that defines most business product and marketing strategy. Which is partly why Apples products and advertising are so insanely great. They have the courage of their own convictions, instead of the opinions of everyone else’s whims. On the subject, Steve Jobs loves to quote Henry Ford […]",https://hbr.org/2010/02/no-reference-points.html,my_library,"behaviors, influence-persuasion, leadership",2022-07-18T16:05:08.000Z,https://hbr.org/resources/images/hbr_opengraph_940x490.png,,False
876787354,Moving Your Agenda | The Leading Blog: A Leadership Blog,,Leadership Now is a leading source for leadership development and analysis. We believe that anyone can make a difference by leading from where they are.,https://www.leadershipnow.com/leadingblog/2017/12/moving_your_agenda.html,my_library,"behaviors, influence-persuasion, leadership",2022-07-18T16:04:40.000Z,,,False
876787349,How An Ancient Chinese War General Would Run Your Startup Better - Mattermark,,"""The success of your startup is determined before you ship a single line of code."" Okay, you’re right, Sun Tzu, the ancient Chinese war general and author",https://mattermark.com/ancient-chinese-war-general-run-startup-better,my_library,"behaviors, influence-persuasion, leadership",2022-07-18T15:22:53.000Z,https://mattermark.com/wp-content/uploads/2017/01/Battle_at_Dabulin.jpg,,False
876787341,Why Should Anyone Be Led by You?,,"We all know that leaders need vision and energy, but after an exhaustive review of the most influential theories on leadership–as well as workshops with thousands of leaders and aspiring leaders–the authors learned that great leaders also share four unexpected qualities. The first quality of exceptional leaders is that they selectively reveal their weaknesses (weaknesses, not fatal flaws). Doing so lets employees see that they are approachable. It builds an atmosphere of trust and helps galvanize commitment. The second quality of inspirational leaders is their heavy reliance on intuition to gauge the appropriate timing and course of their actions. Such leaders are good “situation sensors”–they can sense what’s going on without having things spelled out for them. Managing employees with “tough empathy” is the third quality of exceptional leadership. Tough empathy means giving people what they need, not what they want. Leaders must empathize passionately and realistically with employees, care intensely about the work they do, and be straightforward with them. The fourth quality of top-notch leaders is that they capitalize on their differences. They use what’s unique about themselves to create a social distance and to signal separateness, which in turn motivates employees to perform better. All four qualities are necessary for inspirational leadership, but they cannot be used mechanically; they must be mixed and matched to meet the demands of particular situations. Most important, however, is that the qualities encourage authenticity among leaders. To be a true leader, the authors advise, “Be yourself–more–with skill.”",https://hbr.org/2000/09/why-should-anyone-be-led-by-you,my_library,"behaviors, influence-persuasion, leadership",2022-07-18T15:22:24.000Z,https://hbr.org/resources/images/article_assets/2000/09/SEPT15_03_article_Goffee_t.jpg,,False
876786758,Google’s Quest to Build a Better Boss (Published 2011),,A company study found that a manager’s technical skills were far less valued by employees than people skills.,http://www.nytimes.com/2011/03/13/business/13hire.html,my_library,"behaviors, influence-persuasion, leadership",2022-07-18T15:20:21.000Z,https://static01.nyt.com/images/misc/nyt_logo_t_oembed_880x586.png,,False
876786757,We Need to Talk About Servant Leadership,,"Tastes great, less filling",https://mfbt.ca/we-need-to-talk-about-servant-leadership-a719c4c05434,my_library,"behaviors, influence-persuasion, leadership",2022-07-18T15:20:19.000Z,https://miro.medium.com/v2/resize:fit:1200/1*i1HWKQM_wQGXO8msiudwvw.jpeg,,False
876786756,How to Mentor a Perfectionist,,It’s really hard.,https://hbr.org/2017/02/how-to-mentor-a-perfectionist,my_library,"behaviors, coaching-mentoring, influence-persuasion, leadership",2022-07-18T15:20:14.000Z,https://hbr.org/resources/images/article_assets/2017/02/feb17-21-88968409.jpg,,False
876786753,Lincoln on Leadership,,"Fight the Good Fight The probability that we may fall in the struggle ought not to deter us from the support of a cause we believe to be just. Try Honey Before Vinegar If you would win a man to your cause, first convince him that you are his sincere friend. On the contrary … …",https://www.farnamstreetblog.com/2014/08/lincoln-on-leadership,my_library,"behaviors, influence-persuasion, leadership",2022-07-18T15:20:06.000Z,https://149664534.v2.pressablecdn.com/wp-content/uploads/2020/06/FS-LOGO.png,,False
876786745,https://www.fastcompany.com/3016115/leadership-now/7-tough-leadership-lessons-from-a-navy-seal-commander,,,https://www.fastcompany.com/3016115/leadership-now/7-tough-leadership-lessons-from-a-navy-seal-commander,my_library,"behaviors, influence-persuasion, leadership",2022-07-18T15:19:33.000Z,,,False
876786726,Book summary the 21 irrefutable laws of leadership by john maxwell part 1,,,http://hgimnetwork.org/2015/01/book-summary-the-21-irrefutable-laws-of-leadership-by-john-maxwell-part-1,my_library,"behaviors, influence-persuasion, leadership",2022-07-18T15:18:34.000Z,,,False
876786704,The Ten Golden Rules of Leadership: Classical Wisdom for Modern Leaders,,The Ten Golden Rules of Leadership explores the classical figures to determine the ten crucial axioms of leadership. Rule 1. Know Theyself. Rule 2 ...,https://www.farnamstreetblog.com/2015/07/golden-rules-of-leadership,my_library,"behaviors, influence-persuasion, leadership",2022-07-18T15:16:58.000Z,https://149664534.v2.pressablecdn.com/wp-content/uploads/2020/06/FS-LOGO.png,,False
876786334,What Marissa Mayer Brought to Yahoo That Can’t Be Bought or Sold | HackerNoon,,"In the least surprising news of 2016, Yahoo is selling its core business to Verizon for a sad $5 billion. Everyone knew this was coming — but for some reason, the headlines keep blaming Marissa.",https://hackernoon.com/what-marissa-mayer-brought-to-yahoo-that-cant-be-bought-or-sold-4ee82382e4ee,my_library,"influence-persuasion, leadership",2022-07-05T21:47:03.000Z,https://hackernoon.imgix.net/fallback-feat.png,,False
876784856,Small Actions Make Great Leaders,,"Leadership has traditionally been taught as a set of larger actions, such as having a difficult conversation or coaching someone. In reality, leading well is an integrated activity, in which one is doing many things simultaneously. One way to learn to do this better is to think about leadership as a series of small actions that are practiced, then carefully sequenced and interwoven during interactions. For instance, instead of thinking of something as a “difficult conversation,” a leader might aim to disarm, then show appreciation, then appeal to values. Research identifies 25 such actions, and learning to implement them in the right circumstances can help one become a better leader.",https://hbr.org/2022/06/small-actions-make-great-leaders,my_library,"culture, influence-persuasion, leadership",2022-06-22T16:35:29.000Z,https://hbr.org/resources/images/article_assets/2022/06/Jun22_22_1250870.jpg,,False
876784127,Leading Cross-Functional Teams,,This is the legendary presentation about cross-functional teams from Ken Norton that made donuts and product management synonymous.,https://www.kennorton.com/essays/leading-cross-functional-teams.html,my_library,"influence-persuasion, leadership, prodmgmt",2022-06-07T18:22:49.000Z,https://www.bringthedonuts.com/img/crossfunctional/beach.jpg,,False
876784109,How to harness employees’ emotional energy,,Fuel success by linking a company’s strategic goals to the reasons people are proud to work there.,https://www.strategy-business.com/blog/How-to-Harness-Employees-Emotional-Energy,my_library,"emotions, influence-persuasion, leadership",2022-06-07T18:20:23.000Z,https://www.strategy-business.com/media/image/40317823_thumb5_690x400.jpg,,False
876783935,What It Really Means to Be Successful: Our Favorite Reads,,There’s no “right way” to do it.,https://t.co/nsAykopoIe?ssr=true,my_library,"influence-persuasion, leadership",2022-05-19T23:28:42.000Z,https://hbr.org/resources/images/article_assets/2022/05/A_May22_04_towfiqu-barbhuiya-junsplash.jpg,,False
876781986,The Secret Ingredient of Thriving Companies? Human Magic.,,"The traditional corporate approach to motivating people has been a combination of carrots and sticks: a system of financial incentives designed to mobilize everyone around a plan designed by a few smart people at the top. Multiple studies have confirmed that, for any work involving cognitive or creative skills, financial rewards do not drive motivation and performance. So, what does? According to former Best Buy CEO Hubert Joly, it takes several mutually reinforcing elements to create an environment that unleashes the kind of human magic necessary for a company purpose to take root and flourish. He presents six ingredients to create your company’s unique recipe for human magic.",https://hbr.org/2022/01/the-secret-ingredient-of-thriving-companies-human-magic,my_library,"influence-persuasion, leadership, management",2022-01-15T17:45:56.000Z,https://hbr.org/resources/images/article_assets/2022/01/Jan22_10_639854106.jpg,,False
876780876,How to Give the Gift of Generative Thinking,,"If you want to help people, don’t give them advice. Do this instead.",https://betterhumans.pub/how-to-give-the-gift-of-generative-thinking-6386b7ba0e61,my_library,"influence-persuasion, leadership, listening, speaking",2021-12-13T12:16:51.000Z,https://miro.medium.com/v2/da:true/resize:fit:1024/0*Hrt5Bs9jKQp-xpNt,,False
876780015,The Founder’s Guide to Discipline: Lessons from Front’s Mathilde Collin,,"Front's CEO and co-founder Mathilde Collin shares why a founder’s discipline matters more than vision, unveiling her own best practices and templates for communication, time management, fundraising and team building.",https://review.firstround.com/the-founders-guide-to-discipline-lessons-from-fronts-mathilde-collin,my_library,"culture, influence-persuasion, leadership",2021-10-29T12:49:28.000Z,https://review.firstround.com/content/images/2056/firstround-2fvwxgsbutwuw5kumgp1za_2018-10-26-20mathilde-20collin-20--20brandon-20smith-20photo-20--2025.jpg,,False
876779982,‘Give away your Legos’ and other commandments for scaling startups,,"Molly Graham helped forge a work culture at Facebook that's withstood huge amounts of growth. Today, she's something of a rapid scaling expert. Here's the key to doing it right, she says.",https://review.firstround.com/give-away-your-legos-and-other-commandments-for-scaling-startups,my_library,"culture, influence-persuasion, leadership, startups",2021-10-16T23:05:13.000Z,https://review.firstround.com/content/images/2056/firstround-2ffrqz6prtrqqllq8mdhju_6a0115714b7dbf970c01675f67f4e0970b.jpg,,False
876779962,The Skill of Org Design,,"Building effective organisations is a remarkably useful, if rare, skill. This is what it looks like, what it consists of, and how to tell if someone has it.",https://commoncog.com/blog/org-design-skill,my_library,"influence-persuasion, leadership",2021-10-08T13:22:56.000Z,https://commoncog.com/content/images/2021/10/org_design_skill.jpg,,False
876779947,The Ultimate Guide to Running Executive Meetings — 25 Tips from Top Startup,,"Frustrated with your Executive team meetings? We tapped 25 top leaders from the startup C-Suite to share their tested tips, from getting started with an executive team to crafting the agenda and tracking success. Whether you're a first-time CEO or seasoned startup leader, there are plenty of new ideas to try from folks at Superhuman, Lattice, Asana and more.",https://review.firstround.com/the-ultimate-guide-to-running-executive-meetings-25-tips-from-top-startup-leaders,my_library,"influence-persuasion, leadership",2021-10-01T19:18:40.000Z,https://review.firstround.com/content/images/2056/firstround-2fgettyimages-1303910709.jpg,,False
876779849,How to Deliver Constructive Feedback in Difficult Situations,,"“We are dangerous when we are not conscious of our responsibility for how we behave, think, and feel.”―Marshall Rosenberg,  As a founder, my biggest regrets revolve around not having difficu…",https://productivityhub.org/2019/04/19/how-to-deliver-constructive-feedback-in-difficult-situations,my_library,"influence-persuasion, leadership, motivation",2021-08-22T21:16:54.000Z,https://productivityhub.org/wp-content/uploads/2019/04/annotation-2019-04-19-181227.png,,False
876778449,Find the Right Words to Inspire Your Team,,"It’s important to understand that when you, as a leader, communicate with your team, using weaker words weakens your message and blunts your ability to inspire people. It’s not enough to just throw thoughts out there and hope for the best. You need to actively recommend ideas and assert their worthiness in all of your communications. For example, consider these “power words”: “I’m proposing (not “sharing”) an idea that will make our process more efficient.” “I’m suggesting (not “sharing”) a new logo that better conveys our brand message.” “I’m recommending (not “sharing”) a campaign to make our workplace more diverse.” Ultimately, audiences respond more actively to big points than to small words, but thoughtful leaders need to assess both, knowing that the more powerfully they come across — even in small ways — the greater impact they have on the people they hope to inspire.",https://hbr.org/2021/04/find-the-right-words-to-inspire-your-team,my_library,"behaviors, influence-persuasion, leadership, motivation, speaking",2021-04-18T22:50:02.000Z,https://hbr.org/resources/images/article_assets/2021/04/Apr21_13_HBRquotations.jpg,,False
