id,title,note,excerpt,url,folder,tags,created,cover,highlights,favorite
876796896,Why We Love Music,,"Researchers are discovering how music affects the brain, helping us to make sense of its real emotional and social power.",https://greatergood.berkeley.edu/article/item/why_we_love_music,my_library,"emotions, music, neurology",2024-05-11T22:02:19.000Z,https://ggsc.s3.us-west-2.amazonaws.com/assets/images/valorie_salimpoor_-_abcdef_-_6ae5e3fef5842e26e7a607b6eac020e814a8fa43-fb_-_abcdef_-_404233a83e7afbefa1b01d740929d77eb1e16b58.jpg,,False
876795671,ChillsDB: an open-source database of chills-inducing stimuli,,"ChillsDB is the first database of validated audiovisual stimuli eliciting aesthetic chills (goosebumps, psychogenic shivers) in the US population.",https://dataverse.harvard.edu/dataset.xhtml?persistentId=doi:10.7910/DVN/ADLSZE,my_library,"chills, emotions, music",2024-04-18T03:54:38.000Z,https://dataverse.harvard.edu/jakarta.faces.resource/images/dataverseproject.png.xhtml;jsessionid=16d2d4137e0c52026b32cc42c482,,False
876791722,How our brains process music and why we like what we like | Press Play,,How long does it take before you change the station or hit “skip” if you don’t like a song? Seconds — according to researchers at New York University.,https://www.kcrw.com/news/shows/press-play-with-madeleine-brand/abortion-scotus-incarceration-music-hbo/science-like-song,my_library,"emotions, music",2023-04-11T23:04:08.000Z,https://www.kcrw.com/news/shows/press-play-with-madeleine-brand/abortion-scotus-incarceration-music-hbo/science-like-song/@@images/rectangular_image/page-header?v=1681240184.18,,False
876789738,"This 715-song playlist is scientifically verified to give you the chills, thanks to ""frisson""",,"Listening to some songs can cause a powerful physiological response known as ""frisson."" What is it, and why does it happen?",https://bigthink.com/neuropsych/frisson-song-playlist,my_library,"emotions, music",2022-12-18T22:40:41.000Z,"https://bigthink.com/wp-content/uploads/2022/05/frisson.jpg?resize=1200,630",,False
876778031,Dissecting the Bloodthirsty Bliss of Death Metal,,Fans of this violent music report feelings of transcendence and positive emotions; psychologists want to learn why.,https://getpocket.com/explore/item/dissecting-the-bloodthirsty-bliss-of-death-metal,my_library,"behaviors, emotions, empathy, music",2021-02-12T12:59:56.000Z,https://pocket-image-cache.com/1200x/filters:format(jpg):extract_focal()/https%3A%2F%2Fpocket-syndicated-images.s3.amazonaws.com%2Farticles%2F5992%2F1611598543_GettyImages-103462741.jpg,,False
