id,title,note,excerpt,url,folder,tags,created,cover,highlights,favorite
876789837,Deploying an Infrastructure as Code Project in GCP Using Terraform.,,The creation of resources in the cloud and the management of the lifecycle of these resources can be...,https://dev.to/wonder717/deploying-an-infrastructure-as-code-project-in-gcp-using-terraform-25jn,my_library,"devops, google-cloud, terraform",2022-12-28T15:53:12.000Z,https://dev-to-uploads.s3.amazonaws.com/uploads/articles/3otvb2z646ytpt1hl2rv.jpg,,False
876779181,GitHub - hashicorp/terraform: Terraform enables you to safely and predictab,,"Terraform enables you to safely and predictably create, change, and improve infrastructure. It is a source-available tool that codifies APIs into declarative configuration files that can be shared ...",https://github.com/hashicorp/terraform,my_library,"devops, programming, terraform",2021-06-09T02:24:31.000Z,https://repository-images.githubusercontent.com/17728164/10b4bf00-6a20-11ea-8934-20870600afc0,,False
876776507,State of the Art Infrastructure as Code,,The newest layer of abstraction by Gruntwork that’ll make your life easier,https://towardsdatascience.com/state-of-the-art-infrastructure-as-code-4fbd59d92462?source=rss----7f60cf5620c9---4,my_library,"devops, terraform",2020-12-18T11:19:43.000Z,https://miro.medium.com/v2/resize:fit:1200/1*p9ZXAF5uxxcxuf7cH-cv1w.jpeg,,False
876776453,Terraform vs Ansible: What's the difference and which one you should use?,,Preparing your Infrastructure as Code solution? Ansible and Terraform are two of the most popular choices. But what's the difference?,https://linuxhandbook.com/terraform-vs-ansible,my_library,"ansible, devops, terraform",2020-12-10T03:38:01.000Z,https://linuxhandbook.com/content/images/2020/11/ansible-vs-terraform-1.jpg,,False
876775834,Introduction to Terraform,,This week I explored Terraform as part of my exploration of development and operations topics. Terraform is a tool for automating the…,https://medium.com/@etgreer91/introduction-to-terraform-25688c6df612,my_library,"devops, terraform",2020-08-15T16:30:19.000Z,https://miro.medium.com/v2/resize:fit:712/1*etej6CTBPY8VLaGLGiIhQw.png,,False
876774907,Install Terraform | Terraform - HashiCorp Learn,,"Install Terraform on Mac, Linux, or Windows by downloading the binary or using a package manager (Homebrew or Chocolatey). Then create a Docker container locally by following a quick-start tutorial to check that Terraform installed correctly.",https://learn.hashicorp.com/terraform/getting-started/install,my_library,"devops, terraform",2020-05-16T15:49:44.000Z,https://developer.hashicorp.com/og-image/terraform.jpg,,False
