id,title,note,excerpt,url,folder,tags,created,cover,highlights,favorite
876797883,"LVMH: Guardians of Tradition, Engineers of Desirability",,"From royal connections to succession plans, explore LVMH's journey in mastering desirability and achieving global dominance in the luxury industry.",https://quartr.com/insights/company-research/lvmh-guardians-of-tradition-engineers-of-desirability,my_library,"luxury, prodmgmt",2024-07-03T21:54:54.000Z,https://a.storyblok.com/f/182663/1200x630/71411eda35/og-image_lvmh-company-research_guardians-of-tradition-and-desirability.png/m/1200x630,,False
876792829,The secret economics of the Birkin bag,,"On a flight from Paris to London in 1983 Jane Birkin, an Anglo-French chanteuse and actress, spilled the contents of her overstuffed straw...",https://businessday.ng/life-arts/article/the-secret-economics-of-the-birkin-bag,my_library,"behaviors, coolness-desire-envy, luxury, pricing, prodmgmt",2023-07-29T22:58:26.000Z,https://cdn.businessday.ng/2023/07/bag-1.png,,False
876791601,Telfar’s Dynamic Pricing Model Offers a New Way to Gauge Luxury Item Demand,,Telfar has introduced a “Live Price” pricing model based on customer demand.,https://retailwire.com/discussion/telfars-dynamic-pricing-model-offers-a-new-way-to-gauge-luxury-item-demand,my_library,"algorithms-math, luxury, pricing, prodmgmt",2023-03-28T19:33:08.000Z,https://retailwire.com/wp-content/uploads/2023/03/3583A50D-13E1-4359-BDB2-0280FE83105C.png,,False
876786444,How to Sell a $300 Chocolate Bar,,Follow the wine playbook.,https://api.atlasobscura.com/articles/expensive-chocolate-ecuador-toak,my_library,"food-drink, luxury, pricing, prodmgmt",2022-07-13T01:32:31.000Z,https://img.atlasobscura.com/Clt2XV0YSiQkItb8lZvRq9ZWlVm_-pNoJ7UH3F74Ifs/rt:fit/w:600/q:81/sm:1/scp:1/ar:1/aHR0cHM6Ly9hdGxh/cy1kZXYuczMuYW1h/em9uYXdzLmNvbS91/cGxvYWRzL2Fzc2V0/cy9jNjIzMmUyNmY0/N2Y1MGUwYTVfVjE1/LUlDLTJZIGJpcmQn/cyBleWUgdmlldy5q/cGc.jpg,,False
876785146,How to Sell High-priced (and High-quality) Products,,"In the 1950s, most products were built to last. Companies knew that manufacturing long-lasting products would spread word-of-mouth referrals, which meant",http://www.practicalecommerce.com/articles/134656-How-to-Sell-High-priced-and-High-quality-Products,my_library,"emotions, luxury, pricing, prodmgmt",2022-06-28T16:45:05.000Z,https://www.practicalecommerce.com/wp-content/uploads/2017/03/How-to-Sell-High-quality-and-Higher-priced-Products.jpg,,False
876785095,Applying Luxury Principles to Ecommerce Design,,"Luxury brands should use their digital channels to support and enhance their high-quality customer experiences. This requires providing product details that spark interest, balancing visual design with other priorities, and avoiding interruptions that risk cheapening the brand.",https://www.nngroup.com/articles/luxury-principles-ecommerce-design,my_library,"brandmgmt, ecommerce, luxury, prodmgmt",2022-06-27T02:06:43.000Z,https://media.nngroup.com/media/articles/opengraph_images/luxury_ecommerce_3_38.png,,False
876784933,Luxury groups ponder ways to get rid of their unsold inventory,,Other than slashing prices,https://www.economist.com/business/2020/01/30/luxury-groups-ponder-ways-to-get-rid-of-their-unsold-inventory,my_library,"luxury, marketing, prodmgmt",2022-06-23T20:34:28.000Z,https://www.economist.com/img/b/1280/720/90/sites/default/files/20200201_WBP503.jpg,,False
876784024,Why So Many Luxury Brands Are Terrible at Ecommerce,,"Until recently, a lack of digital prioritization and desire to control access have led to sub-par luxury ecommerce experiences. Many luxury brands are struggling to improve.",https://www.nngroup.com/articles/luxury-terrible-ecommerce,my_library,"fashion, luxury, prodmgmt, ui-ux",2022-05-30T20:29:42.000Z,https://media.nngroup.com/media/articles/opengraph_images/luxury-ecommerce-article1_22.png,,False
876771883,https://t.co/5oaFLodGNL?ssr=true,,,https://t.co/5oaFLodGNL?ssr=true,my_library,"behaviors, ecommerce, luxury, prodmgmt",2019-08-29T22:08:18.000Z,,,False
