id,title,note,excerpt,url,folder,tags,created,cover,highlights,favorite
876791965,"Package Managers: Understanding npm, npx and yarn",,"In the development scenario using JavaScript/TypeScript, it is unthinkable to build professional...",https://dev.to/azhariel/package-managers-understanding-npm-npx-and-yarn-3j0c,my_library,"javascript, npm, packages, yarn",2023-05-27T17:41:13.000Z,"https://media.dev.to/dynamic/image/width=1000,height=500,fit=cover,gravity=auto,format=auto/https%3A%2F%2Fdev-to-uploads.s3.amazonaws.com%2Fuploads%2Farticles%2Fyztk8piq6o2gyy75cx4h.png",,False
876790690,Npm vs Yarn: What Should you use for managing packages in React?,,"Both npm (Node Package Manager) and Yarn are popular package managers for JavaScript projects,...",https://dev.to/darkxenium/npm-vs-yarn-what-should-you-use-for-managing-packages-in-react-2332,my_library,"javascript, npm, packages, programming, webdev, yarn",2023-02-11T15:19:42.000Z,"https://media.dev.to/dynamic/image/width=1000,height=500,fit=cover,gravity=auto,format=auto/https%3A%2F%2Fdev-to-uploads.s3.amazonaws.com%2Fuploads%2Farticles%2Fdp1loumndlgnx799slw3.png",,False
876783814,NPM vs Yarn: let's settle things out.,,"Yarn and NPM are two of the most popular Node.js package managers. They allow downloading,...",https://dev.to/ayoub3bidi/npm-vs-yarn-lets-settle-things-out-28m6,my_library,"javascript, npm, yarn",2022-04-13T23:48:11.000Z,"https://media.dev.to/dynamic/image/width=1000,height=500,fit=cover,gravity=auto,format=auto/https%3A%2F%2Fdev-to-uploads.s3.amazonaws.com%2Fuploads%2Farticles%2Fnme1xaytpf1nzbodvb8v.jpg",,False
876782337,2013 04 12 package managers an introducto,,,http://codylindley.com/techpro/2013_04_12__package-managers-an-introducto,my_library,"command-line, javascript, npm, programming, webdev",2022-01-23T12:33:33.000Z,,,False
876782048,npm Docs,,"Documentation for the npm registry, website, and command-line interface",https://docs.npmjs.com,my_library,"javascript, npm",2022-01-16T22:42:59.000Z,https://user-images.githubusercontent.com/29712634/81721690-e2fb5d80-9445-11ea-8602-4b2294c964f3.png,,False
876781966,Give Grunt the Boot! A Guide to Using npm as a Build Tool — SitePoint,,"Peter Dierx demonstrates how flexible and powerful npm can be when used as a build tool and suggests that you might not actually need Grunt, Gulp and co.",http://www.sitepoint.com/guide-to-npm-as-a-build-tool,my_library,"javascript, npm",2022-01-13T14:18:36.000Z,,,False
876780109,NPM vs. YARN: Basic Commands,,Here is a quick reference guide for basic commands that we can use when dealing with Node and...,https://dev.to/vandnakapoor19/npm-vs-yarn-basic-commands-3bl6,my_library,"javascript, npm, yarn",2021-11-28T22:12:20.000Z,"https://media.dev.to/dynamic/image/width=1000,height=500,fit=cover,gravity=auto,format=auto/https%3A%2F%2Fdev-to-uploads.s3.amazonaws.com%2Fuploads%2Farticles%2F3cnokd8x4gyghxsshxe3.jpg",,False
876779251,10 npm Commands that every developer must know,,NPM stands for Node Package Manager and it is the package manager for the Node JavaScript platform....,https://dev.to/gurshehzadsingh/10-npm-commands-that-every-developer-must-know-4gmn,my_library,"javascript, nodejs, npm",2021-06-21T18:50:27.000Z,"https://media.dev.to/dynamic/image/width=1000,height=500,fit=cover,gravity=auto,format=auto/https%3A%2F%2Fdev-to-uploads.s3.amazonaws.com%2Fuploads%2Farticles%2Fxottxoe135huml09jgj1.png",,False
876773654,npm,,,https://www.npmjs.com/browse/depended,my_library,"javascript, npm",2020-02-19T20:01:18.000Z,,,False
