id,title,note,excerpt,url,folder,tags,created,cover,highlights,favorite
876777478,Carl Braun on Communicating Like a Grown-Up,,Industrial genius Carl Braun believed that clear thinking and clear communication go hand in hand. Here the guide on writing productively to get things done.,https://www.farnamstreetblog.com/2016/03/carl-braun-communicating,my_library,"behaviors, influence-persuasion, leadership",2021-01-30T14:31:23.000Z,https://149664534.v2.pressablecdn.com/wp-content/uploads/2016/03/Productive-writing.png,,False
876776223,Memos,,,https://sriramk.com/memos,my_library,"influence-persuasion, leadership, writing",2020-11-03T01:57:42.000Z,,,False
876773799,Quotes and Lessons about Strategy from Machiavelli’s “The Prince” – Effecti,,,https://effectiviology.com/strategy-lessons-from-machiavelli-the-prince,my_library,"behaviors, influence-persuasion, leadership",2020-02-19T20:10:51.000Z,,,False
876773034,The Charisma Effect,,How to bend people to your will.,https://getpocket.com/explore/item/how-to-bend-people-to-your-will,my_library,"behaviors, influence-persuasion, leadership",2019-12-31T13:52:34.000Z,https://pocket-image-cache.com/1200x/filters:format(jpg):extract_focal()/https%3A%2F%2Fcdn.theatlantic.com%2Fassets%2Fmedia%2Fimg%2F2016%2F08%2FDIS_Hutson_SoSCharm%2Flead_720_405.jpg%3Fmod%3D1533692236,,False
876771955,7 Strategies for Establishing Authority,,Remember that the essence of authority is that people willingly follow your lead. That is what the following strategies are designed to do.,https://medium.com/swlh/7-strategies-for-establishing-authority-6ca2bdd8cdfc,my_library,"influence-persuasion, leadership",2019-08-30T00:52:16.000Z,https://miro.medium.com/v2/resize:fit:1200/1*9-8xPocLU9TE3wocC8XwBA.jpeg,,False
