id,title,note,excerpt,url,folder,tags,created,cover,highlights,favorite
876780128,"Why fast, effective data labeling has become a competitive advantage (VB Li",,"If an AI model can make decisions on the company’s behalf through products and services, that model is essentially their competitive edge.",https://venturebeat.com/2021/11/24/why-fast-effective-data-labeling-has-become-a-competitive-advantage-vb-live,my_library,"labeling, machine-learning",2021-11-29T17:20:00.000Z,https://venturebeat.com/wp-content/uploads/2021/11/GettyImages-886575164-e1667519889873.jpg?w=1024?w=1200&strip=all,,False
876780054,Semi-Supervised Learning — How to Assign Labels with Label Propagation Algo,,"How does Semi-Supervised Machine Learning work, and how to use it in Python?",https://towardsdatascience.com/semi-supervised-learning-how-to-assign-labels-with-label-propagation-algorithm-9f1683f4d0eb,my_library,"labeling, machine-learning",2021-11-14T18:25:15.000Z,https://miro.medium.com/v2/resize:fit:1200/1*KY9mGIsWlELiUHBiyIncLg.png,,False
876780002,A Free And Powerful Labelling Tool Every Data Scientist Should Know,,One of the best labelling tools I have ever used.,https://link.medium.com/pL4PbUnOykb,my_library,"labeling, machine-learning",2021-10-24T00:17:11.000Z,https://miro.medium.com/v2/resize:fit:1200/1*kYKaN7n0Sz9dxlyY_dZZuA.jpeg,,False
876778973,Theoretical Understandings of Product Embedding for E-commerce Machine Lear,,,https://arxiv.org/pdf/2102.12029.pdf,my_library,"ecommerce, labeling, machine-learning, prodmgmt",2021-05-09T17:35:35.000Z,,,False
876774703,Layered Label Propagation Algorithm,,An algorithm for community finding,https://towardsdatascience.com/layered-label-propagation-algorithm-1b181b982e80?source=rss----7f60cf5620c9---4,my_library,"algorithms-math, labeling, machine-learning",2020-04-19T14:01:35.000Z,https://miro.medium.com/v2/resize:fit:1200/1*--JXGbe2PmmuTZYHo-APug.png,,False
