id,title,note,excerpt,url,folder,tags,created,cover,highlights,favorite
950808548,The Strange Power of Laughter,,An anthropologist explores laughter as a far more complex phenomenon than simple delight—reflecting on its surprising power to disturb and disrupt.,https://www.sapiens.org/culture/uncontrollable-laughter-culture-meaning/,my_library,"language-linguistics, emotions, comedy-fun-humor",2025-01-21T11:25:29.926Z,https://www.sapiens.org/app/uploads/2025/01/01-laughing-smiling-mouths-pop-art-1280x881.jpeg,,False
876792614,Why are some sounds funny?,,"To English speakers, the word, “peanut” isn’t especially funny. But “peanut” in Serbian, “kikiriki” is widely considered by Serbs to be the funniest word in their language. This raises the question of why people laugh at some words (“poop”) but not at others (“treadmill”). Does it come down to their meanings? Or are people responding to their sounds? Psycholinguist Chris Westbury set out to discover the answer.",https://theworld.org/stories/2023-06-26/why-are-some-sounds-funny,my_library,"comedy-fun-humor, language-linguistics",2023-06-30T22:37:18.000Z,https://media.pri.org/s3fs-public/images/2023/06/2023-06-26-alberta.jpg,,False
876788659,The surprising power of memes,,The science of these viral mash-ups reveals why they are so effective at spreading ideas and beliefs.,https://www.bbc.com/future/article/20220928-the-surprising-power-of-internet-memes,my_library,"comedy-fun-humor, language-linguistics, memes",2022-10-01T10:39:08.000Z,https://ychef.files.bbci.co.uk/624x351/p0d35323.jpg,,False
876787594,What’s So Funny? The Science of Why We Laugh,,"Psychologists, neuroscientists and philosophers are trying to understand humor.",https://getpocket.com/explore/item/what-s-so-funny-the-science-of-why-we-laugh,my_library,"comedy-fun-humor, language-linguistics",2022-07-19T15:09:20.000Z,https://pocket-image-cache.com/1200x/filters:format(jpg):extract_focal()/https%3A%2F%2Fpocket-syndicated-images.s3.amazonaws.com%2Farticles%2F8041%2F1657852079_GettyImages-1195958069.jpg,,False
876784842,Mapping How to Laugh Online in Different Languages,,In this map of laughter around the world you will be able to see how haha is written in different countries depending on their languages.,https://preply.com/en/d/laughing-around-the-world-map--lp,my_library,"comedy-fun-humor, language-linguistics",2022-06-22T01:24:46.000Z,https://cms-assets.preply.com/59bcd2/4r263aeifv_DPR_Map_Laugh_Online.png,,False
876784095,"With ‘The Far Side,’ Gary Larson Pioneered the Art of the Meme",,There couldn’t be a ‘Is This a Pigeon?’ without a ‘Beware of Doug’.,https://getpocket.com/explore/item/with-the-far-side-gary-larson-pioneered-the-art-of-the-meme,my_library,"comedy-fun-humor, language-linguistics, memes, storytelling",2022-06-05T22:16:32.000Z,https://pocket-image-cache.com/1200x/filters:format(jpg):extract_focal()/https%3A%2F%2Fmelmagazine.com%2Fwp-content%2Fuploads%2F2020%2F02%2Ffarside.jpg,,False
876784002,What's the funniest name you've heard someone call an object when they couldn't remember its actual name?,,"24K votes, 10K comments. 49M subscribers in the AskReddit community. r/AskReddit is the place to ask and answer thought-provoking questions.",https://www.reddit.com/r/AskReddit/comments/71xsch/whats_the_funniest_name_youve_heard_someone_call,my_library,"comedy-fun-humor, language-linguistics",2022-05-28T18:55:38.000Z,https://share.redd.it/preview/post/71xsch,,False
