id,title,note,excerpt,url,folder,tags,created,cover,highlights,favorite
876769942,25 Ecommerce A/B Testing Ideas For Your 5 Top Store Pages,,The biggest question in ecommerce A/B testing is not “how.”,https://sumo.com/stories/ecommerce-ab-testing,my_library,"a-b, analytics, ecommerce, prodmgmt",2018-11-26T23:43:38.000Z,https://bdow.com/wp-content/uploads/2024/04/8b7543d2-14d1-4fd3-81f5-ff23b48ef081.jpg,,False
876797056,Streamlining E-commerce: Leveraging Entity Resolution for Product Matching,,How Google figures out the price of a product across websites,https://towardsdatascience.com/streamlining-e-commerce-leveraging-entity-resolution-for-product-matching-6a507fd5e925?source=rss----7f60cf5620c9---4,my_library,"ecommerce, entity-resolution, prodmgmt",2024-05-28T21:46:15.000Z,https://miro.medium.com/v2/resize:fill:1053:554/g:fp:0.48:0.81/1*AdDgjZa07fTC2wKR0pFgsw.png,,False
876797039,Amazon Marketplace Fears,,Amazon's marketplace accounts for most of the revenue for thousands of merchants. Therein lies the fear.,https://www.practicalecommerce.com/amazon-marketplace-fears,my_library,"ecommerce, logistics-shipping, prodmgmt",2024-05-27T02:43:41.000Z,https://www.practicalecommerce.com/wp-content/uploads/2024/05/Amazon-Marketplace-Fears.jpg,,False
876795676,Exclusive | Inside Amazon’s Secret Operation to Gather Intel on Rivals,,"Staff went undercover on Walmart, eBay and other marketplaces as a third-party seller called ‘Big River.’ The mission: to scoop up information on pricing, logistics and other business practices.",https://www.wsj.com/business/retail/amazon-secret-operation-intel-rivals-eb82ea3c,my_library,"ecommerce, prodmgmt, spycraft",2024-04-18T17:22:23.000Z,https://images.wsj.net/im-949574/social,,False
876795419,"Lessons from More Than 1,000 E-Commerce Pricing Tests",,"At most small and medium-sized e-commerce retailers, prices are typically set and updated in an ad hoc fashion without one clear owner. The process often starts by using a gross margin target, followed by some comparison with competitors, and then some adjustments from there. Many of these retailers would quickly admit that this isn’t an optimal strategy, and that they are likely leaving money on the table — and they’re often right. The authors’ experience with price testing has shown that there is actually a significant amount of money left on the table when pricing is left un-optimized.",https://hbr.org/2024/03/lessons-from-more-than-1000-e-commerce-pricing-tests,my_library,"analytics, ecommerce, pricing, prodmgmt",2024-03-19T20:37:05.000Z,https://hbr.org/resources/images/article_assets/2024/02/Mar24_19_1255616569.jpg,,False
876793827,ChatGPT Prompts for Customer Personas,,"Identify and target personas of keywords, competitors, Reddit discussions, and more.",https://www.practicalecommerce.com/chatgpt-prompts-for-customer-personas,my_library,"chatgpt, ecommerce, prodmgmt, search",2024-01-23T07:53:20.000Z,https://www.practicalecommerce.com/wp-content/uploads/2024/01/ChatGPT-Prompts-for-Customer-Personas.jpg,,False
876793807,‘Let’s Go Shopping (LGS)’ Dataset: A Large-Scale Public Dataset with 15M Im,,"Developing large-scale datasets has been critical in computer vision and natural language processing. These datasets, rich in visual and textual information, are fundamental to developing algorithms capable of understanding and interpreting images. They serve as the backbone for enhancing machine learning models, particularly those tasked with deciphering the complex interplay between visual elements in images and their corresponding textual descriptions. A significant challenge in this field is the need for large-scale, accurately annotated datasets. These are essential for training models but are often not publicly accessible, limiting the scope of research and development. The ImageNet and OpenImages datasets, containing human-annotated",https://www.marktechpost.com/2024/01/14/lets-go-shopping-lgs-dataset-a-large-scale-public-dataset-with-15m-image-caption-pairs-from-publicly-available-e-commerce-websites,my_library,"datasets, ecommerce, machine-vision, prodmgmt",2024-01-17T07:19:04.000Z,https://www.marktechpost.com/wp-content/uploads/2024/01/Screenshot-2024-01-14-at-4.05.26-AM.png,,False
876793730,19 Open Source Ecommerce Platforms,,"Open-source platforms are flexible, composable, and highly customizable. Here's the all-new update to our longstanding list.",https://www.practicalecommerce.com/open-source-ecommerce-platforms,my_library,"ecommerce, prodmgmt, programming",2024-01-01T00:30:24.000Z,https://www.practicalecommerce.com/wp-content/uploads/2023/12/20-Open-Source-Ecommerce-Platforms.jpg,,False
876793673,What is RGSP? Google’s Randomized Generalized Second-Price ad auctions expl,,"A deep dive into why the DOJ thinks RGSP makes ad auctions unfair, and why Google believes it creates a better user experience.",https://searchengineland.com/google-rgsp-randomized-generalized-second-price-ad-auctions-explained-433053,my_library,"adtech-adwords, advertising-commercials, auctions, ecommerce, game-theory, prodmgmt",2023-10-15T23:12:55.000Z,https://searchengineland.com/wp-content/seloads/2023/10/shutterstock_1294394836.jpg,,False
876792998,eBay rolls out a tool that generates product listings from photos,,"eBay's new generative AI tool, rolling out on iOS first, can write a product listing from a single photo -- or so the company claims.",https://techcrunch.com/2023/09/07/ebay-rolls-out-a-tool-that-generates-product-listings-from-photos,my_library,"ecommerce, machine-vision, object-detection, prodmgmt",2023-09-07T16:51:03.000Z,https://techcrunch.com/wp-content/uploads/2019/09/GettyImages-632621434.jpg,,False
876792923,11 free tools for PPC campaign management,,"These tools can help you analyze PPC competitors, track search trends or design ad creative – all without spending a dime.",https://searchengineland.com/free-tools-ppc-campaign-management-430520,my_library,"analytics, ecommerce, keywords-ppc-seo, prodmgmt, programming",2023-08-14T13:06:36.000Z,https://searchengineland.com/wp-content/seloads/2023/08/Top-free-tools-for-use-in-paid-media.png,,False
876792893,Four Types of Ecommerce Merchandising That Business Owners Should Know,,"By Sam Cortez, managing editor and outreach specialist for Scalefluence.comMerchandising is the process and practice of displaying and arranging products for the best customer experience. The concept of merchandising is based on guiding prospective customers through the buyer’s journey and presenting them with the right products, at the right time and place, in the right quantity, and with the best prices.",https://www.retailtechnologyreview.com/articles/2020/11/03/four-types-of-ecommerce-merchandising-that-business-owners-should-know,my_library,"ecommerce, prodmgmt",2023-08-06T23:52:18.000Z,,,False
876791961,Use ‘Look Inside’ to Sell More Products,,"The benefits of Amazon's ""Look inside"" book label applies to many products. Apparel, bags, housewares, and more could experience more conversions with an inside peek.",https://www.practicalecommerce.com/use-look-inside-to-sell-more-products,my_library,"ecommerce, packaging, prodmgmt",2023-05-25T23:25:48.000Z,https://www.practicalecommerce.com/wp-content/uploads/2023/05/Use-Look-Inside-to-Sell-More-Products.jpg,,False
876791868,Thrift shops thrive when disorder is balanced with high seller knowledge,,"One person's trash may well be another's ""come up,"" or what the rapper Macklemore calls hidden treasures in the song ""Thrift Shop,"" but only if secondhand shoppers follow the rapper's lead and dig through ...",https://phys.org/news/2023-05-thrift-disorder-high-seller-knowledge.html,my_library,"collecting-curation, ecommerce, prodmgmt",2023-05-02T22:33:19.000Z,https://scx2.b-cdn.net/gfx/news/hires/2023/thrift-shops-thrive-wh.jpg,,False
876791023,The Future of Ecommerce: How a Product Becomes a Purchase,,"General Partner Connie Chan on how leading brands are using AI and other technology to combine the serendipitous discovery of offline shopping with the infinite options of online shopping. Today, most of the Western world revolves around search-based online commerce. This means that most shoppers type directly what they want into a store search bar,...",https://a16z.com/2023/03/23/the-future-of-ecommerce,my_library,"discovery, ecommerce, marketing, prodmgmt, search",2023-03-24T11:49:05.000Z,https://d1lamhf6l6yk6d.cloudfront.net/uploads/2023/04/The-Future-of-Ecommerce-How-a-Product-Becomes-a-Purchase.png,,False
876791002,10 Best Practices for Ecommerce Checkout Design,,"Optimizing your ecommerce checkout process is crucial to reduce cart abandonment rates, as it affects...",https://dev.to/medusajs/10-best-practices-for-ecommerce-checkout-design-81e,my_library,"ecommerce, prodmgmt",2023-03-22T10:18:38.000Z,"https://media.dev.to/dynamic/image/width=1000,height=500,fit=cover,gravity=auto,format=auto/https%3A%2F%2Fdev-to-uploads.s3.amazonaws.com%2Fuploads%2Farticles%2Fu0fh61t8bku2k2514ybe.jpg",,False
876790861,How 20 years of Google’s AdSense changed the internet,,Google's targeted ad initiative AdSense was initially launched as “content targeting advertising” 20 years ago this month. Here’s how it changed the internet.,https://www.fastcompany.com/90861689/how-20-years-of-googles-adsense-changed-the-internet?partner=rss,my_library,"adtech-adwords, advertising-commercials, ecommerce, prodmgmt",2023-03-10T20:18:45.000Z,"https://images.fastcompany.com/image/upload/f_auto,q_auto,c_fit/wp-cms/uploads/2023/03/p-1-90861689-how-20-years-of-googles-adsense-changed-the-internet.jpg",,False
876790859,Target Just Announced Something Brilliant That Amazon Can't Compete With,,Make it easy for your customers to do business with you.,http://inc.com/jason-aten/target-just-announced-drive-up-returns-amazon-cant-compete.html,my_library,"ecommerce, prodmgmt, returns",2023-03-10T20:06:54.000Z,"https://img-cdn.inc.com/image/upload/f_webp,q_auto,c_fit,w_1024,h_1024/images/panoramic/getty_1242556990_oz6lum.jpg",,False
876790720,"Tools to Create, Optimize Meta Descriptions",,Meta descriptions do not influence organic rankings. But the descriptions appear in search snippets more often than not and thus impact clicks on organic listings.,https://www.practicalecommerce.com/tools-to-create-optimize-meta-descriptions,my_library,"ecommerce, keywords-ppc-seo, prodmgmt, programming",2023-02-16T14:32:46.000Z,https://www.practicalecommerce.com/wp-content/uploads/2023/02/Tools-to-Create-and-Optimize-Meta-Descriptions.jpg,,False
876790572,Welcome to the Shoppy Shop,,Why does every store suddenly look the same?,https://clicks.getpocket.com/f/a/Ryu7EyN_DBreesFv94oj6w~~/AAQRxQA~/RgRluRBJP4QDAWh0dHBzOi8vd3d3LmdydWJzdHJlZXQuY29tLzIwMjMvMDEvd2h5LWV2ZXJ5LXNob3BweS1zaG9wLWxvb2tzLWV4YWN0bHktdGhlLXNhbWUuaHRtbD91dG1fbWVkaXVtPWVtYWlsJnV0bV9zb3VyY2U9cG9ja2V0X2hpdHMmdXRtX2NhbXBhaWduPVBPQ0tFVF9ISVRTLUVOLURBSUxZLVJFQ1MtMjAyM18wMV8yOSZzcG9uc29yZWQ9MCZwb3NpdGlvbj01JnNjaGVkdWxlZF9jb3JwdXNfaXRlbV9pZD0yY2U1M2M5NS04M2IxLTQ5OTYtODA4ZC05MjQyN2M5MDkxMTBXA3NwY0IKY9NJi9ZjZNKY1VIQYmpwY2pwQGdtYWlsLmNvbVgEAAABzA~~,my_library,"ecommerce, prodmgmt",2023-01-30T01:49:58.000Z,https://pyxis.nymag.com/v1/imgs/67c/db7/3206a6d26e64b0b7d866cd82ff80d74a06-Big-Night-QUICK-EDIT-18--1-.1x.rsocial.w1200.jpg,,False
876789973,3 Flaws of Cost-plus Pricing - Practical Ecommerce,,Cost-plus pricing on the surface seems straightforward. But then market forces intervene.,https://www.practicalecommerce.com/3-flaws-of-cost-plus-pricing,my_library,"ecommerce, pricing, prodmgmt",2023-01-22T17:16:19.000Z,https://www.practicalecommerce.com/wp-content/uploads/2023/01/3-Flaws-of-Cost-plus-Pricing.jpg,,False
876789862,Hacker News,,,https://news.ycombinator.com/item?id=34281730,my_library,"ecommerce, payments, prodmgmt",2023-01-07T16:34:08.000Z,,,False
876789530,Basically everything on Amazon has become an ad,,Inside the under-the-radar business that makes more money than Amazon Prime.,https://www.vox.com/recode/2022/11/10/23450349/amazon-advertising-everywhere-prime-sponsored-products,my_library,"advertising-commercials, ecommerce, prodmgmt",2022-11-15T12:23:21.000Z,https://platform.vox.com/wp-content/uploads/sites/2/chorus/uploads/chorus_asset/file/24183422/1236892318.jpg?quality=90&strip=all&crop=0%2C10.732984293194%2C100%2C78.534031413613&w=1200,,False
876788828,A Complete Taxonomy of Internet Chum - The Awl,,"by John MahoneyThis is a bucket of chum. Chum is decomposing fish matter that elicits a purely neurological brain stem response in its target consumer: larger fish, like sharks. It signals that they should let go, deploy their nictitating  ...",https://www.theawl.com/2015/06/a-complete-taxonomy-of-internet-chum,my_library,"adtech-adwords, advertising-commercials, behaviors, ecommerce, prodmgmt",2022-10-29T13:49:33.000Z,,,False
876788700,GoodwillFinds.com gives shoppers more reasons to feel good about buying sec,,"A new recommerce venture offers all of the benefits of buying second hand plus a means to help fund social service programs in local communities, such as job training and youth mentorship. Do you see retailers trying to raise the visibility of their secondhand offerings in light of rising prices?",https://retailwire.com/discussion/goodwillfinds-com-gives-shoppers-more-reasons-to-feel-good-about-buying-secondhand,my_library,"ecommerce, prodmgmt, retail",2022-10-05T15:00:47.000Z,https://retailwire.com/wp-content/uploads/2022/10/goodwillfinds-product-page-on-laptop-666x333-1.jpg,,False
876788569,"Subscriptions are out, refills are in.",,"Everything these days is a subscription. And honestly, on reflection, subscriptions are complete horseshit.",https://bluepnume.medium.com/subscriptions-are-out-refills-are-in-311fd6e41e5e,my_library,"ecommerce, prodmgmt, subscriptions",2022-09-18T00:30:33.000Z,https://miro.medium.com/v2/resize:fit:1200/1*NI_76_ONKO3FYVGY1YnoAg.png,,False
876788521,Multi-Objective Ranking for Promoted Auction Items,,Determining which promoted auction items to display in a merchandising placement is a multi-sided customer challenge that presents opportunities to both surface amazing auction inventory to buyers and help sellers boost visibility on their auction listings.,https://tech.ebayinc.com/engineering/multi-objective-ranking-for-promoted-auction-items,my_library,"auctions, ecommerce, machine-learning, prodmgmt",2022-09-13T23:23:21.000Z,https://static.ebayinc.com/static/assets/Uploads/Blog/Posts/_resampled/ScaleWidthWzEwMjRd/220901-MO-Ranking-Promo-Auctions-tech-blog-v1-01-inc-16x9-hero-A.jpg?fs=f6e676ab58c64f01,,False
876788508,PPC management for e-commerce: 28 tools to explore,,Software and tools not only help you manage your time better but provide helpful insights that you wouldn't otherwise see in a Google or Facebook interface.,https://searchengineland.com/ppc-management-for-e-commerce-28-tools-to-explore-387801,my_library,"ecommerce, keywords-ppc-seo, prodmgmt, programming",2022-09-10T03:19:34.000Z,https://searchengineland.com/wp-content/seloads/2022/09/Shutterstock_628146863.jpg,,False
876788375,7 useful Excel formulas and functions for PPC,,Use these tips to quickly analyze performance data and identify high-impact PPC optimizations that will move the needle.,https://searchengineland.com/excel-formulas-functions-ppc-387428,my_library,"analytics, ecommerce, excel, keywords-ppc-seo, prodmgmt",2022-08-24T14:20:05.000Z,https://searchengineland.com/wp-content/seloads/2022/08/Excel-tips-for-search-marketing-professionals-Formulas-and-functions.jpeg,,False
876787786,Elevate Your E-commerce Journey With Animated UX Microinteractions,,Microinteraction best practices that improve e-commerce UX.,https://www.toptal.com/designers/animation/ux-microinteractions-e-commerce-design,my_library,"ecommerce, prodmgmt, ui-ux",2022-08-17T15:28:28.000Z,https://bs-uploads.toptal.io/blackfish-uploads/components/open_graph_image/8956960/og_image/optimized/OPEN_GRAPH-2c063e6ae705085cd8be77c57da781fa.png,,False
876787707,5 Amazon product listing optimization must-haves,,Amazon will continue to be highly competitive. Want to be successful? Optimize your product listings to the fullest with these tips.,https://searchengineland.com/amazon-product-listing-optimization-must-haves-386902,my_library,"analytics, ecommerce, keywords-ppc-seo, prodmgmt",2022-08-05T01:21:06.000Z,https://searchengineland.com/wp-content/seloads/2022/08/Untitled-design-4.png,,False
876787596,How Paper Catalogs Remain Relevant in a Digital Age,,"Whether or not you should pursue a catalog strategy is a question that deserves significant thought. As digital marketing becomes more complex, it may make a lot of sense to send out correctly designed catalogs to the right customers. For e-commerce retailers without physical stores, catalogs can effectively mimic stores’ sensory experiences to enhance customer affinity. For multichannel retailers, by understanding the channel preferences of current customers through transactional data, multichannel retailers can add an effective catalog marketing channel to their store and e-commerce channel strategies.",https://hbr.org/2022/07/how-paper-catalogs-remain-relevant-in-a-digital-age,my_library,"catalogs, ecommerce, marketing, prodmgmt",2022-07-19T18:47:57.000Z,https://hbr.org/resources/images/article_assets/2022/07/Jul22_19_118078009.jpg,,False
876787512,Piracy Doubled My App Sales,,,http://danielamitay.com/blog/2011/1/17/piracy-doubled-my-app-sales,my_library,"ecommerce, piracy, prodmgmt",2022-07-19T00:28:58.000Z,,,False
876787458,How to Price Shipping and Handling Fees,,Today's consumers expect free shipping for most items. But it's not always obvious for merchants to know when and how to offer it. Here's our all-new update for analyzing shipping costs and free delivery.,https://www.practicalecommerce.com/how-to-price-shipping-and-handling-fees,my_library,"ecommerce, pricing, prodmgmt, supply-chain",2022-07-18T21:29:55.000Z,https://www.practicalecommerce.com/wp-content/uploads/2022/07/071622-pet-rock-featured.jpg,,False
876786675,How to Build an Amazon Affiliate Website - 2024 Guide - Make A Website Hub,,"When it comes to making money online you’re going to have a lot of options at your disposal. Frankly, it can be quite overwhelming just choosing an online",https://makeawebsitehub.com/build-amazon-affiliate-website,my_library,"affiliates, ecommerce, keywords-ppc-seo, marketing, prodmgmt",2022-07-18T15:14:41.000Z,https://makeawebsitehub.com/wp-content/uploads/2016/03/How-to-Build-an-Amazon-Affiliate-Website.jpg,,False
876786664,Advanced list building,,,https://jilt.com/blog/advanced-list-building,my_library,"ecommerce, email, prodmgmt",2022-07-18T15:13:51.000Z,,,False
876786585,Neil Patel's Digital Marketing Blog,,"Your #1 resource for digital marketing tips, trends, and strategy to help you build a successful online business.",https://blog.kissmetrics.com/custom-shipping-supplies,my_library,"ecommerce, marketing, packaging, prodmgmt",2022-07-18T15:06:55.000Z,,,False
876786480,All Markets Are Not Created Equal: 10 Factors To Consider When Evaluating Digital Marketplaces,,"Since Benchmark’s investment in Ebay 15 years ago, we have been fascinated by online marketplaces. Entrepreneurs accurately recognize that the connective tissue of the Internet provides an opportunity to link the players in a particular market, reducing friction in both the buying and selling experience. For example, my car tax check is an online platfrom that allows you to book a slot for a complete history and guidance of your car taxes and other details. The arrival of the smartphone amplifies these opportunities, as the Internet’s connective tissue now extends deeper and deeper into an industry with the participants connected…",http://abovethecrowd.com/2012/11/13/all-markets-are-not-created-equal-10-factors-to-consider-when-evaluating-digital-marketplaces,my_library,"ecommerce, platforms, prodmgmt",2022-07-17T15:05:23.000Z,https://i0.wp.com/abovethecrowd.com/wp-content/uploads/2012/11/text-quote.png?fit=888%2C484&ssl=1,,False
876786393,Catalogs & Wishbooks,,"336 Vintage Christmas Catalogs & Holiday Wish Books with 302,605 total catalog pages from Sears, Montgomery Ward and JCPenney over the years.",https://christmas.musetechnical.com,my_library,"catalogs, ecommerce, prodmgmt",2022-07-07T19:35:17.000Z,,,False
876786357,Five Questions Companies Should Ask Before Making an Innovation-Driven Acquisition,,"The Swiss pharmaceutical giant Roche is nothing if not determined in its quest to acquire Illumina, the San Diego-based leader in genetic-sequencing equipment. In January, after Illumina’s board rebuffed Roche’s initial overtures, Roche made a $5.7 billion tender offer directly to shareholders. When that didn’t succeed, it extended the offer to midnight last Friday. Now […]",https://hbr.org/2012/03/five-questions-companies-shoul,my_library,"due-diligence, ecommerce, marketing, packaging, prodmgmt",2022-07-05T21:48:24.000Z,https://hbr.org/resources/images/hbr_opengraph_940x490.png,,False
876786313,http://www.postaffiliatepro.com/blog/the-ultimate-list-of-,,,http://www.postaffiliatepro.com/blog/the-ultimate-list-of-,my_library,"affiliates, ecommerce, prodmgmt",2022-07-05T21:43:12.000Z,,,False
876786268,Why Your eCommerce Business Should Have a Pop-Up Shop,,"Ecommerce is booming, and there’s no doubt about that. The numbers speak for themselves. After all, in 2017, ecommerce sales reached $2.3 trillion, and",https://readwrite.com/2019/04/25/why-your-ecommerce-business-should-have-a-pop-up-shop,my_library,"ecommerce, prodmgmt, retail",2022-07-05T21:37:33.000Z,https://readwrite.com/wp-content/uploads/2019/04/Why-Your-eCommerce-Business-Should-Have-a-Pop-Up-Shop.jpg,,False
876785231,Asking Users to Complete Tough Mudders to Use Your Product,,"Funnel optimization for web3 companies will become critical to their success. Token grants cost 4-7x than traditional customer acquisition techniques. Other techniques, like incentivized referral, improve the economics but still tally 19 month payback periods. A year-and-a-half might be fine for a SaaS company selling a $50k to $100k ARR product, but long-term viability demands achieving 3-6 month paybacks of modern web2 consumer companies. Why are the payback periods so high?",https://www.tomtunguz.com/virtual_wallets_funnel_optimization,my_library,"blockchain, ecommerce, prodmgmt",2022-07-05T20:29:23.000Z,,,False
876785213,Buy Till You Die: Understanding Customer Lifetime Value,,The BG/NBD model explained.,https://towardsdatascience.com/buy-till-you-die-understanding-customer-lifetime-value-eb2c0a23b85,my_library,"ecommerce, metrics, prodmgmt",2022-07-05T10:38:46.000Z,https://miro.medium.com/v2/resize:fit:1200/1*-RFL4MlVM9P1bWaMLB9gLA.png,,False
876785166,Cross-chain Deals and Adversarial Commerce,,"This paper appeared in VLDB'19 and is authored by Maurice Herlihy, Barbara Liskov, and Liuba Shrira.   How can autonomous, mutually-distrust...",http://muratbuffalo.blogspot.com/2019/12/cross-chain-deals-and-adversarial.html,my_library,"ecommerce, game-theory, prodmgmt, trust",2022-06-29T02:01:54.000Z,https://blogger.googleusercontent.com/img/b/R29vZ2xl/AVvXsEj9zDXH4La3ONZRkelqeYdrTwn6ts-2wuBrl145-1nMMcHDRAlimr2WTtWokUIr1geMdlD6P6KhvgB0iPBkMAiTOqEgSkfZrQN73V8zyovQsE4XXxd3vvTkcghIWM2YJhYwU7EiIK9XHa0/s400/ccdealmatrix.png,,False
876785137,16 Tools to Manage Your Reputation,,"Reputation management is essential for any brand. Your company's future may depend on what’s been said about it in posts, comments, reviews, and rankings. Fortunately, there are affordable tools to help. Here is a list of tools to manage your brand’s reputation.",http://www.practicalecommerce.com/articles/68072-20-Free-Tools-to-Manage-Your-Reputation,my_library,"ecommerce, prodmgmt, reputation",2022-06-28T15:21:44.000Z,https://www.practicalecommerce.com/wp-content/uploads/2021/07/16-Tools-to-Manage-Your-Reputation.jpg,,False
876785095,Applying Luxury Principles to Ecommerce Design,,"Luxury brands should use their digital channels to support and enhance their high-quality customer experiences. This requires providing product details that spark interest, balancing visual design with other priorities, and avoiding interruptions that risk cheapening the brand.",https://www.nngroup.com/articles/luxury-principles-ecommerce-design,my_library,"brandmgmt, ecommerce, luxury, prodmgmt",2022-06-27T02:06:43.000Z,https://media.nngroup.com/media/articles/opengraph_images/luxury_ecommerce_3_38.png,,False
876785088,Neil Patel's Digital Marketing Blog,,"Your #1 resource for digital marketing tips, trends, and strategy to help you build a successful online business.",https://blog.kissmetrics.com/1step-checkout-right-way,my_library,"ecommerce, prodmgmt",2022-06-25T18:41:31.000Z,,,False
876784943,Video Tools Archives,,,https://www.practicalecommerce.com/tag/video-tools,my_library,"ecommerce, prodmgmt, programming, video",2022-06-23T20:35:03.000Z,,,False
876784920,13 Platforms for Shoppable Video,,Video is increasingly impacting ecommerce. Consumers use it for purchase decisions. Influencers live-stream product endorsements. And brands deploy video for engagement and product offerings. Here is a list of platforms for shoppable video.,https://www.practicalecommerce.com/12-platforms-for-shoppable-video,my_library,"ecommerce, prodmgmt, video",2022-06-23T20:33:35.000Z,https://www.practicalecommerce.com/wp-content/uploads/2020/08/thumb3.jpg,,False
