id,title,note,excerpt,url,folder,tags,created,cover,highlights,favorite
876789854,Conversation Skills Essentials – Tynan.com,,,https://tynan.com/letstalk,my_library,"empathy, influence-persuasion, listening, negotiation, politeness",2023-01-03T01:44:05.000Z,https://tynan.com/wp-content/uploads/2022/12/wp-1672412215285-scaled.jpg,,False
876789563,The Secret To Talking To Someone Who Always Gets Defensive,,"Talking to someone who gets defensive can be frustrating. So, what can you do? Here's how to sidestep someone's personal fortifications.",https://www.fatherly.com/life/how-to-talk-to-someone-who-always-gets-defensive,my_library,"behaviors, influence-persuasion, listening, speaking",2022-11-22T00:56:20.000Z,https://imgix.bustle.com/uploads/image/2022/11/10/dbb37cee-7e2f-4b2b-98f3-6af1a9f1279c-gettyimages-932650136.jpg?w=1200&h=630&fit=crop&crop=faces&fm=jpg,,False
876789509,Hidden ways people drain another's energy,,Examples of hidden ways people drain one other’s energy in social interaction—and what to do about it,https://betterhumans.pub/how-to-handle-8-energy-drains-in-communication-b050de3f1fe?source=rss----7038e003d060---4,my_library,"influence-persuasion, listening, speaking",2022-11-08T16:23:22.000Z,https://miro.medium.com/v2/resize:fit:1200/1*rK-SFk0pyueascmgCww3VQ.jpeg,,False
876784070,What’s Your Listening Style?,,"We may have learned that we need to let people speak without interrupting but taking turns talking does not truly denote listening. And unintentionally hijacking conversations to advise, inject humor, empathize, prioritize efficiency, or insert ourselves into the speaker’s narrative is often done with good intentions, but may instead disrupt the human connection we think we’re forging. Recognizing when to shift out of our habitual styles and consciously apply alternative styles of listening and responding may allow for more effective and meaningful interactions.",https://hbr.org/2022/05/whats-your-listening-style,my_library,"empathy, feedback, influence-persuasion, listening",2022-06-03T12:17:22.000Z,https://hbr.org/resources/images/article_assets/2022/05/May22_31_165776274.jpg,,False
876783812,The Endgames of Bad Faith Communication,,,https://consilienceproject.org/endgames-of-bad-communication,my_library,"behaviors, emotions, empathy, influence-persuasion, language-linguistics, listening",2022-04-13T18:29:22.000Z,https://consilienceproject.org/wp-content/uploads/2022/02/RAG0522PP010_Endgames-Bad-Faith_2-1024x576.jpg,,False
876780876,How to Give the Gift of Generative Thinking,,"If you want to help people, don’t give them advice. Do this instead.",https://betterhumans.pub/how-to-give-the-gift-of-generative-thinking-6386b7ba0e61,my_library,"influence-persuasion, leadership, listening, speaking",2021-12-13T12:16:51.000Z,https://miro.medium.com/v2/da:true/resize:fit:1024/0*Hrt5Bs9jKQp-xpNt,,False
876779964,"How to Get Someone to Tell You Their Secrets, According to an Investigative Journalist",,"And once you do get them to open up, don’t betray their trust.",https://lifehacker.com/how-to-get-someone-to-tell-you-their-secrets-according-1847783774,my_library,"influence-persuasion, interrogations, interviewing, listening",2021-10-08T18:28:21.000Z,https://lifehacker.com/imagery/articles/01HF2GH4A411BMRAFWAXE14VW5/hero-image.fill.size_1200x675.jpg,,False
876777417,How to Talk to People You Disagree With,,"Bridge the divide with thoughtful conversation techniques, next-level listening, and a dip into the science of changing minds.",https://getpocket.com/explore/item/how-to-talk-to-people-you-disagree-with,my_library,"behaviors, confidence, influence-persuasion, listening, negotiation",2021-01-25T14:37:29.000Z,https://pocket-image-cache.com/1200x/filters:format(jpg):extract_focal()/https%3A%2F%2Fs3.amazonaws.com%2Fpocket-collectionapi-prod-images%2Fd93f5c7f-f085-4d78-9c7d-be340e1fd63c.jpeg,,False
