id,title,note,excerpt,url,folder,tags,created,cover,highlights,favorite
876784179,Defining Aggregators,,"Building on Aggregation Theory, this provides a precise definition of the characteristics of aggregators, and a classification system based on suppliers. Plus, how to think about aggregator regulat…",https://stratechery.com/2017/defining-aggregators,my_library,"aggregation, platforms, prodmgmt",2022-06-12T14:03:52.000Z,https://i0.wp.com/stratechery.com/wp-content/uploads/2018/03/cropped-android-chrome-512x512-1.png?fit=512%2C512&ssl=1,,False
876784090,Airbnb and the Internet Revolution,,"Airbnb gets less press than Uber, but in some respects its even more radical: understanding how it works leads one to question many of the premises of modern society from hotels to regulations. It&…",https://stratechery.com/2015/airbnb-and-the-internet-revolution,my_library,"aggregation, network-effects, prodmgmt",2022-06-04T23:07:38.000Z,https://i0.wp.com/stratechery.com/wp-content/uploads/2018/03/cropped-android-chrome-512x512-1.png?fit=512%2C512&ssl=1,,False
876784058,Aggregation and the New Regulation,,"Because of the Internet realities described by Aggregation Theory a smaller number of companies hold an increasing amount of power. However, an increasing focus on market forces reduces the latitud…",https://stratechery.com/2015/aggregation-and-regulation,my_library,"aggregation, platforms, prodmgmt",2022-06-02T18:04:23.000Z,https://i0.wp.com/stratechery.com/wp-content/uploads/2018/03/cropped-android-chrome-512x512-1.png?fit=512%2C512&ssl=1,,False
876780091,Commoditizing Suppliers,,"Aggregators, by virtue of owning demand, gain power over suppliers which become modularized and commoditized. The Moat Map The Moat Map describes the correlation between the degree of supplier diff…",https://stratechery.com/outline/commoditization-suppliers,my_library,"aggregation, prodmgmt",2021-11-23T15:02:59.000Z,https://i0.wp.com/stratechery.com/wp-content/uploads/2018/03/cropped-android-chrome-512x512-1.png?fit=512%2C512&ssl=1,,False
876780090,Aggregation Theory – Stratechery by Ben Thompson,,Aggregation Theory provides a framework to understand the impact of the Internet on nearly all industries.,https://stratechery.com/concept/aggregation-theory,my_library,"aggregation, prodmgmt",2021-11-23T15:00:41.000Z,https://i0.wp.com/stratechery.com/wp-content/uploads/2018/03/cropped-android-chrome-512x512-1.png?fit=512%2C512&ssl=1,,False
876769351,The Moat Map,,The Moat Map describes the correlation between the degree of supplier differentiation and the externalization (or internalization) of a company’s network effect.,https://stratechery.com/2018/the-moat-map,my_library,"aggregation, platforms, prodmgmt",2018-05-20T01:14:44.000Z,https://i0.wp.com/stratechery.com/wp-content/uploads/2018/05/Paper.stratechery-Year-One.358.png?fit=1200%2C900&ssl=1,,False
