id,title,note,excerpt,url,folder,tags,created,cover,highlights,favorite
950928266,A Spy Satellite You’ve Never Heard of Helped Win the Cold War,,"Engineers at the Naval Research Lab launched a spy satellite program called Parcae and revolutionized signals intelligence at the height of the Cold War. The program relied on computers to sift through intelligence data, providing a technological edge at a pivotal moment in the Cold War.",https://spectrum.ieee.org/reconnaissance-satellite,my_library,"spycraft, history, military-warfare",2025-01-21T15:15:32.189Z,https://spectrum.ieee.org/media-library/an-iilustration-of-a-satellite-over-the-earth.png?id=55666085&width=1200&height=600&coordinates=0%2C98%2C0%2C586,,True
922144132,How to Stage a Coup,,"""I'm now going to offer you a megalomaniac explanation of the course of events""",https://www.statecraft.pub/p/how-to-commit-a-coup,my_library,"spycraft, influence-persuasion, military-warfare, history",2024-12-15T16:38:15.058Z,"https://substackcdn.com/image/fetch/w_1200,h_600,c_fill,f_jpg,q_auto:good,fl_progressive:steep,g_auto/https%3A%2F%2Fsubstack-video.s3.amazonaws.com%2Fvideo_upload%2Fpost%2F152873301%2Fbd23e29e-e434-4a53-9562-cbd7c45d7466%2Ftranscoded-1733854297.png",,False
876796843,"The Scientist and the A.I.-Assisted, Remote-Control Killing Machine",,Israeli agents had wanted to kill Iran’s top nuclear scientist for years. Then they came up with a way to do it with no operatives present.,https://substack.com/redirect/d2598b49-ad86-47fa-84dd-9b47fc04d3fc?j=eyJ1Ijoib2M1ZCJ9.6RI8bKqkPfjslAbXhUVKrkrSWm-QGIMChpLXQrmwskM,my_library,"military-warfare, spycraft",2024-05-04T21:32:11.000Z,https://static01.nyt.com/images/2021/09/19/world/19iran-assassination-p1/19iran-assassination-p1-largeHorizontalJumbo-v2.jpg?year=2021&h=683&w=1024&s=ca357608f64b6cc9c9eef88b7d649535c7fe8cd40a56bce79e8b56ee5b30395c&k=ZQJBKqZ0VN,,False
876793972,Russia’s shadow tanker fleet runs into trouble,,"Every day, millions of barrels of oil are being transported by ships with obscured ownership and origin. But is the game up?",https://www.lowyinstitute.org/the-interpreter/russia-s-shadow-tanker-fleet-runs-trouble,my_library,"military-warfare, spycraft",2024-02-12T17:01:16.000Z,https://www.lowyinstitute.org/sites/default/files/2024-02/Russian%20tanker%20comp.jpg,,False
876792617,"In a Mutiny or Coup, the Scramble to Persuade and Pick a Side Is Critical",,"Experts say plotters’ most crucial task is to convince other soldiers and officers that success is assured. Plus, our columnist’s recommendations for reading up on coups, and modern Russia.",https://www.nytimes.com/2023/06/30/world/russia-mutiny-coup.html,my_library,"military-warfare, spycraft",2023-07-01T00:49:15.000Z,https://static01.nyt.com/images/2023/06/30/multimedia/30InterpreterNL-Coups-01-wzpk/30InterpreterNL-Coups-01-wzpk-largeHorizontalJumbo.jpg?year=2023&h=683&w=1024&s=7c2a2f8a3a09630ed2aead6da105812873e7a4c3085b4277930964fb197703b4&k=ZQJBKqZ0VN,,False
876790771,Secretive military space agency stepping out of the shadows - SpaceNews,,"When a SpaceX Falcon Heavy launched a national security mission to geostationary Earth orbit Jan. 15, the Space Force revealed that three of the payloads onboard were developed by one of its most s…",https://spacenews.com/secretive-military-space-agency-stepping-out-of-the-shadows,my_library,"military-warfare, spycraft, astronomy-space",2023-02-23T02:22:26.000Z,https://i0.wp.com/spacenews.com/wp-content/uploads/2023/02/USSF_67spacex.jpg?fit=1000%2C666&ssl=1,,False
876789825,Investigating the Nord Stream Pipeline Sabotage,,"As investigators piece together clues, Russia has quietly taken steps to begin expensive repairs on the giant gas pipeline, complicating theories about who was behind September’s sabotage.",https://www.nytimes.com/2022/12/26/world/europe/nordstream-pipeline-explosion-russia.html,my_library,"military-warfare, spycraft",2022-12-27T13:30:07.000Z,https://static01.nyt.com/images/2022/12/21/multimedia/21pipeline-01-1-3600/21pipeline-01-1-3600-largeHorizontalJumbo.jpg?year=2022&h=682&w=1024&s=89f3d7416f6a2c063720a86bcd378ed4218bffef329b3b17ed055700f8d83534&k=ZQJBKqZ0VN,,False
876785217,Blocked persons and letters of marque,,"What are letters of marque and reprisal, and who is on the US’s list of Block Persons?",https://dynomight.net/blocked-persons,my_library,"military-warfare, public-policy, spycraft",2022-07-05T19:56:54.000Z,https://dynomight.net/img/blocked-persons/flag1.jpg,,False
876784190,"The Project Gutenberg eBook of Simple Sabotage Field Manual, by Office of Strategic Services",,,https://www.gutenberg.org/files/26184/26184-h/26184-h.htm,my_library,"military-warfare, spycraft",2022-06-13T10:01:59.000Z,,,False
