id,title,note,excerpt,url,folder,tags,created,cover,highlights,favorite
876785177,Why Your Angular Bundle Is Bloated,,A common reason why an Angular bundle is bloated is that it uses a library like MomentJS that isn't...,https://dev.to/bitovi/why-your-angular-bundle-is-bloated-p2d,my_library,"angularjs, javascript, programming",2022-06-30T20:50:46.000Z,"https://media.dev.to/dynamic/image/width=1000,height=500,fit=cover,gravity=auto,format=auto/https%3A%2F%2Fdev-to-uploads.s3.amazonaws.com%2Fuploads%2Farticles%2Fthkap3noyidzsjq9o7un.jpg",,False
876781916,Tips and practices to optimize your AngularJS app,,"AngularJS is a magic framework. Using it well will drastically improve your productivity, code modularity and reusability. Using it badly…",https://medium.com/developers-writing/tips-and-practices-to-optimize-your-angularjs-app-8118550ff808#.cgr26upxg,my_library,"angularjs, javascript",2022-01-12T23:32:29.000Z,https://miro.medium.com/v2/resize:fit:955/1*vNhaw1SCSu_DuKwSHZSQnQ.png,,False
876781904,11 Tips to Improve AngularJS Performance - Tech TLDR;,,"I am new to Angular (even though I am not new to the web development), so please take everything that I am about to say with a grain of salt. That being said, I watched a lot of talks and read a lot of articles relevant to Angular performance, and this post is the summary […]",https://www.alexkras.com/11-tips-to-improve-angularjs-performance,my_library,"angularjs, javascript",2022-01-12T23:29:39.000Z,https://techtldr.com/wp-content/uploads/batarang.png,,False
876781901,angular/angular-cli: CLI tool for Angular,,CLI tool for Angular.,https://github.com/angular/angular-cli,my_library,"angularjs, javascript",2022-01-12T23:28:52.000Z,https://repository-images.githubusercontent.com/36891867/7600907d-5c07-47a5-a7b5-80b9c8922d6c,,False
876781896,Angular,,Angular is a platform for building mobile and desktop web applications.     Join the community of millions of developers who build compelling user interfaces with Angular.,https://angular.io/docs/ts/latest/guide/style-guide.html,my_library,"angularjs, javascript",2022-01-12T23:27:21.000Z,,,False
876781063,Build A Real World Beautiful Web APP with Angular 8— The Ultimate Guide (2019) — PART II,,🕑 The Wait Is Over ❕,https://medium.com/@hamedbaatour/build-a-real-world-beautiful-web-app-with-angular-8-the-ultimate-guide-2019-part-ii-fe70852b2d6d,my_library,"angularjs, javascript",2021-12-26T21:09:25.000Z,https://miro.medium.com/v2/resize:fit:1200/1*57lZyqXY85XSTYR3IuZKCg.png,,False
876781042,晋中瓮畔电子有限公司,,,http://angulartestingquickstart.com/testing-directive,my_library,"angularjs, javascript",2021-12-23T20:24:01.000Z,,,False
876780951,johnpapa/angular-styleguide: Angular Style Guide: A starting point for Angular development teams to provide consistency through good practices.,,Angular Style Guide: A starting point for Angular development teams to provide consistency through good practices. - johnpapa/angular-styleguide,https://github.com/johnpapa/angular-styleguide,my_library,"angularjs, javascript",2021-12-15T02:31:57.000Z,https://opengraph.githubassets.com/bc3cd82ba885eb562326ca1297806a72dfd323c769b4fef9e1a0a15ecd7fa02d/johnpapa/angular-styleguide,,False
876780896,Creating Graphics Using SVG and AngularJS | DotNetCurry,,Learn to create interesting biological models and graphics using SVG and AngularJS,http://www.dotnetcurry.com/angularjs/1213/create-graphics-using-svg-angularjs,my_library,"angularjs, javascript, svg",2021-12-13T23:49:49.000Z,,,False
876780157,"Angular Introduction - Angular is a leading, powerful and most popular frontend javascript framework for creating single page application or SPA",,,https://www.tutorialslogic.com/angular/introduction,my_library,"angularjs, javascript",2021-12-01T14:49:50.000Z,https://www.tutorialslogic.com/images/tutorials/angular/ti-angular.jpg,,False
876776113,Deploy Angular Apps to Firebase From GitHub,,How to create simple CI/CD pipelines for automated deployments,https://towardsdatascience.com/deploy-angular-apps-to-firebase-from-github-5f5ef0aad396?source=rss----7f60cf5620c9---4,my_library,"angularjs, firebase, github, javascript",2020-11-03T00:10:19.000Z,https://miro.medium.com/v2/da:true/resize:fit:1200/0*PEJWGzRj_QBUgenT,,False
876775889,Top 15 Angular Projects for Beginners,,55K subscribers in the angularjs community. A community for the awesome MVC JS framework.,https://www.reddit.com/r/angularjs/comments/iwt6zy/top_15_angular_projects_for_beginners,my_library,"angularjs, javascript",2020-09-22T21:36:49.000Z,https://external-preview.redd.it/b2YLPJqVlPJgYw_mF8-GA1jeDkmPG_s7G1yKXWKbr10.jpg?auto=webp&s=8cd99a7aca6f811d636426b5caee60c719a54480,,False
876775860,Angular v/s React v/s Vue: The Complete Comparison,,"""Framework is heart of every technology.""   Whether you are a beginner, a senior developer, a freela...",https://dev.to/ozakaran/angular-v-s-react-v-s-vue-the-complete-comparison-2b7k,my_library,"angularjs, javascript, reactjs, vue",2020-08-27T17:58:42.000Z,"https://media.dev.to/dynamic/image/width=1000,height=500,fit=cover,gravity=auto,format=auto/https%3A%2F%2Fdev-to-uploads.s3.amazonaws.com%2Fi%2F0sps53blrn5vydwico5r.png",,False
876773932,Build a real-time chat app using Socket.io and Angular.JS,,55K subscribers in the angularjs community. A community for the awesome MVC JS framework.,https://www.reddit.com/r/angularjs/comments/f9wufa/build_a_realtime_chat_app_using_socketio_and,my_library,"angularjs, javascript",2020-03-09T20:16:47.000Z,https://i.redd.it/o0h58lzmax6a1.png,,False
