id,title,note,excerpt,url,folder,tags,created,cover,highlights,favorite
920828064,Addressing the Butterfly Effect: Data Assimilation Using Ensemble Kalman Filter,,"Learn how to implement the Ensemble Kalman Filter for data assimilation, with mathematical details step-by-step code.",https://towardsdatascience.com/addressing-the-butterfly-effect-data-assimilation-using-ensemble-kalman-filter-9883d0e1197b?source=rss----7f60cf5620c9---4,my_library,kalman-filters,2024-12-13T12:26:37.511Z,https://miro.medium.com/v2/resize:fit:1200/1*_RVkkqXYFWt69FNSOlO2ew.jpeg,,False
876795468,The Kalman Filter,,we help students master the Kalman Filter,https://thekalmanfilter.com,my_library,"algorithms-math, kalman-filters",2024-03-28T03:50:29.000Z,,,False
876793973,Kalman Filter Explained Simply - The Kalman Filter,,Tired of equations and matrices? Ready to learn the easy way? This post explains the Kalman Filter simply with pictures and examples!,https://thekalmanfilter.com/kalman-filter-explained-simply,my_library,"algorithms-math, dsp, kalman-filters",2024-02-12T17:01:26.000Z,https://thekalmanfilter.com/wp-content/uploads/2021/01/kalman_filter_overview-1024x700.png,,False
876792846,A non-mathematical introduction to Kalman Filters for programmers,,"Read my manifesto on Code as an alternative to Mathematics. Code for this article can be found on this Colab Notebook should you choose to follow along. Why Kalman Filters? Kalman filters are ingenius. If you have never heard of them, then a very intuitive (and arguably reductive) way to think about them is to",https://praveshkoirala.com/2023/06/13/a-non-mathematical-introduction-to-kalman-filters-for-programmers,my_library,"algorithms-math, filters, kalman-filters",2023-08-03T10:56:29.000Z,,,False
876781879,"How a Kalman filter works, in pictures | Bzarg",,,http://www.bzarg.com/p/how-a-kalman-filter-works-in-pictures,my_library,"algorithms-math, kalman-filters, machine-learning",2022-01-12T20:12:37.000Z,,,False
876778925,Notebook on nbviewer,,Check out this Jupyter notebook!,http://nbviewer.ipython.org/github/rlabbe/Kalman-and-Bayesian-Filters-in-Python/blob/master/table_of_contents.ipynb,my_library,"bayes, filters, kalman-filters, machine-learning",2021-05-01T00:07:59.000Z,http://ipython.org/ipython-doc/dev/_images/ipynb_icon_128x128.png,,False
