id,title,note,excerpt,url,folder,tags,created,cover,highlights,favorite
876783773,5 Tips to Design Ruby on Rails Transactions the Right Way | AppSignal Blog,,Check out these 5 tips to ensure your transactions are readable and well-designed in your Ruby on Rails app.,https://blog.appsignal.com/2022/03/30/5-tips-to-design-ruby-on-rails-transactions-the-right-way.html,my_library,rubyonrails,2022-03-31T23:15:27.000Z,https://ondemand.bannerbear.com/signedurl/vYR1M6Lyq22EAnXbgZ/image.jpg?modifications=W3sibmFtZSI6InRpdGxlIiwidGV4dCI6IjUgVGlwcyB0byBEZXNpZ24gUnVieSBvbiBSYWlscyBUcmFuc2FjdGlvbnMgdGhlIFJpZ2h0IFdheSJ9LHsibmFtZSI6ImltYWdlIiwiaW1hZ2VfdXJsIjoiaHR0cHM6Ly9hcHBzaWduYWwtbmV4dGpzLWJsb2ctbnlxcjZxY3I4LWFwcHNpZ25hbC52ZXJjZWwuYXBwL2ltYWdlcy9ibG9nLzIwMjItMDMvcmFpbHMtdHJhbnNhY3Rpb25zLnBuZyJ9LHsibmFtZSI6ImNhdGVnb3J5X2xvZ28iLCJpbWFnZV91cmwiOiJodHRwczovL2FwcHNpZ25hbC1uZXh0anMtYmxvZy1ueXFyNnFjcjgtYXBwc2lnbmFsLnZlcmNlbC5hcHAvaW1hZ2VzL2xvZ29zL3J1YnktbG9nby5wbmcifV0&s=fe77b4a82d596ef7ae6e2eb0ff0831ba40d58bc532b61c61d7ab249af0c34a71,,False
876782879,GoRails Job Board,,Looking for a Ruby on Rails job or hiring Rails developers? We can help you!,https://jobs.gorails.com,my_library,"career-jobs-work, rubyonrails",2022-03-23T20:50:56.000Z,https://job-boardly-production.s3.amazonaws.com/dosklbmxcd7g10yfprxolp1anoeu,,False
876782868,Ask HN: Cheaper Heroku alternatives for Rails apps? | Hacker News,,,https://news.ycombinator.com/item?id=30755202,my_library,"devops, heroku, rubyonrails",2022-03-21T20:31:45.000Z,,,False
876782855,Optimizing Rails connections,,How to configure database connections in your Rails app,https://dev.to/hopsoft/optimizing-rails-connections-4gkd,my_library,"databases, devops, rubyonrails",2022-03-18T01:28:50.000Z,"https://media.dev.to/dynamic/image/width=1000,height=500,fit=cover,gravity=auto,format=auto/https%3A%2F%2Fdev-to-uploads.s3.amazonaws.com%2Fuploads%2Farticles%2Fti8ainzir3qvydb7nw57.jpeg",,False
876782849,https://www.railsgigs.com/blog/2022/03/09/rails-email-setup-for-development-staging-and-production,,,https://www.railsgigs.com/blog/2022/03/09/rails-email-setup-for-development-staging-and-production,my_library,rubyonrails,2022-03-17T14:43:49.000Z,,,False
876782698,Changing a polymorphic_type in Rails — Development (2022),,How my team redefined the way we store one of the polymorphic associations in the Shopify codebase. This post is the solution we wish we found when we were looking.,https://shopify.engineering/changing-polymorphic-type-rails,my_library,rubyonrails,2022-02-19T03:41:19.000Z,https://cdn.shopify.com/s/files/1/0779/4361/articles/ShopifyEng_BlogIllustrations_211209_72ppi_04_ChangingAPolymorphicTypeInRails.jpg?v=1645144071,,False
876782673,"Color Picker with Ruby on Rails 6, Stimulus and Webpacker",,"A tutorial to integrate a Javascript color picker library Pickr, with Ruby on Rails 6.0, StimulusJS, and Webpacker.",https://chrislabarge.com/posts/color-picker,my_library,"color, rubyonrails",2022-02-12T15:13:51.000Z,https://chrislabarge.com/img/color-picker.jpg,,False
876782578,Security Risks On Rails: Misconfiguration and Unsafe Integrations,,This article was originally written by Diogo Souza on the Honeybadger Developer Blog.  In the third...,https://dev.to/honeybadger/security-risks-on-rails-misconfiguration-and-unsafe-integrations-3m71,my_library,"rubyonrails, security, webdev",2022-01-31T23:25:37.000Z,"https://media.dev.to/dynamic/image/width=1000,height=500,fit=cover,gravity=auto,format=auto/https%3A%2F%2Fdev-to-uploads.s3.amazonaws.com%2Fuploads%2Farticles%2Fpj1byopwzvu16ou84jzf.png",,False
876782467,Run Ordinary Rails Apps Globally · Fly,,Documentation and guides from the team at Fly.io.,https://fly.io/blog/run-ordinary-rails-apps-globally,my_library,"devops, rubyonrails",2022-01-26T23:43:33.000Z,https://fly.io/ruby-dispatch/run-ordinary-rails-apps-globally/assets/run-rails-globally.webp,,False
876782186,amerine/acts_as_tree: ActsAsTree -- Extends ActiveRecord to add simple support for organizing items into parent–children relationships.,,ActsAsTree -- Extends ActiveRecord to add simple support for organizing items into parent–children relationships. - amerine/acts_as_tree,https://github.com/amerine/acts_as_tree,my_library,rubyonrails,2022-01-17T21:14:37.000Z,https://opengraph.githubassets.com/afe8eb8f37f22477782f283931cd276d232385c45680d3b4fc44f971e70ca322/amerine/acts_as_tree,,False
876782185,https://hixonrails.com/ruby-on-rails-tutorials/ruby-on-rails-action-mailer-configuration/,,,https://hixonrails.com/ruby-on-rails-tutorials/ruby-on-rails-action-mailer-configuration,my_library,rubyonrails,2022-01-17T21:14:35.000Z,,,False
876782184,Ruby on Rails Screencasts - RailsCasts,,"Short Ruby on Rails screencasts containing tips, tricks and tutorials. Great for both novice and experienced web developers.",http://railscasts.com,my_library,rubyonrails,2022-01-17T21:14:29.000Z,,,False
876782183,Speeding Up Rendering Rails Pages with render_async - Semaphore,,Adding new code to Rails controllers can slow your pages down. Here's how to make rendering your Rails pages faster.,https://semaphoreci.com/blog/2017/06/08/speeding-up-rails-pages-with-render-async.html,my_library,rubyonrails,2022-01-17T21:13:55.000Z,https://semaphoreci.com/wp-content/uploads/2018/12/speed-up-rendering-rails-pages-with-render-async.jpg,,False
876782182,Installation and Usage of Rails MongoDB,,,https://www.botreetechnologies.com/blog/how-to-install-and-use-mongodb-with-rails6,my_library,"mongodb, nosql, rubyonrails",2022-01-17T21:13:52.000Z,https://www.botreetechnologies.com/blog/wp-content/uploads/2020/04/how-to-install-and-use-mongodb-with-rails-6-1.jpg,,False
876782181,42 performance tips for Ruby on Rails,,This was originally posted on my blog     Since Ruby on Rails is not the fastest web framework out th...,https://dev.to/mskog/42-performance-tips-for-ruby-on-rails-4aik,my_library,rubyonrails,2022-01-17T21:13:42.000Z,"https://media.dev.to/dynamic/image/width=1000,height=500,fit=cover,gravity=auto,format=auto/https%3A%2F%2Fwww.mskog.com%2Fimages%2Fspeedlines.jpg",,False
876782180,💎Rails tip💎,,"Are you dealing with an external API and not sure where to put that code? Using ActiveModel::Model module can be a clean way of doing so in a OO way.

It's a model, but not connected to ActiveRecord/your DB.  
— Sebastien Auriault (@websebdev)",https://twitter.com/websebdev/status/1360647965765951497?s=12,my_library,rubyonrails,2022-01-17T21:13:21.000Z,,,False
876782179,https://hixonrails.com/ruby-on-rails-tutorials/ruby-on-rails-application-monitoring/,,,https://hixonrails.com/ruby-on-rails-tutorials/ruby-on-rails-application-monitoring,my_library,rubyonrails,2022-01-17T21:12:48.000Z,,,False
876782178,https://hixonrails.com/ruby-on-rails-tutorials/ruby-on-rails-set-up-on-github-with-circleci/,,,https://hixonrails.com/ruby-on-rails-tutorials/ruby-on-rails-set-up-on-github-with-circleci,my_library,rubyonrails,2022-01-17T21:12:07.000Z,,,False
876782176,Getting Started with Svelte and Rails 6,,Svelte is slowly rising to fame these days and it’s getting more and more traction with new version 3 being released in April.,https://medium.com/@nikolalsvk/getting-started-with-svelte-and-rails-6-d8384c80ad6c,my_library,"rubyonrails, sveltejs",2022-01-17T21:11:39.000Z,https://miro.medium.com/v2/resize:fit:1200/1*uYw3b9iiXEpEcKTOp9wUFw.jpeg,,False
876782172,Creating and Customizing Rails Generators & Templates — Ruby on Rails Guides,,"Creating and Customizing Rails Generators & TemplatesRails generators are an essential tool for improving your workflow. With this guide you will learn how to create generators and customize existing ones.After reading this guide, you will know: How to see which generators are available in your application. How to create a generator using templates. How Rails searches for generators before invoking them. How to customize your scaffold by overriding generator templates. How to customize your scaffold by overriding generators. How to use fallbacks to avoid overwriting a huge set of generators. How to create an application template.",https://guides.rubyonrails.org/generators.html#generators-lookup,my_library,rubyonrails,2022-01-17T21:09:55.000Z,https://avatars.githubusercontent.com/u/4223,,False
876782169,Understanding Webpacker in Rails 6 | Road to Rails 6,,"Starting with Rails 6, Webpacker is the default JavaScript compiler. It means that all the JavaScript code will be handled by Webpacker instead of the old assets pipeline aka Sprockets. Webpacker is different from asset pipeline in terms of philosophy as well as implementation. In this blog post, we will",https://prathamesh.tech/2019/08/26/understanding-webpacker-in-rails-6,my_library,"javascript, rubyonrails, webdev, webpacker",2022-01-17T19:33:12.000Z,,,False
876782168,https://hixonrails.com/ruby-on-rails-tutorials/ruby-on-rails-security-best-practices/,,,https://hixonrails.com/ruby-on-rails-tutorials/ruby-on-rails-security-best-practices,my_library,"ruby, rubyonrails, webdev",2022-01-17T19:32:37.000Z,,,False
876782166,Full Text Search in Milliseconds with Rails and PostgreSQL,,"This article shows how to optimize a Full Text Search implementation with Rails and PostgreSQL, taking a single query from 130ms to 7ms.",https://pganalyze.com/blog/full-text-search-ruby-rails-postgres,my_library,"postgres, rubyonrails, search",2022-01-17T19:31:48.000Z,https://pganalyze.com/static/be06f82c4bee648c1ea8fe0d77d92c52/fcb2f/full_text_search_ruby_rails_postgres.jpg,,False
876782165,Adding a custom seed file,,"I want to populate a new feature with dummy data, but don't want to use the db/seeds.rb file as it already has seeds other data irrelevant for this feature.

To run the default seeds.rb file, you r...",https://stackoverflow.com/questions/19872271/adding-a-custom-seed-file#19872375,my_library,rubyonrails,2022-01-17T19:31:45.000Z,https://cdn.sstatic.net/Sites/stackoverflow/Img/apple-touch-icon.png?v=c78bd457575a,,False
876782163,Rails 6: the missing developer setup guide,,Learnings and notes from a JavaScript developer trying out Ruby and Ruby on Rails 6 for the first time.,https://dev.to/vvo/a-rails-6-setup-guide-for-2019-and-2020-hf5,my_library,rubyonrails,2022-01-17T19:31:08.000Z,"https://media.dev.to/dynamic/image/width=1000,height=500,fit=cover,gravity=auto,format=auto/https%3A%2F%2Fthepracticaldev.s3.amazonaws.com%2Fi%2Fm329bzrdklhi1ys99fq0.jpg",,False
876782162,"Rails 6: B-Sides and Rarities—Martian Chronicles, Evil Martians’ team blog",,Discover lesser-known Rails 6 features that stay out of the spotlight but can bring a lot to your current applications.,https://evilmartians.com/chronicles/rails-6-b-sides-and-rarities,my_library,rubyonrails,2022-01-17T19:30:32.000Z,https://evilmartians.com/social-cards/chronicles/rails-6-b-sides-and-rarities.jpg,,False
876782161,https://rubyweekly.com/link/102532/ad5e785e3b,,,https://rubyweekly.com/link/102532/ad5e785e3b,my_library,"crypto, rubyonrails",2022-01-17T19:30:30.000Z,,,False
876782160,Rails Concerns: To Concern Or Not To Concern | AppSignal Blog,,Should you be concerned about Rails concerns?,https://blog.appsignal.com/2020/09/16/rails-concers-to-concern-or-not-to-concern.html,my_library,rubyonrails,2022-01-17T19:30:27.000Z,https://ondemand.bannerbear.com/signedurl/vYR1M6Lyq22EAnXbgZ/image.jpg?modifications=W3sibmFtZSI6InRpdGxlIiwidGV4dCI6IlJhaWxzIENvbmNlcm5zOiBUbyBDb25jZXJuIE9yIE5vdCBUbyBDb25jZXJuIn0seyJuYW1lIjoiaW1hZ2UiLCJpbWFnZV91cmwiOiJodHRwczovL2FwcHNpZ25hbC1uZXh0anMtYmxvZy04Y3NrbnhianItYXBwc2lnbmFsLnZlcmNlbC5hcHAvaW1hZ2VzL2Jsb2cvMjAyMC0wOS9yYWlscy1jb25jZXJucy5qcGcifSx7Im5hbWUiOiJjYXRlZ29yeV9sb2dvIiwiaW1hZ2VfdXJsIjoiaHR0cHM6Ly9hcHBzaWduYWwtbmV4dGpzLWJsb2ctOGNza254YmpyLWFwcHNpZ25hbC52ZXJjZWwuYXBwL2ltYWdlcy9sb2dvcy9ydWJ5LWxvZ28ucG5nIn1d&s=daaf771f8056a9681f8bdd1032b30327e6f43047cc26647fbb1811ad1b1f84c9,,False
876782158,https://hixonrails.com/ruby-on-rails-tutorials/ruby-on-rails-testing-rspec-configuration/,,,https://hixonrails.com/ruby-on-rails-tutorials/ruby-on-rails-testing-rspec-configuration,my_library,rubyonrails,2022-01-17T19:29:19.000Z,,,False
876782157,ActiveRecord’s queries tricks,,My favourite part of Rails is clearly ActiveRecord’s scopes. Their expressiveness and their reusability is simply great.,https://medium.com/@apneadiving/active-records-queries-tricks-2546181a98dd,my_library,rubyonrails,2022-01-17T19:25:48.000Z,,,False
876782156,https://launchschool.com/blog/understanding-polymorphic-associations-in-rails,,,https://launchschool.com/blog/understanding-polymorphic-associations-in-rails,my_library,rubyonrails,2022-01-17T19:25:46.000Z,,,False
876782155,Understanding Rails secrets/credentials - Code with Jason,,"What this feature is for The credentials feature is a way of storing secrets that you don’t want to keep in plaintext, like AWS credentials for example. (In fact, the one and only thing I keep in my main Rails project’s credentials are my Active Storage AWS credentials.) Why the credentials feature is difficult to […]",https://rubyweekly.com/link/83853/ad5e785e3b,my_library,"ruby, rubyonrails",2022-01-17T19:25:30.000Z,,,False
876782154,Devise Authentication in Depth — SitePoint,,Ilya Bodrov continues the Authentication in Rails series by looking at the most popular authentication gem: Devise. Basic setup to using extensions.,https://www.sitepoint.com/devise-authentication-in-depth,my_library,rubyonrails,2022-01-17T19:25:28.000Z,,,False
876782152,Show relevant chunks of text with Rails excerpt helper,,"The Rails helper excerpt can extract a chunk of text that matches a certain phrase, no matter where in the string it is.",https://boringrails.com/tips/rails-excerpt-helper,my_library,"ruby, rubyonrails",2022-01-17T19:24:26.000Z,https://boringrails.com/images/tip-sticker.png,,False
876782151,Eager Loading and the N+1 Query Problem | Learn Enough News & Blog,,News & blog about Learn Enough (including the Ruby on Rails Tutorial),https://news.learnenough.com/eager-loading,my_library,"databases, rubyonrails",2022-01-17T19:24:24.000Z,http://softcover.github.io/learnenough-news/images/le.png,,False
876782148,Customizing Rails rake tasks,,Motivation   Rails rake tasks are commands that automate specific acti...,https://dev.to/vinistock/customizing-rails-rake-tasks-3bg5,my_library,"rake, rubyonrails",2022-01-17T19:23:57.000Z,"https://media.dev.to/dynamic/image/width=1000,height=500,fit=cover,gravity=auto,format=auto/https%3A%2F%2Fcl.ly%2F2860d742140c%2Fdownload%2FImage%25202018-11-29%2520at%25207.07.24%2520PM.png",,False
876782147,Introduction to Ruby on Rails Patterns and Anti-patterns,,Welcome to the first post in our series about Ruby on Rails Patterns and Anti-patterns. In each of th...,https://dev.to/appsignal/introduction-to-ruby-on-rails-patterns-and-anti-patterns-2mhc,my_library,rubyonrails,2022-01-17T19:23:43.000Z,"https://media.dev.to/dynamic/image/width=1000,height=500,fit=cover,gravity=auto,format=auto/https%3A%2F%2Fdev-to-uploads.s3.amazonaws.com%2Fi%2Fe5d53rf69hxz738n8vyw.jpg",,False
876782143,Creating Your Own Scaffold Generator in Rails - Nopio,,"Thanks to built-in scaffolding feature starting the project in Ruby on Rails is easy, but when you create your own scaffold generator, it's even easier!",https://www.nopio.com/blog/creating-scaffold-generator-rails,my_library,rubyonrails,2022-01-17T19:22:37.000Z,https://cdn.nopio.com/wp-content/uploads/2017/03/28095241/building_rails_scafford_generator.jpg,,False
876782142,Exploring Metaprogramming in Ruby :: the halcyon blog,,"Metaprogramming is an integral part of Ruby, more so than in any other language. This article explains the hows and whys.",https://www.halcyon.hr/posts/exploring-metaprogramming-in-ruby,my_library,"ruby, rubyonrails",2022-01-17T19:21:11.000Z,https://www.halcyon.hr/posts/exploring-metaprogramming-in-ruby/images/ruby_hu0319058d9e6e9bac6a5a9313f3a1ec62_212499_1200x630_fit_q75_box.jpg,,False
876782139,How to Create Fake Data with Faker,,You can either Collect Data or Create your Own Data,https://towardsdatascience.com/how-to-create-fake-data-with-faker-a835e5b7a9d9?source=rss----7f60cf5620c9---4,my_library,"datasets, rubyonrails",2022-01-17T19:20:57.000Z,https://miro.medium.com/v2/da:true/resize:fit:1200/0*FRDnXejNj_-d52yM,,False
876782081,https://www.airpair.com/reactjs/posts/reactjs-a-guide-for-rails-developers,,,https://www.airpair.com/reactjs/posts/reactjs-a-guide-for-rails-developers,my_library,"reactjs, rubyonrails",2022-01-16T22:46:11.000Z,,,False
876781873,How a routine gem update ended up creating $73k worth of subscriptions,,"On November 5, 2021 (a Friday of course), we've deployed innocent-looking gem updates. Minor versions of Ruby on Rails, Ruby Sentry client, Ruby Slack client, http libraries, Puma, Devise, OmniAuth Ruby client, Mongoid, and a few test gems.  However, something went very wrong.  We saw odd Stripe errors on Airbrake.",https://serpapi.com/blog/how-a-routine-gem-update-ended-up-charging,my_library,"mongodb, rubyonrails",2022-01-09T12:35:41.000Z,https://serpapi.com/blog/content/images/size/w1200/2022/01/image-5.png,,False
876780802,https://rubyweekly.com/link/117341/ad5e785e3b,,,https://rubyweekly.com/link/117341/ad5e785e3b,my_library,rubyonrails,2021-12-11T11:22:21.000Z,,,False
876780088,Converting PDF preview in Rails 6 using Active Storage and MiniMagic,,"In this demo application we will demonstrate that how you can upload documents using active records and convert preview of PDF pages as images. We have also used action cable to display progress of PDF pages to image conversion inside bootstrap modal. Though this is a simple and basic example but you can learn different concepts here from the code base.

Here you can find the repository for this demo application:
https://github.com/RaviSys/pdf-preview-demo

Hope you enjoy learning this.",https://m.youtube.com/watch?v=PZglYDXCRIk,my_library,"pdfs, rubyonrails",2021-11-23T14:54:31.000Z,https://i.ytimg.com/vi/PZglYDXCRIk/sddefault.jpg,,False
876779940,How to build a search engine with Ruby on Rails,,Implementing search in your Rails app can be vexing. Here's a great pattern to use that combines the best parts of ActiveRecord and Postgres.,https://blog.testdouble.com/posts/2021-09-09-how-to-build-a-search-engine-with-ruby-on-rails,my_library,"postgres, rubyonrails, search, sql",2021-10-01T17:50:59.000Z,https://cdn.prod.website-files.com/6647a84a9616b0776fb903e9/66667ea42cee85721676cd1b_social-how-to-build-a-search-engine-with-ruby-on-rails.png,,False
876779840,Modern web apps without JavaScript bundling or transpiling,,"I didn't much care for vanilla JavaScript prior to ES6. Through all of the 2000s, I chased different approaches to avoid writing too much of it. First there was RJS (Ruby-to-JavaScript). Then there was CoffeeScript. Both transpiling approaches that turned more enjoyable-to-write source code into the kind of JavaScript that browsers wou...",https://world.hey.com/dhh/modern-web-apps-without-javascript-bundling-or-transpiling-a20f2755,my_library,"javascript, rubyonrails, webpack",2021-08-20T00:09:05.000Z,https://world.hey.com/dhh/avatar-fb368b1ee9b185dc2a09b03eabdb61678dd55244,,False
876779823,Ruby's Hidden Gems: Bullet | AppSignal Blog,,Let's dive into Bullet and find out how it can help you identify some database-related problems.,https://blog.appsignal.com/2021/08/11/ruby-hidden-gems-bullet-and-how-it-integrates-with-appsignal.html,my_library,"rubygems, rubyonrails",2021-08-12T12:34:23.000Z,https://ondemand.bannerbear.com/signedurl/vYR1M6Lyq22EAnXbgZ/image.jpg?modifications=W3sibmFtZSI6InRpdGxlIiwidGV4dCI6IlJ1YnkncyBIaWRkZW4gR2VtczogQnVsbGV0In0seyJuYW1lIjoiaW1hZ2UiLCJpbWFnZV91cmwiOiJodHRwczovL2FwcHNpZ25hbC1uZXh0anMtYmxvZy1ueXFyNnFjcjgtYXBwc2lnbmFsLnZlcmNlbC5hcHAvaW1hZ2VzL2Jsb2cvMjAyMS0wOC9idWxsZXQuanBnIn0seyJuYW1lIjoiY2F0ZWdvcnlfbG9nbyIsImltYWdlX3VybCI6Imh0dHBzOi8vYXBwc2lnbmFsLW5leHRqcy1ibG9nLW55cXI2cWNyOC1hcHBzaWduYWwudmVyY2VsLmFwcC9pbWFnZXMvbG9nb3MvcnVieS1sb2dvLnBuZyJ9XQ&s=c2c64085d25d101ed2f53e8a20bb6c4d1818d0223fd6d6fe41c1848798616b23,,False
876779779,ruby - Rbenv and Rails mismatches - Stack Overflow,,"Good morning everyone,
I've installed Ruby 3.0.2 via rbenv in order to test-drive a Rails 6.0 app. It seems like rbenv's Rails shiv is not working properly.
$ rbenv install 3.0.2
Downloading ruby-3...",https://stackoverflow.com/questions/68521184/rbenv-and-rails-mismatches,my_library,"rbenv, ruby, rubyonrails",2021-07-25T19:22:40.000Z,https://cdn.sstatic.net/Sites/stackoverflow/Img/apple-touch-icon.png?v=c78bd457575a,,False
876779358,How to Build a Booking Engine Similar to Booking.com with Ruby on Rails 6 a,,"Think building a booking system is not your cup of tea? I bet, you will change your mind after...",https://dev.to/kiosan/how-to-build-a-booking-engine-similar-to-booking-com-with-ruby-on-rails-6-and-elasticsearch-7-40nk,my_library,"elasticsearch, rubyonrails, search",2021-07-10T19:43:54.000Z,"https://media.dev.to/dynamic/image/width=1000,height=500,fit=cover,gravity=auto,format=auto/https%3A%2F%2Fdev-to-uploads.s3.amazonaws.com%2Fuploads%2Farticles%2Fugm9r90o6f82rs64pw8r.jpg",,False
876779342,"Understanding How Rbenv, RubyGems And Bundler Work Together",,"Rbenv, RubyGems, and Bundler work together to give us a lot of control over our code's environment. If you know how they work, you'll be better prepared to troubleshoot any problems you encounter.  In this article, Ol...",https://www.honeybadger.io/blog/rbenv-rubygems-bundler-path,my_library,"bundler, rbenv, ruby, rubygems, rubyonrails",2021-07-07T16:02:00.000Z,https://ondemand.bannerbear.com/signedurl/nZ52rq9EkQ6V3bp1Lj/image.jpg?modifications=W3sibmFtZSI6InRpdGxlIiwidGV4dCI6IlVuZGVyc3RhbmRpbmcgSG93IFJiZW52LCBSdWJ5R2VtcyBBbmQgQnVuZGxlciBXb3JrIFRvZ2V0aGVyIiwiY29sb3IiOm51bGwsImJhY2tncm91bmQiOm51bGx9LHsibmFtZSI6ImhlYWRzaG90IiwiaW1hZ2VfdXJsIjoiaHR0cHM6Ly93d3ctZmlsZXMuaG9uZXliYWRnZXIuaW8vYXV0aG9ycy9vbGFzdWJvbWlvbHV3YWxhbmEucG5nIn0seyJuYW1lIjoic3VtbWFyeSIsInRleHQiOiJSYmVudiwgUnVieUdlbXMsIGFuZCBCdW5kbGVyIHdvcmsgdG9nZXRoZXIgdG8gZ2l2ZSB1cyBhIGxvdCBvZiBjb250cm9sIG92ZXIgb3VyIGNvZGUncyBlbnZpcm9ubWVudC4gSWYgeW91IGtub3cgaG93IHRoZXkgd29yaywgeW91J2xsIGJlIGJldHRlciBwcmVwYXJlZCB0byB0cm91Ymxlc2hvb3QgYW55IHByb2JsZW1zIHlvdSBlbmNvdW50ZXIuICBJbiB0aGlzIGFydGljbGUsIE9sYXN1Ym9taSB3YWxrcyB1cyB0aHJvdWdoIHRoZSBiYXNpY3Mgb2YgaG93IHRoZXNlIHRocmVlIHRvb2xzIGRvIHdoYXQgdGhleSBkby4iLCJjb2xvciI6bnVsbCwiYmFja2dyb3VuZCI6bnVsbH0seyJuYW1lIjoiYXV0aG9yIiwidGV4dCI6IkJ5ICpTdWJvbWkgT2x1d2FsYW5hKiIsImNvbG9yIjpudWxsLCJiYWNrZ3JvdW5kIjpudWxsfSx7Im5hbWUiOiJ0YWdzIiwidGV4dCI6IiNydWJ5IiwiY29sb3IiOm51bGwsImJhY2tncm91bmQiOm51bGx9XQ&s=65ee71ecc6331ecd0f2a4671cb9864f2c4076060307549679982a95fa21e837c,,False
876779341,Webpacker in Rails 6,,Webpacker is the default JavaScript compiler for Rails 6 applications. Which means that all the...,https://dev.to/shahershamroukh/webpacker-in-rails-6-4j5k,my_library,"bundler, rubyonrails, webpack, webpacker",2021-07-07T15:58:53.000Z,"https://media.dev.to/dynamic/image/width=1000,height=500,fit=cover,gravity=auto,format=auto/https%3A%2F%2Fdev-to-uploads.s3.amazonaws.com%2Fuploads%2Farticles%2Fmwzhpu5jvl6gobw1ip2j.png",,False
876779135,How I organize my Rails apps - Code with Jason,,"Overview Influenced by the experiences I’ve had last over many years of building and maintaining Rails applications, combined with my experiences using other technologies, I’ve developed some ways of structuring Rails applications that have worked out pretty well for me. Some of my organizational tactics follow conventional wisdom, like keeping controllers thin. Other of my […]",https://www.codewithjason.com/organize-rails-apps,my_library,rubyonrails,2021-06-01T19:27:21.000Z,,,False
876779074,Rails 6 — Custom Seed Files. While building applications in Rails… | by Zac,,While building applications in Rails it’s very common to have to add a new model after you’ve already set up a DB and added some seed data…,https://developingzack.medium.com/rails-6-custom-seed-files-1cda97a67985,my_library,"ruby, rubyonrails",2021-05-26T15:55:05.000Z,https://miro.medium.com/v2/resize:fit:1200/1*JN4iXXjtT9nlzjCXFCrJaw.png,,False
876779073,ruby - libffi.so.7: cannot open shared object file: No such file or directo,,"I just upgraded to ubuntu 20.10 and when I tried to work with rails app that was working perfectly fine earlier started to show this error.
LoadError: libffi.so.7: cannot open shared object file: N...",https://askubuntu.com/questions/1286772/libffi-so-7-cannot-open-shared-object-file-no-such-file-or-directory,my_library,rubyonrails,2021-05-26T11:51:53.000Z,https://cdn.sstatic.net/Sites/askubuntu/Img/apple-touch-icon.png?v=e16e1315edd6,,False
876779020,Rails with Webpacker : a full setup,,Article was originally published here : https://bootrails.com/blog/rails-webpacker-full-setup  Webpac...,https://dev.to/bdavidxyz/rails-with-webpacker-a-full-setup-3h49,my_library,"javascript, rubyonrails, webpacker",2021-05-18T16:53:23.000Z,"https://media.dev.to/dynamic/image/width=1000,height=500,fit=cover,gravity=auto,format=auto/https%3A%2F%2Fdev-to-uploads.s3.amazonaws.com%2Fuploads%2Farticles%2Fyibamky1ohcwypyfumnd.png",,False
876779010,Polymorphic associations in Rails,,A quick overview of how to use polymorphic associations in rails,https://dev.to/codeandclay/polymorphic-associations-in-rails-25bo,my_library,rubyonrails,2021-05-17T22:11:46.000Z,"https://media.dev.to/dynamic/image/width=1000,height=500,fit=cover,gravity=auto,format=auto/https%3A%2F%2Fdev-to-uploads.s3.amazonaws.com%2Fuploads%2Farticles%2Fi22st1sm44xxrmzd3n70.jpg",,False
