id,title,note,excerpt,url,folder,tags,created,cover,highlights,favorite
876797106,A guide to investigating digital ad libraries,,"How to dig into ad libraries from Google, Meta and other platforms to track spending, narratives, campaigns and more",https://open.substack.com/pub/digitalinvestigations/p/a-guide-to-investigating-digital,my_library,"adtech, advertising-commercials, seo",2024-06-04T19:53:13.000Z,"https://substackcdn.com/image/fetch/w_1200,h_600,c_fill,f_jpg,q_auto:good,fl_progressive:steep,g_auto/https%3A%2F%2Fsubstack-post-media.s3.amazonaws.com%2Fpublic%2Fimages%2F8f4c8fba-6705-452c-95be-01888d801078_1792x1024.webp",,False
876797104,Free tools for investigating digital ads,,"Originally published Feb. 17, 2022",https://digitalinvestigations.substack.com/p/free-tools-for-investigating-digital,my_library,"adtech-adwords, advertising-commercials, seo",2024-06-04T19:48:29.000Z,https://images.unsplash.com/photo-1510511336377-1a9caa095849?crop=entropy&cs=tinysrgb&fit=max&fm=jpg&ixid=MnwzMDAzMzh8MHwxfHNlYXJjaHw1OXx8ZGlnaXRhbCUyMGFkdmVydGlzaW5nfGVufDB8fHx8MTY3MTE5MjcxMw&ixlib=rb-4.0.3&q=80&w=1080,,False
876787674,How Much Does Google Ads Cost? | 2022 Google Ads Pricing,,"How much does Google Ads cost? Google Ads costs $100 - $10,000 per month with an average CPC of $0.11 - $0.50. Learn more about Google Ads pricing here!",https://www.webfx.com/blog/marketing/much-cost-advertise-google-adwords,my_library,"adtech-adwords, advertising-commercials, keywords-ppc-seo",2022-07-30T21:01:03.000Z,https://www.webfx.com/wp-content/uploads/2023/05/2_much_cost_advertise_google_adwords.png,,False
876787534,7 Deadly Google Ads Mistakes That'll Make You Broke (And How to Fix Them),,"Here's some common AdWords mistakes that make affect your campaigns, as well as how to fix them.",https://blog.kissmetrics.com/10-commons-adwords-mistakes,my_library,"adtech-adwords, keywords-ppc-seo",2022-07-19T00:29:39.000Z,https://neilpatel.com/wp-content/uploads/2016/04/broke.jpg,,False
876786519,Brand Bidding Techniques: Smart Ways To Use Typos & URLs As Keywords,,"Finding the right mix of keywords is as much science as it is good common sense. When it comes to your brand, there are typo and URL derivation techniques",http://searchengineland.com/brand-bidding-techniques-smart-ways-to-use-typos-urls-as-keywords-42725,my_library,"adtech-adwords, brandmgmt, ecommerce, keywords-ppc-seo",2022-07-18T14:57:51.000Z,https://searchengineland.com/wp-content/seloads/2022/11/SEL-OG-1920x1080-1.png,,False
876784235,Predicting Keyword Volume Before Data is in Adwords,,"Being able to get in front of trending keywords can be a valuable but difficult task. In this week's Whiteboard Friday, we'll be talking about predicting keyword volume - before the data is even in adwords!",https://moz.com/blog/predicting-keyword-volume-before-data-is-in-adwords,my_library,"adtech-adwords, keywords-ppc-seo",2022-06-13T13:22:28.000Z,https://moz.com/images/blog/banners/whiteboard-friday-27dcaca_2021-03-31-032749.png?w=1200&h=630&q=82&auto=format&fit=crop&dm=1617161269&s=aa8cda585f310b84d07679e3d2aee90b,,False
876784062,Google AdWords: Successful Campaigns for Beginners - noupe,,Google AdWords is a good opportunity to boost sales in a short period of time for both small and large businesses alike. Learn the basics here.,https://www.noupe.com/business-online/google-adwords-beginners-97764.html,my_library,"adtech-adwords, keywords-ppc-seo",2022-06-02T20:09:40.000Z,https://www.noupe.com/wp-content/uploads/2016/05/glenn-carstens-peters-npxXWgQ33ZQ-unsplash-1.jpg,,False
876782573,"We Analyzed The Top 7,000 Websites in 22 Industries. Here’s What We Learned",,"We analyzed 7,000+ websites with reviews of more than 4 stars on Trustpilot. Here are some SEO factors we noticed they had in common.",https://neilpatel.com/blog/top-websites-seo-paid-advertising,my_library,"adtech-adwords, ecommerce, keywords-ppc-seo",2022-01-31T13:36:49.000Z,https://neilpatel.com/wp-content/uploads/2022/02/analyzed-7000websites-22-industries-700x412.png,,False
