id,title,note,excerpt,url,folder,tags,created,cover,highlights,favorite
876776166,6 methods for touch-free and remote payments,,"Checking out should be easier, especially now.",https://www.retaildive.com/spons/6-methods-for-touch-free-and-remote-payments/584699,my_library,"ecommerce, prodmgmt",2020-11-03T00:42:04.000Z,https://www.retaildive.com/imgproxy/V8bFxt_tLMBcTz2pfFz07-ZaZ5BZfM0fnGBbQy6XPqE/g:ce/rs:fit:770:435/bG9jYWw6Ly8vZGl2ZWltYWdlL1NxdWFyZS1SZXRhaWxEaXZlLVRvdWNoLUZyZWUtUmVtb3RlLmpwZWc=.webp,,False
876776093,14 Tools to Sell on Facebook and Instagram,,"Shopping on Facebook and Instagram is finally here. With the recent launches of Shops on both apps and Live Shopping, Facebook is facilitating easier commerce across its platform. Here is a list of tools to help you sell on Facebook and Instagram.",https://www.practicalecommerce.com/14-tools-to-sell-on-facebook-and-instagram,my_library,"ecommerce, prodmgmt",2020-11-03T00:05:39.000Z,https://www.practicalecommerce.com/wp-content/uploads/2020/09/14-Tools-to-Sell-on-Facebook-and-Instagram.jpg,,False
876775737,The First Steps in Adding Ecommerce to a Brick-and-mortar Store,,"Brick-and-mortar retail businesses are turning toward ecommerce to generate revenue — online and click-and-collect. As they make this digital transformation, those merchants will likely have questions about ecommerce platforms, themes, and design. While all of these are important, a company's focus should be on products and marketing first, in my experience.",https://www.practicalecommerce.com/the-first-steps-in-adding-ecommerce-to-a-brick-and-mortar-store,my_library,"ecommerce, prodmgmt",2020-08-02T14:03:13.000Z,https://www.practicalecommerce.com/wp-content/uploads/2020/07/073020-featured-retail.jpg,,False
876775718,10 Best Ecommerce Platforms Compared & Rated For 2020,,"Our top ecommerce builders are based on objective performance data, feature set & value. Check out ecommerce platforms now.",https://www.ecommerceceo.com/ecommerce-platforms,my_library,"ecommerce, platforms, prodmgmt",2020-07-26T19:13:16.000Z,https://ecommececeo.b-cdn.net/wp-content/uploads/2021/01/Best-Ecommerce-Platforms.png,,False
876775562,10 Marketplaces to Buy and Sell Ecommerce Sites,,"A ecosystem of buyers, sellers, and brokers creates a thriving M&A market for digital businesses.",http://www.practicalecommerce.com/10-marketplaces-to-buy-and-sell-ecommerce-sites,my_library,"ecommerce, prodmgmt",2020-06-23T13:59:15.000Z,https://www.practicalecommerce.com/wp-content/uploads/2024/01/Marketplaces-to-Buy-and-Sell-Websites.jpg,,False
876775539,Amazon’s New Competitive Advantage: Putting Its Own Products First,,"Brands have long been able to bid for the premier slot at the top left of Amazon’s listings, but during the pandemic the online retailer has begun using this position for its private-label items, raising antitrust concerns.",https://www.propublica.org/article/amazons-new-competitive-advantage-putting-its-own-products-first,my_library,"ecommerce, prodmgmt",2020-06-08T10:50:09.000Z,https://img.assets-c3.propublica.org/images/articles/20200606-Amazon-features-own-OG.jpg?crop=focalpoint&fit=crop&fp-x=0.5&fp-y=0.5&h=630&imgixProfile=propublicaAssets&q=90&w=1200&s=eb5c6aa68221e70b1b314bbb145aa3a5,,False
876774899,How ceramics brand East Fork transitioned to a pre-sale only model,,"2020 was the year East Fork ceramics planned to become profitable. Now, that's likely no longer on the table, but the company is using a new model to better handle its balance sheet: pre-sales. Now, new product lines will all be for sale before they're manufactured, as a way to get capital in as early as possible.",https://www.modernretail.co/startups/how-ceramics-brand-east-fork-transitioned-to-a-pre-sale-only-model,my_library,"ecommerce, prodmgmt, retail",2020-05-15T11:30:53.000Z,https://www.modernretail.co/wp-content/uploads/sites/5/2020/05/eastfork.png,,False
876774830,Web Monetization - The Ecosystem,,"Greetings, everyone. This post begins a series on Web Monetization and serves to document my learning...",https://dev.to/dfoderick/web-monetization-the-ecosystem-1e57,my_library,"ecommerce, prodmgmt",2020-05-14T11:03:26.000Z,https://dev-to-uploads.s3.amazonaws.com/uploads/articles/3otvb2z646ytpt1hl2rv.jpg,,False
876774789,"AliExpress - Online Shopping for Popular Electronics, Fashion, Home & Garde",,"AliExpress lets you unlock top brands' bestselling electronics, clothing, homewares, toys, sporting equipment, auto parts and more so you can live better for less.",https://www.aliexpress.com,my_library,"dropshipping, ecommerce, prodmgmt",2020-05-02T19:33:28.000Z,https://ae01.alicdn.com/kf/Sa0202ec8a96a4085962acfc27e9ffd04F/1080x1080.jpg,,False
876774787,"‘It’s bullshit’: Inside the weird, get-rich-quick world of dropshipping",,"In Bali, western immigrants are selling products they've never handled, from countries they've never visited, to consumers they've never met",https://www.wired.co.uk/article/dropshipping-instagram-ads,my_library,"dropshipping, ecommerce, prodmgmt",2020-05-01T19:11:09.000Z,"https://media.wired.com/photos/65e713145f2286a91492cd40/191:100/w_1280,c_limit/wired-uk-default-image-1-1.jpeg",,False
876773911,Introducing the Periodic Table of Digital Commerce Marketing,,"Packing an astonishing amount of information into an easy-to-digest visual, it's well worth the download.",https://searchengineland.com/introducing-the-periodic-table-of-digital-commerce-marketing-329436,my_library,"ecommerce, marketing, prodmgmt",2020-03-09T20:16:47.000Z,https://searchengineland.com/wp-content/seloads/2020/02/dcm-table-1920x1080-1.jpg,,False
876773853,Wayfair is all in on logistics,,Executives insist 2020 is the year Wayfair's logistics investments will show their worth.,https://www.supplychaindive.com/news/wayfair-logistics-investment/573199,my_library,"ecommerce, prodmgmt, supply-chain",2020-02-29T02:18:38.000Z,https://www.supplychaindive.com/imgproxy/shhsMYEAZHwBuZy_krvIlsKJ85jWliqNlhl192yPamY/g:nowe:0:1476/c:5310:3000/rs:fit:770:435/bG9jYWw6Ly8vZGl2ZWltYWdlL3dheWZhaXJtZW1iZXJzaGlwLmpwZw==.webp,,False
876773014,How to use returns to build customer loyalty,,Returns are on the rise – here’s what you can do to make it your competitive advantage.,https://www.supplychaindive.com/spons/how-to-use-returns-to-build-customer-loyalty/564309,my_library,"custsvc, ecommerce, prodmgmt",2019-12-23T17:01:08.000Z,https://www.supplychaindive.com/imgproxy/ygO0phPAF1GPqw9lUZMLrrbAid5zRJ91tHzZhX1Wp54/g:ce/rs:fit:770:435/bG9jYWw6Ly8vZGl2ZWltYWdlL1JldGFpbF9EaXZlX01ldGFwYWNrX1Byb21vdGVkX1N0b3J5X09jdG9iZXJfSW1hZ2UuanBn.webp,,False
876772908,"Hacks, Methods and Tools to Keyword Research for eCommerce Stores",,"Learn the exact way that I perform keyword research that generates profitable, scalable ROI for eCommerce stores.",https://t.co/abzfMOsC49?amp=1,my_library,"adtech-adwords, ecommerce, prodmgmt",2019-12-23T16:56:41.000Z,https://savvyrevenue.com/wp-content/uploads/2024/05/980467_Illustration-for-article-Hacks-metoder-og-vaerktojer-til-Google-Ads-sogeordsanalyse-for-webshops_Op1_021721.png,,False
876772000,Free Shipping — Real Life,,Delivery robots will redefine the meaning of every object they transport,https://reallifemag.com/free-shipping,my_library,"ecommerce, prodmgmt, supply-chain",2019-08-31T18:28:42.000Z,https://reallifemag.com/wp-content/uploads/2019/02/KFNblQwA-1024x780.jpg,,False
876771979,Shopping Cart or Wishlist? Saving Products for Later in Ecommerce,,"On ecommerce sites, saving shopping-cart items for possible later purchase must be discoverable and low-effort.",https://www.nngroup.com/articles/wishlist-or-cart,my_library,"behaviors, ecommerce, prodmgmt, wishlists",2019-08-30T03:01:11.000Z,https://media.nngroup.com/media/articles/opengraph_images/wishlist-or-cart.png,,False
876771957,BX Benchmarking,,Buyer Experience Benchmarking of 5 Top eCommerce Sites Dec 2018 Ken Leaver,https://docs.google.com/presentation/d/1j_-tDctiFQew9PAKMZPvH87rFeXCSIcP81Ti8CDGnLg/edit?usp=embed_facebook,my_library,"benchmarks, ecommerce, prodmgmt, ui-ux",2019-08-30T00:57:41.000Z,https://lh7-us.googleusercontent.com/docs/AHkbwyIbKFrYx10_wOZnlNkHuuz1xGHxf5lE1gUiH17pWc4PjAVoA3XpKiXARePf-FLnzFQJFuamxVwUFGFI1BiYqqyyEQi-LRhvSXLEGYXCqeCSewEKxgTG=w1200-h630-p,,False
876771929,"How to Display Taxes, Fees, and Shipping Charges on Ecommerce Sites",,Unexpected service fees and special-delivery costs should be disclosed early in the shopping process to avoid losing customers.,https://www.nngroup.com/articles/ecommerce-taxes-fees,my_library,"ecommerce, prodmgmt",2019-08-30T00:09:19.000Z,https://media.nngroup.com/media/articles/opengraph_images/ecommerce-taxes-fees.png,,False
876771916,Applying Discounts and Promotions on Ecommerce Websites,,Coupons and other discounts should be easy to apply and shopping carts should clearly display how the total was affected by the promotion.,https://www.nngroup.com/articles/applying-discounts,my_library,"ecommerce, pricing, prodmgmt",2019-08-29T23:50:00.000Z,https://media.nngroup.com/media/articles/opengraph_images/applying-discounts.png,,False
876771889,How to Negotiate the Price of a Pricey Premium Domain,,Buying a domain at the asking price? That's like buying a used car at the asking price. Doing your homework pays off.,https://www.entrepreneur.com/article/332076,my_library,"ecommerce, pricing, prodmgmt",2019-08-29T22:46:22.000Z,https://assets.entrepreneur.com/content/3x2/2000/20190411201042-GettyImages-919442746.jpeg?format=pjeg&auto=webp,,False
876771883,https://t.co/5oaFLodGNL?ssr=true,,,https://t.co/5oaFLodGNL?ssr=true,my_library,"behaviors, ecommerce, luxury, prodmgmt",2019-08-29T22:08:18.000Z,,,False
876771881,4 Online Merchandising Hacks to Increase Profits,,"Retailers seek to avoid markdowns and sell out of the season at full margin, but it isn’t easy to predict how much inventory to acquire. In this post, I'll address four online merchandising tactics that balance consumer demand with inventory levels, to maximize profits.",https://www.practicalecommerce.com/4-online-merchandising-hacks-to-increase-profits,my_library,"ecommerce, prodmgmt, retail",2019-08-29T22:07:32.000Z,https://www.practicalecommerce.com/wp-content/uploads/2019/04/4-Merchandising-Hacks-to-Increase-Profits.jpg,,False
876771852,Beginner’s Guide to Product Qualified Leads (PQLs),,A product qualified lead (PQL) is a lead who has experienced meaningful value using your product through a free trial or freemium model. Learn how to use them in your organization here.,https://labs.openviewpartners.com/beginners-guide-to-product-qualified-leads-pqls,my_library,"ecommerce, leadgen-leadmgmt, prodmgmt",2019-08-29T16:14:57.000Z,https://openviewpartners.com/wp-content/uploads/2019/05/PQLs.png,,False
876771782,How SaaS Products Ascend the “Trust Pyramid”,,"SaaS products may be the future of how we work, but that future will only happen if we can learn how to build trust with your customers.",https://openviewpartners.com/blog/how-saas-products-ascend-the-trust-pyramid,my_library,"ecommerce, prodmgmt, trust",2019-08-20T20:48:41.000Z,https://openviewpartners.com/wp-content/uploads/2019/08/Trust.png,,False
876771750,Amazon is a boring retailer — Benedict Evans,,"Amazon is so new, and so dramatic in its speed and scale and aggression, that we can easily forget how many of the things it’s doing are actually very old.",https://www.ben-evans.com/benedictevans/2019/7/26/amazon-as-experiment,my_library,"ecommerce, platforms, prodmgmt, retail",2019-08-09T03:07:33.000Z,http://static1.squarespace.com/static/50363cf324ac8e905e7df861/5d23b492d50aa10001e2a918/5d23b4924b382a0001468379/1718919971627/D1ZGB3OV4AAKv0f.jpg?format=1500w,,False
876771685,Free SaaS tools for companies on a budget (and a pre-formatted budgeting sheet) - Canny Blog,,Not every SaaS company has endless spare money. One of the biggest piggy bank breakers are the tools we use—and it adds up fast.,https://canny.io/blog/free-saas-tools-for-budget,my_library,"ecommerce, prodmgmt, programming",2019-07-25T18:28:05.000Z,https://canny.io/blog/wp-content/uploads/2019/07/feature-voting-1.png,,False
876771063,7 Gaps in Google Analytics That Require Additional Tools,,"Google Analytics is a powerful, free web analytics platform. However, it has gaps that are better served by other tools. I'll address those gaps and tools in this post.",https://www.practicalecommerce.com/6-gaps-in-google-analytics-that-require-additional-tools,my_library,"analytics, ecommerce, prodmgmt",2019-06-23T18:55:40.000Z,https://www.practicalecommerce.com/wp-content/uploads/2019/06/6-Gaps-in-Google-Analytics-That-Require-Additional-Tools.jpg,,False
876771030,The inherent value of identifiable store traffic,,Many attributes of the customer journey are very predictable and can be planned for to create and convert inbound store footfall.,https://www.retaildive.com/news/the-inherent-value-of-identifiable-store-traffic/555478,my_library,"ecommerce, prodmgmt, retail",2019-05-29T02:30:14.000Z,https://www.retaildive.com/imgproxy/rkSWer3mfeJvlv0kcPIuRK1eLBdr8A8g19wN_bBxLNk/g:ce/rs:fit:770:435/bG9jYWw6Ly8vZGl2ZWltYWdlL1Nob3BwaW5nXzEwMDBzaHV0dGVyc3RvY2tfNzU2MDE4NDMzLmpwZw==.webp,,False
876770992,Amazon and Target race to revolutionize the cardboard shipping box,,The box has never looked better.,https://www.fastcompany.com/90342864/rethinking-the-cardboard-box-has-never-been-more-important-just-ask-amazon-and-target?partner=feedburner,my_library,"ecommerce, packaging, prodmgmt",2019-05-08T21:23:49.000Z,"https://images.fastcompany.com/image/upload/f_auto,q_auto,c_fit/wp-cms/uploads/2019/05/p-1-90342864-amazon-and-target-race-to-revolutionize-the-cardboard-shipping-box.jpg",,False
876770750,Laundry detergent or boxed wine? How e-commerce is changing packaging,,Manufacturers are developing two packaging designs for the same product: those destined for the retail shelf and those sent directly to consumers.,https://www.supplychaindive.com/news/tide-laundry-detergent-e-commerce-packaging-design/547461,my_library,"ecommerce, packaging, prodmgmt",2019-02-05T03:05:57.000Z,https://www.supplychaindive.com/imgproxy/qyWnhXWtcTMRxwi-c7a7vByBHU2DtER9_vLkzAclBZU/g:ce/rs:fit:770:435/bG9jYWw6Ly8vZGl2ZWltYWdlL3RpZGVfY3JvcF9hcnJpdmUyLmpwZw==.webp,,False
876770717,Untuckit is using Amazon to offload older styles,,Untuckit is using Amazon to offload older styles -- preferring the marketplace as an alternative over the traditional outlet store.,https://digiday.com/retail/untuckit-amazon-offload-older-styles,my_library,"clothes, ecommerce, prodmgmt",2019-01-22T14:35:52.000Z,https://digiday.com/wp-content/uploads/sites/3/2019/01/Untuckit.jpg,,False
876770697,How PopSockets Prospered after Leaving Amazon,,"PopSockets opted not to be a direct vendor to Amazon. Instead, it chose one major reseller to represent it on the marketplace. But, Amazon would not allow it. So, PopSockets walked away.",https://www.practicalecommerce.com/how-popsockets-prospered-after-leaving-amazon,my_library,"ecommerce, prodmgmt, startups",2019-01-13T01:25:38.000Z,https://www.practicalecommerce.com/wp-content/uploads/2019/01/How-PopSockets-Prospered-after-Leaving-Amazon.jpg,,False
876770625,Shopify App Store: Ecommerce App Marketplace,,"Shopify App Store: customize your online store and grow your business with Shopify-approved apps for marketing, store design, fulfillment, and more.",https://apps.shopify.com,my_library,"ecommerce, platforms, prodmgmt, shopify",2018-12-22T11:01:35.000Z,https://apps.shopify.com/cdn/shopifycloud/shopify_app_store/assets/shopify-app-store-og-20221205-c459b0ff67853c82f74f3b9ee07016fa6d41292b4bfabaf28711a3013b880cf0.jpg,,False
876770612,‘It’s their moat’: How Shopify built an $800 million partner ecosystem,,"Shopify is partnering with a network of more than 20,000 app developers and agency partners to build profitable businesses.",https://digiday.com/retail/shopify-partner-ecosystem-800-million,my_library,"ecommerce, platforms, prodmgmt",2018-12-21T02:32:59.000Z,https://digiday.com/wp-content/uploads/sites/3/2018/12/shoify_bannere.jpg,,False
876769908,Why the Sharing Economy Has Come to Apparel,,Express and Ann Taylor are just two of several established retailers that have launched clothing rental subscriptions in recent months.,https://www.adweek.com/brand-marketing/why-the-sharing-economy-has-come-to-apparel,my_library,"clothes, ecommerce, prodmgmt",2018-11-13T15:57:02.000Z,https://www.adweek.com/wp-content/uploads/2018/11/retail-subscription-CONTENT_2018.jpg?w=600&h=315&crop=1,,False
876769614,eCommerce 101: Understanding Shopping Cart Abandonment [with Infographic],,An illuminating infographic highlights 10 e-commerce pain points that ruin the user experience and lead to shopping cart abandonment.,https://www.toptal.com/designers/ux/shopping-cart-abandonment-infographic,my_library,"ecommerce, prodmgmt",2018-08-23T15:06:17.000Z,https://bs-uploads.toptal.io/blackfish-uploads/components/open_graph_image/8957512/og_image/optimized/shopping-cart-abandonment-infographic-94f25eab7bc28cea22d5a3718236262f.png,,False
876769610,Service as a SKU | Andreessen Horowitz,,"Editor’s note: This article by now-a16z general partner Alex Rampell was originally published in 2012 in TechCrunch.  The biggest ecommerce opportunity today involves taking offline services and offering them for sale online (O2O commerce). The first generation of O2O commerce was driven by discounting, push-based engagements, and artificial scarcity. The still-unfulfilled opportunity in O2O today is tantamount to...",http://a16z.com/2018/08/17/service-as-a-sku,my_library,"ecommerce, ideas, prodmgmt",2018-08-21T16:32:41.000Z,https://d1lamhf6l6yk6d.cloudfront.net/uploads/2023/09/consumer-Yoast-Facebook.jpg,,False
876769591,What PopSugar learned from selling products through text messages,,"PopSugar said it expects to have 20,000 subscribers by year's end to its text message program, which it's used to sell protein bars and housewares.",https://digiday.com/media/popsugar-learned-selling-products-text-messages,my_library,"ecommerce, marketing, mobile, prodmgmt",2018-08-13T22:37:58.000Z,https://digiday.com/wp-content/uploads/sites/3/2017/02/mobilestock.jpg,,False
876769545,The Real Benefit of Amazon Reviews,,I'm a longtime seller on Amazon's marketplace. I also mentor many sellers and help brands to improve their marketplace sales. And I belong to various,https://www.practicalecommerce.com/real-benefit-amazon-reviews,my_library,"custsvc, ecommerce, prodmgmt, reviews",2018-07-05T02:41:17.000Z,https://www.practicalecommerce.com/wp-content/uploads/2018/06/The-Real-Benefit-of-Amazon-Reviews.jpg,,False
876769375,Strategy & Implementation of Third-Party Connections in Products,,Building a product that connects to multiple third-party products is a common approach — an annotated twitter thread exploring strategic…,https://medium.learningbyshipping.com/connectors-3f04f928c821,my_library,"apis, ecommerce, prodmgmt",2018-06-05T03:23:03.000Z,https://miro.medium.com/v2/resize:fill:996:524/g:fp:0.48:0.39/1*oLcTlh0yrnH1CHqnv0HhdQ.png,,False
876769364,10 ways to offer shoppers a discount,,"Many online retailers unintentionally train consumers to expect discounts. Clothing stores are amongst the worst offenders. Constant discounting makes full-price shoppers believe they’re being overcharged. They often won’t shop until the next sale, which leads to a vicious cycle. It is a rare company that doesn’t get asked for discounts. In this post, I'll review 10 ways to offer clients a discount.",https://www.practicalecommerce.com/10-ways-offer-shoppers-discount,my_library,"ecommerce, pricing, prodmgmt",2018-05-30T16:06:51.000Z,https://www.practicalecommerce.com/wp-content/uploads/2018/05/10-ways-to-offer-shoppers-a-discount.jpg,,False
876769321,Indie Hackers: Work Together to Build Profitable Online Businesses,,Connect with developers sharing the strategies and revenue numbers behind their companies and side projects.,https://www.indiehackers.com/@RickVanHaasteren/how-i-got-my-first-1000-users-47d06edc3d,my_library,"ecommerce, growth-hacks, keywords-ppc-seo, prodmgmt",2018-05-07T01:24:56.000Z,https://www.indiehackers.com/images/shareables/home.jpg,,False
876769315,Why sell barbells?,,"I'm often asked why I started FringeSport. People inquire, ""Of all the things to do, why sell barbells?"" I tell them that if I wanted only to make money,",https://www.practicalecommerce.com/why-sell-barbells,my_library,"ecommerce, prodmgmt",2018-05-04T12:56:20.000Z,https://www.practicalecommerce.com/wp-content/uploads/2018/05/Why-sell-barbells.jpg,,False
876769020,Amazon’s systematic approach,,Amazon turned an event into a blockbuster. Here’s a roadmap for retailers who want to replicate its success.,https://www.mckinsey.com/business-functions/marketing-and-sales/our-insights/the-prime-day-play-three-lessons-from-amazon039s-one-day-event,my_library,"ecommerce, prodmgmt",2017-11-24T02:55:19.000Z,https://www.mckinsey.com/~/media/mckinsey/business%20functions/marketing%20and%20sales/our%20insights/the%20prime%20day%20play%20three%20lessons%20from%20amazon039s%20one%20day%20event/image_hero%20amazon%20prime%20day%20app.png,,False
876769005,4 Marketing Lessons from Opening a Brick-and-mortar Store,,"Lessons learned from opening a brick-and-mortar retail store may apply to online merchants, providing insights about promoting products, driving sales,",https://www.practicalecommerce.com/4-marketing-lessons-opening-brick-mortar-store,my_library,"ecommerce, prodmgmt, retail",2017-11-15T23:53:48.000Z,https://www.practicalecommerce.com/wp-content/uploads/2017/11/111417-vibram-featured.jpg,,False
