id,title,note,excerpt,url,folder,tags,created,cover,highlights,favorite
876795413,Empty Frames and Other Oddities From the Unsolved Gardner Museum Heist,,"After 34 years, not one of the 13 works stolen during the largest art theft in history has surfaced but the puzzling peculiarities of the case still draw interest.",https://www.nytimes.com/2024/03/18/arts/design/unsolved-gardner-museum-heist.html,my_library,"art, truecrime",2024-03-18T22:07:32.000Z,https://static01.nyt.com/images/2024/03/18/arts/18heist-promo-static/18heist-promo-static-largeHorizontalJumbo.png,,False
876790969,Crime of the Centuries,,"Tomb raiders, crooked art dealers, and museum curators fed billionaire Michael Steinhardt’s addiction to antiquities. Many also happened to be stolen.",https://nymag.com/intelligencer/article/michael-steinhardt-antiquities-stolen-artifacts.html,my_library,"art, goodreads, history, truecrime",2023-03-19T13:22:04.000Z,https://pyxis.nymag.com/v1/imgs/456/966/35bed97349922be998366f4cf2961b1aac-stolen-artifacts-lede.1x.rsocial.w1200.jpg,,False
876790704,The husband-and-wife forgers who fooled the art market — and made millions | CNN,,"Wolfgang and Helene Beltracchi’s forgeries infiltrated museums, auction houses and private collections. A decade after their conviction, psychoanalyst Jeannette Fischer asks: Why did they do it?",https://www.cnn.com/style/article/wolfgang-helen-beltracchi-forgers/index.html,my_library,"art, goodreads, truecrime",2023-02-15T13:26:19.000Z,"https://media.cnn.com/api/v1/images/stellar/prod/230124095815-02-wolfgang-helene-beltracchi-restricted.jpg?c=16x9&q=w_800,c_fill",,False
876789560,The $65 Million Art Heist That Put ‘Ocean’s Eleven’ to Shame,,A billionaire playboy’s alleged murder is at the center of the world’s most confounding heist job.,https://getpocket.com/explore/item/the-65-million-art-heist-that-put-ocean-s-eleven-to-shame,my_library,"art, truecrime",2022-11-22T00:36:12.000Z,https://pocket-image-cache.com/1200x/filters:format(jpg):extract_focal()/https%3A%2F%2Fmelmagazine.com%2Fwp-content%2Fuploads%2F2021%2F02%2FReal_Life_Oceans-11_Romanian_Art_Thieves-1024x427.jpg,,False
876788630,What Canada’s Largest Art Heist Reveals about the Art World’s Shady Side | The Walrus,,The stolen masterpieces have never turned up—and nobody’s really looking for them,https://thewalrus.ca/canadas-biggest-art-theft,my_library,"art, truecrime",2022-09-24T19:26:23.000Z,https://walrus-assets.s3.amazonaws.com/img/Lewson_ArtHeist_1800.jpg,,False
876778971,Tome Raiders: Solving the Great Book Heist,,"When nearly $3.5M of rare books were stolen in an audacious heist at Feltham in 2017, police wondered, what’s the story?",https://getpocket.com/explore/item/tome-raiders-solving-the-great-book-heist,my_library,"art, goodreads, truecrime",2021-05-09T17:34:55.000Z,https://pocket-image-cache.com/1200x/filters:format(jpg):extract_focal()/https%3A%2F%2Fpocket-syndicated-images.s3.amazonaws.com%2Farticles%2F6281%2F1619214715_GettyImages-182146040.jpg,,False
