id,title,note,excerpt,url,folder,tags,created,cover,highlights,favorite
876792826,When ideas have sex,,"At TEDGlobal 2010, author Matt Ridley shows how, throughout history, the engine of human progress has been the meeting and mating of ideas to make new ideas. It's not important how clever individuals are, he says; what really matters is how smart the collective brain is.",https://www.ted.com/talks/matt_ridley_when_ideas_have_sex,my_library,"ideas, inventions-innovation",2023-07-29T21:05:43.000Z,https://pi.tedcdn.com/r/talkstar-photos.s3.amazonaws.com/uploads/cf3c728f-5252-4bcf-87fb-a32a93158735/MattRidley_2010G-embed.jpg?u%5Br%5D=2&u%5Bs%5D=0.5&u%5Ba%5D=0.8&u%5Bt%5D=0.03&quality=82c=1050%2C550&w=1050,,False
876792808,The World Is Full of Sleeping Beauties,,Success in nature and culture depends just as much on timing as it does on brilliance.,https://nautil.us/the-world-is-full-of-sleeping-beauties-304237,my_library,"creativity, grit-hustle-perseverence, ideas, inventions-innovation",2023-07-28T00:58:35.000Z,https://assets.nautil.us/sites/3/nautilus/jOYgwu0L-Courage_HERO.png?auto=compress&fm=png&ixlib=php-3.3.1,,False
876791694,Women’s Basketball Continues Slump,,"SB Loses Shootout to Manhattan On Nov. 24 Stony Brook’s Women’s Basketball team faced the Manhattan Jasper’s. In a high scoring affair, Stony Brook lost by a final score of 74-68. The Jasper’s held the lead most of the game, including a game high 12 point lead at half (44-32).",https://www.sbstatesman.com/2023/04/04/if-we-lose-the-internet-archive-were-screwed,my_library,"ideas, intellectual-property, inventions-innovation",2023-04-08T13:20:00.000Z,,,False
876789573,Should You Invest in Disruptive Materials?,,,https://www.visualcapitalist.com/sp/should-you-invest-in-disruptive-materials,my_library,"finance, ideas, inventions-innovation, materials, startups",2022-11-23T21:56:59.000Z,,,False
876788404,Every Complex Idea Has a Million Stupid Cousins,,"Chances are, you've met far more stupid cousins than you realize",https://apxhard.substack.com/p/every-complex-idea-has-a-million,my_library,"ideas, inventions-innovation",2022-08-30T01:40:45.000Z,"https://substackcdn.com/image/fetch/w_1200,h_600,c_fill,f_jpg,q_auto:good,fl_progressive:steep,g_auto/https%3A%2F%2Fbucketeer-e05bbc84-baa3-437e-9518-adb32be77984.s3.amazonaws.com%2Fpublic%2Fimages%2F692590a0-654e-46d8-b5a4-721debbd181f_800x600.png",,False
876787765,The Key to Successful Innovation? Progress Over Product,,Tap into people's unspoken needs to create breakthrough innovations.,https://www.inc.com/david-schonthal/the-key-to-successful-innovation-progress-over-product.html,my_library,"ideas, inventions-innovation, prodmgmt",2022-08-14T22:37:21.000Z,"https://img-cdn.inc.com/image/upload/f_webp,q_auto,c_fit,w_1024,h_1024/images/panoramic/GettyImages-1318465606_508079_j4ffkh.jpg",,False
876779934,The Stories Behind 20 Inventions That Changed the World,,"From blood banks and barcodes to the Super Soaker and the pizza box, here are the fascinating stories behind inventions that changed the world.",https://www.mentalfloss.com/article/648542/inventions-changed-world,my_library,"ideas, inventions-innovation, prodmgmt",2021-09-29T10:54:14.000Z,http://minutemedia-ressh.cloudinary.com/image/upload/v1640183829/shape/cover/sport/648542-inventionsheader-shutterstock-217946221-1392641645-17228257-1725804580-1530190412-1199196346-1207465822-1207465822-gettyimages-julia-lemba-6e7f34ed206942ed8b8ebbd2eb406070.jpg,,False
876779305,"Suppose I Wanted to Kill a Lot of Pilots | by EJ | Jul, 2021 | History of Y",,,https://historyofyesterday.com/suppose-i-wanted-to-kill-a-lot-of-pilots-f126bbc756fa,my_library,"ideas, inventions-innovation",2021-07-03T14:49:08.000Z,,,False
