id,title,note,excerpt,url,folder,tags,created,cover,highlights,favorite
876789510,13 Easy-to-use CRMs,,A customer relationship management tool can help a business grow and scale at an affordable price. Here is a list of simple CRMs for businesses of all sizes.,https://www.practicalecommerce.com/13-easy-to-use-crms,my_library,"crms, prodmgmt, programming, sales-salesmgmt",2022-11-08T16:38:17.000Z,https://www.practicalecommerce.com/wp-content/uploads/2022/11/thumb.jpg,,False
876787808,Pipeline Analysis Playbook,,"In many board rooms, the most important go-to-market number this quarter is pipeline health. For some companies, the pipeline may be less clear than a quarter or two ago. Summer seasonality may play a role. Macroeconomics might also be lurking within the numbers. Pipeline fluctuations are normal. But any meaningful & unexpected surprise warrants introspection. Pipeline analysis often has four parts: Craft the sales sandwich to predict your GTM conversion rates & determine if close rates have changed in parallel.",https://www.tomtunguz.com/pipeline-analysis-playbook,my_library,"analytics, prodmgmt, programming, sales-salesmgmt",2022-08-19T18:53:18.000Z,,,False
876787540,The Complete Guide to Building the Perfect Sales Stack,,"I was recently talking with Mark Roberge, CRO at Hubspot, for a podcast we’re launching soon. I asked him, “What is a common question that…",https://medium.com/swlh/the-complete-guide-to-building-the-perfect-ales-stack-d53653e02530#.u51m23bzo,my_library,"prodmgmt, programming, sales-salesmgmt",2022-07-19T00:29:53.000Z,https://miro.medium.com/v2/resize:fit:1200/1*kCvP_uZJt1Xh00G6JpitZQ.jpeg,,False
876786591,http://www.insightsquared.com/2014/01/how-to-write-a-customer-objection-guide-for-your-sales-team,,,http://www.insightsquared.com/2014/01/how-to-write-a-customer-objection-guide-for-your-sales-team,my_library,"objections, programming, sales-salesmgmt",2022-07-18T15:07:43.000Z,,,False
876771984,Assembly required – 45 sales tools to build the ultimate tech stack,,"As your sales team grows, your tech stack almost always does too. But figuring out which sales tools you should buy can be a daunting task.",https://www.intercom.com/blog/sales-tools,my_library,"prodmgmt, programming, sales-salesmgmt",2019-08-30T03:08:08.000Z,https://blog.intercomassets.com/blog/wp-content/uploads/2018/11/Best-Sales-Tools.png,,False
