id,title,note,excerpt,url,folder,tags,created,cover,highlights,favorite
876793658,Using Action Policy for a Ruby on Rails App: The Basics,,"In the first part of a two-part series, we'll introduce how to use the Action Policy gem for a Ruby on Rails blog application.",https://blog.appsignal.com/2023/10/04/using-action-policy-for-a-ruby-on-rails-app-the-basics.html,my_library,rubyonrails,2023-10-10T20:52:18.000Z,https://ondemand.bannerbear.com/signedurl/Mn62mqoVbWvyB5wgQ1/image.jpg?modifications=W3sibmFtZSI6InRpdGxlIiwidGV4dCI6IlVzaW5nIEFjdGlvbiBQb2xpY3kgZm9yIGEgUnVieSBvbiBSYWlscyBBcHA6IFRoZSBCYXNpY3MifSx7Im5hbWUiOiJpbWFnZSIsImltYWdlX3VybCI6Imh0dHBzOi8vYXBwc2lnbmFsLW5leHRqcy1ibG9nLW55cXI2cWNyOC1hcHBzaWduYWwudmVyY2VsLmFwcC9pbWFnZXMvYmxvZy8yMDIzLTEwL2FjdGlvbi1wb2xpY3ktcDEuanBnIn0seyJuYW1lIjoiY2F0ZWdvcnlfbG9nbyIsImltYWdlX3VybCI6Imh0dHBzOi8vYXBwc2lnbmFsLW5leHRqcy1ibG9nLW55cXI2cWNyOC1hcHBzaWduYWwudmVyY2VsLmFwcC9pbWFnZXMvbG9nb3MvcnVieS1sb2dvLnBuZyJ9XQ&s=05b91cc162eacbb553c11e9138676764b2bc65318af81e8fa1efe64eabb9d43a,,False
876793087,An Introduction to LiteStack for Ruby on Rails,,"In the first part of this series, we'll set up an example Rails application and introduce the basics of LiteStack.",https://blog.appsignal.com/2023/09/27/an-introduction-to-litestack-for-ruby-on-rails.html,my_library,rubyonrails,2023-09-27T21:37:03.000Z,https://ondemand.bannerbear.com/signedurl/Mn62mqoVbWvyB5wgQ1/image.jpg?modifications=W3sibmFtZSI6InRpdGxlIiwidGV4dCI6IkFuIEludHJvZHVjdGlvbiB0byBMaXRlU3RhY2sgZm9yIFJ1Ynkgb24gUmFpbHMifSx7Im5hbWUiOiJpbWFnZSIsImltYWdlX3VybCI6Imh0dHBzOi8vYXBwc2lnbmFsLW5leHRqcy1ibG9nLW55cXI2cWNyOC1hcHBzaWduYWwudmVyY2VsLmFwcC9pbWFnZXMvYmxvZy8yMDIzLTA5L3AxLWxpdGVzdGFjay5qcGcifSx7Im5hbWUiOiJjYXRlZ29yeV9sb2dvIiwiaW1hZ2VfdXJsIjoiaHR0cHM6Ly9hcHBzaWduYWwtbmV4dGpzLWJsb2ctbnlxcjZxY3I4LWFwcHNpZ25hbC52ZXJjZWwuYXBwL2ltYWdlcy9sb2dvcy9ydWJ5LWxvZ28ucG5nIn1d&s=6e322153a5b90bddc33924ee2b573808471fad7af5d1dab57b494c7f47405421,,False
876793020,Ruby on Rails extends Docker support,,"Now available in a beta, Rails 7.1 will generate all Dockerfiles needed for deployment, tuned for production use.",https://www.infoworld.com/article/3706871/ruby-on-rails-extends-docker-support.html,my_library,"docker, rubyonrails",2023-09-17T14:08:26.000Z,https://www.infoworld.com/wp-content/uploads/2024/06/shutterstock_402767335-100927753-orig.jpg?quality=50&strip=all&w=1024,,False
876792996,An Introduction to RuboCop for Ruby on Rails,,"Let's dive into what RuboCop is, how it helps developers, how to use it, and some key practical use cases.",https://blog.appsignal.com/2023/09/06/an-introduction-to-rubocop-for-ruby-on-rails.html,my_library,"rubygems, rubyonrails",2023-09-06T16:40:08.000Z,https://ondemand.bannerbear.com/signedurl/Mn62mqoVbWvyB5wgQ1/image.jpg?modifications=W3sibmFtZSI6InRpdGxlIiwidGV4dCI6IkFuIEludHJvZHVjdGlvbiB0byBSdWJvQ29wIGZvciBSdWJ5IG9uIFJhaWxzIn0seyJuYW1lIjoiaW1hZ2UiLCJpbWFnZV91cmwiOiJodHRwczovL2FwcHNpZ25hbC1uZXh0anMtYmxvZy1lenRmYnhvNXQtYXBwc2lnbmFsLnZlcmNlbC5hcHAvaW1hZ2VzL2Jsb2cvMjAyMy0wOC9ydWJvY29wLmpwZyJ9LHsibmFtZSI6ImNhdGVnb3J5X2xvZ28iLCJpbWFnZV91cmwiOiJodHRwczovL2FwcHNpZ25hbC1uZXh0anMtYmxvZy1lenRmYnhvNXQtYXBwc2lnbmFsLnZlcmNlbC5hcHAvaW1hZ2VzL2xvZ29zL3J1YnktbG9nby5wbmcifV0&s=9259e3cba5256f8051a92756fb071a5247988ed6d44482941ed6a36224b994f7,,False
876792832,Building Value Objects in Rails with composed_of,,Learn how to improve the interface of your existing Active Record Models with this underutilized API.,https://thoughtbot.com/blog/rails-value-objects,my_library,rubyonrails,2023-07-29T23:25:21.000Z,https://images.prismic.io/thoughtbot-website/Zn0Q2JbWFbowe7qY_default-article-background.png?auto=format%2Ccompress&mark-x=356&mark-y=100&mark64=aHR0cHM6Ly9hc3NldHMuaW1naXgubmV0L350ZXh0Lz90eHQtbGVhZD0wJnR4dC10cmFjaz0wJnR4dDY0PVFuVnBiR1JwYm1jZ1ZtRnNkV1VnVDJKcVpXTjBjeUJwYmlCU1lXbHNjeUIzYVhSb0lHTnZiWEJ2YzJWa1gyOW0mdHh0Y2xyPWY1ZjVmNSZ0eHRmb250PUlCTVBsZXhTYW5zSlAtU2VtaUJvbGQmdHh0cGFkPTAmdHh0c2l6ZT02NCZ3PTgwMA%3D%3D&txt-align=center%2Cmiddle&txt-color=f5f5f5&txt-fit=max&txt-font=IBMPlexSansJP-SemiBold&txt-size=24&txt-x=391&txt-y=526&txt=Steve+Polito,,False
876792831,Tokenized Tokens,,Documentation and guides from the team at Fly.io.,https://fly.io/blog/tokenized-tokens,my_library,"rubyonrails, security",2023-07-29T23:25:06.000Z,https://fly.io/blog/tokenized-tokens/assets/ghosts.png,,False
876792759,Rails 7.0: Fulfilling a vision,,This version of Rails has been years in the conceptual making. It’s the fulfillment of a vision to present a truly full-stack approach to web development that tackles both the front- and back-end challenges with equal vigor. An omakase menu that includes everything from the aperitif to the dessert.,https://rubyonrails.org/2021/12/15/Rails-7-fulfilling-a-vision,my_library,"javascript, rubyonrails",2023-07-24T00:35:45.000Z,https://rubyonrails.org/assets/images/opengraph.png,,False
876792735,Top 5 Gems for Implementing a Search Engine in a Rails App,,"Thanks to gems, it is easy to implement a search engine into Rails applications. Of course, you have to choose which gem to use. While there are countless options, four stand out as the best. You will be happy with any of these options.",https://devcamp.com/site_blogs/implementing-a-search-engine-in-a-rails-application,my_library,"rubyonrails, search",2023-07-23T23:59:46.000Z,,,False
876792725,An Introduction to Devise for Ruby on Rails,,"In part one of this series on Devise, we'll cover the basics of the Devise gem.",https://blog.appsignal.com/2023/07/12/an-introduction-to-devise-for-ruby-on-rails.html,my_library,"authentication, rubygems, rubyonrails",2023-07-23T23:59:42.000Z,https://ondemand.bannerbear.com/signedurl/Mn62mqoVbWvyB5wgQ1/image.jpg?modifications=W3sibmFtZSI6InRpdGxlIiwidGV4dCI6IkFuIEludHJvZHVjdGlvbiB0byBEZXZpc2UgZm9yIFJ1Ynkgb24gUmFpbHMifSx7Im5hbWUiOiJpbWFnZSIsImltYWdlX3VybCI6Imh0dHBzOi8vYXBwc2lnbmFsLW5leHRqcy1ibG9nLW55cXI2cWNyOC1hcHBzaWduYWwudmVyY2VsLmFwcC9pbWFnZXMvYmxvZy8yMDIzLTA3L2RldmlzZS1wMS5qcGcifSx7Im5hbWUiOiJjYXRlZ29yeV9sb2dvIiwiaW1hZ2VfdXJsIjoiaHR0cHM6Ly9hcHBzaWduYWwtbmV4dGpzLWJsb2ctbnlxcjZxY3I4LWFwcHNpZ25hbC52ZXJjZWwuYXBwL2ltYWdlcy9sb2dvcy9ydWJ5LWxvZ28ucG5nIn1d&s=b9e64a107b058f81519a4c6cb04adec593255bd9db0ce4f10527f248118500dd,,False
876792640,Google Login in Rails 7 with devise,,Google login can provide a convenient and seamless authentication option for your users. In this...,https://dev.to/ahmadraza/google-login-in-rails-7-with-devise-2gpo,my_library,rubyonrails,2023-07-07T10:26:59.000Z,"https://media.dev.to/dynamic/image/width=1000,height=500,fit=cover,gravity=auto,format=auto/https%3A%2F%2Fdev-to-uploads.s3.amazonaws.com%2Fuploads%2Farticles%2Fkozhpw91ujb736goesve.png",,False
876792006,Creating Custom Rails Generators,,A complete and concise overview to help you create custom Rails Generators and avoid the speed bumps that might otherwise slow you down.,https://garrettdimon.com/journal/posts/creating-custom-rails-generators,my_library,rubyonrails,2023-06-02T13:49:06.000Z,"https://res.cloudinary.com/garrettdimon/image/asset/co_rgb:2d4f6c,c_fit,w_1100,h_50,l_text:Source%20Code%20Pro_32_antialias_subpixel_italic_normal_left_letter_spacing_-1_line_spacing_0:2023-04-09/fl_layer_apply,g_south_east,x_50,y_60/co_rgb:0F0F0F,c_fit,w_1100,h_250,l_text:Helvetica_64_antialias_subpixel_bold_normal_left_letter_spacing_-2_line_spacing_0:Creating%20Custom%20Rails%20Generators/fl_layer_apply,g_north_west,x_50,y_75.0/co_rgb:757575,c_fit,w_1100,h_250,l_text:Georgia_36_antialias_subpixel_italic_normal_left_letter_spacing_0_line_spacing_14:A%20complete%20and%20concise%20overview%20to%20help%20you%20create%20custom%20Rails%20Generators%20and%20avoid%20the%20speed%20bumps%20that%20might%20otherwise%20slow%20you%20down./fl_layer_apply,g_south_west,x_50,y_200/opengraph-large-90f3b5b96ff667c89dd7bf0906c0f78e.png",,False
876791963,The Top Rails Gems for Cybersecurity Applications You Should Know About,,Security should be one of the main areas of concern while developing a website application. To...,https://dev.to/rachgrey/the-top-rails-gems-for-cybersecurity-applications-you-should-know-about-131g,my_library,"rubygems, rubyonrails",2023-05-26T18:40:45.000Z,https://dev-to-uploads.s3.amazonaws.com/uploads/articles/3otvb2z646ytpt1hl2rv.jpg,,False
876791923,Welcome to Rails Cheat Sheet,,A helpful list of resources for people who are just getting started out with Rails.,https://fly.io/ruby-dispatch/welcome-to-rails-cheat-sheet,my_library,rubyonrails,2023-05-14T20:25:33.000Z,https://fly.io/ruby-dispatch/welcome-to-rails-cheat-sheet/assets/beginning-rails.png,,False
876791846,"Exception Handling and Validations in Rails, and how to display errors to u",,Introduction   In this article we will go over exception handling and validation in Rails....,https://dev.to/jaguilar89/exception-handling-and-validations-in-rails-and-how-to-display-errors-to-users-505l,my_library,rubyonrails,2023-04-29T10:42:32.000Z,"https://media.dev.to/dynamic/image/width=1000,height=500,fit=cover,gravity=auto,format=auto/https%3A%2F%2Fdev-to-uploads.s3.amazonaws.com%2Fuploads%2Farticles%2Fdx4v908yh7xjrecc9a32.png",,False
876791836,How to use Sidekiq in Rails 7: Background Jobs,,"In this blog, we'll explore how to use background jobs with Sidekiq in Rails 7 to handle long-running...",https://dev.to/ahmadraza/how-to-use-sidekiq-in-rails-7-background-jobs-1dmb,my_library,rubyonrails,2023-04-26T20:14:22.000Z,"https://media.dev.to/dynamic/image/width=1000,height=500,fit=cover,gravity=auto,format=auto/https%3A%2F%2Fdev-to-uploads.s3.amazonaws.com%2Fuploads%2Farticles%2F2f5jsy6gle1i56qvnvcr.png",,False
876791791,How to Load Code in Ruby | AppSignal Blog,,"Let's look into three options for code loading in Ruby: using load, require, and autoload.",https://blog.appsignal.com/2023/04/19/how-to-load-code-in-ruby.html,my_library,"ruby, rubyonrails",2023-04-19T12:37:56.000Z,https://ondemand.bannerbear.com/signedurl/Mn62mqoVbWvyB5wgQ1/image.jpg?modifications=W3sibmFtZSI6InRpdGxlIiwidGV4dCI6IkhvdyB0byBMb2FkIENvZGUgaW4gUnVieSJ9LHsibmFtZSI6ImltYWdlIiwiaW1hZ2VfdXJsIjoiaHR0cHM6Ly9hcHBzaWduYWwtbmV4dGpzLWJsb2ctbnlxcjZxY3I4LWFwcHNpZ25hbC52ZXJjZWwuYXBwL2ltYWdlcy9ibG9nLzIwMjMtMDQvY29kZS1sb2FkaW5nLmpwZyJ9LHsibmFtZSI6ImNhdGVnb3J5X2xvZ28iLCJpbWFnZV91cmwiOiJodHRwczovL2FwcHNpZ25hbC1uZXh0anMtYmxvZy1ueXFyNnFjcjgtYXBwc2lnbmFsLnZlcmNlbC5hcHAvaW1hZ2VzL2xvZ29zL3J1YnktbG9nby5wbmcifV0&s=ba5ca9d4aa12d253e090b4dc46c852c158e02c4ee75ab0b95bfe250dcb460752,,False
876791770,Stripe Connect onboarding with Ruby on Rails,,"Stripe Connect provides a suite of tools and APIs that allow you to create, manage, and scale your...",https://dev.to/stripe/stripe-connect-onboarding-with-ruby-on-rails-32i4,my_library,rubyonrails,2023-04-16T23:11:42.000Z,"https://media2.dev.to/dynamic/image/width=1000,height=500,fit=cover,gravity=auto,format=auto/https%3A%2F%2Fdev-to-uploads.s3.amazonaws.com%2Fuploads%2Farticles%2Fj5lub080xzhzl10r833o.png",,False
876791754,Upgrading to Rails 7: Moving away from Webpacker,,Webpacker was retired for Rails 7. Let’s explore some options for replacing it when making an upgrade.,https://thoughtbot.com/blog/upgrading-to-rails7-moving-away-from-webpacker,my_library,"rubyonrails, webpacker",2023-04-14T20:07:03.000Z,https://images.prismic.io/thoughtbot-website/Zn0Q2JbWFbowe7qY_default-article-background.png?auto=format%2Ccompress&mark-x=356&mark-y=100&mark64=aHR0cHM6Ly9hc3NldHMuaW1naXgubmV0L350ZXh0Lz90eHQtbGVhZD0wJnR4dC10cmFjaz0wJnR4dDY0PVZYQm5jbUZrYVc1bklIUnZJRkpoYVd4eklEYzZJRTF2ZG1sdVp5QmhkMkY1SUdaeWIyMGdWMlZpY0dGamEyVnkmdHh0Y2xyPWY1ZjVmNSZ0eHRmb250PUlCTVBsZXhTYW5zSlAtU2VtaUJvbGQmdHh0cGFkPTAmdHh0c2l6ZT02NCZ3PTgwMA%3D%3D&txt-align=center%2Cmiddle&txt-color=f5f5f5&txt-fit=max&txt-font=IBMPlexSansJP-SemiBold&txt-size=24&txt-x=391&txt-y=526&txt=Marina+Joranhezon,,False
876791745,The Definitive Guide to Rack for Rails Developers,,"This article explains Rack, including both the protocol and the gem, as well as the concept of middleware.",https://www.akshaykhot.com/definitive-guide-to-rack,my_library,"rack, rubyonrails",2023-04-14T02:08:01.000Z,https://www.writesoftwarewell.com/content/images/2022/12/Rack-2.png,,False
876791635,Sharing Rails views with Jekyll [Brighter Planet's Safety in Numbers],,,https://numbers.brighterplanet.com/2010/08/09/sharing-rails-views-with-jekyll,my_library,"jekyll, rubyonrails",2023-04-01T19:38:45.000Z,,,False
876791619,Sessions in Rails: Everything You Need to Know,,"In this post, we’ll learn about Rails sessions, including what is a session, why we need them, and why they're so important. I’ll also take you behind the scenes and show you how Rails implements sessions and where the `session` method actually comes from. Hint: it’s not in the Rails codebase.",https://www.akshaykhot.com/rails-sessions,my_library,rubyonrails,2023-03-31T01:13:07.000Z,https://www.writesoftwarewell.com/content/images/2023/03/christmas-tree-with-old-clock.jpeg,,False
876791579,44 Top Ruby Gems: Must-have for Web Development,,"Discover the Best Ruby gems to enhance your project and make development easier. From testing to deployment, these gems will streamline your workflow.",https://www.codica.com/blog/top-ruby-gems-we-cant-live-without,my_library,"ruby, rubygems, rubyonrails",2023-03-26T18:02:06.000Z,https://www.codica.com/static/c72102e5c2bea21df2b9ec317d19ae8c/1f05b/OG_banner_bd5a796f55.jpg,,False
876791026,Tracking TODO and FIXME Comments with Rails Notes Command,,"This post shows how you can use the notes command in Rails to search through your codebase for comments starting with a specific keyword. By default, it searches the codebase for FIXME, OPTIMIZE, and TODO comments, but you can also configure it to use custom keywords.",https://www.akshaykhot.com/rails-notes-command,my_library,"documentation, rubyonrails",2023-03-24T16:59:11.000Z,https://www.writesoftwarewell.com/content/images/2024/02/code-3.png,,False
876791001,How to Setup Devise for User Authentication on Rails 7,,"If you are a frequent user of Ruby on Rails, you know that building authentication and user...",https://dev.to/ackshaey/how-to-setup-devise-for-user-authentication-on-rails-7-ojg,my_library,"authentication, rubyonrails",2023-03-22T10:18:08.000Z,"https://media2.dev.to/dynamic/image/width=1000,height=500,fit=cover,gravity=auto,format=auto/https%3A%2F%2Fdev-to-uploads.s3.amazonaws.com%2Fuploads%2Farticles%2F6iv0w14vh6mb9enf95pv.png",,False
876790912,Mastering PostgreSQL Views and CTEs for Rails Developers: A Comprehensive G,,Introduction   Views and Common Table Expression or CTE are two important concept in...,https://dev.to/yet_anotherdev/mastering-postgresql-views-and-ctes-for-rails-developers-a-comprehensive-guide-3fl4,my_library,"databases, postgres, rubyonrails",2023-03-15T12:11:25.000Z,https://dev-to-uploads.s3.amazonaws.com/uploads/articles/3otvb2z646ytpt1hl2rv.jpg,,False
876790847,Episode 391 - Deploying with MRSK | Drifting Ruby,,"Kamal (MRSK) deploys web apps anywhere from bare metal to cloud VMs using Docker with zero downtime. In this episode, we will set up a Digital Ocean infrastructure with a Load Balancer, Virtual Machines, and a PostgreSQL database. We'll use Kamal (MRSK) to provision and deploy our Rails application to the Virtual Machines.",https://www.driftingruby.com/episodes/deploying-with-mrsk,my_library,rubyonrails,2023-03-07T00:39:11.000Z,https://d1rz1wpk7ms5d5.cloudfront.net/1yfb594qm4mpbd2icxh77aqi6r0r,,False
876790830,Configuring Rails Environments,,"Despite its strong opinions and powerful conventions, Rails is a highly flexible and configurable framework. If you don’t like something, there’s almost certainly a way to change it. This article provides a brief overview of configuring Rails applications and environments.",https://www.akshaykhot.com/configuring-rails-environments,my_library,rubyonrails,2023-03-04T13:53:29.000Z,https://www.writesoftwarewell.com/content/images/size/w1200/2023/03/environments-1.jpeg,,False
876790806,Making the Most of Your Logs in Rails,,"It's easy to get going with logging with Rails, but not so easy to master it. Discover how you can get the most from your logs.",https://blog.appsignal.com/2023/03/01/making-the-most-of-your-logs-in-rails.html,my_library,rubyonrails,2023-03-01T13:37:02.000Z,https://ondemand.bannerbear.com/signedurl/Mn62mqoVbWvyB5wgQ1/image.jpg?modifications=W3sibmFtZSI6InRpdGxlIiwidGV4dCI6Ik1ha2luZyB0aGUgTW9zdCBvZiBZb3VyIExvZ3MgaW4gUmFpbHMifSx7Im5hbWUiOiJpbWFnZSIsImltYWdlX3VybCI6Imh0dHBzOi8vYXBwc2lnbmFsLW5leHRqcy1ibG9nLW55cXI2cWNyOC1hcHBzaWduYWwudmVyY2VsLmFwcC9pbWFnZXMvYmxvZy8yMDIzLTAzL3JhaWxzLWxvZ3MucG5nIn0seyJuYW1lIjoiY2F0ZWdvcnlfbG9nbyIsImltYWdlX3VybCI6Imh0dHBzOi8vYXBwc2lnbmFsLW5leHRqcy1ibG9nLW55cXI2cWNyOC1hcHBzaWduYWwudmVyY2VsLmFwcC9pbWFnZXMvbG9nb3MvcnVieS1sb2dvLnBuZyJ9XQ&s=d53b6b250e155fbddd6cd2855a070f4ff162804dbe1a949ac68b976b054b5208,,False
876790802,How to add bootstrap in Rails 7,,How to add bootstrap in rails 7   Bootstrap is a popular CSS framework that can help you...,https://dev.to/rutikkpatel/how-to-add-bootstrap-in-rails-7-5pd,my_library,"css, rubyonrails",2023-02-27T16:56:16.000Z,https://dev-to-uploads.s3.amazonaws.com/uploads/articles/3otvb2z646ytpt1hl2rv.jpg,,False
876790793,You Don't Need Rails to Start Using Hotwire,,"Although Hotwire is closely tied to Ruby on Rails, you don't really need Rails to learn, play, and experiment with Hotwire.",https://www.akshaykhot.com/using-hotwire-without-rails,my_library,rubyonrails,2023-02-26T00:35:19.000Z,https://www.writesoftwarewell.com/content/images/size/w1200/2023/02/gallery-2.png,,False
876790783,Introduction of Rails Engine with basic example.,,What is RailsEngine?   A Rails engine is a self-contained piece of functionality that can be...,https://dev.to/harsh_u115/introduction-of-rails-engine-with-basic-example-2egm,my_library,rubyonrails,2023-02-25T12:28:48.000Z,"https://media.dev.to/dynamic/image/width=1000,height=500,fit=cover,gravity=auto,format=auto/https%3A%2F%2Fdev-to-uploads.s3.amazonaws.com%2Fuploads%2Farticles%2Ft7e24eo438vz1oipslwn.png",,False
876790753,Polymorphic associations in Active Record,,"As a software developer, one of the best feelings has to be thinking up a great feature for your...",https://dev.to/mattishida/polymorphic-associations-in-active-record-2pjk,my_library,rubyonrails,2023-02-22T00:08:06.000Z,https://dev-to-uploads.s3.amazonaws.com/uploads/articles/3otvb2z646ytpt1hl2rv.jpg,,False
876790747,How to use Docker with Ruby on Rails applications.,,What is docker? and how to use it with ruby on rails applications? and benefits of using...,https://dev.to/harsh_u115/how-to-use-docker-with-ruby-on-rails-applications-4p13,my_library,"docker, rubyonrails",2023-02-20T13:57:54.000Z,"https://media.dev.to/dynamic/image/width=1000,height=500,fit=cover,gravity=auto,format=auto/https%3A%2F%2Fdev-to-uploads.s3.amazonaws.com%2Fuploads%2Farticles%2F63gbxtpmsrge0issa8dh.png",,False
876790713,What's New in Rails 7.1,,Let's take a look at what we can expect from the upcoming Rails 7.1 release.,https://blog.appsignal.com/2023/02/15/whats-new-in-rails-7-1.html,my_library,rubyonrails,2023-02-16T01:49:11.000Z,https://ondemand.bannerbear.com/signedurl/Mn62mqoVbWvyB5wgQ1/image.jpg?modifications=W3sibmFtZSI6InRpdGxlIiwidGV4dCI6IldoYXQncyBOZXcgaW4gUmFpbHMgNy4xIn0seyJuYW1lIjoiaW1hZ2UiLCJpbWFnZV91cmwiOiJodHRwczovL2FwcHNpZ25hbC1uZXh0anMtYmxvZy1ueXFyNnFjcjgtYXBwc2lnbmFsLnZlcmNlbC5hcHAvaW1hZ2VzL2Jsb2cvMjAyMy0wMi9yYWlscy03LTEucG5nIn0seyJuYW1lIjoiY2F0ZWdvcnlfbG9nbyIsImltYWdlX3VybCI6Imh0dHBzOi8vYXBwc2lnbmFsLW5leHRqcy1ibG9nLW55cXI2cWNyOC1hcHBzaWduYWwudmVyY2VsLmFwcC9pbWFnZXMvbG9nb3MvcnVieS1sb2dvLnBuZyJ9XQ&s=69bfe0d4baf4b29cbd0344ef220561ad6af9c0860aac43afee8cd7b87d5fa75a,,False
876790534,An Overview Of Ruby on Rails 7.1 Features. Part III.,,Leaked OnlyFans photos and video of manny.codes,https://manny.codes/this-week-in-rails-wrapped-an-overview-of-rails-7-1-features-part-iii,my_library,"ruby, rubyonrails",2023-01-24T03:29:00.000Z,,,False
876789927,Starting Rails 7 for Front-End Development,,Rails 7 is now more flexible in terms of the front-end technologies we want to use for our projects. Webpacker has been retired and right now is not really recommended to use for new projects.,https://reinteractive.com/articles/starting-rails-7-for-front-end-development,my_library,rubyonrails,2023-01-16T21:22:02.000Z,"https://res.cloudinary.com/hynqxvid6/image/upload/c_fit,f_auto,h_1024,w_1024/v1/media/richard-gonsales-e469e5c2a603861f5789939fb765e87895ce64b206e6d1657047b7255fc101d9.jpg",,False
876789926,Getting Started with Ruby on Rails on Render | Render,,"This guide demonstrates how to set up a local Ruby on Rails environment, create a simple view, and deploy it to Render.",https://render.com/docs/deploy-rails,my_library,rubyonrails,2023-01-16T21:21:58.000Z,https://docs.render.com/og/deploy-rails-f3c0772.png,,False
876789915,Create a Business Language for a Rails Application,,Build and parse a programming language to extend your Rails application's functionality.,https://blog.appsignal.com/2023/01/11/create-a-business-language-for-a-rails-application.html,my_library,rubyonrails,2023-01-15T19:03:43.000Z,https://ondemand.bannerbear.com/signedurl/Mn62mqoVbWvyB5wgQ1/image.jpg?modifications=W3sibmFtZSI6InRpdGxlIiwidGV4dCI6IkNyZWF0ZSBhIEJ1c2luZXNzIExhbmd1YWdlIGZvciBhIFJhaWxzIEFwcGxpY2F0aW9uIn0seyJuYW1lIjoiaW1hZ2UiLCJpbWFnZV91cmwiOiJodHRwczovL2FwcHNpZ25hbC1uZXh0anMtYmxvZy1ueXFyNnFjcjgtYXBwc2lnbmFsLnZlcmNlbC5hcHAvaW1hZ2VzL2Jsb2cvMjAyMy0wMS9idXNpbmVzcy1sYW5ndWFnZS1yYWlscy5wbmcifSx7Im5hbWUiOiJjYXRlZ29yeV9sb2dvIiwiaW1hZ2VfdXJsIjoiaHR0cHM6Ly9hcHBzaWduYWwtbmV4dGpzLWJsb2ctbnlxcjZxY3I4LWFwcHNpZ25hbC52ZXJjZWwuYXBwL2ltYWdlcy9sb2dvcy9ydWJ5LWxvZ28ucG5nIn1d&s=14a2985c7a6e917099fc3cef3cf9fe2293310f9e1d46bc5d2bbe84b705812ebf,,False
876789914,Understanding the Instrumentation API in Rails,,The Rails Instrumentation API provides a simple observer pattern and also allows you to benchmark a piece of code.,https://www.akshaykhot.com/rails-instrumentation-api,my_library,rubyonrails,2023-01-15T19:01:55.000Z,https://www.writesoftwarewell.com/content/images/size/w1200/2023/10/rails_instrumentation-2.png,,False
876789909,How To Use PostgreSQL with Your Ruby on Rails Application on Ubuntu 18.04 |,,"A PostgreSQL database is a robust and flexible choice for your Ruby on Rails application. In this tutorial, you will set up a Ruby on Rails development envir…",https://www.digitalocean.com/community/tutorials/how-to-use-postgresql-with-your-ruby-on-rails-application-on-ubuntu-18-04,my_library,"postgres, rubyonrails",2023-01-14T19:20:03.000Z,https://www.digitalocean.com/_next/static/media/intro-to-cloud.d49bc5f7.jpeg,,False
876789887,What if writing tests was a joyful experience?,,"At Jane Street we use a pattern/library called “expect tests” thatmakes test-writing feel like a REPL session, or like exploratoryprogramming in a Jupyter no...",https://blog.janestreet.com/the-joy-of-expect-tests,my_library,"best-practices, rubyonrails, webdev",2023-01-13T19:12:14.000Z,https://blog.janestreet.com/the-joy-of-expect-tests/expect.gif,,False
876789876,To Thread or Not to Thread: An In-Depth Look at Ruby’s Execution Models - Shopify,,"An in-depth look at threads vs processes in Ruby web applications, and when you should use each.",https://shopify.engineering/ruby-execution-models,my_library,"programming, ruby, rubyonrails",2023-01-09T17:06:58.000Z,https://cdn.shopify.com/s/files/1/0779/4361/articles/ShopifyEng_BlogIllustrations_220411_216ppi_02_RubyExecutionModels.jpg?v=1653485716,,False
876789875,Let's Learn Ruby on Rails Hotwire by Building a To-Do List,,"In this article, we'll learn Ruby on Rails and Hotwire by building a to-do list from scratch. It shows how to build single-page web applications using traditional web architecture (server-rendered HTML), without the complexity of modern JavaScript frameworks like React.",https://www.akshaykhot.com/building-to-do-list-using-hotwire-and-stimulus,my_library,rubyonrails,2023-01-09T17:06:55.000Z,https://www.writesoftwarewell.com/content/images/size/w1200/2022/12/finished_app.png,,False
876789873,Rails Authentication From Scratch,,"If you’re like me then you probably take Devise for granted because you’re too intimidated to roll your own authentication system. As powerful as Devise is, it’s not perfect. There are plenty of cases where I’ve reached for it only to end up constrained by its features and design, and wished I could customize it exactly to my liking.",https://stevepolito.design/blog/rails-authentication-from-scratch,my_library,"authentication, rubyonrails",2023-01-09T17:06:18.000Z,https://stevepolito.design/assets/images/open-graph/blog/rails-authentication-from-scratch.png,,False
876789838,Deploy API only Rails App with Capistrano,,"Capistrano is a deployment automation tool built on Ruby, Rake, and SSH. It allows you to deploy your...",https://dev.to/coolprobn/deploy-api-only-rails-app-with-capistrano-2d0g,my_library,"devops, programming, rubyonrails",2022-12-28T15:53:14.000Z,"https://media.dev.to/dynamic/image/width=1000,height=500,fit=cover,gravity=auto,format=auto/https%3A%2F%2Fdev-to-uploads.s3.amazonaws.com%2Fuploads%2Farticles%2Flvno5gexvv6evbvj9djy.jpeg",,False
876789801,rails/docked: Running Rails from Docker for easy start to development,,Running Rails from Docker for easy start to development - rails/docked,https://rubyweekly.com/link/133475/ad5e785e3b,my_library,"docker, rubyonrails",2022-12-22T16:07:19.000Z,https://opengraph.githubassets.com/9c90e7ea5a621d6709afca198798c87844915a93ea9fd980cc8d1e8c6add04dd/rails/docked,,False
