id,title,note,excerpt,url,folder,tags,created,cover,highlights,favorite
934466903,Who Killed the Fudge King?,,How I (possibly) solved a cold case on my summer vacation.,https://magazine.atavist.com/who-killed-the-fudge-king-jersey-shore-harry-anglemyer/,my_library,"crime, goodreads",2024-12-31T15:51:41.540Z,https://magazine.atavist.com/wp-content/uploads/2023/09/FudgeKing_1_crop.jpg,,False
910582568,"My Uncle, the Hit Man",,No one in my family wanted to talk about Harold’s life as a contract killer for the Mob. Then one day he called me.,https://www.newyorker.com/magazine/2001/08/06/harold-konigsberg-hit-man-blood-relation,my_library,"crime, goodreads",2024-11-28T13:16:28.158Z,"https://media.newyorker.com/photos/6724ec802e674db6b7df08ad/16:9/w_1280,c_limit/R10186.png",,True
876797087,Watch It Burn,,"Two scammers, a web of betrayal, and Europe’s fraud of the century.",https://magazine.atavist.com/watch-it-burn-france-europe-carbon-fraud-scam-vat-betrayal,my_library,"goodreads, truecrime",2024-06-01T16:30:55.000Z,https://magazine.atavist.com/wp-content/uploads/2024/02/WATCHITBURN_LEAD-scaled.jpg,,False
876797055,Master of Make-Believe,,"Zach Horwitz came to Los Angeles hoping to make it in the movies. He ended up running a seven-hundred-million-dollar scam, defrauding a sprawling group of investors, starting with his best friends.",https://www.newyorker.com/magazine/2024/06/03/master-of-make-believe,my_library,"goodreads, truecrime",2024-05-28T21:41:59.000Z,"https://media.newyorker.com/photos/664e06210131ee15cead2ddd/16:9/w_1280,c_limit/r44322web.jpg",,False
876797021,There Are Places You Cannot Go,,"A friendship born out of the ruins of a nation, a dangerous journey home, and a 40-year search for the truth.",https://magazine.atavist.com/there-are-places-you-cannot-go-cambodia-genocide,my_library,"goodreads, truecrime",2024-05-22T20:39:28.000Z,https://magazine.atavist.com/wp-content/uploads/2019/07/cam1-1564156716-50-9.jpg,,False
876796907,Poison Pill,,Is the killer behind the 1982 Tylenol poisonings still on the loose? Exclusive revelations by investigators yield the first authoritative account of what happened and who likely did it.,https://getpocket.com/explore/item/poison-pill,my_library,"goodreads, truecrime",2024-05-12T05:39:16.000Z,https://pocket-image-cache.com/1200x/filters:format(jpg):extract_focal()/https%3A%2F%2Fpocket-syndicated-images.s3.amazonaws.com%2Farticles%2F9993%2F1715122969_ScreenShot2022-07-07at2.54.23PM.png,,False
876795528,‘Stay Away From Him. He’s Dangerous.’,,"""For years, a mysterious figure preyed on gay men in Atlanta. People on the streets called him the Handcuff Man—but the police knew his real name.""",https://longreads.com/2024/04/04/handcuff-man-atlanta-crime-lgbtq-atavist-magazine,my_library,"goodreads, truecrime",2024-04-04T19:45:09.000Z,https://longreads.com/wp-content/uploads/2024/03/HandcuffMan_1_crop.jpg,,False
876793908,A Teen’s Fatal Plunge Into the London Underworld,,"After Zac Brettler mysteriously plummeted into the Thames, his grieving parents discovered that he’d been posing as an oligarch’s son. Would the police help them solve the puzzle of his death?",https://www.newyorker.com/magazine/2024/02/12/a-teens-fatal-plunge-into-the-london-underworld,my_library,"goodreads, truecrime",2024-02-06T20:46:06.000Z,"https://media.newyorker.com/photos/65bc2f47a3cf2052ac8339c0/16:9/w_1280,c_limit/240212_r43752.jpg",,False
876792989,"Kyle Deschanel, the Rothschild Who Wasn’t",,Kyle de Rothschild Deschanel was an instant New York sensation who seemed to live on a 24/7 carousel of mega-dollar deals and raucous parties. Then his best friend found an ID marked “Aryeh Dodelson.”,https://www.vanityfair.com/style/2023/08/kyle-deschanel-the-rothschild-who-wasnt,my_library,"goodreads, truecrime",2023-09-04T19:31:34.000Z,"https://media.vanityfair.com/photos/64ee1963be7c1560056f44ea/16:9/w_1280,c_limit/NicoleRifkin_RabbiRothschild_Illustration_FINAL.jpg",,False
876792705,12 Gripping True-Crime Reads,,"For some of us, dark times call for dark reads.",http://getpocket.com/collections/12-gripping-true-crime-reads,my_library,"goodreads, truecrime",2023-07-22T23:13:14.000Z,https://pocket-image-cache.com/1200x/filters:format(jpg):extract_focal()/https%3A%2F%2Fs3.amazonaws.com%2Fpocket-collectionapi-prod-images%2F6694b4b0-d4dd-4d6b-8490-4c05304fdd27.jpeg,,False
876792693,Notes From the Inner Lives of Con Artists,,Venture inside the minds of some of the greatest scammers.,http://getpocket.com/collections/notes-from-the-inner-lives-of-con-artists,my_library,"behaviors, deceit-deception, goodreads, truecrime",2023-07-22T14:38:37.000Z,https://pocket-image-cache.com/1200x/filters:format(jpg):extract_focal()/https%3A%2F%2Fs3.amazonaws.com%2Fpocket-collectionapi-prod-images%2F088c1288-764e-42ca-95c3-2b2ff8586217.jpeg,,False
876791925,The Last Gamble of Tokyo Joe,,"Ken Eto rose through the ranks of the Chicago mob, and then it tried to kill him. The underworld would never be the same.",https://www.chicagomag.com/epic/the-last-gamble-of-tokyo-joe,my_library,"goodreads, truecrime",2023-05-14T21:43:09.000Z,https://www.chicagomag.com/wp-content/uploads/2023/05/NEW-2-topper-Ken-Eto.jpg,,False
876791583,How a Team of Ambitious Crooks in 1960s Montreal Planned the Biggest Bank Heist Anyone Had Ever Seen,,"In the spring of 1961, Georges Lemay, a dapper thirty-six-year-old French Canadian, spent his days holed up in his cottage on a private island on a river in the Laurentian Mountains north of Montre…",https://crimereads.com/1960s-montreal-bank-heist,my_library,"crime, goodreads, truecrime",2023-03-26T18:43:48.000Z,https://s26162.pcdn.co/wp-content/uploads/sites/3/2023/03/montreal-heist-feat.jpg,,False
876790969,Crime of the Centuries,,"Tomb raiders, crooked art dealers, and museum curators fed billionaire Michael Steinhardt’s addiction to antiquities. Many also happened to be stolen.",https://nymag.com/intelligencer/article/michael-steinhardt-antiquities-stolen-artifacts.html,my_library,"art, goodreads, history, truecrime",2023-03-19T13:22:04.000Z,https://pyxis.nymag.com/v1/imgs/456/966/35bed97349922be998366f4cf2961b1aac-stolen-artifacts-lede.1x.rsocial.w1200.jpg,,False
876790923,"11 of the Greatest Scams of All Time, Curated by ‘Scam Goddess’ Laci Mosley",,"The comedian and podcast host—and bonafide scam expert—shares her favorite capers, along with what makes them so irresistible.",https://getpocket.com/collections/11-of-the-greatest-scams-of-all-time-curated-by-scam-goddess-laci-mosley,my_library,"deceit-deception, goodreads, truecrime",2023-03-16T13:35:52.000Z,https://pocket-image-cache.com/1200x/filters:format(jpg):extract_focal()/https%3A%2F%2Fs3.amazonaws.com%2Fpocket-collectionapi-prod-images%2F380ef6fd-85fd-4244-bacd-2d5a19779f08.jpeg,,False
876790804,How the Biggest Fraud in German History Unravelled,,The tech company Wirecard was embraced by the German élite. But a reporter discovered that behind the façade of innovation were lies and links to Russian intelligence.,https://www.newyorker.com/magazine/2023/03/06/how-the-biggest-fraud-in-german-history-unravelled,my_library,"finance, goodreads, truecrime",2023-02-28T20:50:44.000Z,"https://media.newyorker.com/photos/63f8dec082148b761217e4e8/16:9/w_1280,c_limit/230306_r41943.jpg",,False
876790716,The Strange Real-Life Mystery Behind Edgar Allan Poe’s “The Black Cat”,,"George Stebbins was tearing down a stone wall in the cellar of his home in Northfield, Massachusetts when he uncovered the bones. A skull emerged first, then the spine and the bones of the arms and…",https://crimereads.com/real-life-mystery-edgar-allan-poes-the-black-cat,my_library,"crime, goodreads, writing",2023-02-16T11:00:09.000Z,https://s26162.pcdn.co/wp-content/uploads/sites/3/2023/01/poe-black-cat-feat.jpg,,False
876790710,Avenging Billy: How amateur sleuths took on a gay porn actor’s haunting Hollywood murder,,Local sleuths help find a suspect in gay porn actor Bill Newton's murder. His dismembered head and feet were found in a Hollywood dumpster in 1990.,https://www.latimes.com/california/story/2023-02-07/sleuths-help-lapd-cold-case-bill-newton,my_library,"goodreads, mysteries, truecrime",2023-02-15T21:21:15.000Z,https://ca-times.brightspotcdn.com/dims4/default/ec9ff40/2147483647/strip/true/crop/1280x672+0+18/resize/1200x630!/quality/75/?url=https%3A%2F%2Fcalifornia-times-brightspot.s3.amazonaws.com%2F7b%2F78%2F1ef193d1434ea28211ce63cec322%2Fla-me-weho-cold-case-murder01.PNG,,False
876790707,Portrait of a killer: art class in one of Mexico’s most notorious prisons,,"The long read: In 2016, artist César Aréchiga talked one of Mexico’s most dangerous maximum security prisons into letting him run art classes for its inmates, many of them violent gang members. Could he really change their lives?",https://www.theguardian.com/world/2023/feb/09/portrait-of-a-killer-art-class-in-one-of-mexicos-most-notorious-prisons,my_library,"art, crime, goodreads",2023-02-15T20:42:03.000Z,https://i.guim.co.uk/img/media/85dfe24597727891427b9089fc7da507e782b0c9/0_0_5000_3000/master/5000.jpg?width=1200&height=630&quality=85&auto=format&fit=crop&overlay-align=bottom%2Cleft&overlay-width=100p&overlay-base64=L2ltZy9zdGF0aWMvb3ZlcmxheXMvdGctYWdlLTIwMjMucG5n&enable=upscale&s=64cd8895fa8be9a7e107b68ad3a3b583,,False
876790704,The husband-and-wife forgers who fooled the art market — and made millions | CNN,,"Wolfgang and Helene Beltracchi’s forgeries infiltrated museums, auction houses and private collections. A decade after their conviction, psychoanalyst Jeannette Fischer asks: Why did they do it?",https://www.cnn.com/style/article/wolfgang-helen-beltracchi-forgers/index.html,my_library,"art, goodreads, truecrime",2023-02-15T13:26:19.000Z,"https://media.cnn.com/api/v1/images/stellar/prod/230124095815-02-wolfgang-helene-beltracchi-restricted.jpg?c=16x9&q=w_800,c_fill",,False
876790552,The Spectacular Case of Lørenskog: Norway's Ongoing Search for a Murderer,,"Anne-Elisabeth Hagen, 68, was married to one of the wealthiest men in Norway. But four years ago, she disappeared, and police still have no solid leads. The entire country has been obsessed by the case ever since.",https://www.spiegel.de/international/europe/the-spectacular-case-of-lorenskog-norway-s-ongoing-search-for-a-murderer-a-b615c528-392e-4708-8796-5047d2620484,my_library,"goodreads, truecrime",2023-01-26T19:03:21.000Z,https://cdn.prod.www.spiegel.de/images/24ef94df-b528-444c-ba39-103b394edc93_w1200_r1.778_fpx42_fpy46.jpg,,False
876789959,The Schwarzschild defence,,Nature - A boost to the ratings.,https://www.nature.com/articles/d41586-022-04550-2,my_library,"crime, goodreads, scifi",2023-01-22T11:47:32.000Z,https://media.nature.com/lw1200/magazine-assets/d41586-022-04550-2/d41586-022-04550-2_23845524.jpg,,False
876788836,The Most Lawless County in Texas,,"Suzanne Wooten did the impossible and became the first candidate to defeat a sitting judge in Collin County. What followed is the unbelievable, epic tale of the craziest case in the history of jurisprudence.",https://www.dmagazine.com/publications/d-magazine/2022/october/the-most-lawless-county-in-texas,my_library,"goodreads, truecrime",2022-10-30T18:23:46.000Z,https://assets.dmagstatic.com/wp-content/uploads/2022/09/Suzanne-Wooten-portrait-2.jpg,,False
876787595,Inside the Mind-Boggling World of the Antiquities Theft Task Force,,You can't make this shit up,https://annehelen.substack.com/p/inside-the-mind-boggling-world-of,my_library,"art, crime, goodreads",2022-07-19T16:17:05.000Z,"https://substackcdn.com/image/fetch/w_1200,h_600,c_fill,f_jpg,q_auto:good,fl_progressive:steep,g_auto/https%3A%2F%2Fbucketeer-e05bbc84-baa3-437e-9518-adb32be77984.s3.amazonaws.com%2Fpublic%2Fimages%2Fac4ce1a3-b760-419b-a70c-b9231128c2eb_1024x683.jpeg",,False
876784958,Hacker News,,,https://torontolife.com/city/the-case-of-the-missing-46-million,my_library,"crime, crypto, goodreads",2022-06-23T23:11:19.000Z,,,False
876783803,How Bitcoin Tracers Took Down the Web’s Biggest Child Abuse Site,,Welcome to Video’s customers thought their payments were untraceable. They couldn’t have been more wrong. The untold story of the case that shredded the myth of Bitcoin’s anonymity.,https://www.wired.com/story/tracers-in-the-dark-welcome-to-video-crypto-anonymity-myth,my_library,"crime, crypto, goodreads",2022-04-10T17:03:33.000Z,"https://media.wired.com/photos/624e318eedc71717de2dee32/191:100/w_1280,c_limit/Crypto-Trap4.jpg",,False
876783754,A Cold Case,,"Suddenly, a New York cop remembered a long-ago double murder.",https://www.newyorker.com/magazine/2000/02/14/a-cold-case,my_library,"goodreads, truecrime",2022-03-27T18:42:06.000Z,"https://media.newyorker.com/photos/590970e41c7a8e33fb38ec34/16:9/w_1280,c_limit/000214_ra333.jpg",,False
876782397,The Infamous FBI Informant Behind a 20-Fatality Limo Crash,,It was the deadliest U.S. transportation disaster in a decade. The man behind it was one of the most notorious confidential informants in FBI history.,https://nymag.com/intelligencer/article/limo-crash-ny-fbi-informant.html,my_library,"crime, goodreads",2022-01-23T19:43:22.000Z,https://pyxis.nymag.com/v1/imgs/e6d/163/e3757a55ca2d4f95aa414b24dcd44d1064-0222FEA-Limo-nymag-limostory-mh.1x.rsocial.w1200.jpg,,False
876781030,"The lawyer who tried faking his death, and the writer exposing his crime dynasty",,Mandy Matney kept a harsh spotlight trained on South Carolina’s Murdaugh family until they became impossible for anyone to ignore,https://www.theguardian.com/us-news/2021/dec/16/mandy-matney-alex-murdaugh-writer-crime-story,my_library,"crime, goodreads",2021-12-22T19:29:19.000Z,https://i.guim.co.uk/img/media/14ed1b4087c413c45206d850b70eb45573bf67c0/0_0_1500_900/master/1500.jpg?width=1200&height=630&quality=85&auto=format&fit=crop&overlay-align=bottom%2Cleft&overlay-width=100p&overlay-base64=L2ltZy9zdGF0aWMvb3ZlcmxheXMvdGctYWdlLTIwMjEucG5n&enable=upscale&s=bfc5fcc24643d9311523b5f4e0ea345c,,False
876780736,Death of a Lobsterman,,"On a remote island in Maine, a group of friends thought they witnessed one man killing another with an ax. But no one was ever arrested. In a small town far out at sea, justice sometimes works a little differently.",https://www.esquire.com/news-politics/a38241137/roger-feltis-killing-vinalhaven-dan-landers,my_library,"crime, goodreads",2021-12-10T00:55:48.000Z,"https://hips.hearstapps.com/hmg-prod/images/indexxx-1638406177.jpg?crop=0.668xw:0.551xh;0.164xw,0.169xh&resize=1200:*",,False
876780147,The Spine Collector,,"For five years, a mysterious figure has been stealing books before their release. Is it espionage? Revenge? A trap? Or a complete waste of time?",https://www.vulture.com/2021/08/stealing-books-before-release-mystery.html#_ga=2.215798815.903158467.1629117538-1459850996.1625077603,my_library,"books, crime, goodreads",2021-11-30T22:19:33.000Z,https://pyxis.nymag.com/v1/imgs/713/db4/bc7671f72d4bdd086ca2222dec1165a9f2-1721FEA-Phishing-Phishing-Opener-Final.1x.rsocial.w1200.jpg,,False
876780101,The Notorious Mrs. Mossler,,"In the mid-sixties, Candace Mossler was one of the most widely known socialites in Houston. She was in her forties, vivacious and full of charm, with wavy blond hair, deep-blue eyes, and a surgically enhanced figure that was often remarked upon in the many newspaper columns written about her.",https://email.getpocket.com/ls/click?upn=ky17TgJ1REx4YaZOG279kWynXx0v09uKYpx6EYlS8tkyLPKvwCUAG5ryLylQRsGTjoMV_8XOtBOf0-2BgI-2BPwTgvOpOkjz0cTGvHU6qEjV-2B98KLYXhI5rK59fXfvPezcbJXxt4IFB2WkclMchoMOU67Wt6-2B3ATu7JD0Zf7DhGFZe-2BQSHlBDmRiLF9xcUAAAERDOWqV7fHmjmuex1kWE9VM1er2cXcWc-2Fb4VZ6kmMpkGt9KyoVuXOZmtFz9ulxmv7VQARGOI7xqFE7A8qfXxcw4tkHnKgFRvyNEDYS0paW9qjD7292ru5j8GGJaArZ37OW-2B9rNeXd1Ism-2BgDnWcc49jT7NuC7zEyEzmwMBFs-2BAlSaHWCwTiUzrohEwETVsnXmbN6S95l-2Bs6VFSdXieewsowH04DXAUHvrSKVzBPRy8vCdH5sg1qXyBsu0fjlqxCrXZernGjs,my_library,"crime, goodreads, mysteries",2021-11-28T01:11:36.000Z,https://pocket-image-cache.com/unsafe/https%3A%2F%2Ftxmo-server.imgix.net%2F2021%2F11%2Fcandace-mossler-feature.jpg%3Fauto%3Dcompress%26crop%3Dfaces%26fit%3Dfit%26h%3D1500%26ixlib%3Dphp-3.0.0%26q%3D45%26w%3D2400%26s%3D7bb38c46b182effd2456e3bedd924af1,,False
876780076,The Tomb Raiders of the Upper East Side,,Inside the Manhattan DA’s Antiquities Trafficking Unit,https://www.theatlantic.com/magazine/archive/2021/12/bogdanos-antiquities-new-york/620525,my_library,"crime, goodreads, history",2021-11-23T11:27:06.000Z,https://cdn.theatlantic.com/thumbor/c4rBm3ibiY-t1CzlEOj2bkiT02g=/0x43:2000x1085/1200x625/media/img/2021/11/WEL_Sabar_BogdanosOpenerHP/original.jpg,,False
876780048,What lies beneath: the secrets of France’s top serial killer expert,,"The long read: An intrepid expert with dozens of books to his name, Stéphane Bourgoin was a bestselling author, famous in France for having interviewed more than 70 notorious murderers. Then an anonymous collective began to investigate his past",https://www.theguardian.com/news/2021/nov/09/secrets-of-top-serial-killer-expert-france-stephane-bourgoin,my_library,"crime, goodreads",2021-11-13T11:07:28.000Z,https://i.guim.co.uk/img/media/cb5820e4959fe02031f64e6574bd01e7601c053e/0_0_4576_2746/master/4576.jpg?width=1200&height=630&quality=85&auto=format&fit=crop&overlay-align=bottom%2Cleft&overlay-width=100p&overlay-base64=L2ltZy9zdGF0aWMvb3ZlcmxheXMvdGctYWdlLTIwMjEucG5n&enable=upscale&s=590c196a5703d91a8c29d9c0e01f1f5a,,False
876779902,‘Every message was copied to the police’: the inside story of the most daring surveillance sting in history,,"Billed as the most secure phone on the planet, An0m became a viral sensation in the underworld. There was just one problem for anyone using it for criminal means: it was run by the police",https://www.theguardian.com/australia-news/2021/sep/11/inside-story-most-daring-surveillance-sting-in-history,my_library,"crime, goodreads, privacy",2021-09-13T23:59:44.000Z,https://i.guim.co.uk/img/media/d8b4040ccdc40c4de3ef5dcf4cf2bbd3216971e5/0_572_4204_2521/master/4204.jpg?width=1200&height=630&quality=85&auto=format&fit=crop&overlay-align=bottom%2Cleft&overlay-width=100p&overlay-base64=L2ltZy9zdGF0aWMvb3ZlcmxheXMvdGctYWdlLTIwMjEucG5n&enable=upscale&s=f04d49544a9d3daa4d13a5fce32ae7fa,,False
876779893,The Lost Boys,,"It was the most shocking crime of its day, 27 boys from the same part of town kidnapped, tortured, and killed by an affable neighbor named Dean Corll. Forty years later, it remains one of the least understood—or talked about—chapters in Houston's history.",https://www.texasmonthly.com/news-politics/the-lost-boys?fbclid=IwAR0RuqpJ0Vi0tULMAvYgL5fHiBa5ybPs0ys2zkh9sbUirg244fRQ7E4pggw&hsa_acc=354467449&hsa_ad=6249141692408&hsa_cam=6249140206608&hsa_grp=6249140207008&hsa_net=facebook&hsa_src=fb&hsa_ver=3,my_library,"crime, goodreads, mysteries",2021-09-08T09:35:53.000Z,https://txmo-server.imgix.net/2021/08/true-crime-houston-lost-boys-feature-1.jpg?auto=compress&crop=faces&fit=fit&h=1500&ixlib=php-3.0.0&q=45&w=2400&s=9bd785caf731fef7bddde20463584111,,False
876779856,The Kingpin of Shanghai,,"From the depths of poverty, Du Yuesheng rose through Shanghai’s underworld to become one of the most influential, and overlooked, figures in modern China.",https://www.damninteresting.com/the-kingpin-of-shanghai,my_library,"crime, goodreads, history",2021-08-26T21:55:38.000Z,https://damn-8791.kxcdn.com/wp-content/uploads/2021/08/cover-003b.jpg,,False
876779817,"Family, identity and one of the longest manhunts in U.S. history",,"Fifty years ago, a shooting that nearly killed police officer Daril Cinquanta set in motion a decadeslong chase across the American West",https://www.deseret.com/2021/8/2/22601909/the-fugitive-and-the-chameleon-fbi-daril-cinquanta-lawrence-pusateri-luis-ramon-montoya,my_library,"goodreads, truecrime",2021-08-09T23:39:27.000Z,https://www.deseret.com/resizer/v2/AM6F4FS4C7VRHYTDDQZRXVUU4A.jpg?focal=798%2C963&auth=2f3b29f2f2c7808b460bed6f0d6be68f7c3ef983015038106e6406a2494a1a11&width=1200&height=630,,False
876779374,Who Killed Cachou the Bear? Murder Mystery in Spain Rattles Conservationists,,Conservationists saw the 6-year-old brown bear as a symbol of hope. Villagers saw him as a menace. Then he turned up dead.,https://www.bloomberg.com/news/features/2021-07-08/who-killed-cachou-the-bear-murder-mystery-in-spain-rattles-conservationists,my_library,"animals, crime, goodreads",2021-07-13T20:51:35.000Z,https://assets.bwbx.io/images/users/iqjWHBFdfxIU/itqv47ZcUbzw/v0/1200x800.jpg,,False
876779338,“The Only Thing I Knew How to Do Was Kill People”: Inside the Rash of Unexp,,"Dozens of people were killed, died by suicide, or went missing from the Texas military base last year alone. What is behind the violence and tragedy at Fort Hood?",https://www.vanityfair.com/news/2021/06/inside-the-rash-of-unexplained-deaths-at-fort-hood,my_library,"goodreads, truecrime",2021-07-07T09:13:36.000Z,"https://media.vanityfair.com/photos/60dcc789ba7beb43db9b1b42/16:9/w_1280,c_limit/VF-0821-Yalkin-For-Hood-Lede-Tout.jpg",,False
876779207,"Decades After Mysteriously Drowning, Pecos Jane Has a Name – Texas Monthly",,"The young woman who mysteriously drowned in the Ropers Motel pool in 1966 might have remained anonymous forever, if not for cutting-edge genetics, old-fashioned genealogy—and the kindness of a small West Texas town.",https://www.texasmonthly.com/news-politics/pecos-jane-identified-forensic-genealogy,my_library,"crime, goodreads, mysteries",2021-06-14T20:00:02.000Z,https://img.texasmonthly.com/2021/06/pecos-jane-case-feature.jpg?auto=compress&crop=faces&fit=fit&fm=pjpg&ixlib=php-3.3.1&q=45,,False
876779141,The Snitch - The Atavist Magazine,,"In Scott Kimball, the FBI thought it had found a high-value informant who could help solve big cases. What it got instead was lies, betrayal, and murder.",https://magazine.atavist.com/the-snitch-fbi-scott-kimball-informant-killer-colorado?fbclid=IwAR2JsTDgsKgVsPlXGgkRPAUONZzLYpegtXTqYDmkboZvINX391B8BlYFK2k,my_library,"crime, goodreads",2021-06-03T02:13:32.000Z,https://magazine.atavist.com/wp-content/uploads/2021/05/thesnitch_headerCROP.jpg,,False
876779076,"Three Family Members, One Business. Robbing Armored Cars.",,A man returns home from the army and gets a surprising offer from his father: Join the family business and help mom & pop pull off a string of daring cross-country heists. No one expects the betrayals coming.,https://getpocket.com/explore/item/family-business,my_library,"goodreads, truecrime",2021-05-27T00:19:27.000Z,https://pocket-image-cache.com/1200x/filters:format(jpg):extract_focal()/https%3A%2F%2Fpocket-syndicated-images.s3.amazonaws.com%2Farticles%2F6345%2F1620347959_1q76Xol7zRdld3s-BbFrB_Q.jpeg,,False
876779000,"Cryptoqueen: How this woman scammed the world, then vanished - BBC News",,How did Ruja Ignatova make $4bn selling her fake cryptocurrency to the world - and where did she go?,https://www.bbc.com/news/stories-50435014,my_library,"blockchain, crypto, goodreads, truecrime",2021-05-16T00:10:28.000Z,https://ichef.bbci.co.uk/news/1024/branded_news/17996/production/_109826669_queen_promo-nc.jpg,,False
876778971,Tome Raiders: Solving the Great Book Heist,,"When nearly $3.5M of rare books were stolen in an audacious heist at Feltham in 2017, police wondered, what’s the story?",https://getpocket.com/explore/item/tome-raiders-solving-the-great-book-heist,my_library,"art, goodreads, truecrime",2021-05-09T17:34:55.000Z,https://pocket-image-cache.com/1200x/filters:format(jpg):extract_focal()/https%3A%2F%2Fpocket-syndicated-images.s3.amazonaws.com%2Farticles%2F6281%2F1619214715_GettyImages-182146040.jpg,,False
876778434,The John Patterson Kidnapping in Mexico - The Atlantic,,"In 1974, John Patterson was abducted by the People’s Liberation Army of Mexico—a group no one had heard of before. The kidnappers wanted $500,000, and insisted that Patterson’s wife deliver the ransom.",https://www.theatlantic.com/magazine/archive/2021/05/john-patterson-kidnapping-mexico/618396,my_library,"crime, goodreads",2021-04-16T10:25:29.000Z,https://cdn.theatlantic.com/thumbor/rSKQZK1FfTaXH6nIxQkcrFpLpBw=/0x43:2000x1085/1200x625/media/img/2021/04/KoernerOpenerFullhp/original.jpg,,False
876778061,Huntsville station,,‘It’s a trip just being out’: at the local Greyhound bus station with newly released men from the Texas State Penitentiary,https://aeon.co/videos/a-bus-station-is-the-first-stop-on-the-road-to-freedom-for-former-inmates-in-texas,my_library,"crime, goodreads",2021-02-18T12:08:08.000Z,https://images.aeonmedia.co/images/98aa14e4-9dd7-45cd-9de2-1c39e865f4c6/huntsville-station-landscape.jpg?width=1200&quality=75&format=auto,,False
876777384,WHERE IS BUM FARTO,,"In Sept. 9, 1975, William Osterhoudt, a local school principal, looked out at an implausible scene unfolding at the pink house belonging to his neighbor on United Street. Key West Fire Chief Joseph…",https://www.sun-sentinel.com/news/fl-xpm-1996-10-06-9610100301-story.html,my_library,"crime, goodreads",2021-01-19T01:44:29.000Z,https://www.sun-sentinel.com/wp-content/uploads/2023/03/SS-WordPress-Fallback-Image.png,,False
876777274,"My Bodyguard, My Self | Topic",,,https://www.topic.com/my-bodyguard-my-self,my_library,"crime, goodreads, security",2021-01-01T19:36:49.000Z,,,False
876777234,John Franzese ratted out his Colombo crime family father – then disappeared,,"John Franzese Jr. helped send his father, notorious Colombo family mobster Sonny Franzese, to prison. Then he turned up in Indianapolis.",https://www.indystar.com/in-depth/news/2019/03/26/john-sonny-franzese-colombo-crime-family-indianapolis/3139068002,my_library,"crime, goodreads",2020-12-26T15:20:54.000Z,https://www.gannett-cdn.com/presto/2019/03/13/PIND/ed6f36b8-cf54-435a-9a49-cc17cd1a25b6-MobsterMat_MM_016.jpg,,False
