id,title,note,excerpt,url,folder,tags,created,cover,highlights,favorite
876787565,Get your work recognized: write a brag document,,,https://jvns.ca/blog/brag-documents,my_library,"behaviors, bragging",2022-07-19T00:30:39.000Z,,,False
876787356,The Best Article Ever Written About Bragging,,"After feeling belittled, I journey into the heart of bragging and discover 17 modes of showing off.",https://www.lesspenguiny.com/articles/best-article-on-bragging,my_library,"behaviors, bragging",2022-07-18T16:04:44.000Z,https://s3.amazonaws.com/less-penguiny/bragging/ScreenShot2018-09-18at165847.jpg,,False
876779138,Why are we so uncharitable to those doing good deeds?,,"From veganism to fundraising, psychologists have found acts of altruism often attract mistrust and even anger",http://www.theguardian.com/science/2021/may/23/why-are-we-so-uncharitable-to-those-doing-good-deeds,my_library,"behaviors, bragging, modesty",2021-06-03T01:34:16.000Z,https://i.guim.co.uk/img/media/c3564f5f4612064575a10a94cd1ee03678b99888/0_0_2362_1416/master/2362.jpg?width=1200&height=630&quality=85&auto=format&fit=crop&overlay-align=bottom%2Cleft&overlay-width=100p&overlay-base64=L2ltZy9zdGF0aWMvb3ZlcmxheXMvdG8tYWdlLTIwMjEucG5n&enable=upscale&s=fc40a784029bbf115c85242ef005fd6c,,False
876777459,https://psychlens.com/psychology-of-bragging/,,,https://psychlens.com/psychology-of-bragging,my_library,"behaviors, bragging",2021-01-30T01:13:33.000Z,,,False
876777458,7 Ways Narcissists Manipulate Relationships,,"How narcissists use ""narcissistic supply"" to exploit relationships.",https://www.psychologytoday.com/us/blog/communication-success/201903/7-ways-narcissists-manipulate-relationships,my_library,"behaviors, bragging",2021-01-30T01:13:33.000Z,https://cdn2.psychologytoday.com/assets/styles/manual_crop_1_91_1_1528x800/public/field_blog_entry_teaser_image/2019-03/shutterstock_83226820_compressed_for_web_page.jpg?itok=sg-Effa9,,False
