id,title,note,excerpt,url,folder,tags,created,cover,highlights,favorite
882412367,Basecamp-maker 37Signals says its “cloud exit” will save it $10M over 5 years,,"After buying its own hardware, 37Signals will be “literally deleting our AWS account come this summer.” But most firms are looking at hybrid mixes.",https://arstechnica.com/information-technology/2024/10/basecamp-maker-37signals-says-its-cloud-exit-will-save-it-10m-over-5-years/,my_library,"aws, cloud",2024-10-21T21:19:33.960Z,https://cdn.arstechnica.net/wp-content/uploads/2024/10/GettyImages-1358638792.jpg,,False
876795190,"Reducing our AWS bill by $100,000 - Fathom Analytics",,We reduced our AWS bill so that we could invest in more important areas.,https://usefathom.com/blog/reduce-aws-bill,my_library,"aws, cloud, devops",2024-02-28T07:12:08.000Z,https://usefathom.com/assets/src/blog/meta-reduce-aws-bill.jpg,,False
876788607,AWS vs GCP reliability is wildly different | Pierce Freeman,,,https://freeman.vc/notes/aws-vs-gcp-reliability-is-wildly-different,my_library,"aws, devops, google-cloud",2022-09-22T13:12:57.000Z,,,False
876783925,The actual infrastructure costs of running SaaS at scale (billions of reque,,In this article we are going to share two main things:    The evolution of our infrastructure over...,https://dev.to/dabeeeenster/the-actual-infrastructure-costs-of-running-saas-at-scale-billions-of-requestsmonth-5hlm,my_library,"aws, cloud, devops, programming",2022-05-17T22:26:24.000Z,"https://media.dev.to/dynamic/image/width=1000,height=500,fit=cover,gravity=auto,format=auto/https%3A%2F%2Fdev-to-uploads.s3.amazonaws.com%2Fuploads%2Farticles%2Fv0fpxrfyotkqeigvsnef.png",,False
876783855,"Ask HN: Beyond AWS/Azure/GCP, what cloud providers should I know more about",,,https://news.ycombinator.com/item?id=31218268,my_library,"aws, cloud, devops",2022-05-01T21:44:36.000Z,,,False
876783811,AWS Data Transfer Costs: Solving Hidden Network Transfer Costs,,Hidden AWS data transfer costs can lead to higher than expected cloud service bills. This post will help track hidden fees and show you how to control them.,https://cloud.netapp.com/blog/aws-cvo-blg-aws-data-transfer-costs-solving-hidden-network-transfer-costs,my_library,"aws, cloud, devops, pricing",2022-04-13T18:29:17.000Z,https://bluexp.netapp.com/hubfs/Small%20Image-AWS%20Data%20Transfer%20Pricing_%20Hidden%20Network%20Transfer%20Costs%20and%20What%20to%20Do%20About%20Them-1932x966.png,,False
876782798,[deleted by user],,"139 votes, 93 comments. 352K subscribers in the devops community.",https://www.reddit.com/r/devops/comments/t8es2r/what_are_some_pros_in_choosing_gcp_over_aws_or,my_library,"aws, azure, cloud, devops, google-cloud",2022-03-07T16:52:50.000Z,,,False
876781105,Introduction to the AWS CLI,,,https://dev.to/donaldsebleung/introduction-to-the-aws-cli-e6o,my_library,"aws, cloud, devops",2021-12-30T21:16:34.000Z,,,False
876781089,My Top 10 Free Learning Resources for AWS,,,https://hashnode.tpschmidt.com/my-top-10-free-learning-resources-for-aws,my_library,"aws, cloud, devops",2021-12-27T16:40:06.000Z,,,False
876781080,The Trouble with Tribbles...: The cost of cloud,,"Putting your IT infrastructure into the cloud seems to be the ""in"" thing. It's been around for a while, of course. And, like most things rel...",https://ptribble.blogspot.com/2021/12/the-cost-of-cloud.html,my_library,"aws, cloud, devops",2021-12-27T16:39:40.000Z,,,False
876780830,Infrastructure As Code Provisioning Tool - AWS CloudFormation - AWS,,"AWS CloudFormation is an infrastructure as code (IaC) service that allows you to easily model, provision, and manage AWS and third-party resources.",https://aws.amazon.com/cloudformation,my_library,"aws, cloud",2021-12-12T18:17:22.000Z,https://a0.awsstatic.com/libra-css/images/logos/aws_logo_smile_1200x630.png,,False
876780801,"Introduction to Management, Governance and Migration with AWS - Part 1",,,https://dev.to/aws-builders/introduction-to-management-governance-and-migration-with-aws-part-1-2h2d,my_library,"aws, cloud, devops",2021-12-11T11:22:14.000Z,,,False
876780750,Cloud Computing Services - Amazon Web Services (AWS),,"Amazon Web Services offers reliable, scalable, and  inexpensive cloud computing services. Free to join, pay only for what you use.",https://aws.amazon.com,my_library,"aws, cloud",2021-12-11T01:29:11.000Z,https://a0.awsstatic.com/libra-css/images/logos/aws_logo_smile_1200x630.png,,False
876770834,https://www.datasciencecentral.com/m/blogpost?id=6448529:BlogPost:694035,,,https://www.datasciencecentral.com/m/blogpost?id=6448529:BlogPost:694035,my_library,"aws, cloud",2019-03-10T17:56:05.000Z,,,False
