id,title,note,excerpt,url,folder,tags,created,cover,highlights,favorite
876788828,A Complete Taxonomy of Internet Chum - The Awl,,"by John MahoneyThis is a bucket of chum. Chum is decomposing fish matter that elicits a purely neurological brain stem response in its target consumer: larger fish, like sharks. It signals that they should let go, deploy their nictitating  ...",https://www.theawl.com/2015/06/a-complete-taxonomy-of-internet-chum,my_library,"adtech-adwords, advertising-commercials, behaviors, ecommerce, prodmgmt",2022-10-29T13:49:33.000Z,,,False
876784910,How to Market Taboo Products,,Tips from successful campaigns promoting everything from shapewear to prostate health.,https://www.entrepreneur.com/article/344940,my_library,"advertising-commercials, behaviors, marketing, prodmgmt",2022-06-23T20:32:31.000Z,https://assets.entrepreneur.com/content/3x2/2000/20200113211633-thinx-sundayad-crop.jpeg?format=pjeg&auto=webp,,False
876779171,How Political Parties Can Win Converts,,Political parties rarely run ads to try to win over long-term loyalists. New research suggests it’s actually possible—and worthwhile.,https://www.politico.com/news/magazine/2021/06/04/political-science-campaign-advertising-party-persuasion-491804,my_library,"advertising-commercials, behaviors",2021-06-07T21:41:58.000Z,https://static.politico.com/ea/1c/5f9fbebe4922ae2a52e6ed043ea7/mag-ap21113577114917.jpg,,False
876779062,The Secret Psychology of Sneaker Colors,,"You think they randomly choose those glaring shades of Nike, Adidas and New Balance? Think again.",https://www.nytimes.com/2021/05/24/style/sneaker-color-psychology.html,my_library,"advertising-commercials, behaviors, color, fashion",2021-05-24T12:17:58.000Z,https://static01.nyt.com/images/2021/05/27/fashion/24SNEAKERCOLORS-sacai-SUB/24SNEAKERCOLORS-sacai-SUB-largeHorizontalJumbo.jpg?year=2021&h=683&w=1024&s=472ace93a889d0f03e27a2adba89e700b2e30c403cc45594670024520db881dd&k=ZQJBKqZ0VN,,False
876778091,The Decoy Effect: How You Are Influenced to Choose Without Really Knowing I,,Think you got a good deal? Look again.,https://getpocket.com/explore/item/the-decoy-effect-how-you-are-influenced-to-choose-without-really-knowing-it,my_library,"advertising-commercials, behaviors, prodmgmt",2021-02-21T23:49:18.000Z,https://pocket-image-cache.com/1200x/filters:format(jpg):extract_focal()/https%3A%2F%2Fimages.theconversation.com%2Ffiles%2F257627%2Foriginal%2Ffile-20190207-174890-1btlu70.jpg%3Fixlib%3Drb-1.1.0%26q%3D45%26auto%3Dformat%26w%3D496%26fit%3Dclip,,False
876777492,"To Counteract Propaganda, We Should Look to Lessons from Advertising",,The goal should not be conversion but doubt.,https://getpocket.com/explore/item/to-counteract-propaganda-we-should-look-to-lessons-from-advertising,my_library,"advertising-commercials, behaviors, bias, conspiracies, influence-persuasion",2021-01-31T17:56:17.000Z,https://pocket-image-cache.com/1200x/filters:format(jpg):extract_focal()/https%3A%2F%2Fpocket-syndicated-images.s3.amazonaws.com%2Farticles%2F5980%2F1611345286_GettyImages-672713099.jpg,,False
876777221,Ads Don’t Work That Way | Melting Asphalt,,,https://meltingasphalt.com/ads-dont-work-that-way,my_library,"advertising-commercials, behaviors, emotions, goodreads, marketing",2020-12-26T12:27:19.000Z,,,False
