id,title,note,excerpt,url,folder,tags,created,cover,highlights,favorite
876789799,How to Build Your Own Rails Generator,,"Generators are a powerful feature you can use to automate routine tasks in Rails—but do you know how to make your own? This article explores Rails generators in depth, including how to build a generator from scratch.",https://rubyweekly.com/link/133410/ad5e785e3b,my_library,rubyonrails,2022-12-22T16:06:51.000Z,https://ondemand.bannerbear.com/signedurl/nZ52rq9EkQ6V3bp1Lj/image.jpg?modifications=W3sibmFtZSI6InRpdGxlIiwidGV4dCI6IkhvdyB0byBCdWlsZCBZb3VyIE93biBSYWlscyBHZW5lcmF0b3IiLCJjb2xvciI6bnVsbCwiYmFja2dyb3VuZCI6bnVsbH0seyJuYW1lIjoiaGVhZHNob3QiLCJpbWFnZV91cmwiOiJodHRwczovL3d3dy1maWxlcy5ob25leWJhZGdlci5pby9hdXRob3JzL3dpbGxpYW1rZW5uZWR5LnBuZyJ9LHsibmFtZSI6InN1bW1hcnkiLCJ0ZXh0IjoiR2VuZXJhdG9ycyBhcmUgYSBwb3dlcmZ1bCBmZWF0dXJlIHlvdSBjYW4gdXNlIHRvIGF1dG9tYXRlIHJvdXRpbmUgdGFza3MgaW4gUmFpbHPigJRidXQgZG8geW91IGtub3cgaG93IHRvIG1ha2UgeW91ciBvd24_IFRoaXMgYXJ0aWNsZSBleHBsb3JlcyBSYWlscyBnZW5lcmF0b3JzIGluIGRlcHRoLCBpbmNsdWRpbmcgaG93IHRvIGJ1aWxkIGEgZ2VuZXJhdG9yIGZyb20gc2NyYXRjaC4iLCJjb2xvciI6bnVsbCwiYmFja2dyb3VuZCI6bnVsbH0seyJuYW1lIjoiYXV0aG9yIiwidGV4dCI6IkJ5ICpXaWxsaWFtIEtlbm5lZHkqIiwiY29sb3IiOm51bGwsImJhY2tncm91bmQiOm51bGx9LHsibmFtZSI6InRhZ3MiLCJ0ZXh0IjoiI3J1YnkgI3JhaWxzIiwiY29sb3IiOm51bGwsImJhY2tncm91bmQiOm51bGx9XQ&s=db1fb4a9a7fea68abc922223e543e6cfee39a29eaef242792ae9c42d5450d777,,False
876789791,How to validate the presence of a boolean field in a Rails model,,A subtle bug happens when validating the presence of boolean fields in Rails. Here’s how to find it before it hits production.,https://thoughtbot.com/blog/how-to-validate-the-presence-of-a-boolean-field-in-a-rails-model,my_library,rubyonrails,2022-12-21T18:54:31.000Z,https://images.prismic.io/thoughtbot-website/Zn0Q2JbWFbowe7qY_default-article-background.png?auto=format%2Ccompress&mark-x=356&mark-y=100&mark64=aHR0cHM6Ly9hc3NldHMuaW1naXgubmV0L350ZXh0Lz90eHQtbGVhZD0wJnR4dC10cmFjaz0wJnR4dDY0PVNHOTNJSFJ2SUhaaGJHbGtZWFJsSUhSb1pTQndjbVZ6Wlc1alpTQnZaaUJoSUdKdmIyeGxZVzRnWm1sbGJHUWdhVzRnWVNCU1lXbHNjeUJ0YjJSbGJBJTNEJTNEJnR4dGNscj1mNWY1ZjUmdHh0Zm9udD1JQk1QbGV4U2Fuc0pQLVNlbWlCb2xkJnR4dHBhZD0wJnR4dHNpemU9NjQmdz04MDA%3D&txt-align=center%2Cmiddle&txt-color=f5f5f5&txt-fit=max&txt-font=IBMPlexSansJP-SemiBold&txt-size=24&txt-x=391&txt-y=526&txt=Stefanni+Brasil,,False
876789606,Rails 7.1 features,,There are many new features and improvements in Rails 7.1 that can be useful for developers. Here are...,https://dev.to/daviducolo/rails-71-features-p1c,my_library,rubyonrails,2022-12-02T22:43:01.000Z,"https://media.dev.to/dynamic/image/width=1000,height=500,fit=cover,gravity=auto,format=auto/https%3A%2F%2Fdev-to-uploads.s3.amazonaws.com%2Fuploads%2Farticles%2Fch3uv1ndgy9guex1y2t4.png",,False
876789580,Sign Up | LinkedIn,,"500 million+ members | Manage your professional identity. Build and engage with your professional network. Access knowledge, insights and opportunities.",https://www.linkedin.com/feed/update/urn:li:activity:7001178652008697856,my_library,"rspec, rubyonrails",2022-11-25T17:54:23.000Z,https://static.licdn.com/scds/common/u/images/logos/favicons/v1/favicon.ico,,False
876789579,"A Brief Introduction to Rails Initializers: Why, What, and How",,"You can use Rails initializers to configure your application or external gems. In this post, we'll learn how they work.",https://www.akshaykhot.com/introduction-to-rails-initializers,my_library,rubyonrails,2022-11-25T17:40:52.000Z,https://www.writesoftwarewell.com/content/images/2023/07/code-10.png,,False
876789547,Basics of Rails Password Protection,,"In this blog, we will be using bcrypt for authentication in our rails backend. Password protection...",https://dev.to/emilyfernschild/basics-of-rails-password-protection-2fd1,my_library,rubyonrails,2022-11-20T21:34:53.000Z,https://dev-to-uploads.s3.amazonaws.com/uploads/articles/3otvb2z646ytpt1hl2rv.jpg,,False
876789519,How to Scale Ruby on Rails Applications,,"Check out some ways to scale your Ruby on Rails applications, including with caching and background workers.",https://blog.appsignal.com/2022/11/09/how-to-scale-ruby-on-rails-applications.html,my_library,rubyonrails,2022-11-10T22:43:01.000Z,https://ondemand.bannerbear.com/signedurl/Mn62mqoVbWvyB5wgQ1/image.jpg?modifications=W3sibmFtZSI6InRpdGxlIiwidGV4dCI6IkhvdyB0byBTY2FsZSBSdWJ5IG9uIFJhaWxzIEFwcGxpY2F0aW9ucyJ9LHsibmFtZSI6ImltYWdlIiwiaW1hZ2VfdXJsIjoiaHR0cHM6Ly9hcHBzaWduYWwtbmV4dGpzLWJsb2ctbnlxcjZxY3I4LWFwcHNpZ25hbC52ZXJjZWwuYXBwL2ltYWdlcy9ibG9nLzIwMjItMTEvc2NhbGluZy1yb3IucG5nIn0seyJuYW1lIjoiY2F0ZWdvcnlfbG9nbyIsImltYWdlX3VybCI6Imh0dHBzOi8vYXBwc2lnbmFsLW5leHRqcy1ibG9nLW55cXI2cWNyOC1hcHBzaWduYWwudmVyY2VsLmFwcC9pbWFnZXMvbG9nb3MvcnVieS1sb2dvLnBuZyJ9XQ&s=c88e972d1715085cfc34a0ea8ff8d61d3dbaceeafc164d0cd76fc93de3bea7d6,,False
876789494,How to Build Your Own Rails Generator,,"Generators are a powerful feature you can use to automate routine tasks in Rails—but do you know how to make your own? This article explores Rails generators in depth, including how to build a generator from scratch.",https://www.honeybadger.io/blog/build-a-rails-generator,my_library,rubyonrails,2022-11-05T23:30:14.000Z,https://ondemand.bannerbear.com/signedurl/nZ52rq9EkQ6V3bp1Lj/image.jpg?modifications=W3sibmFtZSI6InRpdGxlIiwidGV4dCI6IkhvdyB0byBCdWlsZCBZb3VyIE93biBSYWlscyBHZW5lcmF0b3IiLCJjb2xvciI6bnVsbCwiYmFja2dyb3VuZCI6bnVsbH0seyJuYW1lIjoiaGVhZHNob3QiLCJpbWFnZV91cmwiOiJodHRwczovL3d3dy1maWxlcy5ob25leWJhZGdlci5pby9hdXRob3JzL3dpbGxpYW1rZW5uZWR5LnBuZyJ9LHsibmFtZSI6InN1bW1hcnkiLCJ0ZXh0IjoiR2VuZXJhdG9ycyBhcmUgYSBwb3dlcmZ1bCBmZWF0dXJlIHlvdSBjYW4gdXNlIHRvIGF1dG9tYXRlIHJvdXRpbmUgdGFza3MgaW4gUmFpbHPigJRidXQgZG8geW91IGtub3cgaG93IHRvIG1ha2UgeW91ciBvd24_IFRoaXMgYXJ0aWNsZSBleHBsb3JlcyBSYWlscyBnZW5lcmF0b3JzIGluIGRlcHRoLCBpbmNsdWRpbmcgaG93IHRvIGJ1aWxkIGEgZ2VuZXJhdG9yIGZyb20gc2NyYXRjaC4iLCJjb2xvciI6bnVsbCwiYmFja2dyb3VuZCI6bnVsbH0seyJuYW1lIjoiYXV0aG9yIiwidGV4dCI6IkJ5ICpXaWxsaWFtIEtlbm5lZHkqIiwiY29sb3IiOm51bGwsImJhY2tncm91bmQiOm51bGx9LHsibmFtZSI6InRhZ3MiLCJ0ZXh0IjoiI3J1YnkgI3JhaWxzIiwiY29sb3IiOm51bGwsImJhY2tncm91bmQiOm51bGx9XQ&s=db1fb4a9a7fea68abc922223e543e6cfee39a29eaef242792ae9c42d5450d777,,False
876788847,Lesson 8 - Devise Gem with Rails 7 & Hotwire,,"In this video I will show you how to create a simple authentication system using Rails 7 and Devise Gem. Learn how to create a global navbar that has conditional logic for user authentication.

Reference the code here !

https://github.com/swiftruby/devisefromscratch",https://m.youtube.com/watch?t=490s&v=k9g2sPXarwg,my_library,"authentication, rubyonrails",2022-10-30T19:42:10.000Z,https://i.ytimg.com/vi/k9g2sPXarwg/maxresdefault.jpg,,False
876788795,Heroku alternatives for Rails projects: Deploying my shit to fly.io,,"I like to develop production projects and side projects as deployment-driven as possible. Over the years I had tons of projects on Heroku and I'm grateful for the experience 🙏 But if tons of projects are to come again, I don't see a point in paying 7$ bucks per side-project.  Luckily",https://richstone.io/heroku-alternatives-for-rails-projects-deploying-my-shit-on-fly-io,my_library,"heroku, rubyonrails",2022-10-23T18:45:00.000Z,https://digitalpress.fra1.cdn.digitaloceanspaces.com/xhtzjbw/2022/10/goo-code-makes-its-way-to-the-Cloud.PNG,,False
876788764,Many-to-Many Associations in Active Record Example,,"Background   Using Ruby, Active Record, Sinatra, and a React frontend, I created a traveler...",https://dev.to/williamluck/many-to-many-associations-in-active-record-example-285h,my_library,rubyonrails,2022-10-19T14:07:18.000Z,https://dev-to-uploads.s3.amazonaws.com/uploads/articles/3otvb2z646ytpt1hl2rv.jpg,,False
876788714,GitHub - davidteren/simple_tails: Sensible semantic HTML styling out the bo,,Sensible semantic HTML styling out the box for Ruby on Rails applications - davidteren/simple_tails,https://github.com/davidteren/simple_tails,my_library,"css, rubyonrails",2022-10-09T23:00:26.000Z,https://opengraph.githubassets.com/0ad3d383a9a60644fc9bbb3f6a8357d878200c2739e9e983bc090bcf82550e8b/davidteren/simple_tails,,False
876788695,Security Best Practices for Your Rails Application,,Ensure your Rails application stays secure by following some best practices and habits.,https://blog.appsignal.com/2022/10/05/security-best-practices-for-your-rails-application.html,my_library,"rubyonrails, security, webdev",2022-10-05T12:01:06.000Z,https://ondemand.bannerbear.com/signedurl/Mn62mqoVbWvyB5wgQ1/image.jpg?modifications=W3sibmFtZSI6InRpdGxlIiwidGV4dCI6IlNlY3VyaXR5IEJlc3QgUHJhY3RpY2VzIGZvciBZb3VyIFJhaWxzIEFwcGxpY2F0aW9uIn0seyJuYW1lIjoiaW1hZ2UiLCJpbWFnZV91cmwiOiJodHRwczovL2FwcHNpZ25hbC1uZXh0anMtYmxvZy1ueXFyNnFjcjgtYXBwc2lnbmFsLnZlcmNlbC5hcHAvaW1hZ2VzL2Jsb2cvMjAyMi0xMC9zZWN1cml0eS1yYWlscy5qcGcifSx7Im5hbWUiOiJjYXRlZ29yeV9sb2dvIiwiaW1hZ2VfdXJsIjoiaHR0cHM6Ly9hcHBzaWduYWwtbmV4dGpzLWJsb2ctbnlxcjZxY3I4LWFwcHNpZ25hbC52ZXJjZWwuYXBwL2ltYWdlcy9sb2dvcy9ydWJ5LWxvZ28ucG5nIn1d&s=6ffceaf6b165054b61f9a7868de01c5263ed928258189528d3cfc43f402c39d2,,False
876788484,JIT Compilers for Ruby and Rails: An Overview,,"Find out about the different JIT compilers for Ruby — YJIT, MJIT, and TenderJIT — and their benefits.",https://blog.appsignal.com/2022/09/07/jit-compilers-for-ruby-and-rails-an-overview.html,my_library,"compilers, ruby, rubyonrails",2022-09-08T01:14:20.000Z,https://ondemand.bannerbear.com/signedurl/Mn62mqoVbWvyB5wgQ1/image.jpg?modifications=W3sibmFtZSI6InRpdGxlIiwidGV4dCI6IkpJVCBDb21waWxlcnMgZm9yIFJ1YnkgYW5kIFJhaWxzOiBBbiBPdmVydmlldyJ9LHsibmFtZSI6ImltYWdlIiwiaW1hZ2VfdXJsIjoiaHR0cHM6Ly9hcHBzaWduYWwtbmV4dGpzLWJsb2ctbnlxcjZxY3I4LWFwcHNpZ25hbC52ZXJjZWwuYXBwL2ltYWdlcy9ibG9nLzIwMjItMDkvaml0LXJ1YnkuanBnIn0seyJuYW1lIjoiY2F0ZWdvcnlfbG9nbyIsImltYWdlX3VybCI6Imh0dHBzOi8vYXBwc2lnbmFsLW5leHRqcy1ibG9nLW55cXI2cWNyOC1hcHBzaWduYWwudmVyY2VsLmFwcC9pbWFnZXMvbG9nb3MvcnVieS1sb2dvLnBuZyJ9XQ&s=e70b756b3e8b38ef79990b8853b376dd5b620ea9ffcbd3296dc9bcea50ffe516,,False
876788475,Introducing Trilogy: a new database adapter for Ruby on Rails,,"We've open sourced Trilogy, the database adapter we use to connect Ruby on Rails to MySQL-compatible database servers.",https://github.blog/2022-08-25-introducing-trilogy-a-new-database-adapter-for-ruby-on-rails,my_library,"mysql, rubyonrails",2022-09-05T22:56:24.000Z,https://github.blog/wp-content/uploads/2022/08/Group-1.png?fit=1200%2C630,,False
876788462,Episode 365 - Automate Rake Tasks | Drifting Ruby,,"When rake tasks need to be part of a deployment, you could find yourself in a situation where the rake task was forgotten about or have to go through the process of shelling into the environment to execute the tasks. In this episode, we look at addressing these issues by creating a way to have rake tasks execute automatically.",https://www.driftingruby.com/episodes/automate-rake-tasks,my_library,"rake, rubyonrails",2022-09-05T22:15:30.000Z,https://d1rz1wpk7ms5d5.cloudfront.net/f7uhkzmvzd3pnwsvx54i7t90i0dj,,False
876787812,Advanced Database Programming with Rails and Postgres,,"Learn about Active Record and subqueries, views and materialized views, and domain types and composite types in Postgres and Ruby on Rails.",https://rubyweekly.com/link/127468/ad5e785e3b,my_library,"databases, postgres, rubyonrails",2022-08-19T18:55:01.000Z,https://pganalyze.com/og/ebook-advanced-database-programming-rails-postgres.jpg,,False
876787732,Split Your Rails Seeds File into Separate Files in Different Folders | by E,,I’m working on a Rails backend app to serve as the API for my database.,https://medium.com/@ethanryan/split-your-rails-seeds-file-into-separate-files-in-different-folders-3c57be765818,my_library,rubyonrails,2022-08-09T22:44:57.000Z,https://miro.medium.com/v2/resize:fit:560/1*Yysg706lHjuzcGECkWM0xg.png,,False
876787713,Connect a Ruby on Rails App with React in a Monolith,,"Learn about the three main types of app architecture, then connect React with your monolith Ruby on Rails app.",https://blog.appsignal.com/2022/08/03/connect-a-ruby-on-rails-app-with-react-in-a-monolith.html,my_library,"reactjs, rubyonrails",2022-08-06T14:57:57.000Z,https://ondemand.bannerbear.com/signedurl/vYR1M6Lyq22EAnXbgZ/image.jpg?modifications=W3sibmFtZSI6InRpdGxlIiwidGV4dCI6IkNvbm5lY3QgYSBSdWJ5IG9uIFJhaWxzIEFwcCB3aXRoIFJlYWN0IGluIGEgTW9ub2xpdGgifSx7Im5hbWUiOiJpbWFnZSIsImltYWdlX3VybCI6Imh0dHBzOi8vYXBwc2lnbmFsLW5leHRqcy1ibG9nLW55cXI2cWNyOC1hcHBzaWduYWwudmVyY2VsLmFwcC9pbWFnZXMvYmxvZy8yMDIyLTA4L3JhaWxzLXJlYWN0LW1vbm9saXRoLmpwZyJ9LHsibmFtZSI6ImNhdGVnb3J5X2xvZ28iLCJpbWFnZV91cmwiOiJodHRwczovL2FwcHNpZ25hbC1uZXh0anMtYmxvZy1ueXFyNnFjcjgtYXBwc2lnbmFsLnZlcmNlbC5hcHAvaW1hZ2VzL2xvZ29zL3J1YnktbG9nby5wbmcifV0&s=d3977cd2634663f9e273806f4396efed1b0c54aa226661f77f2deb9e89f9a4c6,,False
876786395,Best photos on manny.codes,,Leaked OnlyFans photos and video of manny.codes,https://manny.codes/4-books-for-intermediate-ruby-and-rails-developers,my_library,"books, ruby, rubyonrails",2022-07-07T21:56:56.000Z,,,False
876786385,Get Started with Hotwire in Your Ruby on Rails App,,Learn the basics of Hotwire and how to use it in your Rails app.,https://blog.appsignal.com/2022/07/06/get-started-with-hotwire-in-your-ruby-on-rails-app.html,my_library,"rubyonrails, websockets",2022-07-06T13:22:52.000Z,https://ondemand.bannerbear.com/signedurl/Mn62mqoVbWvyB5wgQ1/image.jpg?modifications=W3sibmFtZSI6InRpdGxlIiwidGV4dCI6IkdldCBTdGFydGVkIHdpdGggSG90d2lyZSBpbiBZb3VyIFJ1Ynkgb24gUmFpbHMgQXBwIn0seyJuYW1lIjoiaW1hZ2UiLCJpbWFnZV91cmwiOiJodHRwczovL2FwcHNpZ25hbC1uZXh0anMtYmxvZy1ueXFyNnFjcjgtYXBwc2lnbmFsLnZlcmNlbC5hcHAvaW1hZ2VzL2Jsb2cvMjAyMi0wNy9ob3R3aXJlLnBuZyJ9LHsibmFtZSI6ImNhdGVnb3J5X2xvZ28iLCJpbWFnZV91cmwiOiJodHRwczovL2FwcHNpZ25hbC1uZXh0anMtYmxvZy1ueXFyNnFjcjgtYXBwc2lnbmFsLnZlcmNlbC5hcHAvaW1hZ2VzL2xvZ29zL3J1YnktbG9nby5wbmcifV0&s=6e4896e0685a5a0c91727d341268d2b4174dfad3e5c29b11706e0d8dc1c6079e,,False
876786367,We need to talk about fixtures,,How the principle of connascence will help us to move away from fixtures.,https://thoughtbot.com/blog/we-need-to-talk-about-fixtures,my_library,"ruby, rubyonrails, testing",2022-07-05T23:58:18.000Z,https://images.prismic.io/thoughtbot-website/Zn0Q2JbWFbowe7qY_default-article-background.png?auto=format%2Ccompress&mark-x=356&mark-y=100&mark64=aHR0cHM6Ly9hc3NldHMuaW1naXgubmV0L350ZXh0Lz90eHQtbGVhZD0wJnR4dC10cmFjaz0wJnR4dDY0PVYyVWdibVZsWkNCMGJ5QjBZV3hySUdGaWIzVjBJR1pwZUhSMWNtVnomdHh0Y2xyPWY1ZjVmNSZ0eHRmb250PUlCTVBsZXhTYW5zSlAtU2VtaUJvbGQmdHh0cGFkPTAmdHh0c2l6ZT02NCZ3PTgwMA%3D%3D&txt-align=center%2Cmiddle&txt-color=f5f5f5&txt-fit=max&txt-font=IBMPlexSansJP-SemiBold&txt-size=24&txt-x=391&txt-y=526&txt=Matheus+Sales,,False
876785238,iseq.c: Use ntz_intptr for faster bitmap scan by casperisfine · Pull Request #6059 · ruby/ruby,,Ref: #6053,https://rubyweekly.com/link/125611/ad5e785e3b,my_library,"ruby, rubyonrails",2022-07-05T20:45:04.000Z,https://opengraph.githubassets.com/5b85c40f0525e625c014a1a354d27ee0caa10702607e78967c0396a224bdf3cd/ruby/ruby/pull/6059,,False
876785235,Full-text Search with Elasticsearch in Rails,,"If you're finding performance bottlenecks with full-text search in your database, it may be time to switch to Elasticsearch. In this tutorial, Ianis introduces Elasticsearch and shows us how to implement an efficient ...",https://rubyweekly.com/link/125624/ad5e785e3b,my_library,"elasticsearch, rubyonrails, search",2022-07-05T20:44:52.000Z,https://ondemand.bannerbear.com/signedurl/nZ52rq9EkQ6V3bp1Lj/image.jpg?modifications=W3sibmFtZSI6InRpdGxlIiwidGV4dCI6IkZ1bGwtdGV4dCBTZWFyY2ggd2l0aCBFbGFzdGljc2VhcmNoIGluIFJhaWxzIiwiY29sb3IiOm51bGwsImJhY2tncm91bmQiOm51bGx9LHsibmFtZSI6ImhlYWRzaG90IiwiaW1hZ2VfdXJsIjoiaHR0cHM6Ly93d3cuaG9uZXliYWRnZXIuaW8vaW1hZ2VzL2hlYWRzaG90cy9pYW5pc3RyaWFuZGFmaWxvdi5wbmcifSx7Im5hbWUiOiJzdW1tYXJ5IiwidGV4dCI6IklmIHlvdSdyZSBmaW5kaW5nIHBlcmZvcm1hbmNlIGJvdHRsZW5lY2tzIHdpdGggZnVsbC10ZXh0IHNlYXJjaCBpbiB5b3VyIGRhdGFiYXNlLCBpdCBtYXkgYmUgdGltZSB0byBzd2l0Y2ggdG8gRWxhc3RpY3NlYXJjaC4gSW4gdGhpcyB0dXRvcmlhbCwgSWFuaXMgaW50cm9kdWNlcyBFbGFzdGljc2VhcmNoIGFuZCBzaG93cyB1cyBob3cgdG8gaW1wbGVtZW50IGFuIGVmZmljaWVudCBzZWFyY2ggZmVhdHVyZSBpbiBSYWlscy4iLCJjb2xvciI6bnVsbCwiYmFja2dyb3VuZCI6bnVsbH0seyJuYW1lIjoiYXV0aG9yIiwidGV4dCI6IkJ5ICpJYW5pcyBUcmlhbmRhZmlsb3YqIiwiY29sb3IiOm51bGwsImJhY2tncm91bmQiOm51bGx9LHsibmFtZSI6InRhZ3MiLCJ0ZXh0IjoiI3J1YnkgI3JhaWxzICNlbGFzdGljc2VhcmNoIiwiY29sb3IiOm51bGwsImJhY2tncm91bmQiOm51bGx9XQ&s=60dd8a28c7bc131a51fed039e5f176120c5594517720894194e161438f58ddbc,,False
876784880,“Don’t Mock What You Don’t Own” in 5 Minutes,,"A common issue when writing tests for real-world software is how to deal with third-party dependencies. Let’s examine an old, but counter-intuitive principle.",https://hynek.me/articles/what-to-mock-in-5-mins,my_library,"best-practices, rubyonrails",2022-06-23T15:18:19.000Z,https://static.hynek.me/cards/what-to-mock-in-5-mins.png?171688d,,False
876784873,The Rails Configuration File (~/.railsrc),,"Did you know that Rails has a ~/.railsrc file?   Similar to your ~/.bashrc or ~/.zshrc file, you can...",https://dev.to/software_writer/the-rails-configuration-file-railsrc-4f4c,my_library,rubyonrails,2022-06-23T14:06:42.000Z,https://dev-to-uploads.s3.amazonaws.com/uploads/articles/3otvb2z646ytpt1hl2rv.jpg,,False
876784869,Rails Geocoder: A Guide to Managing Locations in Your Apps,,In 2019 there are a myriad of options for mapping and geolocation services. Rails geocoder gem makes it easy to find your way around those services.,https://stackify.com/rails-geocoder-a-guide-to-managing-locations-in-your-apps,my_library,"geography, rubyonrails",2022-06-23T01:45:43.000Z,https://stackify.com/wp-content/uploads/2019/06/locate-apps-rails-881x441-1.jpg,,False
876784849,Build your app 10x faster! Stop building the · Avo Admin for Rails,,Ruby on Rails Admin Panel Framework,https://avohq.io,my_library,rubyonrails,2022-06-22T14:06:54.000Z,https://avohq.io/cover-code-optim.jpeg,,False
876784158,How we improved our Rails app’s performance with Conditional Get Requests,,HTTP provides a method of client-side caching known as Conditional Get Requests. This style of caching allows a client to cache the content…,https://sourcediving.com/how-we-improved-our-rails-apps-performance-with-conditional-get-requests-35a7a472a0b9,my_library,rubyonrails,2022-06-11T21:19:25.000Z,https://miro.medium.com/v2/resize:fit:1200/1*ZqmemPKq8b1PJByRfMnaGg.jpeg,,False
876784137,Episode #352 - Roles from Scratch,,"In this episode, we look at different authorization approaches from the most simple to more complex scenarios. https://www.driftingruby.com/episodes/roles-from-scratch

This episode is sponsored by Honeybadger https://www.honeybadger.io/

► Visit the Merchandise Store - https://www.railsstore.com/
► Ruby on Rails Templates - https://www.rubidium.io
► Subscribe to Drifting Ruby at https://www.driftingruby.com/subscription/new",https://youtu.be/htoAZlv-SBM,my_library,rubyonrails,2022-06-08T22:08:56.000Z,https://i.ytimg.com/vi/htoAZlv-SBM/sddefault.jpg,,False
876784134,Add Feature Flags in Ruby on Rails with Flipper | AppSignal Blog,,Find out how feature flags function in principle and get started with feature flags using the Flipper gem.,https://blog.appsignal.com/2022/06/08/add-feature-flags-in-ruby-on-rails-with-flipper.html,my_library,"ruby, rubyonrails",2022-06-08T19:59:10.000Z,https://ondemand.bannerbear.com/signedurl/Mn62mqoVbWvyB5wgQ1/image.jpg?modifications=W3sibmFtZSI6InRpdGxlIiwidGV4dCI6IkFkZCBGZWF0dXJlIEZsYWdzIGluIFJ1Ynkgb24gUmFpbHMgd2l0aCBGbGlwcGVyIn0seyJuYW1lIjoiaW1hZ2UiLCJpbWFnZV91cmwiOiJodHRwczovL2FwcHNpZ25hbC1uZXh0anMtYmxvZy1ueXFyNnFjcjgtYXBwc2lnbmFsLnZlcmNlbC5hcHAvaW1hZ2VzL2Jsb2cvMjAyMi0wNi9mZWF0dXJlLWZsYWdzLWluLXJ1YnkucG5nIn0seyJuYW1lIjoiY2F0ZWdvcnlfbG9nbyIsImltYWdlX3VybCI6Imh0dHBzOi8vYXBwc2lnbmFsLW5leHRqcy1ibG9nLW55cXI2cWNyOC1hcHBzaWduYWwudmVyY2VsLmFwcC9pbWFnZXMvbG9nb3MvcnVieS1sb2dvLnBuZyJ9XQ&s=6a1b2b3ce8987d6fdf3dd7858640b6f6fd7f21b8dfe7732f2ddd2c0acb09a85c,,False
876784133,thoughtbot/hotwire-example-template: A collection of branches that transmit HTML over the wire.,,A collection of branches that transmit HTML over the wire. - thoughtbot/hotwire-example-template,https://github.com/thoughtbot/hotwire-example-template,my_library,rubyonrails,2022-06-08T12:02:44.000Z,https://opengraph.githubassets.com/e94432e383adcbaae92b1fb96af9d7976b7cc0fd098976fbf00d7974b412c927/thoughtbot/hotwire-example-template,,False
876784086,An Introduction to Polymorphism in Ruby on Rails | AppSignal Blog,,Learn how you can implement polymorphism in your Rails application for cleaner code.,https://blog.appsignal.com/2022/05/25/an-introduction-to-polymorphism-in-ruby-on-rails.html,my_library,"ruby, rubyonrails",2022-06-04T20:27:45.000Z,https://ondemand.bannerbear.com/signedurl/Mn62mqoVbWvyB5wgQ1/image.jpg?modifications=W3sibmFtZSI6InRpdGxlIiwidGV4dCI6IkFuIEludHJvZHVjdGlvbiB0byBQb2x5bW9ycGhpc20gaW4gUnVieSBvbiBSYWlscyJ9LHsibmFtZSI6ImltYWdlIiwiaW1hZ2VfdXJsIjoiaHR0cHM6Ly9hcHBzaWduYWwtbmV4dGpzLWJsb2ctbnlxcjZxY3I4LWFwcHNpZ25hbC52ZXJjZWwuYXBwL2ltYWdlcy9ibG9nLzIwMjItMDUvcG9seW1vcnBoaXNtLnBuZyJ9LHsibmFtZSI6ImNhdGVnb3J5X2xvZ28iLCJpbWFnZV91cmwiOiJodHRwczovL2FwcHNpZ25hbC1uZXh0anMtYmxvZy1ueXFyNnFjcjgtYXBwc2lnbmFsLnZlcmNlbC5hcHAvaW1hZ2VzL2xvZ29zL3J1YnktbG9nby5wbmcifV0&s=32610da24f05d8cc56692eadbe18ae0a4bf5d6d758f7b7743bd6f5a992352933,,False
876784085,Using Rails Action Mailer,,In this quick tutorial I will go over how I use Action Mailer in my Rails apps. A bonus if you have...,https://dev.to/tccodez/using-rails-action-mailer-j5c,my_library,"email, programming, rubygems, rubyonrails",2022-06-04T20:27:43.000Z,https://dev-to-uploads.s3.amazonaws.com/uploads/articles/3otvb2z646ytpt1hl2rv.jpg,,False
876784082,2022 Ruby on Rails Community Survey Results,,"Over 2,600 members of the Rails community from 92 countries kindly contributed their thoughts on tools, frameworks, and workflows in their day to day development lives. From these responses we hope to get an understanding of where Rails stands as a framework in 2022.",https://rails-hosting.com/2022,my_library,rubyonrails,2022-06-04T20:27:12.000Z,https://railsdeveloper.com/survey/2022/static/2022-ruby-on-rails-survey-results-b7bbb0d7c1f97f1dbd6a459aa9167def.png,,False
876784075,File: README — Puma&nbsp;master,,,https://msp-greg.github.io/puma,my_library,"rubyonrails, web-servers",2022-06-04T01:46:35.000Z,,,False
876784026,Bundler: The best way to manage a Ruby application's gems,,,https://bundler.io,my_library,"bundler, programming, rubyonrails, webdev",2022-05-30T23:22:27.000Z,,,False
876784025,Markdown Tutorial Using Rails app,,In this markdown tutorial using rails app learn a step-by-step process to add Markdown support to the Rails app using Redcarpet and Coderay gems.,https://www.bacancytechnology.com/blog/add-markdown-to-rails-app,my_library,"markdown, programming, ruby, rubyonrails, webdev",2022-05-30T23:22:13.000Z,https://i.ytimg.com/vi/h-fnfuXdBIY/hqdefault.jpg,,False
876784013,SQLite on Heroku | Heroku Dev Center,,"A guide to SQLite on Heroku - explaining why using SQLite on Heroku's ephemeral file system is a bad fit, and looking at alternatives.",https://devcenter.heroku.com/articles/sqlite3,my_library,"heroku, postgres, rubyonrails",2022-05-29T21:18:53.000Z,https://www.herokucdn.com/images/og.png,,False
876783948,How To Install Ruby on Rails with rbenv on Ubuntu 20.04 | DigitalOcean,,Ruby on Rails is one of the most popular application stacks for developers looking to create sites and web apps. Using rbenv will provide you with a solid en…,https://www.digitalocean.com/community/tutorials/how-to-install-ruby-on-rails-with-rbenv-on-ubuntu-20-04,my_library,"rbenv, ruby, rubyonrails, ubuntu",2022-05-25T19:58:15.000Z,https://community-cdn-digitalocean-com.global.ssl.fastly.net/4EXnYDCyje6NVaQ1PYDtVGJc,,False
876783904,Bootstrapping with Ruby on Rails Generators and Templates | AppSignal Blog,,"Let's explore the basics of Rails generators and templates, then examine how to customize your Rails app with templates.",https://blog.appsignal.com/2022/05/04/bootstrapping-with-ruby-on-rails-generators-and-templates.html,my_library,"ruby, rubyonrails",2022-05-13T12:57:19.000Z,https://ondemand.bannerbear.com/signedurl/Mn62mqoVbWvyB5wgQ1/image.jpg?modifications=W3sibmFtZSI6InRpdGxlIiwidGV4dCI6IkJvb3RzdHJhcHBpbmcgd2l0aCBSdWJ5IG9uIFJhaWxzIEdlbmVyYXRvcnMgYW5kIFRlbXBsYXRlcyJ9LHsibmFtZSI6ImltYWdlIiwiaW1hZ2VfdXJsIjoiaHR0cHM6Ly9hcHBzaWduYWwtbmV4dGpzLWJsb2ctbnlxcjZxY3I4LWFwcHNpZ25hbC52ZXJjZWwuYXBwL2ltYWdlcy9ibG9nLzIwMjItMDUvcmFpbHMtZ2VuZXJhdG9ycy5wbmcifSx7Im5hbWUiOiJjYXRlZ29yeV9sb2dvIiwiaW1hZ2VfdXJsIjoiaHR0cHM6Ly9hcHBzaWduYWwtbmV4dGpzLWJsb2ctbnlxcjZxY3I4LWFwcHNpZ25hbC52ZXJjZWwuYXBwL2ltYWdlcy9sb2dvcy9ydWJ5LWxvZ28ucG5nIn1d&s=e73e344d888097cb3c156d95a3ba6fff92d492c455445343cedf85fd31385056,,False
876783873,Active Record Tricks | Drifting Ruby,,"In this episode, we look at tips and tricks from read only attributes, inserting and upserting (update or insert) records, toggling booleans, and single table inheritance.",https://www.driftingruby.com/episodes/active-record-tricks,my_library,"ruby, rubyonrails",2022-05-05T23:49:42.000Z,https://d1rz1wpk7ms5d5.cloudfront.net/d0l8eisgjw4f62ag530sqnompzm0,,False
876783831,https://www.rubyjobboard.com/blog/2022/04/13/this-one-rails-validation-trick-that-makes-your-code-more-awesome,,,https://www.rubyjobboard.com/blog/2022/04/13/this-one-rails-validation-trick-that-makes-your-code-more-awesome,my_library,rubyonrails,2022-04-15T21:49:39.000Z,,,False
876783815,Different Ways to Set Attributes in ActiveRecord (Rails 7),,Comparing the different ways to set attributes in ActiveRecord (Rails 7),https://scottbartell.com/2022/04/12/set-attributes-in-active-record-rails-7,my_library,rubyonrails,2022-04-14T22:57:27.000Z,,,False
