id,title,note,excerpt,url,folder,tags,created,cover,highlights,favorite
876792792,Resetting MySQL Root Password in Ubuntu: A Step-by-Step Guide,,"Introduction: Losing or forgetting the MySQL root password can be a stressful situation, but don't...",https://dev.to/asifzcpe/resetting-mysql-root-password-in-ubuntu-a-step-by-step-guide-3gnd,my_library,"mysql, sql",2023-07-26T00:40:55.000Z,"https://media.dev.to/dynamic/image/width=1000,height=500,fit=cover,gravity=auto,format=auto/https%3A%2F%2Fdev-to-uploads.s3.amazonaws.com%2Fuploads%2Farticles%2Fkuw488jbbqdnji31pboa.png",,False
876789925,How To Install MySQL on Ubuntu 22.04 | DigitalOcean,,"MySQL is an open-source database management system, commonly installed as part of the popular LAMP (Linux, Apache, MySQL, PHP/Python/Perl) stack. It implemen…",https://www.digitalocean.com/community/tutorials/how-to-install-mysql-on-ubuntu-22-04,my_library,"linux, mysql, ubuntu",2023-01-16T21:21:41.000Z,https://community-cdn-digitalocean-com.global.ssl.fastly.net/M1bswVs7zkuTaBacgsKxDCB4,,False
876788475,Introducing Trilogy: a new database adapter for Ruby on Rails,,"We've open sourced Trilogy, the database adapter we use to connect Ruby on Rails to MySQL-compatible database servers.",https://github.blog/2022-08-25-introducing-trilogy-a-new-database-adapter-for-ruby-on-rails,my_library,"mysql, rubyonrails",2022-09-05T22:56:24.000Z,https://github.blog/wp-content/uploads/2022/08/Group-1.png?fit=1200%2C630,,False
876784859,Postgres Vs MySQL syntax comparison with cheatsheet,,When migrating from PostgreSQL to MySQL we often get stuck with syntax between databases. Here are...,https://dev.to/tipseason/postgres-vs-mysql-syntax-comparison-with-cheatsheet-41n5,my_library,"databases, mysql, postgres",2022-06-22T16:40:53.000Z,"https://media.dev.to/dynamic/image/width=1000,height=500,fit=cover,gravity=auto,format=auto/https%3A%2F%2Fdev-to-uploads.s3.amazonaws.com%2Fuploads%2Farticles%2Fl7vr3b8a0h58yza7hv7d.png",,False
876778126,Why Uber Engineering Switched from Postgres to MySQL,,,https://eng.uber.com/postgres-to-mysql-migration,my_library,"databases, mysql, postgres",2021-02-27T23:19:59.000Z,,,False
876776318,How To Install MySQL on Ubuntu 20.04 | DigitalOcean,,"MySQL is an open-source database management system, commonly installed as part of the popular LAMP (Linux, Apache, MySQL, PHP/Python/Perl) stack. It implemen…",https://www.digitalocean.com/community/tutorials/how-to-install-mysql-on-ubuntu-20-04,my_library,mysql,2020-11-20T01:23:24.000Z,https://community-cdn-digitalocean-com.global.ssl.fastly.net/M1bswVs7zkuTaBacgsKxDCB4,,False
