id,title,note,excerpt,url,folder,tags,created,cover,highlights,favorite
876795540,Essential Formulas for Data Science in Finance,,"In this article, I'll take you through a guide to some essential formulas for Data Science in finance with implementation using Python.",https://thecleverprogrammer.com/2024/04/02/essential-formulas-for-data-science-in-finance,my_library,"finance, python",2024-04-05T16:15:25.000Z,https://thecleverprogrammer.com/wp-content/uploads/2024/04/5-Essential-Formulas-for-Data-Science-in-Finance.png,,False
876781988,Blankly - Rapidly Build Quant Models Across Exchanges,,Build in minutes. Deploy in seconds. Quant workflow reimagined. Built by developers for developers 🚀,https://blankly.finance,my_library,"finance, python",2022-01-15T18:08:43.000Z,https://blankly.finance/platform.png,,False
876781987,Trading Algos - 5 Key Metrics and How to Implement Them in Python,,"Metrics surround us. Whether you're building the next big thing and need to measure customer churn,...",https://dev.to/blankly/trading-algos-5-key-metrics-and-how-to-implement-them-in-python-5gb8,my_library,"finance, python, risk",2022-01-15T18:08:31.000Z,"https://media.dev.to/dynamic/image/width=1000,height=500,fit=cover,gravity=auto,format=auto/https%3A%2F%2Fdev-to-uploads.s3.amazonaws.com%2Fuploads%2Farticles%2Fylgcitr50f29ud9ce3ao.png",,False
876779077,Quantra — a Python coding platform to learn quantitative finance,,"To be honest, the title of the article does quite a good job in describing what Quantra actually is. It’s a platform that helps potential students with their journey of learning about quantitative…",https://towardsdatascience.com/quantra-a-python-coding-platform-to-learn-quantitative-finance-8e5e88c89120?source=rss----7f60cf5620c9---4,my_library,"finance, python",2021-05-27T00:35:36.000Z,https://miro.medium.com/v2/resize:fit:1200/1*5gdsdRUjVNa_ToY-PF2cYQ.jpeg,,False
876769508,Python For Finance: Algorithmic Trading,,Originally published at https://www.datacamp.com/community/tutorials/finance-python-trading,https://medium.com/@kacawi/python-for-finance-algorithmic-trading-60fdfb9bb20d,my_library,"finance, python",2018-06-08T23:46:11.000Z,https://miro.medium.com/v2/resize:fit:640/0*1Tz2TStuR1fbSCS-.png,,False
