id,title,note,excerpt,url,folder,tags,created,cover,highlights,favorite
876793673,What is RGSP? Google’s Randomized Generalized Second-Price ad auctions expl,,"A deep dive into why the DOJ thinks RGSP makes ad auctions unfair, and why Google believes it creates a better user experience.",https://searchengineland.com/google-rgsp-randomized-generalized-second-price-ad-auctions-explained-433053,my_library,"adtech-adwords, advertising-commercials, auctions, ecommerce, game-theory, prodmgmt",2023-10-15T23:12:55.000Z,https://searchengineland.com/wp-content/seloads/2023/10/shutterstock_1294394836.jpg,,False
876790877,How One Guy’s Car Blog Became a $1 Billion Marketplace,,"It’s a place for obsessives to buy, sell and geek out over classic cars. The company pops open its hood after 100,000 auctions to explain why.",https://www.wsj.com/articles/bring-a-trailer-car-auctions-randy-nonnenberg-fa23e131?mod=djemalertNEWS,my_library,"auctions, platforms, pricing, prodmgmt",2023-03-12T18:50:15.000Z,https://images.wsj.net/im-738778/social,,False
876788521,Multi-Objective Ranking for Promoted Auction Items,,Determining which promoted auction items to display in a merchandising placement is a multi-sided customer challenge that presents opportunities to both surface amazing auction inventory to buyers and help sellers boost visibility on their auction listings.,https://tech.ebayinc.com/engineering/multi-objective-ranking-for-promoted-auction-items,my_library,"auctions, ecommerce, machine-learning, prodmgmt",2022-09-13T23:23:21.000Z,https://static.ebayinc.com/static/assets/Uploads/Blog/Posts/_resampled/ScaleWidthWzEwMjRd/220901-MO-Ranking-Promo-Auctions-tech-blog-v1-01-inc-16x9-hero-A.jpg?fs=f6e676ab58c64f01,,False
876781984,"The Wild, Wonderful World of Estate Sales",,The estate-sale industry is fragile and persistent in a way that doesn’t square with the story of the world as we have come to expect it.,https://www.newyorker.com/culture/on-and-off-the-avenue/the-wild-wonderful-world-of-estate-sales,my_library,"auctions, game-theory, pricing, prodmgmt",2022-01-15T16:55:18.000Z,"https://media.newyorker.com/photos/61d75b4bcd3f597e880b05c3/16:9/w_1280,c_limit/Feidelson-Estate-Sales-Lead.jpg",,False
876776170,Auction Prices That Take Your Breath Away,,"Prices for works by some relatively new artists have skyrocketed, seemingly overnight.",https://www.nytimes.com/2020/09/14/arts/auctions-high-prices.html,my_library,"auctions, pricing, prodmgmt",2020-11-03T00:43:27.000Z,https://static01.nyt.com/images/2020/09/15/multimedia/15sp-big-inyt1/15sp-big-inyt1-largeHorizontalJumbo.jpg?year=2020&h=683&w=1024&s=8f5a2d8d9c930ac3868d76562a3e40f536c52fb4b7b5353a0e9f0240276edc6d&k=ZQJBKqZ0VN,,False
876775530,How Auction Houses Orchestrate Sales for Maximum Drama,,"Insiders may already know who’s going to buy what for how much, and lots are presented in a certain order just to build excitement.",https://www.nytimes.com/2015/11/01/arts/design/how-auction-houses-orchestrate-sales-for-maximum-drama.html,my_library,"auctions, prodmgmt",2020-06-03T11:03:58.000Z,https://static01.nyt.com/images/2015/11/01/arts/design/01AUCTIONCOVER/01AUCTIONCOVER-mediumThreeByTwo440.jpg?year=2015&h=293&w=440&s=b71e17df74e3f4c83bf582e5202f123e8a71437852bceb9095629d0f3a039c13&k=ZQJBKqZ0VN,,False
