id,title,note,excerpt,url,folder,tags,created,cover,highlights,favorite
876786506,Starting a Physical Product Company? You’re Gonna Need a Lawyer.,,"My name is Molson Hart. I’m the CEO of a consumer products company I founded 10 years ago, called Viahart. We design and distribute toys…",https://medium.com/swlh/starting-a-physical-product-company-youre-gonna-need-a-lawyer-13b2eecebc9f,my_library,"intellectual-property, patents, physical-products, prodmgmt",2022-07-18T14:56:26.000Z,https://miro.medium.com/v2/resize:fit:1200/0*Cx5IvgrNPzWbnxhY.jpg,,False
876782660,The 4 Main Types of Intellectual Property and Related Costs,,"There are four primary ways that businesses can protect their intellectual property (IP) assets: patents, trademarks, copyrights, and trade secrets.",https://www.innovation-asset.com/blog/the-4-main-types-of-intellectual-property-and-related-costs,my_library,"intellectual-property, legal, prodmgmt",2022-02-10T01:32:12.000Z,https://www.innovation-asset.com/hubfs/blog_images/intellectual-property-protection-methods%20Cropped.jpg,,False
876778386,"Why I wouldn't invest in open-source companies, even though I ran one.",,"After more than 12.000 Github stars, two successful open-source projects, a failed open-core company, and a successful prop-tech one*, I feel more than ever that giving your product away for free is just as bad a business strategy as it sounds.",https://www.linkedin.com/pulse/why-i-wouldnt-invest-open-source-companies-even-though-wolfram-hempel,my_library,"intellectual-property, open-source, platforms, prodmgmt",2021-04-04T16:58:13.000Z,https://media.licdn.com/dms/image/v2/C5612AQGml2--C9hB9w/article-cover_image-shrink_720_1280/article-cover_image-shrink_720_1280/0/1609590515701?e=2147483647&v=beta&t=AOCUNVWIkkhOYD9-4T6D1ED1WT13TNd-vDE392-SnZU,,False
876775920,Starting a Physical Product Company? You’re Gonna Need a Lawyer.,,"My name is Molson Hart. I’m the CEO of a consumer products company I founded 10 years ago, called Viahart. We design and distribute toys…",https://medium.com/@molson_hart/starting-a-physical-product-company-youre-gonna-need-a-lawyer-13b2eecebc9f,my_library,"intellectual-property, prodmgmt",2020-10-20T00:55:13.000Z,https://miro.medium.com/v2/resize:fit:1200/0*Cx5IvgrNPzWbnxhY.jpg,,False
876775705,Did you know you can patent the shape of a food?,,"Yes, you can patent a shape.",https://thehustle.co/07242020-patents,my_library,"intellectual-property, prodmgmt",2020-07-24T12:16:52.000Z,https://20627419.fs1.hubspotusercontent-na1.net/hubfs/20627419/The%20Hustle/Assets/Images/491145868-News-Brief_2020-07-24T004612.495Z.webp,,False
876774825,"Names, Legal Names, and Fractally Deferred Responsibility",,"Don't store legal names, at least not as the default. Here's why, and why it matters.",https://nora.codes/post/names-legal-names-and-fractally-deferred-responsibility,my_library,"intellectual-property, prodmgmt",2020-05-12T18:00:09.000Z,,,False
876773644,Trademarking color is absurd. But not for the reasons you think,,Trying to crush other companies' use of color is not only petty; it completely misses the point of branding.,https://www.fastcompany.com/90465310/trademarking-a-color-is-absurd-but-not-for-the-reasons-you-think?partner=feedburner,my_library,"color, intellectual-property, prodmgmt",2020-02-19T20:00:43.000Z,"https://images.fastcompany.com/image/upload/f_auto,q_auto,c_fit/wp-cms/uploads/2020/02/p-1-90465310-trademarking-a-color-is-dumb.jpg",,False
876771621,The economics of copying,,Art has always had a strange relationship with copying.,https://www.axios.com/the-economics-of-copying-taylor-swift-art-copyright-79e34e3a-80b8-46e3-9ad0-44e5ef46c91c.html,my_library,"intellectual-property, platforms, prodmgmt, virality",2019-07-09T18:05:59.000Z,https://images.axios.com/LuzcZKgR20UnO2JIJTnyjYrltFM=/0x0:1920x1080/1366x768/2019/07/07/1562517625967.jpg,,False
