id,title,note,excerpt,url,folder,tags,created,cover,highlights,favorite
925804841,"A Comprehensive Guide to Computer Networking in Linux: Commands, Tools, and Best Practices",,"Introduction
Linux has become a cornerstone of modern networking, powering everything from personal computers to enterprise servers, firewalls, and network-attached storage (NAS) devices. For beginners venturing into Linux networking, understan...",https://www.r-bloggers.com/2024/12/a-comprehensive-guide-to-computer-networking-in-linux-commands-tools-and-best-practices/,my_library,"linux, networking",2024-12-20T20:15:34.448Z,https://www.spsanderson.com/steveondata/posts/2024-12-20/todays_post.png,,False
876790927,Ping Sweep Using nmap on Linux,,See what devices are active on your subnetwork using peng sweep with nmap command in Linux.,https://linuxhandbook.com/ping-sweep-nmap,my_library,"linux, networking",2023-03-16T13:53:22.000Z,https://linuxhandbook.com/content/images/2023/03/nmap-sweep-in-linux.png,,False
876789725,5 commands you need know about Linux networking,,5 useful Linux network...,https://dev.to/caodawei3/5-commands-you-need-know-about-linux-networking-n3o,my_library,"linux, networking",2022-12-17T22:43:38.000Z,https://dev-to-uploads.s3.amazonaws.com/uploads/articles/3otvb2z646ytpt1hl2rv.jpg,,False
876788490,Common Networking Port Numbers in Linux,,Here are the common networking ports you'll encounter in Linux.,https://linuxhandbook.com/common-ports,my_library,"linux, networking",2022-09-08T23:18:00.000Z,https://linuxhandbook.com/content/images/2022/09/common-networking-port-number.png,,False
876769131,How SSH got port number 22,,The SSH port is 22.  This is the story of how it got that port number.  And practical configuration instructions.,https://www.ssh.com/ssh/port,my_library,"devops, linux, networking",2017-12-27T18:09:48.000Z,https://www.ssh.com/hubfs/ssh-og.png,,False
