id,title,note,excerpt,url,folder,tags,created,cover,highlights,favorite
876788794,Pollen’s enormous debt left behind: exclusive details,,"Two months after the startup went bankrupt, administrators have summarized the $80M+ debt the company has accumulated, most of which will not be paid. The highest offer to buy Pollen’s business assets - but without its liabilities - currently stands at only $250K. Details.",https://blog.pragmaticengineer.com/the-scoop-pollen,my_library,"finance, prodmgmt, startups",2022-10-22T12:49:35.000Z,https://blog.pragmaticengineer.com/content/images/2022/10/Copy-of-Copy-of-The-Scoop--1-.png,,False
876788533,A Taxonomy of Drawdowns,,Plus! Watercooler Shows; Smart Thermostats; Substitutes and Complements; Monetization; Apple Ads; Diff Jobs,https://www.thediff.co/p/a-taxonomy-of-drawdowns,my_library,"finance, prodmgmt, startups",2022-09-15T00:57:05.000Z,"https://www.thediff.co/content/images/image/fetch/w_256,c_limit,f_auto,q_auto:good,fl_progressive:steep/https-3a-2f-2fbucketeer-e05bbc84-baa3-437e-9518-adb32be77984.s3.amazonaws.com-2fpublic-2fimages-2f5b730ae4-aa35-496e-8198-965a187e2e43_600x600.jpg",,False
876788513,SaaS spend ratios on R&D/S&M/G&A,,,https://blossomstreetventures.medium.com/saas-spend-ratios-on-r-d-s-m-g-a-1a0b30931b0,my_library,"finance, prodmgmt, startups",2022-09-12T01:18:57.000Z,https://miro.medium.com/v2/resize:fit:536/1*VK_Tg-_58I8d-ABio2bVGg.png,,False
876786359,"Cash is a fact, profit is an opinion",,"Apologies in advance: If you’re fluent in the language of accounting, please skip to the bonus Verizon iPhone feature at the end. What I’m about to describe will strike you as oversimplified and…",https://mondaynote.com/cash-is-a-fact-profit-is-an-opinion-b90b8fb2d089,my_library,"finance, prodmgmt, startups",2022-07-05T21:48:52.000Z,https://miro.medium.com/v2/resize:fit:1200/0*fg99u6o8MmwWWpYQ.png,,False
876786299,All Revenue is Not Created Equal: The Keys to the 10X Revenue Club,,"[Follow Me on Twitter] “ Don't you know that you are a shooting star, And all the world will love you just as long, As long as you are.”  -- Paul Rodgers, Shooting Star With the IPO market now blown wide-open, and the media completely infatuated with frothy trades in the bubbly late stage private market, it is common to see articles that reference both “valuation” and “revenue” and suggest that there is a correlation between the two. Calculating or qualifying potential valuation using the simplistic and crude tool of a revenue multiple (also known as the price/revenue or price/sales ratio)…",http://abovethecrowd.com/2011/05/24/all-revenue-is-not-created-equal-the-keys-to-the-10x-revenue-club,my_library,"finance, prodmgmt",2022-07-05T21:42:11.000Z,https://149672686.v2.pressablecdn.com/wp-content/uploads/2011/05/seesaw-01.jpg?w=147,,False
876779867,Why payment apps that thrive in India struggle to succeed in Mexico,,One fintech veteran from India found out the hard way why “Mexicans love cash.”,https://restofworld.org/2021/mexico-payment-apps-india,my_library,"ecommerce, finance, prodmgmt",2021-08-31T14:28:36.000Z,https://149346090.v2.pressablecdn.com/wp-content/uploads/2021/08/Alejandra_Rajal_RoW_16-1600x900.jpg,,False
876771875,How to avoid losses and prune projects proactively,,It’s common for companies to hang on for too long to projects or parts of the business that are underperforming. Two effective techniques can help executives make project investment decisions on when to hold on to an asset and when to let it go.,https://www.mckinsey.com/business-functions/strategy-and-corporate-finance/our-insights/how-to-avoid-losses-and-prune-projects-proactively,my_library,"finance, prodmgmt, projmgmt, risk",2019-08-29T22:01:55.000Z,https://www.mckinsey.com/~/media/mckinsey/business%20functions/strategy%20and%20corporate%20finance/our%20insights/how%20to%20avoid%20losses%20and%20prune%20projects%20proactively/how-to-avoid-losses-and-prune-1536x1536-200.jpg,,False
876769790,Lessons from Robert Smith of Vista Equity Partners,,"Robert Smith is the Founder, Chairman, and Chief Executive Officer of Vista Equity Partners. A March 2018 Forbes profile described Vista’s performance: “Since the firm’s inception in 2000, Vi…",https://25iq.com/2018/03/23/business-lessons-from-robert-smith-of-vista-equity-partners,my_library,"finance, prodmgmt, risk",2018-10-07T16:55:32.000Z,https://25iq.com/wp-content/uploads/2018/03/misfit.png,,False
