id,title,note,excerpt,url,folder,tags,created,cover,highlights,favorite
940875922,AMD Reveals Real Reason It Won't Put 3D V-Cache On Multiple CCDs,,"After persistent rumors refused to recede, AMD steps in with a clear explanation why dual-CCD V-Cache doesn't exist.",https://hothardware.com/news/amd-no-dual-vcache-cpus,my_library,"cpus, chip-design, semiconductors",2025-01-08T18:59:07.101Z,https://images.hothardware.com/contentimages/newsitem/66468/content/small_hero-amd-ryzen-9-9950x3d-dual.jpg,"Highlight:No, the actual reason AMD won't make a dual-V-Cache chip is much simpler: it would be pointless and a waste of money.",False
932081717,Intel's $475 million error: the silicon behind the Pentium division bug,,"In 1993, Intel released the high-performance Pentium processor, the start of the long-running Pentium line. The Pentium had many improvement...",http://www.righto.com/2024/12/this-die-photo-of-pentium-shows.html?m=1,my_library,"cpus, chip-design, semiconductors",2024-12-29T01:38:57.441Z,https://static.righto.com/images/pentium-fdiv/fdiv-bug-here-w500.jpg,,False
926173071,AMD Ryzen 7 9800X3D Uses A Thick Dummy Silicon That Comprises 93% Of The CCD Stack And Has No Performance Purpose,,"The CCD stack with 3D V-Cache on the AMD Ryzen 7 9800X3D is only 40-45µm in total, but the rest of the layers add up to a whopping 750µm.",https://wccftech.com/amd-ryzen-7-9800x3d-uses-a-thick-dummy-silicon-that-comprises-93-of-the-ccd/,my_library,"semiconductors, cpus",2024-12-21T11:18:35.571Z,https://cdn.wccftech.com/wp-content/uploads/2024/10/Ryzen-7-9800X3D-1.jpg,"Highlight:stability

Highlight:9800X3D brought the 3D chiplet underneath the CC",False
907103152,Antenna diodes in the Pentium processor,,I was studying the silicon die of the Pentium processor and noticed some puzzling structures where signal lines were connected to the silico...,http://www.righto.com/2024/11/antenna-diodes-in-pentium-processor.html?m=1,my_library,"semiconductors, chip-design, cpus",2024-11-24T00:00:20.996Z,https://static.righto.com/images/pentium-antenna/diodes-w450.jpg,,False
912079437,AMD Disables Zen 4's Loop Buffer,,"A loop buffer sits at a CPU's frontend, where it holds a small number of previously fetched instructions.",https://open.substack.com/pub/chipsandcheese/p/amd-disables-zen-4s-loop-buffer?r=oc5d&utm_medium=ios,my_library,"cpus, semiconductors, chip-design",2024-12-01T02:09:23.356Z,"https://substackcdn.com/image/fetch/w_1200,h_600,c_fill,f_jpg,q_auto:good,fl_progressive:steep,g_auto/https%3A%2F%2Fsubstack-post-media.s3.amazonaws.com%2Fpublic%2Fimages%2Ffc6a6496-65ff-48b9-857c-a465f897ca92_958x716.png",,False
906680507,Why Intel Lost Its CPU Crown To AMD (And How Ryzen Changed The Game) - SlashGear,,"Intel was a dominant leader in the CPU market for the better part of a decade, but AMD has seen massive success in recent years thanks to its Ryzen chips.",https://www.slashgear.com/1703799/intel-vs-amd-ryzen-cpu-performance-history/,my_library,"cpus, semiconductors",2024-11-23T04:50:59.105Z,https://www.slashgear.com/img/gallery/why-intel-lost-its-cpu-crown-to-amd-and-how-ryzen-changed-the-game/l-intro-1730497076.jpg,,False
892648599,Amazon’s Cloud Crisis: How AWS Will Lose The Future Of Computing,,"Nitro, Graviton, EFA, Inferentia, Trainium, Nvidia Cloud, Microsoft Azure, Google Cloud, Oracle Cloud, Handicapping Infrastructure, AI As A Service, Enterprise Automation, Meta, Coreweave, TCO",https://www.semianalysis.com/p/amazons-cloud-crisis-how-aws-will?utm_campaign=post&utm_medium=web,my_library,"semiconductors, cloud, cpus",2024-11-04T13:06:40.704Z,"https://substackcdn.com/image/fetch/w_1200,h_600,c_fill,f_jpg,q_auto:good,fl_progressive:steep,g_auto/https%3A%2F%2Fsubstack-post-media.s3.amazonaws.com%2Fpublic%2Fimages%2Fc4e551c4-2704-4e1c-9c88-b6a827c22fcf_1921x1080.jpeg",,False
881001326,Intel Core Ultra 200 “Arrow Lake” Desktop CPU Specs Leak: Core Ultra 9 285K & Ultra 7 265K With 250W,,"Intel's Core Ultra 200 ""Arrow Lake"" Desktop CPU specifications have now been finalized and we are just a month away from the official launch.",https://wccftech.com/intel-core-ultra-200-arrow-lake-desktop-cpu-final-specs-leak-285k-265k-245k,my_library,"cpus, semiconductors",2013-09-24T00:00:00.000Z,https://cdn.wccftech.com/wp-content/uploads/2024/05/Intel-Arrow-Lake-S-Desktop-CPUs-Core-Ultra-9-285K-Core-Ultra-7-265K-Core-Ultra-5-245K.jpg,,False
876797980,Zen 5’s 2-Ahead Branch Predictor Unit: How a 30 Year Old Idea Allows for Ne,,"When I recently interviewed Mike Clark, he told me, “…you’ll see the actual foundational lift play out in the future on Zen 6, even though it was really Zen 5 that set the table for that.” And at that same Zen 5 architecture event, AMD’s Chief Technology Officer Mark Papermaster said, “Zen 5 is a ground-up redesign of the Zen architecture,” which has brought numerous and impactful changes to the design of the core.",https://chipsandcheese.com/2024/07/26/zen-5s-2-ahead-branch-predictor-unit-how-30-year-old-idea-allows-for-new-tricks,my_library,"chip-design, cpus, semiconductors",2024-07-27T14:37:15.000Z,"https://substackcdn.com/image/fetch/w_1200,h_600,c_fill,f_jpg,q_auto:good,fl_progressive:steep,g_auto/https%3A%2F%2Fsubstack-post-media.s3.amazonaws.com%2Fpublic%2Fimages%2F8e6e8cab-5e3a-4080-a769-16f98d65184b_787x378.jpeg",,False
876797186,Flow claims it can 100x any CPU’s power with its companion chip and some el,,"A Finnish startup called Flow Computing is making one of the wildest claims ever heard in silicon engineering: by adding its proprietary companion chip,",https://techcrunch.com/2024/06/11/flow-claims-it-can-100x-any-cpus-power-with-its-companion-chip-and-some-elbow-grease,my_library,"cpus, semiconductors",2024-06-12T04:15:54.000Z,"https://techcrunch.com/wp-content/uploads/2024/06/flow-computing-header.jpg?resize=1200,781",,False
876795484,Half of Russian-Made Chips Are Defective,,"Anton Shilov reports via Tom's Hardware:  About half of the processors packaged in Russia are defective. This has prompted Baikal Electronics, a Russian processor developer, to expand the number of packaging partners in the country, according to a report in Vedomosti, a Russian-language business dai...",https://hardware.slashdot.org/story/24/03/29/198209/half-of-russian-made-chips-are-defective,my_library,"cpus, russia, semiconductors",2024-03-31T02:10:43.000Z,https://a.fsdn.com/sd/topics/hardware_64.png,,False
876792912,"“Downfall” bug affects years of Intel CPUs, can leak encryption keys and mo",,Researchers also disclosed a separate bug called “Inception” for newer AMD CPUs.,https://arstechnica.com/information-technology/2023/08/data-leaking-downfall-bug-affects-six-generations-of-intel-pc-and-server-cpus,my_library,"cpus, security, semiconductors",2023-08-10T15:50:41.000Z,https://cdn.arstechnica.net/wp-content/uploads/2023/08/DSC09738.jpg,,False
876792909,Downfall Attacks,,Downfall attacks targets a critical weakness found in billions of modern processors used in personal and cloud computers.,https://downfall.page,my_library,"cpus, security, semiconductors",2023-08-09T22:34:37.000Z,https://downfall.page/images/share.png,,False
876792681,Gallery of Processor Cache Effects,,,http://igoro.com/archive/gallery-of-processor-cache-effects,my_library,"cpus, semiconductor-memory, semiconductors",2023-07-18T14:09:35.000Z,,,False
876792674,Kryo: Qualcomm’s Last In-House Mobile Core,,CPU design is hard.,https://chipsandcheese.com/2023/07/12/kryo-qualcomms-last-in-house-mobile-core,my_library,"cpus, semiconductors",2023-07-16T11:01:44.000Z,"https://substackcdn.com/image/fetch/w_1200,h_600,c_fill,f_jpg,q_auto:good,fl_progressive:steep,g_auto/https%3A%2F%2Fsubstack-post-media.s3.amazonaws.com%2Fpublic%2Fimages%2Fff6107e1-e212-4d6f-b7d1-ea376ee6dc8d_547x513.png",,False
876792596,AI Server Cost Analysis – Memory Is The Biggest Loser,,Micron $MU looks very weak in AI,https://www.semianalysis.com/p/ai-server-cost-analysis-memory-is,my_library,"cpus, gpus, semiconductor-memory, semiconductors",2023-06-22T21:59:39.000Z,"https://substackcdn.com/image/fetch/w_1200,h_600,c_fill,f_jpg,q_auto:good,fl_progressive:steep,g_auto/https%3A%2F%2Fsubstack-post-media.s3.amazonaws.com%2Fpublic%2Fimages%2F3f05107e-aad1-4b2d-922c-ddbcafb39085_1252x704.jpeg",,False
876792019,Intel Is All-In on Back-Side Power Delivery,,The company’s PowerVia interconnect tech demonstrated a 6 percent performance gain,https://spectrum.ieee.org/backside-power-delivery,my_library,"cpus, semiconductors",2023-06-09T21:59:59.000Z,https://spectrum.ieee.org/media-library/grey-blocks-the-sizes-of-which-decrease-toward-a-thin-horizontal-white-line-and-then-increase-again-toward-the-top-of-the-image.jpg?id=33959767&width=1200&height=600&coordinates=0%2C155%2C0%2C155,,False
876792005,The Case for Running AI on CPUs Isn’t Dead Yet,,"GPUs may dominate, but CPUs could be perfect for smaller AI models",https://spectrum.ieee.org/ai-cpu,my_library,"cpus, deep-learning, gpus, llms, semiconductors",2023-06-02T00:01:45.000Z,https://spectrum.ieee.org/media-library/an-intel-xeon-processor-on-a-black-backdrop-the-processor-is-shown-from-both-above-and-below-displaying-the-thousands-of-conta.jpg?id=33743986&width=1200&height=600&coordinates=0%2C698%2C0%2C698,,False
876791977,ARM’s Cortex A53: Tiny But Important,,Tech enthusiasts probably know ARM as a company that develops reasonably performant CPU architectures with a focus on power efficiency.,https://chipsandcheese.com/2023/05/28/arms-cortex-a53-tiny-but-important,my_library,"cpus, semiconductors",2023-05-28T16:24:20.000Z,"https://substackcdn.com/image/fetch/w_1200,h_600,c_fill,f_jpg,q_auto:good,fl_progressive:steep,g_auto/https%3A%2F%2Fsubstack-post-media.s3.amazonaws.com%2Fpublic%2Fimages%2F8839954c-4c99-4bd9-8d93-f6f84ab8dfc4_1375x1440.jpeg",,False
876791976,Intel CPU Die Topology - by Jason Rahman - Delayed Branch,,"Over the past 10-15 years, per-core throughput increases have slowed, and in response CPU designers have scaled up core counts and socket counts to continue increasing performance across generations of new CPU models.",https://jprahman.substack.com/p/intel-cpu-die-topology,my_library,"cpus, semiconductors",2023-05-28T16:24:18.000Z,"https://substackcdn.com/image/fetch/w_1200,h_600,c_fill,f_jpg,q_auto:good,fl_progressive:steep,g_auto/https%3A%2F%2Fsubstack-post-media.s3.amazonaws.com%2Fpublic%2Fimages%2F637189f3-ab80-4abf-b8b7-7251cc96a96d_677x438.jpeg",,False
876791680,Hacker News,,"While microprocessors are used in various applications, they are precluded from the use in high-energy physics applications due to the harsh radiation present. To overcome this limitation a...",https://arxiv.org/abs/2304.02410,my_library,"cpus, semiconductors",2023-04-06T23:18:26.000Z,https://arxiv.org/static/browse/0.3.4/images/arxiv-logo-fb.png,,False
876791678,Interconnect Under the Spotlight as Core Counts Accelerate - SemiWiki,,"In the march to more capable, faster, smaller, and lower…",https://semiwiki.com/artificial-intelligence/326727-interconnect-under-the-spotlight-as-core-counts-accelerate,my_library,"cpus, interconnects, semiconductors",2023-04-06T19:41:08.000Z,https://semiwiki.com/wp-content/uploads/2023/03/Core-counts-min.png,,False
876791661,RISC-V In The Datacenter Is No Risky Proposition,,"It was only a matter of time, perhaps, but the skyrocketing costs of designing chips is colliding with the ever-increasing need for performance,",https://www.nextplatform.com/2023/04/04/risc-v-in-the-datacenter-is-no-risky-proposition,my_library,"cpus, datacenters, riscv, semiconductors",2023-04-05T16:40:17.000Z,https://www.nextplatform.com/wp-content/uploads/2023/02/ventana-square_chip_1-logo-1024x1024.png,,False
876790963,China’s flagship CPU designer puts on a brave face amid US sanctions,,"Chinese chip designer Loongson, which has tried to reduce the country’s reliance on Intel and AMD, is developing its own general-purpose GPU despite being added to a US trade blacklist.",https://www.scmp.com/tech/tech-war/article/3213889/tech-war-chinas-flagship-cpu-designer-loongson-puts-brave-face-amid-us-sanctions,my_library,"china, cpus, moats, semiconductors",2023-03-19T11:49:46.000Z,https://cdn.i-scmp.com/sites/default/files/styles/og_image_scmp_generic/public/d8/images/canvas/2023/03/17/3e4c349f-6c36-4dc1-a3de-16cf9a8e577a_e8716a81.jpg?itok=PLISNiPp&v=1679040321,,False
876790869,The basics of Arm64 Assembly - by Diego Crespo,,Just one instruction at a time!,https://www.deusinmachina.net/p/the-basics-of-arm64-assembly,my_library,"cpus, semiconductors",2023-03-12T01:21:03.000Z,"https://substackcdn.com/image/fetch/w_1200,h_600,c_fill,f_jpg,q_auto:good,fl_progressive:steep,g_auto/https%3A%2F%2Fsubstack-post-media.s3.amazonaws.com%2Fpublic%2Fimages%2F86a962e7-d536-4195-873f-2da23bf5a682_1280x720.jpeg",,False
876789949,"More CPU Cores Isn’t Always Better, Especially In HPC",,"If a few cores are good, then a lot of cores ought to be better. But when it comes to HPC this isn’t always the case, despite what the Top500 ranking –",https://www.nextplatform.com/2023/01/19/more-cpu-cores-isnt-always-better-especially-in-hpc,my_library,"cpus, hpc, interconnects, semiconductors",2023-01-20T01:52:23.000Z,https://www.nextplatform.com/wp-content/uploads/2023/01/sea-of-cores-logo-1024x1024.jpg,,False
876788762,Four Cornerstones of CPU Performance.,,,https://easyperf.net/blog/2022/10/17/Four-Cornerstones-of-CPU-Performance,my_library,"cpus, semiconductors",2022-10-19T12:03:41.000Z,,,False
876788645,Monolithic Sapphire Rapids,,Absolute Reticle Limit,https://www.angstronomics.com/p/monolithic-sapphire-rapids?action=share&isFreemail=true&publication_id=897746,my_library,"cpus, semiconductors",2022-09-29T00:43:12.000Z,"https://substackcdn.com/image/fetch/w_1200,h_600,c_fill,f_jpg,q_auto:good,fl_progressive:steep,g_auto/https%3A%2F%2Fbucketeer-e05bbc84-baa3-437e-9518-adb32be77984.s3.amazonaws.com%2Fpublic%2Fimages%2F6c507d69-90d5-4c8a-ab7d-a54e2431c9cb_1920x1440.jpeg",,False
876788446,Performance Benefits of Using Huge Pages for Code. | Easyperf,,,https://easyperf.net/blog/2022/09/01/Utilizing-Huge-Pages-For-Code,my_library,"chip-design, cpus, semiconductor-memory, semiconductors",2022-09-05T01:16:42.000Z,,,False
876786437,New working speculative execution attack sends Intel and AMD scrambling,,"Both companies are rolling out mitigations, but they add overhead of 12 to 28 percent.",https://arstechnica.com/information-technology/2022/07/intel-and-amd-cpus-vulnerable-to-a-new-speculative-execution-attack,my_library,"cpus, malware, semiconductors",2022-07-12T16:23:03.000Z,https://cdn.arstechnica.net/wp-content/uploads/2022/06/cpu.jpeg,,False
876784894,A new vulnerability in Intel and AMD CPUs lets hackers steal encryption keys,,Hertzbleed attack targets power-conservation feature found on virtually all modern CPUs.,https://arstechnica.com/information-technology/2022/06/researchers-exploit-new-intel-and-amd-cpu-flaw-to-steal-encryption-keys,my_library,"cpus, semiconductors",2022-06-23T20:29:55.000Z,https://cdn.arstechnica.net/wp-content/uploads/2022/06/cpu.jpeg,,False
876781976,5.5 mm in 1.25 nanoseconds | Random ASCII – tech blog of Bruce Dawson,,"In 2004 I was working for Microsoft in the Xbox group, and a new console was being created. I got a copy of the detailed descriptions of the Xbox 360 CPU and I read it through multiple times and su…",https://randomascii.wordpress.com/2022/01/12/5-5-mm-in-1-25-nanoseconds,my_library,"cpus, semiconductors",2022-01-13T17:40:44.000Z,https://randomascii.wordpress.com/wp-content/uploads/2022/01/pxl_20220111_000923865-copy_thumb.jpg,,False
876780690,Asplos 17 cam,,,http://rakeshk.crhc.illinois.edu/asplos_17_cam.pdf,my_library,"chip-design, cpus, semiconductors",2021-12-07T01:00:15.000Z,,,False
876780660,Domain-Specific Hardware Accelerators – Communications of the ACM,,,https://cacm.acm.org/magazines/2020/7/245701-domain-specific-hardware-accelerators/fulltext#R24,my_library,"cpus, semiconductors",2021-12-04T20:45:53.000Z,,,False
876780247,Precise timing of machine code with Linux perf. | Easyperf,,,https://easyperf.net/blog/2019/04/03/Precise-timing-of-machine-code-with-Linux-perf,my_library,"cpus, semiconductors",2021-12-03T14:42:48.000Z,,,False
876780198,Microarchitecture,,,https://www.agner.org/optimize/microarchitecture.pdf,my_library,"cpus, semiconductors",2021-12-02T01:43:09.000Z,,,False
876780188,To reinvent the processor,,"A detailed, critical, technical essay on upcoming CPU architectures.",https://medium.com/@veedrac/to-reinvent-the-processor-671139a4a034,my_library,"cpus, semiconductors",2021-12-02T01:42:08.000Z,https://miro.medium.com/v2/resize:fit:1000/1*GfQGVmWUWuOerJ2dQAkQsg.png,,False
876780166,"Software optimization resources. C++ and assembly. Windows, Linux, BSD, Mac OS X",,"Software optimization manuals for C++ and assembly code. Intel and AMD x86 microprocessors. Windows, Linux, BSD, Mac OS X. 16, 32 and 64 bit systems. Detailed descriptions of microarchitectures.",https://www.agner.org/optimize,my_library,"cpus, semiconductors",2021-12-01T14:52:49.000Z,,,False
876779891,Does an AMD Chiplet Have a Core Count Limit?,,,https://www.anandtech.com/show/16930/does-an-amd-chiplet-have-a-core-count-limit,my_library,"cpus, interconnects, semiconductors",2021-09-07T17:58:14.000Z,https://images.anandtech.com/doci/16930/1068852593%20-%20WM_678x452.jpg,,False
876779882,Did IBM Just Preview The Future of Caches?,,,https://www.anandtech.com/show/16924/did-ibm-just-preview-the-future-of-caches,my_library,"cpus, semiconductor-memory, semiconductors",2021-09-04T22:34:47.000Z,https://images.anandtech.com/doci/16924/IBM%20Telum%2021x9_678x452.jpg,,False
876779363,Gutting Decades Of Architecture To Build A New Kind Of Processor,,"There are some features in any architecture that are essential, foundational, and non-negotiable. Right up to the moment that some clever architect shows",https://www.nextplatform.com/2021/07/12/gutting-decades-of-architecture-to-build-a-new-kind-of-processor,my_library,"cpus, semiconductors, startups",2021-07-13T01:32:02.000Z,https://www.nextplatform.com/wp-content/uploads/2021/02/semiconductor_chip_djfks9.jpg,,False
876779191,AMD 3D Stacks SRAM Bumplessly,,"AMD recently unveiled 3D V-Cache, their first 3D-stacked technology-based product.  Leapfrogging contemporary 3D bonding technologies, AMD jumped directly into advanced packaging with direct bonding and an order of magnitude higher wire density.",https://fuse.wikichip.org/news/5531/amd-3d-stacks-sram-bumplessly,my_library,"amd, cpus, semiconductors",2021-06-12T02:10:17.000Z,https://fuse.wikichip.org/wp-content/uploads/2021/06/v-cache-header.png,,False
876779177,Intel: AMD Threat Is Finished (NASDAQ:INTC),,"Although competition from Arm is increasing, AMD remains Intel’s biggest competitor, as concerns of losing market share weigh on Intel’s valuation.",https://seekingalpha.com/article/4433617-intel-amd-threat-is-finished,my_library,"cpus, semiconductors",2021-06-08T20:55:11.000Z,https://static.seekingalpha.com/cdn/s3/uploads/getty_images/1002010996/image_1002010996.jpg?io=getty-c-w1536,,False
876779069,New 'Morpheus' CPU Design Defeats Hundreds of Hackers in DARPA Tests - Extr,,A new CPU design has won accolades for defeating the hacking efforts of nearly 600 experts during a DARPA challenge. Its approach could help us close side-channel vulnerabilities in the future.,https://www.extremetech.com/computing/323107-new-morpheus-cpu-design-defeats-hundreds-of-hackers-in-darpa-tests,my_library,"cpus, semiconductors",2021-05-25T15:13:41.000Z,https://i.extremetech.com/imagery/content-types/06yJ6MX4ZSvTlsS6Zxn7ebh/hero-image.fill.size_1200x675.jpg,,False
876778480,Apple's M1 Positioning Mocks the Entire x86 Business Model,,Apple is positioning its M1 quite differently from any CPU Intel or AMD has released. The long-term impact on the PC market could be significant.,https://www.extremetech.com/computing/322120-apples-m1-positioning-mocks-every-x86-cpu-amd-and-intel-have-ever-launched,my_library,"cpus, semiconductors",2021-04-24T09:14:29.000Z,https://i.extremetech.com/imagery/content-types/07y8rVaCXLLmgvZrDLR8qcc/hero-image.fill.size_1200x675.jpg,,False
876778409,"Sapphire Rapids CPU Leak: Up to 56 Cores, 64GB of Onboard HBM2",,"Sapphire Rapids, Intel's next server architecture, looks like a large leap over the just-launched Ice Lake SP.",https://www.extremetech.com/computing/321658-sapphire-rapids-cpu-leak-up-to-56-cores-64gb-of-onboard-hbm2,my_library,"cpus, semiconductors",2021-04-09T01:44:43.000Z,https://i.extremetech.com/imagery/content-types/07zI5HXgv0QhKowK8q7KJaf/hero-image.fill.size_1200x675.jpg,,False
876778337,"The MIPS R4000, part 9: Stupid branch delay slot tricks",,"Technically legal, but strange.",https://devblogs.microsoft.com/oldnewthing/20180412-00?p=98495,my_library,"cpus, semiconductors",2021-03-30T11:25:13.000Z,https://devblogs.microsoft.com/oldnewthing/wp-content/uploads/sites/38/2019/02/ShowCover.jpg,,False
876778307,Deep Dive Into AMD’s “Milan” Epyc 7003 Architecture,,"The “Milan” Epyc 7003 processors, the third generation of AMD’s revitalized server CPUs, is now in the field, and we await the entry of the “Ice Lake”",https://www.nextplatform.com/2021/03/26/deep-dive-into-amds-milan-epyc-7003-architecture,my_library,"cpus, semiconductors",2021-03-26T11:17:24.000Z,https://www.nextplatform.com/wp-content/uploads/2021/03/amd-milan-epyc-logo-2.jpg,,False
876778254,"The Rise, Fall and Revival of AMD (2020)",,AMD is one of the oldest designers of large scale microprocessors and has been the subject of polarizing debate among technology enthusiasts for nearly 50 years. Its...,https://www.techspot.com/article/2043-amd-rise-fall-revival-history,my_library,"amd, cpus, gpus, semiconductors",2021-03-19T21:59:34.000Z,https://www.techspot.com/articles-info/2043/images/2020-06-29-image.jpg,,False
876778224,The Third Time Charm Of AMD’s Milan Epyc Processors,,"With every passing year, as AMD first talked about its plans to re-enter the server processor arena and give Intel some real, much needed, and very direct",http://www.nextplatform.com/2021/03/15/the-third-time-charm-of-amds-milan-epyc-processors,my_library,"cpus, semiconductors",2021-03-15T17:37:52.000Z,https://www.nextplatform.com/wp-content/uploads/2021/03/amd-milan-epyc-logo.jpg,,False
876778024,AMD's Reliance on TSMC Isn't Harming the Company's Growth Prospects - Extre,,,https://www.extremetech.com/computing/319929-amds-reliance-on-tsmc-isnt-harming-the-companys-growth-prospects,my_library,"cpus, semiconductors",2021-02-11T23:24:37.000Z,https://i.extremetech.com/imagery/content-types/04BMWECKeaN45s7opQOAGkc/hero-image.fill.size_1200x675.jpg,,False
876777530,"Intel Processor Names, Numbers and Generation List",,"Understanding Intel® processor names and numbers helps identify the best laptop, desktop, or mobile device CPU for your computing needs.",https://www.intel.com/content/www/us/en/processors/processor-numbers.html,my_library,"cpus, semiconductors",2021-02-04T11:34:43.000Z,https://www.intel.com/content/dam/www/central-libraries/us/en/images/2023-10/badges-mtl-raptor-lake-refresh.png,,False
876776193,How Debuggers Work: Getting and Setting x86 Registers,,"In this article, I would like to shortly describe the methods used to dump and restore the different kinds of registers on 32-bit and 64-bit x86 CPUs.  The first part will focus on General Purpose Registers, Debug Registers and Floating-Point Registers up to the XMM registers provided by the SSE extension.  I will explain how their values can be obtained via the ptrace(2) interface.",https://www.moritz.systems/blog/how-debuggers-work-getting-and-setting-x86-registers-part-1,my_library,"cpus, semiconductors",2020-11-03T01:37:18.000Z,,,False
876776112,Performance analysis & tuning on modern CPU - DEV Community ?‍??‍?,,"They say ""performance is king'... It was true a decade ago and it certainly is now. With more and mor...",https://dev.to/dendibakh/performance-analysis-tuning-on-modern-cpu-3057,my_library,"cpus, semiconductors",2020-11-03T00:09:59.000Z,"https://media.dev.to/dynamic/image/width=1000,height=500,fit=cover,gravity=auto,format=auto/https%3A%2F%2Fthepracticaldev.s3.amazonaws.com%2Fi%2Fxfs6ng0a2aacwizvqgq7.jpg",,False
876775952,An ex-ARM engineer critiques RISC-V,,RISC-V.md · GitHub,https://gist.github.com/erincandescent/8a10eeeea1918ee4f9d9982f7618ef68,my_library,"cpus, semiconductors",2020-11-01T16:04:16.000Z,https://github.githubassets.com/assets/gist-og-image-54fd7dc0713e.png,,False
876775771,Optimizing 128-bit Division,,"When it comes to hashing, sometimes 64 bit is not enough, for example, because of birthday paradox — the hacker can iterate through random $latex 2^{32}$ entities and it can be proven that wi…",https://danlark.org/2020/06/14/128-bit-division,my_library,"cpus, semiconductors",2020-08-10T01:32:21.000Z,https://danlark.org/wp-content/uploads/2020/06/d2elnjfdkne.png,,False
876775520,x86 instruction listings,,"The x86 instruction set refers to the set of instructions that x86-compatible microprocessors support. The instructions are usually part of an executable program, often stored as a computer file and executed on the processor.",https://en.wikipedia.org/wiki/X86_instruction_listings,my_library,"cpus, semiconductors",2020-06-02T09:22:35.000Z,,,False
