id,title,note,excerpt,url,folder,tags,created,cover,highlights,favorite
876793716,Market Basket Analysis using Python,,"In this article, I'll take you through the task of Market Basket Analysis using Python. Market Basket Analysis using Python.",https://thecleverprogrammer.com/2023/10/16/market-basket-analysis-using-python,my_library,"algorithms-math, machine-learning, market-basket, python",2023-10-30T23:53:51.000Z,https://thecleverprogrammer.com/wp-content/uploads/2023/10/Market-Basket-Analysis-using-Python.png,,False
876791666,A Guide to Association Rule Mining,,Create insights from frequent patterns using market basket analysis with Python,https://towardsdatascience.com/a-guide-to-association-rule-mining-96c42968ba6?source=rss----7f60cf5620c9---4,my_library,"association-rules, machine-learning, market-basket, python",2023-04-05T16:53:08.000Z,https://miro.medium.com/v2/da:true/resize:fit:1200/0*ap-ZMb3c6aIRhPFb,,False
876779372,Apriori Algorithm for Association Rule Learning — How To Find Clear Links B,,Explanation and examples of frequent itemset mining and association rule learning over relational databases in Python,https://towardsdatascience.com/apriori-algorithm-for-association-rule-learning-how-to-find-clear-links-between-transactions-bf7ebc22cf0a?source=rss----7f60cf5620c9---4,my_library,"algorithms-math, apriori, machine-learning, market-basket",2021-07-13T16:19:27.000Z,https://miro.medium.com/v2/resize:fill:1200:632/g:fp:0.49:0.5/1*b1X3sV7WgElbWUZCYMOMrA.png,,False
876778920,"Instacart Market Basket Analysis. Winner’s Interview: 2nd place, Kazuki… |",,"Winner’s Interview: 2nd place, Kazuki Onodera",https://medium.com/kaggle-blog/instacart-market-basket-analysis-feda2700cded,my_library,"instacart, machine-learning, market-basket",2021-05-01T00:05:56.000Z,https://miro.medium.com/v2/resize:fit:1160/1*yf7Bk7LpZCH5wcIGSxBqjA.png,,False
876778089,Affinity Analysis (Market Basket Analysis),,Have you ever wondered how often do you buy certain items together? Why do you buy some items together? How likely do you purchase an item…,https://towardsdatascience.com/affinity-analysis-market-basket-analysis-c8e7fcc61a21?source=rss----7f60cf5620c9---4,my_library,"affinity, machine-learning, market-basket",2021-02-20T18:18:15.000Z,https://miro.medium.com/v2/resize:fit:1200/1*7Vpxt8oX6hTMPOEcMkGIzw.jpeg,,False
