id,title,note,excerpt,url,folder,tags,created,cover,highlights,favorite
876792923,11 free tools for PPC campaign management,,"These tools can help you analyze PPC competitors, track search trends or design ad creative – all without spending a dime.",https://searchengineland.com/free-tools-ppc-campaign-management-430520,my_library,"analytics, ecommerce, keywords-ppc-seo, prodmgmt, programming",2023-08-14T13:06:36.000Z,https://searchengineland.com/wp-content/seloads/2023/08/Top-free-tools-for-use-in-paid-media.png,,False
876791960,7 top enterprise SEO tools compared: A comprehensive evaluation,,"An in-depth look at seven tools used by enterprises for content optimization, technical SEO, and reporting and analytics.",https://searchengineland.com/top-enterprise-seo-tools-comparison-427350,my_library,"keywords-ppc-seo, programming",2023-05-24T19:50:03.000Z,https://searchengineland.com/wp-content/seloads/2023/05/Enterprise-SEO-tools-A-comprehensive-comparison-800x450.png,,False
876790765,SEO: 3 Tools to Find Related Keywords,,Google has long relied on semantic search — producing results based on the intent of the query. Optimizing content for many intent-based keywords can improve rankings.,https://www.practicalecommerce.com/seo-3-tools-to-find-related-keywords,my_library,"keywords-ppc-seo, programming",2023-02-22T21:49:56.000Z,https://www.practicalecommerce.com/wp-content/uploads/2023/02/SEO-3-Tools-to-Find-Related-Keywords.jpg,,False
876790720,"Tools to Create, Optimize Meta Descriptions",,Meta descriptions do not influence organic rankings. But the descriptions appear in search snippets more often than not and thus impact clicks on organic listings.,https://www.practicalecommerce.com/tools-to-create-optimize-meta-descriptions,my_library,"ecommerce, keywords-ppc-seo, prodmgmt, programming",2023-02-16T14:32:46.000Z,https://www.practicalecommerce.com/wp-content/uploads/2023/02/Tools-to-Create-and-Optimize-Meta-Descriptions.jpg,,False
876789803,How to Use Web Crawlers for SEO,,"Web crawler tools are essential for search engine optimization, but the info they provide can be overwhelming. Here's how to prioritize and cut through the clutter.",https://www.practicalecommerce.com/how-to-use-web-crawlers-for-seo,my_library,"keywords-ppc-seo, programming, web-crawlers",2022-12-22T16:08:06.000Z,https://www.practicalecommerce.com/wp-content/uploads/2022/12/How-to-Use-Web-Crawlers-for-SEO.jpg,,False
876788677,19 advanced Google search operators you need to know,,Gain powerful insights to inform your marketing efforts. Use the following advanced Google search operators and commands to your advantage.,https://searchengineland.com/advanced-google-search-operators-388355,my_library,"keywords-ppc-seo, programming, search",2022-10-03T12:33:22.000Z,https://searchengineland.com/wp-content/seloads/2022/09/Advanced-Google-search-operators-800x450.png,,False
876788508,PPC management for e-commerce: 28 tools to explore,,Software and tools not only help you manage your time better but provide helpful insights that you wouldn't otherwise see in a Google or Facebook interface.,https://searchengineland.com/ppc-management-for-e-commerce-28-tools-to-explore-387801,my_library,"ecommerce, keywords-ppc-seo, prodmgmt, programming",2022-09-10T03:19:34.000Z,https://searchengineland.com/wp-content/seloads/2022/09/Shutterstock_628146863.jpg,,False
876786528,Google Search Operators: The Complete List (44 Advanced Operators),,They're super powerful.,https://ahrefs.com/blog/google-advanced-search-operators,my_library,"keywords-ppc-seo, programming, search",2022-07-18T15:00:03.000Z,https://ahrefs.com/blog/wp-content/uploads/2023/04/google-search-operators-the-complete-list-by-joshua-hardwick-general-seo.jpg,,False
876786378,Neil Patel's Digital Marketing Blog,,"Your #1 resource for digital marketing tips, trends, and strategy to help you build a successful online business.",https://blog.kissmetrics.com/58-seo-resources,my_library,"keywords-ppc-seo, programming",2022-07-06T01:20:40.000Z,,,False
876785230,11 Google Sheets formulas SEOs should know,,Sometimes the best SEO tools are free. Learn how to use these formulas to save time and reduce manual errors.,https://searchengineland.com/google-sheet-formulas-seo-386150,my_library,"keywords-ppc-seo, programming",2022-07-05T20:25:52.000Z,https://searchengineland.com/wp-content/seloads/2021/12/seo-main.png,,False
876785229,7 Free Chrome Extensions for SEO,,"Chrome extensions can streamline keyword research, analytics tracking, competitor analysis, and more. Contributor Ann Smarty lists her seven favorite Chrome extensions for SEO.",https://www.practicalecommerce.com/free-chrome-seo-extensions,my_library,"keywords-ppc-seo, programming",2022-07-05T20:25:35.000Z,https://www.practicalecommerce.com/wp-content/uploads/2022/06/7-Free-Chrome-Extensions-for-SEO.jpg,,False
876785211,Top 10 SEO Tools You Need in 2022,,If you are working in the field of SEO or if you are managing a content or Ecommerce website then you...,https://dev.to/santosh3700/top-10-seo-tools-you-need-in-2022-e8n,my_library,"analytics, keywords-ppc-seo, programming",2022-07-04T21:32:04.000Z,"https://media.dev.to/dynamic/image/width=1000,height=500,fit=cover,gravity=auto,format=auto/https%3A%2F%2Fdev-to-uploads.s3.amazonaws.com%2Fuploads%2Farticles%2Fow5r8pkgfglkftz6u0h0.png",,False
876785139,Ahrefs—Marketing Intelligence Tools Powered by Big Data.,,"Unlock data to make effective decisions across digital marketing. SEO, content marketing, PPC, digital PR, and more.",https://ahrefs.com,my_library,"ecommerce, keywords-ppc-seo, programming",2022-06-28T15:22:25.000Z,https://static.ahrefs.com/static/assets/ahrefs-YU6Y7RBK.png,,False
876785069,About Google Tag Manager | Google for Developers,,"Deploy and update measurement tags on your websites and mobile apps from a web interface, without major code changes or app releases.",https://developers.google.com/tag-manager?authuser=0,my_library,"analytics, keywords-ppc-seo, programming",2022-06-25T18:20:56.000Z,https://www.gstatic.com/devrel-devsite/prod/vb596299fc3b3ecd7c5d7aec475be1a412930b770a5f8d074630a8e7a09f63df6/developers/images/opengraph/google-blue.png,,False
876784947,Grow your online visibility,,"Free 7-day access to 55+ tools on SEO, content, competitive research, PPC and social media",https://www.semrush.com/lp/sem/en,my_library,"keywords-ppc-seo, programming",2022-06-23T20:35:14.000Z,https://mcusercontent.com/8fe644fbaa5ad86caefe1ac33/images/c71d6808-f533-4b3d-ac49-a712a5213b19.png,,False
876784818,6 In-demand Marketing Skills for Your Design CV,,"In today’s tech-savvy world, being a great designer is not all about being a whiz at tools such as Adobe Photoshop and Adobe Illustrator. The job is",https://www.noupe.com/inspiration/in-demand-marketing-skills-for-your-design-cv.html,my_library,"css, design, design-patterns, fonts-typography, keywords-ppc-seo, programming, ui-ux, webdev",2022-06-21T13:48:58.000Z,https://www.noupe.com/wp-content/uploads/2022/06/amy-hirschi-JaoVGh5aJ3E-unsplash.jpg,,False
876784783,5 Rank Tracking Tools for Organic Search,,"Monitoring rankings remains the best way to track organic search performance. In this piece, we list five helpful tools to track your site's positions and your competitors'.",https://www.practicalecommerce.com/5-rank-tracking-tools-for-organic-search,my_library,"analytics, keywords-ppc-seo, programming",2022-06-17T00:06:34.000Z,https://www.practicalecommerce.com/wp-content/uploads/2022/06/5-Rank-Tracking-Tools-for-Organic-Search.jpg,,False
876784196,4 Best SEO Tools for Web Designers,,"There’s a lot of overlap between SEO tools, which is why it can be so difficult figuring out which is the best to use. To simplify things, I’ve selected the 4 SEO tools that will seamlessly integrate with your design workflow and won’t break your budget.",https://www.webdesignerdepot.com/2019/11/4-best-seo-tools-for-web-designers,my_library,"keywords-ppc-seo, programming",2022-06-13T10:04:37.000Z,https://www.webdesignerdepot.com/assets/posts/featured/_1200x630_crop_center-center_82_none/54961/wdd.jpg?mtime=1676929111,,False
876784054,33 powerful tools to get the most out of your users,,Check this unique list of handy apps that can help you multiply your website’s visitor or paying customer count without bleeding too much cash.,https://thenextweb.com/socialmedia/2015/06/26/33-powerful-tools-to-get-the-most-out-of-your-users#.tnw_lluehZlJ,my_library,"keywords-ppc-seo, prodmgmt, programming",2022-06-02T18:02:48.000Z,https://img-cdn.tnwcdn.com/image/tnw-blurple?filter_last=1&fit=1280%2C640&url=https%3A%2F%2Fcdn0.tnwcdn.com%2Fwp-content%2Fblogs.dir%2F1%2Ffiles%2F2015%2F04%2Fsocialmediachecklist.jpg&signature=035d078e6c02e39d705b51eb03719b6b,,False
876783958,13 marketing automation tools that can help you boost your sales,,The way we live our lives has an impact on our work. Long lists of typical chores may turn your,https://dataconomy.com/2022/05/13-marketing-automation-tools-that-can-help-you-boost-your-sales,my_library,"analytics, ecommerce, keywords-ppc-seo, marketing, prodmgmt, programming",2022-05-27T22:05:33.000Z,https://dataconomy.com/wp-content/uploads/2022/05/BEST-MARKETING-AUTOMATION-TOOLS-3.jpg,,False
876783913,How to make a GA4 landing page report in 10 easy steps,,The Landing Page report. Universal Analytics has it. GA4 does not. But you can make it! This article will show you how.,https://searchengineland.com/make-ga4-landing-page-report-385133,my_library,"analytics, keywords-ppc-seo, programming",2022-05-14T20:40:39.000Z,https://searchengineland.com/wp-content/seloads/2022/05/google-analytics.png,,False
876783898,This New Tool Lets You Analyse TikTok Hashtags,,"TikTok has come to play a crucial role for open source researchers. By analysing how hashtags are used, this tool lets you dig even deeper.",https://www.bellingcat.com/resources/how-tos/2022/05/11/this-new-tool-lets-you-analyse-tiktok-hashtags,my_library,"keywords-ppc-seo, programming, tiktok",2022-05-12T11:54:49.000Z,https://www.bellingcat.com/app/uploads/2022/05/2021-01-04T000000Z_439149760_MT1SIPA000680QYB_RTRMADP_3_SIPA-USA-scaled.jpg,,False
876783897,3 Keyword Tools for Search Intent,,"Optimizing content for organic rankings requires knowing how Google will interpret searchers' intent — informational, commercial, or navigational.",https://www.practicalecommerce.com/3-keyword-tools-for-search-intent,my_library,"ecommerce, keywords-ppc-seo, prodmgmt, programming",2022-05-12T11:51:48.000Z,https://www.practicalecommerce.com/wp-content/uploads/2022/04/3-Keyword-Tools-for-Search-Intent.jpg,,False
876783870,Free SEO Tools for Do-it-yourself Analysis,,The ability to fix basic SEO glitches can save time and money. Here are five free tools to help.,https://www.practicalecommerce.com/free-seo-tools-for-do-it-yourself-analysis,my_library,"keywords-ppc-seo, programming",2022-05-05T15:48:45.000Z,https://www.practicalecommerce.com/wp-content/uploads/2022/04/Free-SEO-Tools-for-Do-it-yourself-Analysis.jpg,,False
876780961,41 Best SEO Tools in 2024 (Free & Paid),,These tools have helped my site get 600k+ visits per month. (Most of which came from SEO) The best part? All of these tools work GREAT in 2024.,http://backlinko.com/seo-tools,my_library,"keywords-ppc-seo, programming, webdev",2021-12-15T02:33:14.000Z,https://api.backlinko.com/app/uploads/2020/04/best-free-seo-tools.png,,False
876773009,The Ultimate List of Free SEO Tools,,Interested in seeing if your SEO efforts are paying off? We've curated a list of the best free SEO tools to help you determine where your site stands.,https://neilpatel.com/blog/free-seo-tools,my_library,"keywords-ppc-seo, programming",2019-12-23T17:01:08.000Z,https://neilpatel.com/wp-content/uploads/2024/02/Ubersuggest_February-Headers_Image-2-700x420.jpg,,False
