id,title,note,excerpt,url,folder,tags,created,cover,highlights,favorite
876790912,Mastering PostgreSQL Views and CTEs for Rails Developers: A Comprehensive G,,Introduction   Views and Common Table Expression or CTE are two important concept in...,https://dev.to/yet_anotherdev/mastering-postgresql-views-and-ctes-for-rails-developers-a-comprehensive-guide-3fl4,my_library,"databases, postgres, rubyonrails",2023-03-15T12:11:25.000Z,https://dev-to-uploads.s3.amazonaws.com/uploads/articles/3otvb2z646ytpt1hl2rv.jpg,,False
876787812,Advanced Database Programming with Rails and Postgres,,"Learn about Active Record and subqueries, views and materialized views, and domain types and composite types in Postgres and Ruby on Rails.",https://rubyweekly.com/link/127468/ad5e785e3b,my_library,"databases, postgres, rubyonrails",2022-08-19T18:55:01.000Z,https://pganalyze.com/og/ebook-advanced-database-programming-rails-postgres.jpg,,False
876782855,Optimizing Rails connections,,How to configure database connections in your Rails app,https://dev.to/hopsoft/optimizing-rails-connections-4gkd,my_library,"databases, devops, rubyonrails",2022-03-18T01:28:50.000Z,"https://media.dev.to/dynamic/image/width=1000,height=500,fit=cover,gravity=auto,format=auto/https%3A%2F%2Fdev-to-uploads.s3.amazonaws.com%2Fuploads%2Farticles%2Fti8ainzir3qvydb7nw57.jpeg",,False
876782151,Eager Loading and the N+1 Query Problem | Learn Enough News & Blog,,News & blog about Learn Enough (including the Ruby on Rails Tutorial),https://news.learnenough.com/eager-loading,my_library,"databases, rubyonrails",2022-01-17T19:24:24.000Z,http://softcover.github.io/learnenough-news/images/le.png,,False
876777405,Setup Ruby on Rails 6 App with MongoDB under 5 Minutes — Aarvy | by Aarvy |,,"In this article, I will be discussing how to quickly setup a NoSQL database MongoDB with your brand new Rails 6 app. I am using Ubuntu…",https://aarvy.medium.com/setup-ruby-on-rails-6-app-with-mongodb-under-5-minutes-aarvy-56a6a535139d,my_library,"databases, mongodb, rubyonrails",2021-01-23T21:27:42.000Z,https://miro.medium.com/v2/da:true/resize:fit:1200/0*0K2WV1VnHGzH3k7v,,False
876777343,reddit: the front page of the internet,,Rails 6.1 has added support for switching connections for one database instead of all databases,https://blog.saeloun.com/2021/01/08/rails-6-1-pre-database-connection-switching,my_library,"databases, rubyonrails",2021-01-11T12:45:52.000Z,https://blog.saeloun.com/images/opengraph/9e4ce3c4fe143d0e8bdc98351e08a6576ea26660.png,,False
