id,title,note,excerpt,url,folder,tags,created,cover,highlights,favorite
876786433,5 Pricing Resolutions for 2019 - OpenView,,Pricing is a good place to make a few critical resolutions for businesses. Learn the 5 resolutions as you shape your pricing strategy for 2019.,https://labs.openviewpartners.com/5-pricing-resolutions-for-2019#.XBwRGZ-YXPE,my_library,"leadgen-leadmgmt, pricing, prodmgmt, sales-salesmgmt",2022-07-11T22:55:52.000Z,https://openviewpartners.com/wp-content/uploads/2018/12/Pricing-trends-2019.png,,False
876786373,B2B Marketing: How to auto-qualify new leads without a CRM or lead scoring,,"B2B marketers often deliver unqualified leads, which wastes their resources and those of the sales team. How can you generate qualified leads without breaking the bank?  A combination of content marketing and triggered emails enabled one B2B team to generate and auto-qualify leads. The result is a campaign that automatically delivers the company’s best sales prospects. Find out how the team drives SEO traffic and earned a 50% conversion rate on the landing page.",http://www.marketingsherpa.com/article/case-study/auto-qualify-new-leads-without-lead-scoring,my_library,"leadgen-leadmgmt, sales-salesmgmt",2022-07-06T01:08:49.000Z,https://meclabs-images.s3.amazonaws.com/uploads/site/cover_image/2/marketing_sherpa_logo.png,,False
876784205,https://trafficiscurrency.com/product-qualified-leads/,,,https://trafficiscurrency.com/product-qualified-leads,my_library,"analytics, leadgen-leadmgmt, prodmgmt, sales-salesmgmt",2022-06-13T10:06:11.000Z,,,False
876776532,https://customerobjections.com/,,,https://customerobjections.com,my_library,"leadgen-leadmgmt, objections, sales-salesmgmt",2020-12-18T11:20:43.000Z,,,False
876772984,Beginner's Guide to Product-Qualified Leads,,"Unleash the power of Product Qualified Leads to skyrocket your SaaS business growth. Learn to identify, nurture, and convert PQLs now with our guide.",https://productled.com/product-qualified-leads,my_library,"leadgen-leadmgmt, prodmgmt, sales-salesmgmt",2019-12-23T17:01:08.000Z,https://productled.com/wp-content/uploads/2018/11/Product-Qualified-Leads-2.png,,False
