id,title,note,excerpt,url,folder,tags,created,cover,highlights,favorite
876795272,Why I spent 3 years working on a coat hanger,,"The Coat Hinger is available for 30 days on Kickstarter! Go go go!! https://kickstarter.com/projects/simonegiertz/coat-hingers-foldable-coat-hangers

Thank you so much for supporting my creative whims throughout the years. Can you believe it's been almost a decade?!",https://www.youtube.com/watch?t=109s&v=vREokZa4dNU,my_library,"clothes, ideas, startups",2024-02-29T23:46:23.000Z,https://i.ytimg.com/vi/vREokZa4dNU/maxresdefault.jpg,,False
876787740,Spotify For Clothes: How I Launched A Business Helping Guys Discover New Cl,,"Hello! Who are you and what business did you start?My name is Brian McEuen, and I'm the founder of On Brand. We help guys shop for clothes online by curating personalized selections as if they were walking into their very own store. We're like Spotify for clothes! Another way to put it:...",https://www.starterstory.com/stories/on-brand,my_library,"clothes, startups",2022-08-12T11:15:22.000Z,https://d1coqmn8qm80r4.cloudfront.net/stories/social_shares/000/076/253/original/open-uri20240920-2-1b82qw5?1726838043,,False
876786432,A Glimpse Inside a Florentine Silk-Weaving Workshop,,"The Antico Setificio Fiorentino, which relies on looms from the 18th and 19th centuries, has been producing precious textiles since 1786.",https://www.nytimes.com/2022/07/11/travel/antique-florentine-silk-mill.html,my_library,"art, clothes, craftsmanship, history",2022-07-11T22:49:44.000Z,https://static01.nyt.com/images/2022/07/11/travel/11travel-italy-promo/11travel-italy1-largeHorizontalJumbo.jpg?year=2022&h=682&w=1024&s=f3925f1a1c80f429ead8a621fb18bc8c861bb54731f96e83ff0d644c3179f027&k=ZQJBKqZ0VN,,False
876775750,Sweatpants Forever: How the Fashion Industry Collapsed (Published 2020),,"Even before the pandemic, it had started to unravel. What happens now that no one has a reason to dress up?",https://www.nytimes.com/interactive/2020/08/06/magazine/fashion-sweatpants.html,my_library,"clothes, prodmgmt, startups",2020-08-08T14:08:52.000Z,https://static01.nyt.com/images/2020/08/09/magazine/09mag-Sweatpants/09mag-Sweatpants-facebookJumbo.jpg?year=2020&h=550&w=1050&s=5ccc92b922d9887b6fe75474538d2354d87d9497de11cdb23cea7dc870715a8f&k=ZQJBKqZ0VN,,False
876771826,"Buy Low-Tops, Sell High-Tops: A Sneaker Exchange Is Worth $1 Billion",,StockX is one of several online marketplaces that have turned resales of shoes into a big — and highly valued — business.,https://www.nytimes.com/2019/06/26/technology/trading-sneakers-stockx.html,my_library,"clothes, goodreads, startups",2019-08-24T02:36:28.000Z,https://static01.nyt.com/images/2019/06/26/business/26stockx/26stockx-largeHorizontalJumbo.jpg?year=2019&h=682&w=1024&s=3e7a018c0b596126bff3a3e6fc2b3b9e8808040f78936cef775afb92d56ebe98&k=ZQJBKqZ0VN,,False
876769778,Project Repat: $10MM Business Making Quilts From Old T-Shirts,,"Hello! Who are you and what are you working on?My name is Ross Lohr, and I’m a co-founder of Project Repat. We make it easy and affordable for customers to turn their memorable t-shirts into a one of a kind, custom t-shirt quilt backed with cozy fleece. People buy quilts from Project Re...",https://starterstory.com/stories/project-repat,my_library,"clothes, ideas, startups",2018-10-07T15:59:16.000Z,https://d1coqmn8qm80r4.cloudfront.net/stories/social_shares/000/000/126/original/open-uri20210513-4-jmy5et?1620871941,,False
