id,title,note,excerpt,url,folder,tags,created,cover,highlights,favorite
876777432,Cross-Topic Argument Mining: Learning How to Classify Texts,,Classifying cross-topic natural language texts based on their argumentative structure using deep learning,https://towardsdatascience.com/cross-topic-argument-mining-learning-how-to-classify-texts-1d9e5c00c4cc?source=rss----7f60cf5620c9---4,my_library,"classification, deep-learning, nlp, text",2021-01-27T11:19:04.000Z,https://miro.medium.com/v2/da:true/resize:fit:1200/0*V7bXCvUPDw5rIedZ,,False
876773695,Table Detection and Extraction Using Deep Learning,,Extract table from image with Nanonets table detection OCR. Learn OCR table Deep Learning methods to detect tables in images or PDF documents.,https://nanonets.com/blog/table-extraction-deep-learning,my_library,"deep-learning, text, vision",2020-02-19T20:04:25.000Z,https://nanonets.com/blog/content/images/size/w1200/2018/11/droneheroimage-2.png,,False
876772915,Automatic Text Summarization in a Nutshell - KDnuggets,,Marketing scientist Kevin Gray asks Dr. Anna Farzindar of the University of Southern California about Automatic Text Summarization and the various ways it is used.,https://www.kdnuggets.com/2019/12/automatic-text-summarization-nutshell.html,my_library,"deep-learning, text",2019-12-23T16:56:41.000Z,https://www.kdnuggets.com/wp-content/uploads/anna-farzindar.jpg,,False
876769471,agnusmaximus/Word2Bits: Quantized word vectors that take 8x-16x less space than regular word vectors,,Quantized word vectors that take 8x-16x less space than regular word vectors - agnusmaximus/Word2Bits,https://github.com/agnusmaximus/Word2Bits,my_library,"deep-learning, nlp, text",2018-06-08T23:41:14.000Z,https://opengraph.githubassets.com/3a9ec1a321d5abc764ef5e4908347ee4aec77d6a3290a1f7c174285784678fe2/agnusmaximus/Word2Bits,,False
876769330,LightTag is a text annotation platform for data scientists creating AI trai,,"LightTag, a newly launched startup from a former NLP researcher at Citi, has built a ""text annotation platform"" designed to assist data scientists who",https://techcrunch.com/2018/05/11/lighttag,my_library,"deep-learning, machine-learning, text",2018-05-11T11:49:54.000Z,"https://techcrunch.com/wp-content/uploads/2018/05/img_0118.jpg?resize=1200,1041",,False
