id,title,note,excerpt,url,folder,tags,created,cover,highlights,favorite
876792911,Variational Autoencoder (VAE) with Discrete Distribution using Gumbel Softm,,Theory and PyTorch Implementation,https://towardsdatascience.com/variational-autoencoder-vae-with-discrete-distribution-using-gumbel-softmax-b3f749b3417e?source=rss----7f60cf5620c9---4,my_library,"autoencoders, deep-learning, generative, pytorch",2023-08-10T15:50:40.000Z,https://miro.medium.com/v2/resize:fit:640/1*IB22-8qoNpIITYqKA034lQ.png,,False
876791726,The Sequence Chat: Salesforce Research's Junnan Li on Multimodal Generative AI,,One of the creators of the famous BLIP-2 model shares his insights about the current state of multimodal generative AI.,https://thesequence.substack.com/p/the-sequence-chat-salesforce-researchs,my_library,"deep-learning, generative",2023-04-12T13:02:49.000Z,"https://substackcdn.com/image/fetch/w_1200,h_600,c_fill,f_jpg,q_auto:good,fl_progressive:steep,g_auto/https%3A%2F%2Fsubstack-post-media.s3.amazonaws.com%2Fpublic%2Fimages%2F814feca2-f68a-4ec4-8beb-ea2de67381ce_1278x720.jpeg",,False
876790788,Meta unveils a new large language model that can run on a single GPU,,LLaMA-13B reportedly outperforms ChatGPT-like tech despite being 10x smaller.,https://arstechnica.com/information-technology/2023/02/chatgpt-on-your-pc-meta-unveils-new-ai-model-that-can-run-on-a-single-gpu,my_library,"chatgpt, deep-learning, generative, nlp",2023-02-25T19:33:58.000Z,https://cdn.arstechnica.net/wp-content/uploads/2023/02/meta_llm_hero_1.jpg,,False
876790620,Paper Review: A Deep Dive into Imagen,,A critical analysis of Google’s impressive new text-to-image generation tool,https://towardsdatascience.com/paper-review-a-deep-dive-into-imagen-4e5b4092af13?source=rss----7f60cf5620c9---4,my_library,"deep-learning, generative, image-generation",2023-02-03T23:05:38.000Z,https://miro.medium.com/v2/da:true/resize:fit:1200/0*Nkyo43aZ1FtnpmHv,,False
876790570,Text-to-4D dynamic scene generation,,"Find it here, via Ryan Watkins.  Further improvement is required, but the pace of current breakthroughs is remarkable.",https://marginalrevolution.com/marginalrevolution/2023/01/text-to-4d-dynamic-scene-generation.html,my_library,"deep-learning, generative, storytelling, video",2023-01-29T15:10:06.000Z,https://marginalrevolution.com/wp-content/uploads/2016/10/MR-logo-thumbnail.png,,False
876790536,ChatGPT is not all you need. A State of the Art Review of large...,,"During the last two years there has been a plethora of large generative models such as ChatGPT or Stable Diffusion that have been published. Concretely, these models are able to perform tasks such...",https://arxiv.org/abs/2301.04655,my_library,"chatgpt, deep-learning, generative",2023-01-24T03:30:19.000Z,https://arxiv.org/static/browse/0.3.4/images/arxiv-logo-fb.png,,False
876789713,ChatGPT and the Imagenet moment — Benedict Evans,,"The wave of enthusiasm around generative networks feels like another Imagenet moment - a step change in what ‘AI’ can do that could generalise far beyond the cool demos. What can it create, and where are the humans in the loop?",https://www.ben-evans.com/benedictevans/2022/12/14/ChatGPT-imagenet,my_library,"chatgpt, deep-learning, generative, ideas, machine-learning, nlp",2022-12-16T01:53:18.000Z,http://static1.squarespace.com/static/50363cf324ac8e905e7df861/t/639997a380800648445acf3f/1718919976911/B4AAC213-3764-4A49-A1F1-CA18B3368CF0.jpeg?format=1500w,,False
876789673,DeepMind Created An AI Tool That Can Help Generate Rough Film and Stage Scr,,"Alphabet's DeepMind has built an AI tool that can help generate rough film and stage scripts Engadget's Kris Holt reports:  Dramatron is a so-called ""co-writing"" tool that can generate character descriptions, plot points, location descriptions and dialogue. The idea is that human writers will be abl...",https://entertainment.slashdot.org/story/22/12/10/0040219/deepmind-created-an-ai-tool-that-can-help-generate-rough-film-and-stage-scripts,my_library,"deep-learning, generative, movies-television, storytelling",2022-12-10T14:46:03.000Z,https://a.fsdn.com/sd/topics/ai_64.png,,False
