id,title,note,excerpt,url,folder,tags,created,cover,highlights,favorite
876784045,Overview of Github Actions - Part 1,,Overview of Github Actions    Overview of Github Actions - Part 1 Overview of Github Actions...,https://dev.to/makendrang/overview-of-github-actions-part-1-1bc9,my_library,"devops, github, programming",2022-06-01T15:01:34.000Z,https://dev-to-uploads.s3.amazonaws.com/uploads/articles/3otvb2z646ytpt1hl2rv.jpg,,False
876784044,Overview of Github Actions - Part 2,,Overview of Github Actions    Overview of Github Actions - Part 1 Overview of Github Actions...,https://dev.to/makendrang/overview-of-github-actions-part-2-9f6,my_library,"devops, github, programming",2022-06-01T15:01:30.000Z,https://dev-to-uploads.s3.amazonaws.com/uploads/articles/3otvb2z646ytpt1hl2rv.jpg,,False
876780856,GitHub Actions,,"Easily build, package, release, update, and deploy your project in any language—on GitHub or any external system—without having to run code yourself.",https://github.com/features/actions,my_library,"devops, github",2021-12-12T19:44:09.000Z,https://github.githubassets.com/assets/actions-de2bd3e42f20.png,,False
876777292,How to Automate Tasks on GitHub With Machine Learning for Fun and Profit |,,A tutorial on how to build a GitHub App that predicts and applies issue labels using Tensorflow and public datasets.,https://towardsdatascience.com/mlapp-419f90e8f007,my_library,"devops, github, machine-learning",2021-01-02T22:01:54.000Z,https://miro.medium.com/v2/resize:fit:1200/1*yoK0dEQS7gJTEsPEO6I3_A.jpeg,,False
876776539,Complete Walkthrough to Connect your SDE to GCP with Github,,Power-up Your Workflow with Cloud instance!,https://towardsdatascience.com/complete-walkthrough-to-connect-your-sde-to-gcp-with-github-bc39eec0db9e?source=rss----7f60cf5620c9---4,my_library,"devops, github",2020-12-18T11:20:57.000Z,https://miro.medium.com/v2/resize:fit:1200/1*J38K78-faP7JApZJKhJFxw.jpeg,,False
876776132,GitHub CLI 1.0 is now available,,"GitHub CLI brings GitHub to your terminal. It reduces context switching, helps you focus, and enables you to more easily script and create your own workflows. Earlier this year, we…",https://github.blog/2020-09-17-github-cli-1-0-is-now-available,my_library,"devops, github",2020-11-03T00:14:58.000Z,https://github.blog/wp-content/uploads/2020/09/GitHubCLI_SocialCard_VersionNumber_NoSubLine_v2.png?fit=1200%2C630,,False
876769588,GLB: GitHub’s open source load balancer | GitHub Engineering,,,https://githubengineering.com/glb-director-open-source-load-balancer,my_library,"devops, github",2018-08-13T22:36:09.000Z,,,False
