id,title,note,excerpt,url,folder,tags,created,cover,highlights,favorite
876790982,Essential Tools for a Successful DevOps Engineer,,Introduction:   The software development process has been transformed by the DevOps...,https://dev.to/aws-builders/essential-tools-for-a-successful-devops-engineer-4lgl,my_library,"agile, ansible, ci-cd, containers, devops, git, logging, programming, testing",2023-03-20T13:20:56.000Z,"https://media.dev.to/dynamic/image/width=1000,height=500,fit=cover,gravity=auto,format=auto/https%3A%2F%2Fdev-to-uploads.s3.amazonaws.com%2Fuploads%2Farticles%2Fppl7gxtj9ivo53fbjb0i.jpg",,False
876790948,"Getting Started with Ansible: An Introduction to Automation, Configuration",,🔐 Introduction to Ansible               🔗Related content            You can find repo...,https://dev.to/xlmriosx/getting-started-with-ansible-an-introduction-to-automation-configuration-management-and-orchestration-1h95,my_library,"ansible, devops, programming",2023-03-18T22:55:30.000Z,https://dev-to-uploads.s3.amazonaws.com/uploads/articles/3otvb2z646ytpt1hl2rv.jpg,,False
876780758,https://www.thecloud.coach/ansible-crash-course,,,https://www.thecloud.coach/ansible-crash-course,my_library,"ansible, devops, programming",2021-12-11T01:31:21.000Z,,,False
876779830,DevOps 101 : Introduction to Ansible,,Ansible              What is Ansible?   Ansible is an open-source IT Configuration...,https://dev.to/grayhat/devops-101-introduction-to-ansible-1n64,my_library,"ansible, devops, programming",2021-08-16T19:50:47.000Z,"https://media.dev.to/dynamic/image/width=1000,height=500,fit=cover,gravity=auto,format=auto/https%3A%2F%2Fdev-to-uploads.s3.amazonaws.com%2Fuploads%2Farticles%2Fogw51ggqe2hr5erivhd7.png",,False
876776453,Terraform vs Ansible: What's the difference and which one you should use?,,Preparing your Infrastructure as Code solution? Ansible and Terraform are two of the most popular choices. But what's the difference?,https://linuxhandbook.com/terraform-vs-ansible,my_library,"ansible, devops, terraform",2020-12-10T03:38:01.000Z,https://linuxhandbook.com/content/images/2020/11/ansible-vs-terraform-1.jpg,,False
876776373,Self-publishing and the 2nd edition of Ansible for DevOps | Jeff Geerling,,,http://www.jeffgeerling.com/blog/2020/self-publishing-and-2nd-edition-ansible-devops,my_library,"ansible, devops",2020-11-29T20:11:57.000Z,,,False
876776328,Getting started with Ansible | XLAB Steampunk blog,,"This post was originally published on November 12, 2020, but the content has been updated according to the recent Ansible changes. In our previous blog post , we looked at what configuration management tools bring to the table. And in this post, we will take a closer look at Ansible, our configuration management tool of choice. So if you want to learn what Ansible is, what it does, and how it works, this is the post for you.",https://steampunk.si/blog/getting-started-with-ansible,my_library,"ansible, devops",2020-11-22T16:00:41.000Z,https://steampunk.si/blog/getting-started-with-ansible/og_image.jpg,,False
876774590,geerlingguy/ansible-for-devops: Ansible examples from Ansible for DevOps.,,Ansible for DevOps examples.,https://github.com/geerlingguy/ansible-for-devops,my_library,"ansible, devops",2020-03-31T15:44:14.000Z,https://opengraph.githubassets.com/d0e67de81d70ec82bf7a3fcad1c48a4cd8a5dd522f532ba445cb377a1c6301ff/geerlingguy/ansible-for-devops,,False
