id,title,note,excerpt,url,folder,tags,created,cover,highlights,favorite
876790632,Using Curl to make REST API requests | Linuxize,,"In this article, we're going to discuss how to use Curl to interact with RESTful APIs. Curl is a command-line utility for transferring data from or to a remote server.",https://linuxize.com/post/curl-rest-api,my_library,"curl, devops, linux, programming, webdev",2023-02-04T22:41:01.000Z,https://linuxize.com/post/curl-rest-api/featured.jpg,,False
876788639,25 Free Tools to Test Your Website,,"This all-new update to our popular resource includes tools to evaluate page speed, security, accessibility, regulatory compliance, code, and more.",https://www.practicalecommerce.com/free-tools-to-test-your-website,my_library,"devops, programming, search, webdev",2022-09-27T16:13:40.000Z,https://www.practicalecommerce.com/wp-content/uploads/2024/05/23-Free-Tools-to-Test-Your-Website.jpg,,False
876788602,Render: Awesome alternative for Heroku,,"Heroku will stop offering its free tiers this November, leaving developers to choose other...",https://dev.to/maklut/render-awesome-alternative-for-heroku-mf2,my_library,"devops, heroku, programming, webdev",2022-09-22T10:37:13.000Z,"https://media.dev.to/dynamic/image/width=1000,height=500,fit=cover,gravity=auto,format=auto/https%3A%2F%2Fdev-to-uploads.s3.amazonaws.com%2Fuploads%2Farticles%2Fu6kmbieir6su8dt70z3l.png",,False
876788444,"gchq/CyberChef: The Cyber Swiss Army Knife - a web app for encryption, encoding, compression and data analysis",,"The Cyber Swiss Army Knife - a web app for encryption, encoding, compression and data analysis - gchq/CyberChef",https://github.com/gchq/CyberChef,my_library,"devops, programming, security, webdev",2022-09-05T01:08:23.000Z,https://repository-images.githubusercontent.com/74962515/137c6d1b-4aac-4408-a361-c2a27f125b04,,False
876788409,"Heroku no longer offers free service, what's the best alternative now?",,Heroku was such a simple and free experience to host side project and start developing. What is the...,https://dev.to/cyril/heroku-no-longer-offers-free-service-whats-the-best-alternative-now-2ghh,my_library,"devops, heroku, webdev",2022-08-30T02:32:34.000Z,https://dev-to-uploads.s3.amazonaws.com/uploads/articles/3otvb2z646ytpt1hl2rv.jpg,,False
876788408,"Heroku no longer offers free service, what's the best alternative now?",,Heroku was such a simple and free experience to host side project and start developing. What is the...,https://dev.to/adorism/comment/218hi,my_library,"devops, heroku, webdev",2022-08-30T02:32:22.000Z,https://dev-to-uploads.s3.amazonaws.com/uploads/articles/3otvb2z646ytpt1hl2rv.jpg,,False
876788407,Free Alternatives to Heroku,,"Given the recent news about Heroku bringing an end to free dynos and PostgreSQL databases, what other...",https://dev.to/daveson217/free-alternatives-to-heroku-3jh9,my_library,"devops, heroku, webdev",2022-08-30T02:32:07.000Z,https://dev-to-uploads.s3.amazonaws.com/uploads/articles/3otvb2z646ytpt1hl2rv.jpg,,False
876787669,Router Security,,Router Security Home Page,https://routersecurity.org,my_library,"devops, security, webdev",2022-07-30T20:25:24.000Z,,,False
876787653,Test Your Product On A Crappy Laptop | CSS-Tricks,,There is a huge and ever-widening gap between the devices we use to make the web and the devices most people use to consume it. It’s also no secret,https://css-tricks.com/test-your-product-on-a-crappy-laptop,my_library,"analytics, devops, prodmgmt, webdev",2022-07-29T20:08:52.000Z,https://css-tricks.com/wp-json/social-image-generator/v1/image/357637,,False
876785207,3 Best Website Uptime Monitoring Tools&nbsp;,,"One way to achieve this is by employing uptime and downtime monitoring tools. Why Is Website Uptime Monitoring Important? An uptime monitoring solution can help you prevent or reduce these losses. Thus, you must employ a dependable tool that detects downtime or any interruptions related to your…",https://www.webdesignerdepot.com/2022/07/3-best-website-uptime-monitoring-tools,my_library,"devops, programming, webdev",2022-07-04T02:34:32.000Z,https://www.webdesignerdepot.com/assets/posts/featured/_1200x630_crop_center-center_82_none/featured_uptime-scaled.jpeg?mtime=1663768396,,False
876783861,https://social.techcrunch.com/2022/04/23/seo-scammers-buy-expired-domains-vexing-google-trust/,,,https://social.techcrunch.com/2022/04/23/seo-scammers-buy-expired-domains-vexing-google-trust,my_library,"devops, keywords-ppc-seo, webdev",2022-05-03T11:49:03.000Z,,,False
876783796,"Jacob Errington | Roll your own Ngrok with Nginx, Letsencrypt, and SSH reve",,,https://jerrington.me/posts/2019-01-29-self-hosted-ngrok.html,my_library,"devops, ngrok, ssh, web-servers, webdev",2022-04-09T00:00:35.000Z,,,False
876782882,What Is Nix and Why You Should Use It,,Learn how the Nix package manager can help you make the development process more efficient and simpler.,https://serokell.io/blog/what-is-nix,my_library,"devops, nix, programming, webdev",2022-03-23T20:55:32.000Z,https://serokell.io/files/tw/opengraph.twj9avz9.thumbnail_(8).jpg,,False
876782119,Perf tooling,,,http://www.perf-tooling.today,my_library,"devops, webdev",2022-01-17T13:18:24.000Z,,,False
876782112,phanan/htaccess,,✂A collection of useful .htaccess snippets.,https://github.com/phanan/htaccess,my_library,"devops, web-servers, webdev",2022-01-17T13:01:39.000Z,https://opengraph.githubassets.com/6bbe1693d7c112385e5c6b10014f319355db0ac98a638738c1e382e47faf4ba5/phanan/htaccess,,False
876781932,Servers for Hackers,,What programmers need to know about servers.,https://serversforhackers.com,my_library,"devops, web-servers, webdev",2022-01-12T23:38:23.000Z,https://serversforhackers.com/img/sfh-social-lrg.png?b=1,,False
876781886,Ask HN: Good open source alternatives to Google Analytics? | Hacker News,,,https://news.ycombinator.com/item?id=29888599,my_library,"analytics, devops, webdev",2022-01-12T23:07:04.000Z,,,False
876781149,How we handle 80TB and 5M page views a month for under $400,,How the heck do we run a massively popular website and asset resource while being funded primarily by donations?,https://blog.polyhaven.com/how-we-handle-80tb-and-5m-page-views-a-month-for-under-400,my_library,"devops, web-hosting, webdev",2022-01-07T18:57:55.000Z,https://blog.polyhaven.com/wp-content/uploads/2022/01/2022-01-05_17-15-53_firefox.png,,False
876781143,5 Best Practices for Securing SSH,,This article explores 5 SSH best practices you should observe to boost the security of your infrastructure.,https://goteleport.com/blog/5-ssh-best-practices,my_library,"devops, ssh, webdev",2022-01-06T23:48:25.000Z,https://goteleport.com/blog/_next/static/media/securing-ssh@2x.58c7eb6e.png,,False
876780881,The Basics of Web Application Security,,"Security is both very important and often under-emphasized. While many targeted techniques help, there are some basic clean code habits which every developer can and should be doing",http://martinfowler.com/articles/web-security-basics.html,my_library,"devops, security, webdev",2021-12-13T12:20:48.000Z,https://martinfowler.com/articles/web-security-basics/card.png,,False
876779876,"Meet the Self-Hosters, Taking Back the Internet One Server at a Time",,"Tired of Big Tech monopolies, a community of hobbyists is taking their digital lives off the cloud and onto DIY hardware that they control.",https://www.vice.com/en_us/article/pkb4ng/meet-the-self-hosters-taking-back-the-internet-one-server-at-a-time,my_library,"devops, programming, webdev",2021-09-02T14:41:53.000Z,https://www.vice.com/wp-content/uploads/sites/2/2021/09/1630516773059-raspberry-pi-61189601920.jpeg,,False
876779785,"Free for dev - list of software (SaaS, PaaS, IaaS, etc.)",,Content by github.com/ripienaar/free-for-dev Contributors:...,https://dev.to/alexandrefreire/free-for-dev-list-of-software-saas-paas-iaas-etc-2jme,my_library,"devops, programming, webdev",2021-07-27T10:06:50.000Z,"https://media.dev.to/dynamic/image/width=1000,height=500,fit=cover,gravity=auto,format=auto/https%3A%2F%2Fdev-to-uploads.s3.amazonaws.com%2Fuploads%2Farticles%2Fqcr4jj9yljwhp79u6al0.png",,False
876779404,"No, we don’t use Kubernetes",,"“No, we don’t use Kubernetes”. That always gets raised eyebrows... so we decided to write about our reasoning behind this cloud architecture decision.",https://ably.com/blog/no-we-dont-use-kubernetes,my_library,"devops, docker, kubernetes, webdev",2021-07-20T21:12:57.000Z,https://files.ably.io/ghost/prod/2021/07/no-we-dont-use-kubernetes-current-setup-1.png,,False
876779346,Top 6 Ethical Hacking Tools,,"1. Kali Linux  Kali Linux is the most used Ethical Hacking distro available, it is provided with...",https://dev.to/maximking1/top-6-ethical-hacking-tools-4i8a,my_library,"devops, linux, malware, programming, webdev",2021-07-07T23:12:57.000Z,"https://media.dev.to/dynamic/image/width=1000,height=500,fit=cover,gravity=auto,format=auto/https%3A%2F%2Fdev-to-uploads.s3.amazonaws.com%2Fuploads%2Farticles%2Fpb73jfna6xwrmjw5nik1.jpeg",,False
876778496,Lessons I learned from achieving a 99.99% platform uptime,,"Voice123 is the first (and arguably foremost) open marketplace for voice actors.  Today, Voice123 ha...",https://dev.to/germangonzo/lessons-i-learned-from-achieving-a-99-99-platform-uptime-1c9o,my_library,"devops, webdev",2021-04-27T23:55:02.000Z,https://dev-to-uploads.s3.amazonaws.com/uploads/articles/3otvb2z646ytpt1hl2rv.jpg,,False
876778477,http://www.datasciencecentral.com/xn/detail/6448529:BlogPost:1047970,,,http://www.datasciencecentral.com/xn/detail/6448529:BlogPost:1047970,my_library,"aws, devops, programming, webdev",2021-04-24T09:03:40.000Z,,,False
876778366,Phishing Tests Are Necessary. But They Don’t Need to Be Evil.,,"Although phishing tests can be helpful to protect users, using questionable tactics has the potential for harming relationships between a company and its employees. The authors suggest that managers avoid this damage by employing phishing tests with three criteria: Test teams, not individuals; don’t embarrass anyone; and gamify and reward.",https://hbr.org/2021/04/phishing-tests-are-necessary-but-they-dont-need-to-be-evil,my_library,"devops, security, webdev",2021-04-02T14:16:50.000Z,https://hbr.org/resources/images/article_assets/2021/04/Apr21_01_464881289_1196219402.jpg,,False
876778038,Learn Enough Custom Domains to Be Dangerous | Learn Enough to Be Dangerous,,"Custom domains for websites, web apps, and email",https://www.learnenough.com/custom-domains-tutorial/dns_management,my_library,"devops, dns, webdev",2021-02-13T10:32:42.000Z,https://softcover.s3.amazonaws.com/636/learn_enough_custom_domains/images/cover-web.png,,False
876770780,Performance Tuning - Tips & Tricks - NGINX,,,https://www.nginx.com/blog/performance-tuning-tips-tricks?mkt_tok=eyJpIjoiT0dVNU9URXdNVGczTVRsaSIsInQiOiI1NjFtQlZMV2VPRkEzZVpqeDAzYmlQSmFNblc3XC9VaUdFVXlcL05WOHRleVFMMGZwVXBRK3RKTHdsNWlSYitFODkrUUZwbkZCeWllS0thSGFXVElsakxJblE3bFdZNktYNlp4MnJmNGhnaHZGRVNsTmhhNyttbHAwOUlCVXM3MGNVIn0=,my_library,"devops, web-servers, webdev",2019-02-12T13:04:50.000Z,https://blog.nginx.org/wp-content/uploads/2017/08/Testing-NGINX-web-server-performance.png,,False
876770635,Everything you should know about certificates and PKI but are too afraid to ask,,"Certificates and public key infrastructure (PKI) are hard. No shit, right? I know a lot of smart people who''ve avoided this particular rabbit hole. Eventually,  I was forced to learn this stuff because of what it enables: PKI lets you define a system cryptographically. It''s universal and vendor-neutral yet poorly documented. This is the missing manual.",https://smallstep.com/blog/everything-pki.html,my_library,"crypto, devops, webdev",2018-12-24T16:20:57.000Z,https://cms.step.plumbing/uploads/PKI_unfurl_d412910c22.png,,False
