id,title,note,excerpt,url,folder,tags,created,cover,highlights,favorite
952009459,Inbox | Substack,,,https://open.substack.com/pub/andrewships/p/prompt-driven-development?r=oc5d&utm_medium=ios,my_library,"prompt-engineering, rubyonrails",2025-01-22T12:50:20.584Z,,,False
940973618,Deploy a Rails app close to your users · Fly,,,https://fly.io/rails?rdt_cid=4716173275158787643&utm_source=reddit,my_library,"cloud, rubyonrails",2025-01-08T22:49:52.449Z,https://fly.io/phx/ui/images/fly-swiss-knife-412e8b8a530616ae108f2b4bafce9373.png?vsn=d,,False
938557288,Parklife - Parklife: turn a Rack app into a static build,,,https://parklife.dev/,my_library,"rubyonrails, static-sites, jekyll",2025-01-06T02:45:53.122Z,,,False
935449410,Rails for everything | Literally the Void,,,https://literallythevoid.com/blog/rails_for_everything.html,my_library,rubyonrails,2025-01-02T02:23:23.406Z,,,False
924555261,Zero-downtime with Rails credentials part II,,Transitioning the codebase from using environment variables to Rails Credentials for Zero-Downtime Deploys.,https://thoughtbot.com/blog/from-environment-variables-to-rails-credentials-part-two,my_library,rubyonrails,2024-12-18T20:12:36.879Z,https://images.prismic.io/thoughtbot-website/Zn0Q2JbWFbowe7qY_default-article-background.png?auto=format%2Ccompress&blend-mode=normal&blend-x=0&blend-y=0&blend=https%3A%2F%2Fimages.prismic.io%2Fthoughtbot-website%2FZ1tQFJbqstJ98cGP_default.png&mark-x=356&mark-y=100&mark64=aHR0cHM6Ly9hc3NldHMuaW1naXgubmV0L350ZXh0Lz90eHQtbGVhZD0tMTUmdHh0LXRyYWNrPTAmdHh0NjQ9V21WeWJ5MWtiM2R1ZEdsdFpTQjNhWFJvSUZKaGFXeHpJR055WldSbGJuUnBZV3h6SUhCaGNuUWdTVWslM0QmdHh0Y2xyPWY1ZjVmNSZ0eHRmb250PUlCTVBsZXhTYW5zSlAtU2VtaUJvbGQmdHh0cGFkPTAmdHh0c2l6ZT03NiZ3PTgwMA%3D%3D&txt-align=center%2Cmiddle&txt-color=f5f5f5&txt-fit=max&txt-font=IBMPlexSansJP-SemiBold&txt-size=24&txt-x=391&txt-y=526&txt=Sami+Birnbaum%2C+et+al,,False
921103425,Rails 8.0: Goodbye Rails::ConsoleMethods - A Developer's Guide to Console Customization,,"Discover why Rails 8.0 removed Rails::ConsoleMethods, learn the impact on your Rails console, and explore modern alternatives.",https://blog.railsforgedev.com/rails-8-console-methods-deprecation-modernizing-extensions,my_library,rubyonrails,2024-12-13T21:56:20.135Z,https://hashnode.com/utility/r?url=https%3A%2F%2Fcdn.hashnode.com%2Fres%2Fhashnode%2Fimage%2Fupload%2Fv1734081377647%2F41ec0ee6-8eb4-4af8-8dd8-6d9417ed6730.jpeg%3Fw%3D1200%26h%3D630%26fit%3Dcrop%26crop%3Dentropy%26auto%3Dcompress%2Cformat%26format%3Dwebp%26fm%3Dpng,,False
913251933,Deploy web apps anywhere,,"From bare metal to cloud VMs using Docker, deploy web apps anywhere with zero downtime.",https://kamal-deploy.org/,my_library,"rubyonrails, kamal",2024-12-02T23:52:54.550Z,https://kamal-deploy.org/assets/images/opengraph.png,,False
902207756,Zero-downtime with Rails credentials,,Transitioning the codebase from using environment variables to Rails Credentials for Zero-Downtime Deploys.,https://thoughtbot.com/blog/from-environment-variables-to-rails-credentials,my_library,"rubyonrails, devops, web-servers",2024-11-16T11:50:05.159Z,https://images.prismic.io/thoughtbot-website/Zn0Q2JbWFbowe7qY_default-article-background.png?auto=format%2Ccompress&mark-x=356&mark-y=100&mark64=aHR0cHM6Ly9hc3NldHMuaW1naXgubmV0L350ZXh0Lz90eHQtbGVhZD0wJnR4dC10cmFjaz0wJnR4dDY0PVdtVnlieTFrYjNkdWRHbHRaU0IzYVhSb0lGSmhhV3h6SUdOeVpXUmxiblJwWVd4eiZ0eHRjbHI9ZjVmNWY1JnR4dGZvbnQ9SUJNUGxleFNhbnNKUC1TZW1pQm9sZCZ0eHRwYWQ9MCZ0eHRzaXplPTY0Jnc9ODAw&txt-align=center%2Cmiddle&txt-color=f5f5f5&txt-fit=max&txt-font=IBMPlexSansJP-SemiBold&txt-size=24&txt-x=391&txt-y=526&txt=Sami+Birnbaum%2C+et+al,"Highlight:Environment variables are not encrypted and therefore they can not be stored in any form of version control.

Highlight:makes it easier to add new credentials because you don’t need to tell other developers to add them to their own .env file.

Highlight:changes to the environment variables are only picked up when you restart the server and not when you simply reload the server.

Highlight:This hot-reloads the puma server and does not cause any downtime.",False
889151261,Agile Web Development with Rails 8,,"Get the comprehensive, insider information you need for Rails 8 with the new edition of this award-winning classic.",https://pragprog.com/titles/rails8/agile-web-development-with-rails-8/,my_library,"books, rubyonrails",2024-10-30T23:44:02.025Z,https://pragprog.com/titles/rails8/rails8-large.jpg,,False
893647124,Deploying a Jekyll site with Kamal,,"Since Kamal 2 can host multiple sites on the same server, I am consolidating my apps into larger hosts so I have less servers to worry about. Most of my apps are Rails apps, but I have a few static jekyll sites like this blog and I decided to look into how could I move this site to a server I host other Rails apps on.",https://greg.molnar.io/blog/deploying-a-jekyll-site-with-kamal/,my_library,"jekyll, rubyonrails",2024-11-05T14:33:07.435Z,https://greg.molnar.io/images/og/posts/deploying-a-jekyll-site-with-kamal.png,,False
892147050,4 tips when getting started with Hotwire,,A few best practices to keep in mind when getting started with Hotwire and Rails.,https://thoughtbot.com/blog/4-tips-when-getting-started-with-hotwire,my_library,rubyonrails,2024-11-04T01:26:08.531Z,https://images.prismic.io/thoughtbot-website/Zn0Q2JbWFbowe7qY_default-article-background.png?auto=format%2Ccompress&mark-x=356&mark-y=100&mark64=aHR0cHM6Ly9hc3NldHMuaW1naXgubmV0L350ZXh0Lz90eHQtbGVhZD0wJnR4dC10cmFjaz0wJnR4dDY0PU5DQjBhWEJ6SUhkb1pXNGdaMlYwZEdsdVp5QnpkR0Z5ZEdWa0lIZHBkR2dnU0c5MGQybHlaUSUzRCUzRCZ0eHRjbHI9ZjVmNWY1JnR4dGZvbnQ9SUJNUGxleFNhbnNKUC1TZW1pQm9sZCZ0eHRwYWQ9MCZ0eHRzaXplPTY0Jnc9ODAw&txt-align=center%2Cmiddle&txt-color=f5f5f5&txt-fit=max&txt-font=IBMPlexSansJP-SemiBold&txt-size=24&txt-x=391&txt-y=526&txt=Jo%C3%ABl+Quenneville,,False
881001472,What's New in Ruby on Rails 8 | Hacker News,,,https://news.ycombinator.com/item?id=41766515,my_library,rubyonrails,2012-10-24T00:00:00.000Z,,,False
881001461,ankane/neighbor,,Nearest neighbor search for Rails.,https://github.com/ankane/neighbor,my_library,rubyonrails,2010-10-24T00:00:00.000Z,https://opengraph.githubassets.com/b145c6e389e22aab2444e1e8949491b0ecfceb450206a4fbfbec69563db43712/ankane/neighbor,,False
881001443,What's New in Ruby on Rails 8,,Let's explore everything that Rails 8 has to offer.,https://blog.appsignal.com/2024/10/07/whats-new-in-ruby-on-rails-8.html,my_library,rubyonrails,2007-10-24T00:00:00.000Z,https://ondemand.bannerbear.com/signedurl/Mn62mqoVbWvyB5wgQ1/image.jpg?modifications=W3sibmFtZSI6InRpdGxlIiwidGV4dCI6IldoYXQncyBOZXcgaW4gUnVieSBvbiBSYWlscyA4In0seyJuYW1lIjoiaW1hZ2UiLCJpbWFnZV91cmwiOiJodHRwczovL2FwcHNpZ25hbC1uZXh0anMtYmxvZy02bzg4a3I5bmctYXBwc2lnbmFsLnZlcmNlbC5hcHAvaW1hZ2VzL2Jsb2cvMjAyNC0xMC9yYWlscy04LmpwZyJ9LHsibmFtZSI6ImNhdGVnb3J5X2xvZ28iLCJpbWFnZV91cmwiOiJodHRwczovL2FwcHNpZ25hbC1uZXh0anMtYmxvZy02bzg4a3I5bmctYXBwc2lnbmFsLnZlcmNlbC5hcHAvaW1hZ2VzL2xvZ29zL3J1YnktbG9nby5wbmcifV0&s=64db325edac26313fa974f1e781aa0b388def9a0200fdbba953ea74b03b740ef,,False
881001279,High Performance PostgreSQL for Rails: Reliable Scalable Maintainable Dat,,"Build fast, scalable PostgreSQL and Rails apps. Solve data growth, quality, and reliability challenges, for workloads from consumer Internet to enterprise SaaS.",https://pragprog.com/titles/aapsql/high-performance-postgresql-for-rails?ref=stepchange-blog.ghost.io,my_library,"books, postgres, rubyonrails",2024-10-19T18:32:36.985Z,https://pragprog.com/titles/aapsql/aapsql-large.jpg,,False
881001256,Even Better Specs,,Guidelines for Maintainable Tests,https://evenbetterspecs.github.io,my_library,rubyonrails,2013-08-24T00:00:00.000Z,https://evenbetterspecs.github.io/icon_og.png,,False
881001245,Why CTOs are choosing Hotwire and Ruby on Rails,,"A conversation with the CTO and Co-founder of Clara, a recent thoughtbot client, about the strategy behind their decision to build their startup product with Rails and Hotwire.",https://thoughtbot.com/blog/the-strategy-behind-hotwire-and-ruby-on-rails-from-the-cto-of-clara,my_library,rubyonrails,2009-08-24T00:00:00.000Z,https://images.prismic.io/thoughtbot-website/Zn0Q2JbWFbowe7qY_default-article-background.png?auto=format%2Ccompress&mark-x=356&mark-y=100&mark64=aHR0cHM6Ly9hc3NldHMuaW1naXgubmV0L350ZXh0Lz90eHQtbGVhZD0wJnR4dC10cmFjaz0wJnR4dDY0PVYyaDVJRU5VVDNNZ1lYSmxJR05vYjI5emFXNW5JRWh2ZEhkcGNtVWdZVzVrSUZKMVlua2diMjRnVW1GcGJITSUzRCZ0eHRjbHI9ZjVmNWY1JnR4dGZvbnQ9SUJNUGxleFNhbnNKUC1TZW1pQm9sZCZ0eHRwYWQ9MCZ0eHRzaXplPTY0Jnc9ODAw&txt-align=center%2Cmiddle&txt-color=f5f5f5&txt-fit=max&txt-font=IBMPlexSansJP-SemiBold&txt-size=24&txt-x=391&txt-y=526&txt=Kelly+Gebo,,False
876797865,Return to the Rails Way: Installing Ruby on Rails in 2024,,Do a 'full fat install' of Ruby on Rails and see what's changed since its heyday of Web 2.0 — and how it has inspired modern frameworks.,https://thenewstack.io/return-to-the-rails-way-installing-ruby-on-rails-in-2024,my_library,rubyonrails,2024-06-30T04:29:01.000Z,https://cdn.thenewstack.io/media/2024/06/105d9ed6-getty-images-kvwvfscntsc-unsplash.jpg,,False
876797198,Monitor the Performance of Your Ruby on Rails Application Using AppSignal,,"In the second part of this two-part series, we'll use AppSignal to monitor the performance of our Ruby on Rails application.",https://blog.appsignal.com/2024/06/12/monitor-the-performance-of-your-ruby-on-rails-application-using-appsignal.html,my_library,rubyonrails,2024-06-13T16:08:35.000Z,https://ondemand.bannerbear.com/signedurl/Mn62mqoVbWvyB5wgQ1/image.jpg?modifications=W3sibmFtZSI6InRpdGxlIiwidGV4dCI6Ik1vbml0b3IgdGhlIFBlcmZvcm1hbmNlIG9mIFlvdXIgUnVieSBvbiBSYWlscyBBcHBsaWNhdGlvbiBVc2luZyBBcHBTaWduYWwifSx7Im5hbWUiOiJpbWFnZSIsImltYWdlX3VybCI6Imh0dHBzOi8vYXBwc2lnbmFsLW5leHRqcy1ibG9nLW55cXI2cWNyOC1hcHBzaWduYWwudmVyY2VsLmFwcC9pbWFnZXMvYmxvZy8yMDI0LTA2L2RpZ2l0YWxvY2Vhbi1wMi5qcGcifSx7Im5hbWUiOiJjYXRlZ29yeV9sb2dvIiwiaW1hZ2VfdXJsIjoiaHR0cHM6Ly9hcHBzaWduYWwtbmV4dGpzLWJsb2ctbnlxcjZxY3I4LWFwcHNpZ25hbC52ZXJjZWwuYXBwL2ltYWdlcy9sb2dvcy9ydWJ5LWxvZ28ucG5nIn1d&s=4152e2f6234be9e8bf4f9d2ec741b085ab5aaf12664e79d8bd97606d0d9ef7d7,,False
876797109,How to Use Tailwind CSS for Your Ruby On Rails Project,,Let's see how we can use Tailwind CSS in a Rails application and explore its utility-first approach.,https://blog.appsignal.com/2024/06/05/how-to-use-tailwind-css-for-your-ruby-on-rails-project.html,my_library,"css, rubyonrails",2024-06-05T16:56:12.000Z,https://ondemand.bannerbear.com/signedurl/Mn62mqoVbWvyB5wgQ1/image.jpg?modifications=W3sibmFtZSI6InRpdGxlIiwidGV4dCI6IkhvdyB0byBVc2UgVGFpbHdpbmQgQ1NTIGZvciBZb3VyIFJ1YnkgT24gUmFpbHMgUHJvamVjdCJ9LHsibmFtZSI6ImltYWdlIiwiaW1hZ2VfdXJsIjoiaHR0cHM6Ly9hcHBzaWduYWwtbmV4dGpzLWJsb2ctb25xcXE4bnVuLWFwcHNpZ25hbC52ZXJjZWwuYXBwL2ltYWdlcy9ibG9nLzIwMjQtMDYvdGFpbHdpbmQtcmFpbHMuanBnIn0seyJuYW1lIjoiY2F0ZWdvcnlfbG9nbyIsImltYWdlX3VybCI6Imh0dHBzOi8vYXBwc2lnbmFsLW5leHRqcy1ibG9nLW9ucXFxOG51bi1hcHBzaWduYWwudmVyY2VsLmFwcC9pbWFnZXMvbG9nb3MvcnVieS1sb2dvLnBuZyJ9XQ&s=e79d0b4307391bcfd8dea48bf7d152533f628e2600495c565ece842431f68625,,False
876797097,HTML Over The Wire,,Hotwire is an alternative approach to building modern web applications without using much JavaScript by sending HTML instead of JSON over the wire.,https://hotwired.dev,my_library,"html, javascript, rubyonrails, webdev",2024-06-04T01:47:04.000Z,,,False
876797088,Gemfile of dreams: the libraries we use to build Rails apps,,We unveil the toolbox of the Martian Rails engineer; we begin constructing a Gemfile from the universe of Martian gems that encapsulate our philosophy and soul.,https://evilmartians.com/chronicles/gemfile-of-dreams-libraries-we-use-to-build-rails-apps,my_library,"rubygems, rubyonrails",2024-06-01T23:12:39.000Z,https://evilmartians.com/social-cards/chronicles/gemfile-of-dreams-libraries-we-use-to-build-rails-apps.jpg,,False
876797084,Getting Started: Your Ruby On Rails App Hosted On DigitalOcean With AppSign,,"In the first part of a two-part series, we'll introduce how to set up DigitalOcean and AppSignal for a Ruby on Rails application.",https://blog.appsignal.com/2024/05/29/getting-started-your-ruby-on-rails-app-hosted-on-digitalocean-with-appsignal.html,my_library,"cloud, rubyonrails",2024-05-31T13:48:00.000Z,https://ondemand.bannerbear.com/signedurl/Mn62mqoVbWvyB5wgQ1/image.jpg?modifications=W3sibmFtZSI6InRpdGxlIiwidGV4dCI6IkdldHRpbmcgU3RhcnRlZDogWW91ciBSdWJ5IE9uIFJhaWxzIEFwcCBIb3N0ZWQgT24gRGlnaXRhbE9jZWFuIFdpdGggQXBwU2lnbmFsIn0seyJuYW1lIjoiaW1hZ2UiLCJpbWFnZV91cmwiOiJodHRwczovL2FwcHNpZ25hbC1uZXh0anMtYmxvZy1ueXFyNnFjcjgtYXBwc2lnbmFsLnZlcmNlbC5hcHAvaW1hZ2VzL2Jsb2cvMjAyNC0wNS9kaWdpdGFsb2NlYW4tcDEuanBnIn0seyJuYW1lIjoiY2F0ZWdvcnlfbG9nbyIsImltYWdlX3VybCI6Imh0dHBzOi8vYXBwc2lnbmFsLW5leHRqcy1ibG9nLW55cXI2cWNyOC1hcHBzaWduYWwudmVyY2VsLmFwcC9pbWFnZXMvbG9nb3MvcnVieS1sb2dvLnBuZyJ9XQ&s=de7eb5a71347c965bc0762d2eb26165e1d24747c2e976b6d90036fcffe938e59,,False
876797034,Install Ruby On Rails on Ubuntu 24.04 Noble Numbat | GoRails,,"A guide to setting up a Ruby on Rails development environment on Ubuntu 24.04 Noble Numbat with Git, MySQL, and PostgreSQL",https://gorails.com/setup/ubuntu/24.04,my_library,rubyonrails,2024-05-24T20:54:09.000Z,,,False
876796803,How to integrate React with Rails 7,,Want to setup React on your Rails 7 app but don’t know how do it? Read this post to explore options to consider when using React with Ruby on Rails.,https://thoughtbot.com/blog/how-to-integrate-react-rails,my_library,"reactjs, rubyonrails",2024-04-29T23:59:57.000Z,https://images.prismic.io/thoughtbot-website/Zn0Q2JbWFbowe7qY_default-article-background.png?auto=format%2Ccompress&mark-x=356&mark-y=100&mark64=aHR0cHM6Ly9hc3NldHMuaW1naXgubmV0L350ZXh0Lz90eHQtbGVhZD0wJnR4dC10cmFjaz0wJnR4dDY0PVNHOTNJSFJ2SUdsdWRHVm5jbUYwWlNCU1pXRmpkQ0IzYVhSb0lGSmhhV3h6SURjJTNEJnR4dGNscj1mNWY1ZjUmdHh0Zm9udD1JQk1QbGV4U2Fuc0pQLVNlbWlCb2xkJnR4dHBhZD0wJnR4dHNpemU9NjQmdz04MDA%3D&txt-align=center%2Cmiddle&txt-color=f5f5f5&txt-fit=max&txt-font=IBMPlexSansJP-SemiBold&txt-size=24&txt-x=391&txt-y=526&txt=Dave+Iverson,,False
876796801,Using Active Storage To Handle Image Uploads In Ruby On Rails,,"Active Storage is a framework that handles file uploads, allowing you to store them as attachments...",https://dev.to/awaiszafar14/using-active-storage-to-handle-image-uploads-in-ruby-on-rails-450c,my_library,rubyonrails,2024-04-29T23:57:11.000Z,"https://media.dev.to/dynamic/image/width=1000,height=500,fit=cover,gravity=auto,format=auto/https%3A%2F%2Fdev-to-uploads.s3.amazonaws.com%2Fuploads%2Farticles%2Fbsjamsc116t6zq7htept.jpg",,False
876796783,Autotuner: How to Speed Up Your Rails App,,"Ruby’s garbage collector is designed to be adaptable, scaling from short Ruby scripts to running apps that serve millions of requests per second. While it’s designed to be adaptable, it may not work optimally for every use case. For this reason, Ruby’s garbage collector supports many parameters that can be used to tune it. However, the use of these parameters requires knowledge into how the garbage collector works on the inside. Learn how the Autotuner gem can analyze your app’s traffic and provide suggestions for tuning the garbage collector.",https://railsatscale.com/2024-04-24-autotuner-how-to-speed-up-your-rails-app,my_library,"garbage-collection, rubyonrails",2024-04-26T00:41:19.000Z,https://railsatscale.com/2024-04-24-autotuner-how-to-speed-up-your-rails-app/f97fcae7b93bea0e3ce982cb49db85def0d18104.png,,False
876796765,SQLite on Rails: The how and why of optimal performance,,"This is my personal site, where I write about Ruby, programming, and any of my varied fascinations.",https://fractaledmind.github.io/2024/04/15/sqlite-on-rails-the-how-and-why-of-optimal-performance,my_library,"rubyonrails, sqlite",2024-04-23T19:07:02.000Z,,,False
876795643,Pricing | Heroku,,"Heroku offers simple, flexible pricing to meet the needs of every app and every organization. Add data stores, cloud services, support, and more.",https://www.heroku.com/pricing,my_library,"heroku, pricing, rubyonrails",2024-04-16T05:31:59.000Z,https://www.herokucdn.com/images/og.png,,False
876795461,How (and why) to run SQLite in production: RubyConf Taiwan 2023,,"This is my personal site, where I write about Ruby, programming, and any of my varied fascinations.",https://fractaledmind.github.io/2023/12/23/rubyconftw,my_library,"devops, rubyonrails, sqlite",2024-03-27T20:34:47.000Z,,,False
876795434,Rails: How Rails Find Generators,,All of us rails developers have used generators before. Either it is when we run rails new or rails generate scaffold. These commands…,https://medium.com/@kingsobino/rails-how-rails-find-generators-19694db148da,my_library,rubyonrails,2024-03-23T18:45:46.000Z,https://miro.medium.com/v2/resize:fit:1000/0*bc8Z6Rp4cUifjx75.jpg,,False
876795425,How the Rails params hash works,,This article was originally written by Jeffery Morhous on the Honeybadger Developer Blog.  In Ruby on...,https://dev.to/honeybadger/how-the-rails-params-hash-works-3on2,my_library,rubyonrails,2024-03-21T01:59:50.000Z,"https://media.dev.to/dynamic/image/width=1000,height=500,fit=cover,gravity=auto,format=auto/https%3A%2F%2Fdev-to-uploads.s3.amazonaws.com%2Fuploads%2Farticles%2F8uf5bfsc1952ykqcgr2h.png",,False
876795423,Good Database Migration Practices for Your Ruby on Rails App using Strong M,,"Let's explore Strong Migrations, a gem that can help you maintain good practices with your database migrations in Ruby on Rails.",https://blog.appsignal.com/2024/03/20/good-database-migration-practices-for-your-ruby-on-rails-app-using-strong-migrations.html,my_library,rubyonrails,2024-03-20T13:21:00.000Z,https://ondemand.bannerbear.com/signedurl/Mn62mqoVbWvyB5wgQ1/image.jpg?modifications=W3sibmFtZSI6InRpdGxlIiwidGV4dCI6Ikdvb2QgRGF0YWJhc2UgTWlncmF0aW9uIFByYWN0aWNlcyBmb3IgWW91ciBSdWJ5IG9uIFJhaWxzIEFwcCB1c2luZyBTdHJvbmcgTWlncmF0aW9ucyJ9LHsibmFtZSI6ImltYWdlIiwiaW1hZ2VfdXJsIjoiaHR0cHM6Ly9hcHBzaWduYWwtbmV4dGpzLWJsb2ctbnlxcjZxY3I4LWFwcHNpZ25hbC52ZXJjZWwuYXBwL2ltYWdlcy9ibG9nLzIwMjQtMDMvc3Ryb25nLW1pZ3JhdGlvbnMuanBnIn0seyJuYW1lIjoiY2F0ZWdvcnlfbG9nbyIsImltYWdlX3VybCI6Imh0dHBzOi8vYXBwc2lnbmFsLW5leHRqcy1ibG9nLW55cXI2cWNyOC1hcHBzaWduYWwudmVyY2VsLmFwcC9pbWFnZXMvbG9nb3MvcnVieS1sb2dvLnBuZyJ9XQ&s=64ba1ff47bc1cb3b368132f283fce836d81f6d9a1bc00e0b082dfb1b7b4c1a6f,,False
876795347,Active Record or Sequel: Which Best Fits The Needs of Your Ruby App?,,"Let's compare some Active Record features to its lesser-known but powerful cousin, Sequel.",https://blog.appsignal.com/2024/03/06/active-record-or-sequel-which-best-fits-the-needs-of-your-ruby-app.html,my_library,rubyonrails,2024-03-07T07:11:11.000Z,https://ondemand.bannerbear.com/signedurl/Mn62mqoVbWvyB5wgQ1/image.jpg?modifications=W3sibmFtZSI6InRpdGxlIiwidGV4dCI6IkFjdGl2ZSBSZWNvcmQgb3IgU2VxdWVsOiBXaGljaCBCZXN0IEZpdHMgVGhlIE5lZWRzIG9mIFlvdXIgUnVieSBBcHA_In0seyJuYW1lIjoiaW1hZ2UiLCJpbWFnZV91cmwiOiJodHRwczovL2FwcHNpZ25hbC1uZXh0anMtYmxvZy1ueXFyNnFjcjgtYXBwc2lnbmFsLnZlcmNlbC5hcHAvaW1hZ2VzL2Jsb2cvMjAyNC0wMy9zZXF1ZWwtYWN0aXZlcmVjb3JkLmpwZyJ9LHsibmFtZSI6ImNhdGVnb3J5X2xvZ28iLCJpbWFnZV91cmwiOiJodHRwczovL2FwcHNpZ25hbC1uZXh0anMtYmxvZy1ueXFyNnFjcjgtYXBwc2lnbmFsLnZlcmNlbC5hcHAvaW1hZ2VzL2xvZ29zL3J1YnktbG9nby5wbmcifV0&s=086d54be22f2347e61a268c263a8d42e9e761b8025f421fd34fbf01e0b746afd,,False
876795334,Why Rails is a Great Choice for Startups in 2024,,"JavaScript is in the vogue now, but Ruby on Rails can become your startup’s secret competitive advantage.",https://www.gregnavis.com/articles/why-rails-is-a-great-choice-for-startups-in-2024.html,my_library,rubyonrails,2024-03-05T21:42:36.000Z,,,False
876795270,Active Record and PostgreSQL — Ruby on Rails Guides,,"Active Record and PostgreSQLThis guide covers PostgreSQL specific usage of Active Record.After reading this guide, you will know: How to use PostgreSQL's datatypes. How to use UUID primary keys. How to include non-key columns in indexes. How to use deferrable foreign keys. How to use unique constraints. How to implement exclusion constraints. How to implement full text search with PostgreSQL. How to back your Active Record models with database views.",https://guides.rubyonrails.org/active_record_postgresql.html,my_library,"postgres, rubyonrails",2024-02-29T23:45:24.000Z,https://avatars.githubusercontent.com/u/4223,,False
876794105,Hotwire Modals in Ruby on Rails with Stimulus and Turbo Frames,,"In the first part of our series, we'll explore two Hotwire methods to make modals accessible in your Rails application.",https://blog.appsignal.com/2024/02/21/hotwire-modals-in-ruby-on-rails-with-stimulus-and-turbo-frames.html,my_library,"html, javascript, rubyonrails, ui-ux",2024-02-23T18:51:01.000Z,https://ondemand.bannerbear.com/signedurl/Mn62mqoVbWvyB5wgQ1/image.jpg?modifications=W3sibmFtZSI6InRpdGxlIiwidGV4dCI6IkhvdHdpcmUgTW9kYWxzIGluIFJ1Ynkgb24gUmFpbHMgd2l0aCBTdGltdWx1cyBhbmQgVHVyYm8gRnJhbWVzIn0seyJuYW1lIjoiaW1hZ2UiLCJpbWFnZV91cmwiOiJodHRwczovL2FwcHNpZ25hbC1uZXh0anMtYmxvZy1ueXFyNnFjcjgtYXBwc2lnbmFsLnZlcmNlbC5hcHAvaW1hZ2VzL2Jsb2cvMjAyNC0wMi9ob3R3aXJlLXAxLmpwZyJ9LHsibmFtZSI6ImNhdGVnb3J5X2xvZ28iLCJpbWFnZV91cmwiOiJodHRwczovL2FwcHNpZ25hbC1uZXh0anMtYmxvZy1ueXFyNnFjcjgtYXBwc2lnbmFsLnZlcmNlbC5hcHAvaW1hZ2VzL2xvZ29zL3J1YnktbG9nby5wbmcifV0&s=ce18d1f1edeba06dbbe83d2b58298b437d29a7ce2a13f007ae44dd30fab56545,,False
876794104,Effective Queries with Rails and PostgreSQL - Honeybadger Developer Blog,,"Getting data *into* your database is easy, but querying large datasets is challenging—especially without the right indexes. Pavel Tkachenko teaches how to write performant SQL queries with EXPLAIN and ANALYZE.",https://www.honeybadger.io/blog/rails-postgresql-queries,my_library,"postgres, rubyonrails",2024-02-23T18:46:25.000Z,https://ondemand.bannerbear.com/signedurl/nZ52rq9EkQ6V3bp1Lj/image.jpg?modifications=W3sibmFtZSI6InRpdGxlIiwidGV4dCI6IkVmZmVjdGl2ZSBRdWVyaWVzIHdpdGggUmFpbHMgYW5kIFBvc3RncmVTUUwiLCJjb2xvciI6bnVsbCwiYmFja2dyb3VuZCI6bnVsbH0seyJuYW1lIjoiaGVhZHNob3QiLCJpbWFnZV91cmwiOiJodHRwczovL3d3dy1maWxlcy5ob25leWJhZGdlci5pby9hdXRob3JzL3BhdmVsdGthY2hlbmtvLnBuZyJ9LHsibmFtZSI6InN1bW1hcnkiLCJ0ZXh0IjoiR2V0dGluZyBkYXRhICppbnRvKiB5b3VyIGRhdGFiYXNlIGlzIGVhc3ksIGJ1dCBxdWVyeWluZyBsYXJnZSBkYXRhc2V0cyBpcyBjaGFsbGVuZ2luZ-KAlGVzcGVjaWFsbHkgd2l0aG91dCB0aGUgcmlnaHQgaW5kZXhlcy4gUGF2ZWwgVGthY2hlbmtvIHRlYWNoZXMgaG93IHRvIHdyaXRlIHBlcmZvcm1hbnQgU1FMIHF1ZXJpZXMgd2l0aCBFWFBMQUlOIGFuZCBBTkFMWVpFLiIsImNvbG9yIjpudWxsLCJiYWNrZ3JvdW5kIjpudWxsfSx7Im5hbWUiOiJhdXRob3IiLCJ0ZXh0IjoiQnkgKlBhdmVsIFRrYWNoZW5rbyoiLCJjb2xvciI6bnVsbCwiYmFja2dyb3VuZCI6bnVsbH0seyJuYW1lIjoidGFncyIsInRleHQiOiIjcnVieSAjcmFpbHMgI3Bvc3RncmVzcWwiLCJjb2xvciI6bnVsbCwiYmFja2dyb3VuZCI6bnVsbH1d&s=6d6f8d799a5c98d194c052e1fc88a8901df9ff1f8171b5bce0c969dedec2ce55,,False
876794000,Full-Text Search for Ruby on Rails with Litesearch,,"In part six of our series, we'll use Litesearch, the last piece of the puzzle in LiteStack.",https://blog.appsignal.com/2024/02/14/full-text-search-for-ruby-on-rails-with-litesearch.html,my_library,"rubyonrails, search",2024-02-15T04:23:32.000Z,https://ondemand.bannerbear.com/signedurl/Mn62mqoVbWvyB5wgQ1/image.jpg?modifications=W3sibmFtZSI6InRpdGxlIiwidGV4dCI6IkZ1bGwtVGV4dCBTZWFyY2ggZm9yIFJ1Ynkgb24gUmFpbHMgd2l0aCBMaXRlc2VhcmNoIn0seyJuYW1lIjoiaW1hZ2UiLCJpbWFnZV91cmwiOiJodHRwczovL2FwcHNpZ25hbC1uZXh0anMtYmxvZy1ueXFyNnFjcjgtYXBwc2lnbmFsLnZlcmNlbC5hcHAvaW1hZ2VzL2Jsb2cvMjAyNC0wMi9saXRlc3RhY2stcDYuanBnIn0seyJuYW1lIjoiY2F0ZWdvcnlfbG9nbyIsImltYWdlX3VybCI6Imh0dHBzOi8vYXBwc2lnbmFsLW5leHRqcy1ibG9nLW55cXI2cWNyOC1hcHBzaWduYWwudmVyY2VsLmFwcC9pbWFnZXMvbG9nb3MvcnVieS1sb2dvLnBuZyJ9XQ&s=498ad989fa9ba50ca8c2dc62617d4009ca0dead0678964fd20043990ba1f0ef8,,False
876793837,Rails advanced routing constraints,,Learn how to authorize requests at the routing layer to improve security and ergonomics.,https://thoughtbot.com/blog/rails-advanced-routing-constraints,my_library,rubyonrails,2024-01-25T16:18:59.000Z,https://images.prismic.io/thoughtbot-website/Zn0Q2JbWFbowe7qY_default-article-background.png?auto=format%2Ccompress&mark-x=356&mark-y=100&mark64=aHR0cHM6Ly9hc3NldHMuaW1naXgubmV0L350ZXh0Lz90eHQtbGVhZD0wJnR4dC10cmFjaz0wJnR4dDY0PVVtRnBiSE1nWVdSMllXNWpaV1FnY205MWRHbHVaeUJqYjI1emRISmhhVzUwY3clM0QlM0QmdHh0Y2xyPWY1ZjVmNSZ0eHRmb250PUlCTVBsZXhTYW5zSlAtU2VtaUJvbGQmdHh0cGFkPTAmdHh0c2l6ZT02NCZ3PTgwMA%3D%3D&txt-align=center%2Cmiddle&txt-color=f5f5f5&txt-fit=max&txt-font=IBMPlexSansJP-SemiBold&txt-size=24&txt-x=391&txt-y=526&txt=Steve+Polito,,False
876793764,The Rails Config File,,The ~/.railsrc file configures your Rails applications and lets you pre-configure the gems you want in all your Rails apps.,https://www.writesoftwarewell.com/railsrc-rails-configuration-file,my_library,rubyonrails,2024-01-12T07:42:44.000Z,https://www.writesoftwarewell.com/content/images/2024/01/railsrc.png,,False
876793762,Here's what's coming in Rails 8,,"Work on Rails 8 is starting, so I dug through the official GitHub milestone to break down all the upcoming goodies for you. There's plenty coming, including Solid Queue, Solid Cache and Kamal becoming defaults, better support for PWAs, an official LSP, and more!",https://railsnotes.xyz/blog/rails-8-whats-coming,my_library,rubyonrails,2024-01-11T04:12:23.000Z,https://railsnotes.xyz/static/images/rails-8-whats-coming/cover.png,,False
876793712,Performance Guide to create 100k records in less than 3s using Ruby on Rail,,"When working on large-scale projects, quickly creating test data or dummy data can be crucial. In...",https://dev.to/justthev/performance-guide-to-create-100k-records-in-less-than-3s-using-ruby-on-rails-3k07,my_library,"ruby, rubyonrails",2023-10-28T19:45:00.000Z,"https://media.dev.to/dynamic/image/width=1000,height=500,fit=cover,gravity=auto,format=auto/https%3A%2F%2Fdev-to-uploads.s3.amazonaws.com%2Fuploads%2Farticles%2Fyp3kwe3b3viq279glxw7.png",,False
