id,title,note,excerpt,url,folder,tags,created,cover,highlights,favorite
876786383,Eye-Catching Typography To Get More Leads,,"Noupe passionately delivers stylish and dynamic news for designers and Web developers across the globe on all subjects of design; ranging from CSS, Photography, JavaScript, Web design, Graphics, Typography and much more.",https://www.noupe.com/inspiration/typography-to-get-more-leads.html,my_library,"design, fonts-typography, webdev",2022-07-06T12:31:09.000Z,,,False
876784818,6 In-demand Marketing Skills for Your Design CV,,"In today’s tech-savvy world, being a great designer is not all about being a whiz at tools such as Adobe Photoshop and Adobe Illustrator. The job is",https://www.noupe.com/inspiration/in-demand-marketing-skills-for-your-design-cv.html,my_library,"css, design, design-patterns, fonts-typography, keywords-ppc-seo, programming, ui-ux, webdev",2022-06-21T13:48:58.000Z,https://www.noupe.com/wp-content/uploads/2022/06/amy-hirschi-JaoVGh5aJ3E-unsplash.jpg,,False
876782017,7 Practical Tips for Cheating at Design,,Improving your designs with tactics instead of talent.,https://medium.com/refactoring-ui/7-practical-tips-for-cheating-at-design-40c736799886,my_library,"css, fonts-typography, ui-ux, webdev",2022-01-16T19:17:59.000Z,https://miro.medium.com/v2/resize:fit:1200/1*2YuCOOCjdMEJxg-Lb6G2FA.png,,False
876780884,A Comprehensive Guide to Font Loading Strategies—zachleat.com,,A post by Zach Leatherman (zachleat),https://www.zachleat.com/web/comprehensive-webfonts,my_library,"fonts-typography, webdev",2021-12-13T12:22:01.000Z,https://v1.screenshot.11ty.dev/https%3A%2F%2Fwww.zachleat.com%2Fopengraph%2Fweb%2Fcomprehensive-webfonts%2F%3Fcache%3D20240912/opengraph//,,False
876779139,Improving The Performance Of An Online Store (Case Study),,Getting a good performance score from Google is hard for any website — but doing so for an online store is even harder. We achieved green scores — even several for mobile. Here is how we did it.,https://smashingmagazine.com/2021/06/front-end-performance-online-store-jewellerybox,my_library,"css, design, ecommerce, fonts-typography, javascript, prodmgmt, webdev",2021-06-03T01:40:22.000Z,https://archive.smashing.media/assets/344dbf88-fdf9-42bb-adb4-46f01eedd629/8a350bf5-9114-420c-b587-fee03ea4acb6/jewellerybox-uk-online-store-scipioerp.jpg,,False
