id,title,note,excerpt,url,folder,tags,created,cover,highlights,favorite
876793689,Planning poker - Wikipedia,,"Planning poker, also called Scrum poker, is a consensus-based, gamified technique for estimating, mostly used for timeboxing in Agile principles. In planning poker, members of the group make estimates by playing numbered cards face-down to the table, instead of speaking them aloud. The cards are revealed, and the estimates are then discussed. By hiding the figures in this way, the group can avoid the cognitive bias of anchoring, where the first number spoken aloud sets a precedent for subsequent estimates.",https://en.wikipedia.org/wiki/Planning_poker,my_library,"agile, feature-engineering, features-benefits, prodmgmt, projmgmt",2023-10-20T01:13:10.000Z,https://upload.wikimedia.org/wikipedia/commons/e/eb/CrispPlanningPokerDeck.jpg,,False
876788507,Why public chats are better than direct messages,,How we communicate makes an enormous impact on our work. One of the best strategies for improving communication in a team is making it open,https://teamplify.com/blog/why-public-chats-are-better-than-direct-messages,my_library,"communities, prodmgmt, projmgmt",2022-09-10T03:11:31.000Z,,,False
876787766,Acceptance Criteria vs Requirements: Definition and Examples | ProjectPractical.com,,"When you’re defining your software or new product’s requirements, a set of criteria come into play. Acceptance criteria are one part of those criteria that are either agreed upon or come out of client/customer discussions. Unlike requirements, acceptance criteria define what must happen when a decision point such as an objective has been met. Acceptance ... Read more",https://www.projectpractical.com/acceptance-criteria-vs-requirements-definition-and-examples,my_library,"prodmgmt, projmgmt",2022-08-15T14:29:40.000Z,https://www.projectpractical.com/wp-content/uploads/2021/07/Acceptance-Criteria-vs-Requirements.jpg,,False
876787450,Products Over Projects,,"Projects are a popular way of organizing software efforts, but long-running product teams are often superior",https://martinfowler.com/articles/products-over-projects.html,my_library,"prodmgmt, projmgmt",2022-07-18T16:15:18.000Z,https://martinfowler.com/logo-sq.png,,False
876784108,Setting UX Roles and Responsibilities in Product Development: The RACI Temp,,"Use a flexible responsibility-assignment matrix to clarify UX roles and responsibilities, anticipate team collaboration points, and maintain productivity in product development.",https://www.nngroup.com/articles/ux-roles-responsibilities,my_library,"prodmgmt, programming, projmgmt, ui-ux",2022-06-07T18:20:12.000Z,https://media.nngroup.com/media/articles/opengraph_images/The_RACI_Template_Social_Posts_2022_4.png,,False
876778395,Research: How to Get Better at Killing Bad Projects,,"Most innovation managers know that few of their initiatives will succeed, so they keep multiple projects running at the same time and create processes for quickly separating winners from losers. One popular way to make decisions about what stays and what goes is the use of stage gates. Yet, even with stage gates, firms struggle to kill bad projects. The authors undertook a decade-long review of the product development portfolio at former handset maker Sony Ericsson. They found that that the conventional use of stage gates can actually be part of the problem, impeding project discontinuation in counterintuitive ways.",https://hbr.org/2021/04/research-how-to-get-better-at-killing-bad-projects,my_library,"decisions, prodmgmt, projmgmt",2021-04-05T15:04:03.000Z,https://hbr.org/resources/images/article_assets/2021/04/Apr21_02_sb10067440A-002.jpg,,False
876771875,How to avoid losses and prune projects proactively,,It’s common for companies to hang on for too long to projects or parts of the business that are underperforming. Two effective techniques can help executives make project investment decisions on when to hold on to an asset and when to let it go.,https://www.mckinsey.com/business-functions/strategy-and-corporate-finance/our-insights/how-to-avoid-losses-and-prune-projects-proactively,my_library,"finance, prodmgmt, projmgmt, risk",2019-08-29T22:01:55.000Z,https://www.mckinsey.com/~/media/mckinsey/business%20functions/strategy%20and%20corporate%20finance/our%20insights/how%20to%20avoid%20losses%20and%20prune%20projects%20proactively/how-to-avoid-losses-and-prune-1536x1536-200.jpg,,False
