id,title,note,excerpt,url,folder,tags,created,cover,highlights,favorite
916695430,7 New Books added to Big Book of R [7/12/2024] | R-bloggers,,"I’m very happy to introduce 7 additions to the Big Book of R collection which now stands at almost 450 free, open-source R programming books. A special thanks to Gary and Lucca Scrucca for their submissions. In case you missed it, the Big Book of R bot is live on … The post 7 New Books added to Big Book of R [7/12/2024] appeared first on Oscar Baruffa.",https://www.r-bloggers.com/2024/12/7-new-books-added-to-big-book-of-r-7-12-2024/,my_library,"books, _r_",2024-12-07T21:39:57.802Z,https://www.r-bloggers.com/wp-content/uploads/2016/04/R_02_2016-05-01.png,,False
876793753,Spatial Statistics for Data Science: Theory and Practice with R,,A book for Spatial Statistics for Data Science with R.,https://www.paulamoraga.com/book-spatial/index.html,my_library,"books, spatial, _r_",2024-01-08T01:56:55.000Z,https://www.paulamoraga.com/img/cover.png,,False
876789677,Forecasting: Principles&nbsp;and&nbsp;Practice (3rd ed),,3rd edition,https://otexts.com/fpp3,my_library,"algorithms-math, books, forecasting-predictions, supply-chain, _r_",2022-12-10T16:05:58.000Z,https://otexts.com/fpp3///figs/fpp3_front_cover.jpg,,False
876787599,Welcome | Handbook of Graphs and Networks in People Analytics,,"A technical manual of graphs, networks and their applications in the people and social sciences",https://ona-book.org/index.html,my_library,"books, graphs, python, _r_",2022-07-20T12:35:32.000Z,https://ona-book.org/www/cover/cover-ona.png,,False
876782874,"R Graphics Cookbook, 2nd edition",,"This cookbook contains more than 150 recipes to help scientists, engineers, programmers, and data analysts generate high-quality graphs quickly—without having to comb through all the details of R’s graphing systems. Each recipe tackles a specific problem with a solution you can apply to your own project and includes a discussion of how and why the recipe works.",https://r-graphics.org,my_library,"books, visualization, _r_",2022-03-21T20:40:25.000Z,https://r-graphics.org/cover.jpg,,False
876782873,Text Mining with R,,"A guide to text analysis within the tidy data framework, using the tidytext package and other tidy tools",https://www.tidytextmining.com/index.html,my_library,"books, text, _r_",2022-03-21T20:39:34.000Z,https://www.tidytextmining.com/images/cover.png,,False
876782872,Welcome · Advanced R.,,,http://adv-r.had.co.nz,my_library,"books, machine-learning, _r_",2022-03-21T20:39:15.000Z,,,False
876779808,An Introduction to Statistical Learning,,,https://www.statlearning.com,my_library,"books, machine-learning, _r_",2021-08-05T16:59:23.000Z,,,False
876779158,Big Book of R has over 200 books! | R-bloggers,,"Way back in August 2020, I launched Big Book of R, a collection of free (and some paid) R programming books organised by categories like Geospatial, Statistics, Packages and many more. What started off as a 100 book collection has now grown to over 200 :D! Anyway, I felt was … The post Big Book of R has over 200 books! appeared first on Oscar Baruffa.",https://www.r-bloggers.com/2021/05/big-book-of-r-has-over-200-books,my_library,"books, _r_",2021-06-06T23:22:30.000Z,https://i1.wp.com/oscarbaruffa.com/wp-content/uploads/2021/05/Big-Book-of-R-200.png?resize=392%2C209&ssl=1,,False
