id,title,note,excerpt,url,folder,tags,created,cover,highlights,favorite
876795487,The Great Migration from MongoDB to PostgreSQL,,How Infisical migrated from MongoDB to PostgreSQL.,https://infisical.com/blog/postgresql-migration-technical,my_library,"databases, mongodb, postgres",2024-03-31T02:13:59.000Z,https://infisical.com/static/images/postgresql-migration-technical.png,,False
876790862,The Tough Climb To Profitability For MongoDB,,There is something weird about storage companies that were started around the same time as the Great Recession. The big ones that have gone public after,https://www.nextplatform.com/2023/03/09/the-tough-climb-to-profitability-for-mongodb,my_library,"databases, mongodb",2023-03-10T20:19:55.000Z,https://www.nextplatform.com/wp-content/uploads/2020/06/mongodb-logo.jpg,,False
876788763,How to setup MongoDB with Jupyter Notebook,,I have to conclusion how to setup MongoDB (NoSQL) with Jupyter Notebook by summary step like...,https://dev.to/kullawattana/how-to-setup-mongodb-with-jupyter-notebook-mnh,my_library,"databases, jupyter, mongodb",2022-10-19T12:04:22.000Z,https://dev-to-uploads.s3.amazonaws.com/uploads/articles/3otvb2z646ytpt1hl2rv.jpg,,False
876788398,How Discord Stores Billions of Messages,,We decided early on to store all chat history forever so users can come back at any time and have their data available. This is a lot of data: how do we do it?,https://discord.com/blog/how-discord-stores-billions-of-messages,my_library,"databases, devops, mongodb",2022-08-28T00:37:23.000Z,https://cdn.prod.website-files.com/5f9072399b2640f14d6a2bf4/612414349957074a5778efc4_1_8eA5bgAG9NmCJshhccMhZQ.png,,False
876777406,8 Examples to Query a NoSQL Database,,A practical guide with MongoDB,https://towardsdatascience.com/8-examples-to-query-a-nosql-database-fc3dd1c9a8c,my_library,"databases, mongodb, nosql",2021-01-23T21:37:52.000Z,https://miro.medium.com/v2/resize:fit:1200/1*eACslI-RYU6vHUReWgMbRQ.jpeg,,False
876777405,Setup Ruby on Rails 6 App with MongoDB under 5 Minutes — Aarvy | by Aarvy |,,"In this article, I will be discussing how to quickly setup a NoSQL database MongoDB with your brand new Rails 6 app. I am using Ubuntu…",https://aarvy.medium.com/setup-ruby-on-rails-6-app-with-mongodb-under-5-minutes-aarvy-56a6a535139d,my_library,"databases, mongodb, rubyonrails",2021-01-23T21:27:42.000Z,https://miro.medium.com/v2/da:true/resize:fit:1200/0*0K2WV1VnHGzH3k7v,,False
876774929,MongoDB Vs SQL,,"MongoDB and SQL databases are two polar opposite sides of the backend world. The former deals with chaotic unstructured data, while the…",https://towardsdatascience.com/mongodb-vs-sql-237535a3d51c?source=rss----7f60cf5620c9---4,my_library,"databases, mongodb, nosql, sql",2020-05-19T20:54:17.000Z,https://miro.medium.com/v2/resize:fit:1024/0*LRjbhW_YoqJ_wFlh.jpg,,False
