id,title,note,excerpt,url,folder,tags,created,cover,highlights,favorite
876793024,Machine Learning Using Decision Trees in Ruby,,"In the era of hyper-sophisticated machine learning models like ChatGPT, it is surprising how effective the classic decision tree model remains, especially when used in conjunction with other techniques, such as bagging, boosting and random forests. In this blog post we demonstrate how to build an effective decision tree model, and train this model on some sample data.",https://www.vector-logic.com/blog/posts/machine-learning-using-decision-trees-in-ruby,my_library,"decision-trees, machine-learning, ruby",2023-09-17T22:10:43.000Z,https://vector-logic-uploads.s3.eu-west-1.amazonaws.com/c8twh8tz2af2dodgo1n16nm29rbm?response-content-disposition=inline%3B%20filename%3D%22kat-closon-unsplash.jpg%22%3B%20filename%2A%3DUTF-8%27%27kat-closon-unsplash.jpg&response-content-type=image%2Fjpeg&X-Amz-Algorithm=AWS4-HMAC-SHA256&X-Amz-Credential=AKIA42JND3JCHLMFD5NL%2F20241015%2Feu-west-1%2Fs3%2Faws4_request&X-Amz-Date=20241015T182442Z&X-Amz-Expires=300&X-Amz-SignedHeaders=host&X-Amz-Signature=85ba0eafcc6c2a1c1df42887f4984a784073487b3455b8582bff7910fd1e0efc,,False
876779238,New Machine Learning Gems for Ruby,,"In August, I set out to improve the machine learning ecosystem for Ruby and wasn’t sure where it would go. Over the next 5 months, I ended up...",https://ankane.org/new-ml-gems,my_library,"deep-learning, machine-learning, programming, ruby",2021-06-20T18:50:13.000Z,https://ankane.org/images/ml-gems-2.png,,False
876777229,Practical Graph Theory in Ruby,,"This is the next installment in the ""Practical Computer Science"" series, where you will learn how to apply classic computer science concepts to solve real problems using Ruby.  Today we are going to talk about Graph",https://www.rubyguides.com/2017/05/graph-theory-in-ruby,my_library,"algorithms-math, graphs, machine-learning, ruby",2020-12-26T12:30:00.000Z,https://www.rubyguides.com/wp-content/uploads/2017/05/graph-theory-1.png,,False
876777218,"RubyTapas – Short Screencasts of Gourmet Ruby, by Avdi Grimm",,,https://www.rubytapas.com,my_library,"learning, ruby",2020-12-25T18:05:41.000Z,,,False
876777217,Homepage,,Become A Ruby Programming Expert With RubyGuides  This library of&nbsp;150+ in-depth guides explains complex programming topics in plain English so you can become a happy & well-paid Ruby developer!  Discover all the secrets that separate beginner developers,http://www.rubyguides.com,my_library,"learning, ruby",2020-12-25T18:05:40.000Z,https://www.rubyguides.com/wp-content/uploads/2017/08/fb-banner-new.png,,False
876769109,arbox/data-science-with-ruby: Practical Data Science with Ruby based tools.,,Practical Data Science with Ruby based tools.,https://github.com/arbox/data-science-with-ruby,my_library,"machine-learning, ruby",2017-12-27T18:08:51.000Z,https://opengraph.githubassets.com/7990ad6634d76d35106886b850bc24fb2cfe6800f283f8ab61aa8ca69be38389/arbox/data-science-with-ruby,,False
