id,title,note,excerpt,url,folder,tags,created,cover,highlights,favorite
876796787,The art of persuasive storytelling | Kelly D. Parker,,"""Storytelling is one of the most powerful marketing and leadership tools there is,"" says communications expert Kelly D. Parker. She explains how stories make proposals of all kinds more memorable — and shows how you can craft a compelling narrative to connect, persuade and drive meaningful action.",https://www.ted.com/talks/kelly_d_parker_the_art_of_persuasive_storytelling?rss=172BB350-0205,my_library,"influence-persuasion, storytelling",2024-04-26T03:35:20.000Z,https://pi.tedcdn.com/r/talkstar-photos.s3.amazonaws.com/uploads/ca75cf3b-aa42-4f65-90f0-c06564f04c7f/KellyParker_2022X-embed.jpg?u%5Br%5D=2&u%5Bs%5D=0.5&u%5Ba%5D=0.8&u%5Bt%5D=0.03&quality=82c=1050%2C550&w=1050,,False
876795309,Storytelling as a Craft: Advice from 5 Experts on How to Tell a Compelling,,"Every startup leader should practice flexing their storytelling muscles. To help warm these muscles up, we’ve rounded up some of our best advice about storytelling in business that’s been featured in the Review.",https://review.firstround.com/storytelling-as-a-craft-advice-from-5-experts-on-how-to-tell-a-compelling-business-story,my_library,"influence-persuasion, presentations-presenting, storytelling",2024-03-03T07:38:38.000Z,https://review.firstround.com/content/images/2056/firstround-2freal-20portrait.jpg,,False
876785243,Howard Suber Of UCLA Film School Explains How To Tell A Story - Barking Up The Wrong Tree,,Everything you need to know about Howard Suber Of UCLA Film School Explains How To Tell A Story,http://www.bakadesuyo.com/2013/03/interview-ucla-film-school-professor-howard-suber-explains-storyteller,my_library,"influence-persuasion, storytelling",2022-07-05T20:48:51.000Z,https://bakadesuyo.com/wp-content/uploads/2013/03/howard.jpg,,False
876784124,The Surprising Way to Be More Effective at Storytelling,,"To engage leaders, colleagues, and clients, use this simple technique",https://www.inc.com/alison-davis/the-surprising-way-to-be-more-effective-at-storytelling.html,my_library,"influence-persuasion, speaking, storytelling",2022-06-07T18:22:37.000Z,https://images.inc.com/video/video_placeholder.jpg,,False
876780966,The Power of Audience-Centered Storytelling | Bill Carmody | TEDxFergusonLibrary,,"Bill Carmody is a twenty-five year global keynote speaker. He’s had the incredible privilege to present in Brazil with Sir Richard Branson and in India with executives from Fortune 100 companies. Recently he had the distinct privilege to teach several of the UK Brexit government officials how to become more powerful public speakers.
 Bill Carmody is a twenty-five year global keynote speaker. He’s had the incredible privilege to present in Brazil with Sir Richard Branson and in India with executives from Fortune 100 companies. Recently he had the distinct privilege to teach several of the UK Brexit government officials how to become more powerful public speakers. This talk was given at a TEDx event using the TED conference format but independently organized by a local community. Learn more at https://www.ted.com/tedx",https://youtube.com/watch?feature=share&v=-YlkVH5opcU,my_library,"influence-persuasion, speaking, storytelling",2021-12-15T12:58:42.000Z,https://i.ytimg.com/vi/-YlkVH5opcU/maxresdefault.jpg,,False
