id,title,note,excerpt,url,folder,tags,created,cover,highlights,favorite
876784818,6 In-demand Marketing Skills for Your Design CV,,"In today’s tech-savvy world, being a great designer is not all about being a whiz at tools such as Adobe Photoshop and Adobe Illustrator. The job is",https://www.noupe.com/inspiration/in-demand-marketing-skills-for-your-design-cv.html,my_library,"css, design, design-patterns, fonts-typography, keywords-ppc-seo, programming, ui-ux, webdev",2022-06-21T13:48:58.000Z,https://www.noupe.com/wp-content/uploads/2022/06/amy-hirschi-JaoVGh5aJ3E-unsplash.jpg,,False
876782876,Amazing Resources for Web Developers,,Found amazing resources which will save you tons of time as a web developer👇           1. 10015...,https://dev.to/suprabhasupi/amazing-resources-for-web-developers-ma9,my_library,"color, css, html, programming, webdev",2022-03-22T02:18:26.000Z,"https://media2.dev.to/dynamic/image/width=1000,height=500,fit=cover,gravity=auto,format=auto/https%3A%2F%2Fdev-to-uploads.s3.amazonaws.com%2Fuploads%2Farticles%2Fgq7t0traszgdn5bdvsgn.png",,False
876781014,Gulp: A Web Developer's Secret Weapon for Maximizing Site Speed | Toptal®,,"When dealing with web-based projects that run in the production environment, being able to build and deploy changes quickly is a top priority. However, repetitive processes such as building front-end assets, when not automated, can be prone to critical errors.  In this article, Toptal Freelance Software Engineer A...",https://www.toptal.com/javascript/optimize-js-and-css-with-gulp,my_library,"css, javascript, programming, webdev",2021-12-17T20:45:58.000Z,https://bs-uploads.toptal.io/blackfish-uploads/components/open_graph_image/8958284/og_image/optimized/Redesign-Gulp-Luke_Social-1f29a398649e31bc46da96790eec955e.png,,False
876780030,Minification of CSS and JavaScript,,Minification is the process of deleting unneeded or redundant data from a resource without altering...,https://dev.to/iamakanksha16/minification-of-css-and-javascript-31ng,my_library,"css, javascript, programming, webdev",2021-11-03T18:06:30.000Z,"https://media.dev.to/dynamic/image/width=1000,height=500,fit=cover,gravity=auto,format=auto/https%3A%2F%2Fdev-to-uploads.s3.amazonaws.com%2Fuploads%2Farticles%2F2gi37e5wk5hzq8fzlfi8.png",,False
876778514,My current HTML boilerplate - Manuel Matuzović,,"Every element I use for the basic structure of a HTML document, with explanations why.",https://www.matuzo.at/blog/html-boilerplate,my_library,"css, html, programming, webdev",2021-04-30T23:58:40.000Z,https://res.cloudinary.com/dp3mem7or/image/upload/w_1200/articles/sm_boilerplate.png?s=213,,False
876778452,10 Awesome CSS Resources,,A list of few CSS resource that help me design the CSS code better. I will give you a brief intro to...,https://dev.to/kiranrajvjd/10-awesome-css-resources-14mh,my_library,"css, design, programming",2021-04-20T00:29:18.000Z,"https://media.dev.to/dynamic/image/width=1000,height=500,fit=cover,gravity=auto,format=auto/https%3A%2F%2Fdev-to-uploads.s3.amazonaws.com%2Fuploads%2Farticles%2Fof6mzn79o2kahcw2pw1w.jpg",,False
