id,title,note,excerpt,url,folder,tags,created,cover,highlights,favorite
876790959,Two design rules that make products win. - by Thomas Drach,,"The secrets of Zoom, Amazon, and Apple products.",https://subtract.substack.com/p/two-design-rules-that-make-products,my_library,"moats, platforms, prodmgmt",2023-03-19T10:17:30.000Z,"https://substackcdn.com/image/fetch/w_1200,h_600,c_fill,f_jpg,q_auto:good,fl_progressive:steep,g_auto/https%3A%2F%2Fbucketeer-e05bbc84-baa3-437e-9518-adb32be77984.s3.amazonaws.com%2Fpublic%2Fimages%2F71ddc6be-4e8f-4167-95f4-ce1d5721218a_1008x726.png",,False
876790955,How do you solve world-class problems?,,The power of primitives,https://open.substack.com/pub/subtract/p/how-do-you-solve-world-class-problems,my_library,"best-practices, moats, platforms, prodmgmt",2023-03-19T01:15:27.000Z,"https://substackcdn.com/image/fetch/w_1200,h_600,c_fill,f_jpg,q_auto:good,fl_progressive:steep,g_auto/https%3A%2F%2Fsubstack-post-media.s3.amazonaws.com%2Fpublic%2Fimages%2F1709b95e-c5c4-4276-a7c4-8a9c1283d27b_3000x3000.png",,False
876789490,The Art of Profitability by Adrian Slywotzky,,This is a book summary of The Art of Profitability by Adrian Slywotzky. Read The Art of Profitability summary to review key ideas and lessons from the book.,https://jamesclear.com/book-summaries/the-art-of-profitability,my_library,"economics, moats, platforms, prodmgmt",2022-11-05T23:29:55.000Z,https://jamesclear.com/wp-content/uploads/2015/04/The-Art-of-Profitability-by-Adrian-Slywotzky.jpg,,False
876786621,How to Build a Company That Lasts Forever,,"At the core of Europe's strongest economy is the Mittelstand, a tier of impeccably run small manufacturers that measure growth not in years but in centuries. Here's how they do it, in five very German lessons.",http://www.inc.com/magazine/201402/leigh-buchanan/business-lessons-from-german-mittelstand.html,my_library,"moats, platforms",2022-07-18T15:10:29.000Z,https://images.inc.com/uploaded_files/image/1024x576/mittelstand-opener_33256.jpg,,False
876786617,https://codingvc.com/the-value-of-data-part-1-using-data-as-a-competitive-advantage,,,https://codingvc.com/the-value-of-data-part-1-using-data-as-a-competitive-advantage,my_library,"datasets, moats, platforms, prodmgmt",2022-07-18T15:10:21.000Z,,,False
876786319,http://platformed.info/platform-strategy-and-walled-gardens-in-the-toy-industry/,,,http://platformed.info/platform-strategy-and-walled-gardens-in-the-toy-industry,my_library,"moats, platforms, prodmgmt, toys",2022-07-05T21:44:06.000Z,,,False
876782636,Storming Reddit's Moat,,"A Guide to Reddit, Its Key Competitive Advantages, and How to Unbundle It",https://floodstate.substack.com/p/storming-reddits-moat,my_library,"behaviors, moats, platforms, prodmgmt, ui-ux",2022-02-08T01:42:52.000Z,"https://substackcdn.com/image/fetch/w_1200,h_600,c_fill,f_jpg,q_auto:good,fl_progressive:steep,g_auto/https%3A%2F%2Fbucketeer-e05bbc84-baa3-437e-9518-adb32be77984.s3.amazonaws.com%2Fpublic%2Fimages%2F83c38ed4-76a1-4835-9488-66737324a22d_540x361.png",,False
876777294,Why Competitive Advantages Die · Collaborative Fund,,A few factors I’ve seen pull winners off the podium…,https://www.collaborativefund.com/blog/why-competitive-advantages-die,my_library,"moats, platforms, prodmgmt",2021-01-02T22:01:59.000Z,https://api.urlbox.io/v1/sqyEJxrXaccBdLeR/1e648cea4aa6ee59436d9a5f37ce6051d5c3b883b13671fa6f3d726c5e32b4ad/png?width=1200&height=630&url=https%3A%2F%2Fwww.collabfund.com%2Fblog%2Fwhy-competitive-advantages-die%2F%3Fcovershot,,False
876768958,Goodbye Gatekeepers,,"Harvey Weinstein was a gate-keeper — a position that existed in multiple industries, including the media. That entire structure, though, is untenable on the Internet, and that’s a good thing.…",https://stratechery.com/2017/goodbye-gatekeepers,my_library,"moats, platforms",2017-10-22T01:53:51.000Z,https://i0.wp.com/stratechery.com/wp-content/uploads/2017/10/IMG_0017.jpg?fit=1200%2C493&ssl=1,,False
