id,title,note,excerpt,url,folder,tags,created,cover,highlights,favorite
876797097,HTML Over The Wire,,Hotwire is an alternative approach to building modern web applications without using much JavaScript by sending HTML instead of JSON over the wire.,https://hotwired.dev,my_library,"html, javascript, rubyonrails, webdev",2024-06-04T01:47:04.000Z,,,False
876789887,What if writing tests was a joyful experience?,,"At Jane Street we use a pattern/library called “expect tests” thatmakes test-writing feel like a REPL session, or like exploratoryprogramming in a Jupyter no...",https://blog.janestreet.com/the-joy-of-expect-tests,my_library,"best-practices, rubyonrails, webdev",2023-01-13T19:12:14.000Z,https://blog.janestreet.com/the-joy-of-expect-tests/expect.gif,,False
876788695,Security Best Practices for Your Rails Application,,Ensure your Rails application stays secure by following some best practices and habits.,https://blog.appsignal.com/2022/10/05/security-best-practices-for-your-rails-application.html,my_library,"rubyonrails, security, webdev",2022-10-05T12:01:06.000Z,https://ondemand.bannerbear.com/signedurl/Mn62mqoVbWvyB5wgQ1/image.jpg?modifications=W3sibmFtZSI6InRpdGxlIiwidGV4dCI6IlNlY3VyaXR5IEJlc3QgUHJhY3RpY2VzIGZvciBZb3VyIFJhaWxzIEFwcGxpY2F0aW9uIn0seyJuYW1lIjoiaW1hZ2UiLCJpbWFnZV91cmwiOiJodHRwczovL2FwcHNpZ25hbC1uZXh0anMtYmxvZy1ueXFyNnFjcjgtYXBwc2lnbmFsLnZlcmNlbC5hcHAvaW1hZ2VzL2Jsb2cvMjAyMi0xMC9zZWN1cml0eS1yYWlscy5qcGcifSx7Im5hbWUiOiJjYXRlZ29yeV9sb2dvIiwiaW1hZ2VfdXJsIjoiaHR0cHM6Ly9hcHBzaWduYWwtbmV4dGpzLWJsb2ctbnlxcjZxY3I4LWFwcHNpZ25hbC52ZXJjZWwuYXBwL2ltYWdlcy9sb2dvcy9ydWJ5LWxvZ28ucG5nIn1d&s=6ffceaf6b165054b61f9a7868de01c5263ed928258189528d3cfc43f402c39d2,,False
876784026,Bundler: The best way to manage a Ruby application's gems,,,https://bundler.io,my_library,"bundler, programming, rubyonrails, webdev",2022-05-30T23:22:27.000Z,,,False
876784025,Markdown Tutorial Using Rails app,,In this markdown tutorial using rails app learn a step-by-step process to add Markdown support to the Rails app using Redcarpet and Coderay gems.,https://www.bacancytechnology.com/blog/add-markdown-to-rails-app,my_library,"markdown, programming, ruby, rubyonrails, webdev",2022-05-30T23:22:13.000Z,https://i.ytimg.com/vi/h-fnfuXdBIY/hqdefault.jpg,,False
876782578,Security Risks On Rails: Misconfiguration and Unsafe Integrations,,This article was originally written by Diogo Souza on the Honeybadger Developer Blog.  In the third...,https://dev.to/honeybadger/security-risks-on-rails-misconfiguration-and-unsafe-integrations-3m71,my_library,"rubyonrails, security, webdev",2022-01-31T23:25:37.000Z,"https://media.dev.to/dynamic/image/width=1000,height=500,fit=cover,gravity=auto,format=auto/https%3A%2F%2Fdev-to-uploads.s3.amazonaws.com%2Fuploads%2Farticles%2Fpj1byopwzvu16ou84jzf.png",,False
876782169,Understanding Webpacker in Rails 6 | Road to Rails 6,,"Starting with Rails 6, Webpacker is the default JavaScript compiler. It means that all the JavaScript code will be handled by Webpacker instead of the old assets pipeline aka Sprockets. Webpacker is different from asset pipeline in terms of philosophy as well as implementation. In this blog post, we will",https://prathamesh.tech/2019/08/26/understanding-webpacker-in-rails-6,my_library,"javascript, rubyonrails, webdev, webpacker",2022-01-17T19:33:12.000Z,,,False
876782168,https://hixonrails.com/ruby-on-rails-tutorials/ruby-on-rails-security-best-practices/,,,https://hixonrails.com/ruby-on-rails-tutorials/ruby-on-rails-security-best-practices,my_library,"ruby, rubyonrails, webdev",2022-01-17T19:32:37.000Z,,,False
