id,title,note,excerpt,url,folder,tags,created,cover,highlights,favorite
876795643,Pricing | Heroku,,"Heroku offers simple, flexible pricing to meet the needs of every app and every organization. Add data stores, cloud services, support, and more.",https://www.heroku.com/pricing,my_library,"heroku, pricing, rubyonrails",2024-04-16T05:31:59.000Z,https://www.herokucdn.com/images/og.png,,False
876788795,Heroku alternatives for Rails projects: Deploying my shit to fly.io,,"I like to develop production projects and side projects as deployment-driven as possible. Over the years I had tons of projects on Heroku and I'm grateful for the experience 🙏 But if tons of projects are to come again, I don't see a point in paying 7$ bucks per side-project.  Luckily",https://richstone.io/heroku-alternatives-for-rails-projects-deploying-my-shit-on-fly-io,my_library,"heroku, rubyonrails",2022-10-23T18:45:00.000Z,https://digitalpress.fra1.cdn.digitaloceanspaces.com/xhtzjbw/2022/10/goo-code-makes-its-way-to-the-Cloud.PNG,,False
876784013,SQLite on Heroku | Heroku Dev Center,,"A guide to SQLite on Heroku - explaining why using SQLite on Heroku's ephemeral file system is a bad fit, and looking at alternatives.",https://devcenter.heroku.com/articles/sqlite3,my_library,"heroku, postgres, rubyonrails",2022-05-29T21:18:53.000Z,https://www.herokucdn.com/images/og.png,,False
876782868,Ask HN: Cheaper Heroku alternatives for Rails apps? | Hacker News,,,https://news.ycombinator.com/item?id=30755202,my_library,"devops, heroku, rubyonrails",2022-03-21T20:31:45.000Z,,,False
876777428,Best alternatives to hosting on Heroku?,,"33 votes, 56 comments. Heroku is easy to use and has a good marketplace. They make it really easy to deploy and to purchase additional resources. I…",https://www.reddit.com/r/rails/comments/l59eti/best_alternatives_to_hosting_on_heroku,my_library,"devops, heroku, rubyonrails",2021-01-27T11:17:05.000Z,https://share.redd.it/preview/post/l59eti,,False
876773993,Active Storage on Heroku | Heroku Dev Center,,Rails [5.2 introduced Active Storage](https://guides.rubyonrails.org/active_storage_overview.html) as a way of managing attaching and saving files to Active Record models. This guide will cover how to use Active Storage on Heroku.,https://devcenter.heroku.com/articles/active-storage-on-heroku,my_library,"heroku, rubyonrails",2020-03-14T23:49:49.000Z,https://www.herokucdn.com/images/og.png,,False
