id,title,note,excerpt,url,folder,tags,created,cover,highlights,favorite
876783822,Meteor Vue JS Storybook = A Complete Guide To Scalable UI System,,"It has been more than one year since we have introduced Vue Js in our Meteor Production App, and last month we have implemented the…",https://blog.meteor.com/meteor-vue-js-storybook-a-complete-guide-to-scalable-ui-system-eee99647531a,my_library,"javascript, meteorjs, vue",2022-04-14T23:47:00.000Z,https://miro.medium.com/v2/resize:fit:1200/1*P9eeiv9w2mftTuzxb8MFtQ.png,,False
876781128,http://meteortips.com,,,http://meteortips.com,my_library,"javascript, meteorjs",2022-01-04T02:49:41.000Z,,,False
876781116,zodern/meteor-up: Production Quality Meteor Deployment to Anywhere,,Production Quality Meteor Deployment to Anywhere.,https://github.com/zodern/meteor-up,my_library,"javascript, meteorjs",2022-01-02T00:29:17.000Z,https://opengraph.githubassets.com/fa9aee656b25ae2998f930c94c0452cf579362b92c1b3661cf6d3b3697ce6421/zodern/meteor-up,,False
876779786,How real-time data works on Meteor — Know your pub/subs,,"Let's start with how publications and subscriptions work on Meteor, which are the ""under the hood"" of Meteor's real-time data model.",https://blog.meteor.com/how-real-time-data-works-on-meteor-know-your-pub-subs-86620c7dccfa,my_library,"javascript, meteorjs",2021-07-27T10:06:58.000Z,https://miro.medium.com/v2/resize:fit:1200/1*xXE_mwwSsk9gZ6wtTM2F9g.jpeg,,False
876779373,Meteor 2.3 has been released!,,"Node 14, HMR improvements, removal of deprecated APIs and much more!",https://blog.meteor.com/meteor-2-3-has-been-released-f9971464ed1e,my_library,"javascript, meteorjs",2021-07-13T16:36:11.000Z,https://miro.medium.com/v2/resize:fit:1200/1*KZJia42_r4MBXEaWnpY1JA.png,,False
