id,title,note,excerpt,url,folder,tags,created,cover,highlights,favorite
881001439,We should take awkwardness less personally and more seriously | Aeon Essays,,"Rather than being a cringey personal failing, awkwardness is a collective rupture – and a chance to rewrite the social script",https://aeon.co/essays/we-should-take-awkwardness-less-personally-and-more-seriously,my_library,"behaviors, emotions, shaming",2006-10-24T00:00:00.000Z,https://images.aeonmedia.co/images/a4db809e-47eb-480e-b8c9-e1c8e623ffe5/essay-lon34989.jpg?width=1200&quality=75&format=auto,,False
876788686,"Charlie Tyson: ""Theater of Shame""",,What does the state of online shaming reveal about our democracy?,https://yalereview.org/article/online-shaming-twitter-culture-tyson,my_library,"behaviors, emotions, shaming",2022-10-04T11:43:42.000Z,https://d181q449nqu6en.cloudfront.net/content/craft/articles/_1200x630_crop_center-center_82_none/Tyson_Shame_Web_Preview.jpg?mtime=20220908121604&focal=none&tmtime=20220908135350,,False
876788492,How to cope with shame | Psyche Guides,,"Do you feel perpetually bad, broken or unlovable? These tools will help you relate to yourself in a fairer, gentler way",https://psyche.co/guides/how-to-cope-with-shame-by-understanding-where-it-comes-from,my_library,"behaviors, emotions, shaming",2022-09-09T14:40:38.000Z,https://images.aeonmedia.co/images/772c7f16-759f-43e1-b717-51228eb95f82/original.jpg,,False
876787790,The Scientific Underpinnings and Impacts of Shame,,People who feel shame readily are at risk for depression and anxiety disorders,https://getpocket.com/explore/item/the-scientific-underpinnings-and-impacts-of-shame,my_library,"behaviors, emotions, shaming",2022-08-17T15:51:59.000Z,https://pocket-image-cache.com/1200x/filters:format(jpg):extract_focal()/https%3A%2F%2Fpocket-syndicated-images.s3.amazonaws.com%2Farticles%2F8050%2F1657925422_GettyImages-1330019780.jpg,,False
876787680,How to Build Resilience to Shame,,Today’s hustle culture claims “unearned” pleasure is shameful. But there are ways to resist this cultural response.,https://www.yesmagazine.org/issue/pleasure/2022/05/18/how-to-build-resilience-to-shame,my_library,"emotions, empathy, shaming",2022-07-30T21:04:28.000Z,https://www.yesmagazine.org/wp-content/uploads/2022/05/00_LEAD_Resilience_Shame.jpg,,False
